customer_id,first_name,last_name,full_name,email,phone,gender,age,date_of_birth,address_street,address_city,address_state,address_postal_code,address_country,segment,total_orders,total_spend,average_order_value,registration_date,last_purchase_date,is_active,email_verified,phone_verified,preferences_newsletter,preferences_sms_notifications,preferences_preferred_language,preferences_preferred_currency,metadata_source,metadata_created_at,metadata_updated_at,_source_file,_loaded_at
CUS-00000001,Fatima,Rodriguez,Fatima Rodriguez,fatima.rodriguez844@gmail.com,,MALE,73,1953-02-16,2524 Hill Blvd,Berlin,,10115,Germany,Bronze,8,47427.16,2155.78,05-10-2021,2026-07-19,false,false,true,false,false,de,AUD,mobile_app,2021-05-10T00:00:00,2021-12-03T00:00:00,customers.json,2026-02-10T22:25:28.068809
CUS-00000002,Susan,Davis,Susan Davis,susan.davis250@outlook.com,+1-585-973-2357,Female,63,1963-02-14,663 Elm Rd,Chicago,IL,60601,USA,BRONZE,85,14606.58,2086.65,2018-07-30,2023-09-22,false,true,,true,true,,EUR,social_media,2018-07-30T00:00:00,2019-09-24T00:00:00,customers.json,2026-02-10T22:25:28.068809
CUS-00000003,Jessica,Brown,Jessica Brown,jessica.brown608@outlook.com,UNLISTED,F,69,1957-02-15,5068 River Ave,Paris,,75001,France,Platinum,62,34760.69,1158.69,12/05/2018,2021-03-19,true,true,true,true,true,es,USD,social_media,2018-05-12T00:00:00,2018-07-15T00:00:00,customers.json,2026-02-10T22:25:28.068809
CUS-00000004,Robert,Williams,Robert Williams,robert.williams789@outlook.com,871.134.6967,female,59,1967-02-13,6920 River Dr,Los Angeles,CA,90001,USA,Bronze,180,19508.48,1625.71,2018-07-20,2023-12-20,true,false,false,true,false,fr,EUR,website,2018-07-20T00:00:00,2019-10-15T00:00:00,customers.json,2026-02-10T22:25:28.068809
CUS-00000005,Robert,Davis,Robert Davis,robert.davis619@mail.com,,"",43,1983-02-09,646 Forest Ln,London,,SW1A 1AA,United Kingdom,Silver,152,36840.45,1023.35,05-14-2020,2025-05-09,no,true,false,false,true,de,AUD,,2020-05-14T00:00:00,2021-09-20T00:00:00,customers.json,2026-02-10T22:25:28.068809
CUS-00000006,Fatima,Williams,Fatima Williams,fatima.williams850@company.com,4347845163,,53,1973-02-11,6829 Main Dr,Paris,,75001,France,VIP,188,-41084.28,,01-18-2018,2018-04-25,true,false,,true,false,,USD,mobile_app,2018-01-18T00:00:00,2019-05-06T00:00:00,customers.json,2026-02-10T22:25:28.068809
CUS-00000007,Richard,Patel,Richard Patel,richard.patel182@outlook.com,UNLISTED,M,26,2000-02-05,1990 Main Ave,Paris,,75001,France,Silver,17,8237.17,164.74,08-30-2022,2024-05-24,true,true,false,false,true,ja,,partner,2022-08-30T00:00:00,2023-04-25T00:00:00,customers.json,2026-02-10T22:25:28.068809
CUS-00000008,Thomas,Brown,Thomas Brown,thomas.brown685@company.com,835.923.2415,,73,1953-02-16,6594 Park Ave,Chicago,IL,60601,USA,VIP,49,37877.85,946.95,2023-11-09T00:00:00,2026-01-14,false,true,,false,false,de,GBP,,2023-11-09T00:00:00,2024-05-15T00:00:00,customers.json,2026-02-10T22:25:28.068809
CUS-00000009,Michael,Johnson,Michael Johnson,,,Prefer not to say,22,2004-02-04,5195 Park Rd,Toronto,ON,M5V 2H1,Canada,Bronze,138,27701.57,989.34,04-18-2024,2024-12-19,true,true,true,false,true,zh,GBP,social_media,2024-04-18T00:00:00,2024-07-05T00:00:00,customers.json,2026-02-10T22:25:28.068809
CUS-00000010,William,Chen,William Chen,william.chen77@company.com,928.195.3251,,53,1973-02-11,8869 Oak Ln,Los Angeles,CA,90001,USA,Gold,141,6230.16,168.38,1548370800,2019-07-05,1,false,true,false,true,fr,JPY,website,2019-01-25T00:00:00,2019-12-27T00:00:00,customers.json,2026-02-10T22:25:28.068809
CUS-00000011,David,Rodriguez,David Rodriguez,david.rodriguez141@gmail.com,+1-688-143-8687,Prefer not to say,34,1992-02-07,8351 Park Blvd,Berlin,,10115,Germany,Silver,2,43341.28,985.03,1574290800,2021-02-10,1,true,false,true,true,de,EUR,partner,2019-11-21T00:00:00,2020-10-27T00:00:00,customers.json,2026-02-10T22:25:28.068809
CUS-00000012,Richard,Miller,Richard Miller,richard.miller300@mail.com,+1-494-375-5080,Male,49,1977-02-10,3783 Park Ln,Los Angeles,CA,90001,USA,VIP,12,6453.14,137.3,2022-07-20,2023-03-22,yes,true,true,false,true,ja,USD,,2022-07-20T00:00:00,2022-11-04T00:00:00,customers.json,2026-02-10T22:25:28.068809
CUS-00000013,Hans,Brown,Hans Brown,hans.brown424@gmail.com,UNLISTED,MALE,24,2002-02-04,7596 Elm St,Chicago,IL,60601,USA,Platinum,16,42912.77,894.02,2020-04-26T00:00:00,2025-08-21,1,true,false,true,false,es,GBP,referral,2020-04-26T00:00:00,2020-07-25T00:00:00,customers.json,2026-02-10T22:25:28.068809
CUS-00000014,Susan,Smith,Susan Smith,susan.smith805@company.com,3645914613,"",65,1961-02-14,1620 Lake Ln,Chicago,IL,60601,USA,Silver,133,49325.33,2466.27,2018-03-12T00:00:00,2019-01-02,true,true,,true,true,fr,GBP,mobile_app,2018-03-12T00:00:00,2019-04-03T00:00:00,customers.json,2026-02-10T22:25:28.068809
CUS-00000015,Yuki,Patel,Yuki Patel,yuki.patel589@mail.com,+1-741-103-3442,FEMALE,63,1963-02-14,3216 Park Rd,Paris,,75001,France,Gold,12,10013.36,455.15,10-07-2022,2026-02-20,no,true,,false,false,es,JPY,partner,2022-10-07T00:00:00,2022-10-15T00:00:00,customers.json,2026-02-10T22:25:28.068809
CUS-00000016,Hans,Williams,Hans Williams,hans.williams579@gmail.com,(305) 797-9987,F,44,1982-02-09,1947 Oak Rd,Berlin,,10115,Germany,Bronze,154,20486.45,585.33,01/02/2019,2024-01-28,true,false,,false,true,zh,,,2019-02-01T00:00:00,2020-02-09T00:00:00,customers.json,2026-02-10T22:25:28.068809
CUS-00000017,James,Dubois,James Dubois,james.dubois815@yahoo.com,+1-789-384-1001,male,44,1982-02-09,7551 Main Ln,Los Angeles,CA,90001,USA,Bronze,116,41124.59,2741.64,1717020000,2025-06-01,true,true,true,true,false,zh,,referral,2024-05-30T00:00:00,2025-07-31T00:00:00,customers.json,2026-02-10T22:25:28.068809
CUS-00000018,Yuki,Tanaka,Yuki Tanaka,N/A,4161743518,M,60,1966-02-13,9737 Park Blvd,Los Angeles,CA,90001,USA,Silver,109,35699.17,2974.93,1668553200,2025-11-07,no,false,false,false,true,zh,,website,2022-11-16T00:00:00,2023-02-24T00:00:00,customers.json,2026-02-10T22:25:28.068809
CUS-00000019,Richard,Martinez,Richard Martinez,richard.martinez792@company.com,+1-911-229-1881,Female,48,1978-02-10,5557 Oak Rd,Toronto,ON,M5V 2H1,Canada,VIP,67,12062.12,548.28,1578351600,2023-01-24,true,true,true,false,false,,,mobile_app,2020-01-07T00:00:00,2020-03-18T00:00:00,customers.json,2026-02-10T22:25:28.068809
CUS-00000020,Fatima,Davis,Fatima Davis,fatima.davis531@gmail.com,UNLISTED,,30,1996-02-06,6088 Main Ln,New York,NY,10001,USA,Bronze,192,40408.21,1036.11,2018-05-05,2019-05-29,true,false,false,false,true,,AUD,,2018-05-05T00:00:00,2018-09-30T00:00:00,customers.json,2026-02-10T22:25:28.068809
CUS-00000021,Carlos,Martinez,Carlos Martinez,carlos.martinez164@outlook.com,354.279.5734,Female,62,1964-02-14,5923 Lake Dr,Tokyo,,100-0001,Japan,Bronze,39,2255.11,86.73,2023-04-05T00:00:00,2028-03-23,false,true,false,true,false,ja,EUR,referral,2023-04-05T00:00:00,2023-10-11T00:00:00,customers.json,2026-02-10T22:25:28.068809
CUS-00000022,Yuki,Johnson,Yuki Johnson,yuki.johnson318@outlook.com,,,85,1941-02-19,8672 Main Rd,Toronto,ON,M5V 2H1,Canada,silver,161,13427.14,285.68,01-27-2020,2022-04-08,true,false,false,true,true,de,CAD,mobile_app,2020-01-27T00:00:00,2020-10-23T00:00:00,customers.json,2026-02-10T22:25:28.068809
CUS-00000023,Wei,Williams,Wei Williams,wei.williams275@company.com,UNLISTED,Prefer not to say,55,1971-02-12,6388 Elm Rd,Chicago,IL,60601,USA,VIP,193,48040.64,2001.69,02-17-2022,2022-05-11,true,true,false,true,false,fr,AUD,,2022-02-17T00:00:00,2022-05-23T00:00:00,customers.json,2026-02-10T22:25:28.068809
CUS-00000024,Elizabeth,Miller,Elizabeth Miller,elizabeth.miller685@gmail.com,,male,25,2001-02-04,3913 Park Ave,Chicago,IL,60601,USA,Gold,54,30524.26,622.94,02-02-2021,2022-12-30,false,false,,false,true,de,CAD,mobile_app,2021-02-02T00:00:00,2022-03-22T00:00:00,customers.json,2026-02-10T22:25:28.068809
CUS-00000025,Robert,Brown,Robert Brown,robert.brown97@gmail.com,7043213207,female,81,1945-02-18,6379 Oak Blvd,Berlin,,10115,Germany,Bronze,129,36181.87,1340.07,1594591200,2023-12-18,true,true,true,true,true,,USD,partner,2020-07-13T00:00:00,2020-09-05T00:00:00,customers.json,2026-02-10T22:25:28.068809
CUS-00000026,David,Tanaka,David Tanaka,david.tanaka563@gmail.com,+1-586-441-8737,Other,85,1941-02-19,4700 Oak Dr,Amsterdam,,1012 AB,Netherlands,Platinum,75,6739.62,449.31,25/05/2020,2020-10-17,yes,false,false,true,true,,JPY,mobile_app,2020-05-25T00:00:00,2020-08-20T00:00:00,customers.json,2026-02-10T22:25:28.068809
CUS-00000027,Ahmed,Garcia,Ahmed Garcia,ahmed.garcia622@yahoo.com,3336329783,Female,84,1942-02-19,2111 Hill St,New York,NY,10001,USA,Bronze,11,24644.16,1895.7,2022-02-11,2026-07-19,false,false,false,false,true,,,website,2022-02-11T00:00:00,2022-08-27T00:00:00,customers.json,2026-02-10T22:25:28.068809
CUS-00000028,Robert,Mueller,Robert Mueller,robert.mueller329@gmail.com,6466852782,,32,1994-02-06,82 Forest Ave,Sydney,NSW,2000,Australia,VIP,88,10582.39,529.12,05/10/2022,2026-12-18,no,true,false,true,true,es,CAD,referral,2022-10-05T00:00:00,2023-08-15T00:00:00,customers.json,2026-02-10T22:25:28.068809
CUS-00000029,Marie,Brown,Marie Brown,marie.brown105@gmail.com,496.392.3978,Prefer not to say,55,1971-02-12,9907 Forest St,Amsterdam,,1012 AB,Netherlands,Platinum,134,31207.59,1642.5,10/11/2019,2023-01-25,0,false,,true,true,fr,AUD,website,2019-11-10T00:00:00,2020-04-08T00:00:00,customers.json,2026-02-10T22:25:28.068809
CUS-00000030,James,Silva,James Silva,james.silva584@outlook.com,,M,21,2005-02-03,3538 Lake Dr,Toronto,ON,M5V 2H1,Canada,PLATINUM,186,27917.53,1861.17,1534111200,2021-03-06,false,false,,false,true,ja,EUR,,2018-08-13T00:00:00,2019-11-15T00:00:00,customers.json,2026-02-10T22:25:28.068809
CUS-00000031,Sarah,Smith,Sarah Smith,thomas.brown685@company.com,,MALE,,,1610 Elm Ave,Chicago,IL,60601,USA,gold,136,27553.17,1312.06,1668380400,2026-05-27,0,true,false,true,false,de,AUD,mobile_app,2022-11-14T00:00:00,2023-03-17T00:00:00,customers.json,2026-02-10T22:25:28.068809
CUS-00000032,Christopher,Martinez,Christopher Martinez,christopher.martinez279@mail.com,+1-689-870-4665,Female,21,2005-02-03,6148 Main Dr,Tokyo,,100-0001,Japan,silver,166,33432.34,1857.35,2023-08-26,2029-01-31,1,true,,false,true,de,JPY,mobile_app,2023-08-26T00:00:00,2024-11-09T00:00:00,customers.json,2026-02-10T22:25:28.068809
CUS-00000033,Wei,Silva,Wei Silva,wei.silva893@yahoo.com,6537135612,FEMALE,29,1997-02-05,7769 Hill St,Chicago,IL,60601,USA,Platinum,42,38160.17,1031.36,1535320800,2019-06-03,false,false,true,false,false,en,EUR,mobile_app,2018-08-27T00:00:00,2018-12-08T00:00:00,customers.json,2026-02-10T22:25:28.068809
CUS-00000034,Joseph,Davis,Joseph Davis,joseph.davis960@gmail.com,UNLISTED,Other,77,1949-02-17,5652 Hill St,Los Angeles,CA,90001,USA,VIP,49,10982.61,784.47,2018-11-18T00:00:00,2022-08-20,false,false,false,false,true,zh,EUR,partner,2018-11-18T00:00:00,2019-05-02T00:00:00,customers.json,2026-02-10T22:25:28.068809
CUS-00000035,Mary,Jones,Mary Jones,mary.jones302@company.com,7472103322,F,41,1985-02-08,4278 Hill Ave,Sydney,NSW,2000,Australia,SILVER,147,41706.2,1191.61,10-04-2023,2028-10-08,no,false,true,false,true,,,partner,2023-10-04T00:00:00,2024-02-05T00:00:00,customers.json,2026-02-10T22:25:28.068809
CUS-00000036,Liam,Brown,Liam Brown,liam.brown182@mail.com,9367518023,Male,19,2007-02-03,6163 Elm St,Los Angeles,CA,90001,USA,Platinum,169,46912.81,4264.8,01/02/2023,2027-06-17,false,false,false,true,true,de,CAD,,2023-02-01T00:00:00,2023-08-07T00:00:00,customers.json,2026-02-10T22:25:28.068809
CUS-00000037,James,Chen,James Chen,james.chen459@mail.com,,Male,22,2004-02-04,9916 Park Ln,Amsterdam,,1012 AB,Netherlands,Gold,139,27115.79,968.42,1703804400,2029-05-02,1,false,,true,false,ja,GBP,,2023-12-29T00:00:00,2024-11-05T00:00:00,customers.json,2026-02-10T22:25:28.068809
CUS-00000038,Thomas,Patel,Thomas Patel,thomas.patel663@gmail.com,(293) 465-3933,,77,1949-02-17,8069 Hill Dr,Toronto,ON,M5V 2H1,Canada,Bronze,39,19053.39,476.33,1580770800,2024-02-16,yes,false,,true,true,fr,AUD,partner,2020-02-04T00:00:00,2020-05-14T00:00:00,customers.json,2026-02-10T22:25:28.068809
CUS-00000039,Jessica,Johnson,Jessica Johnson,JessicaJohnson,UNLISTED,M,65,1961-02-14,8579 Hill Blvd,Amsterdam,,1012 AB,Netherlands,PLATINUM,152,6285.03,241.73,21/09/2021,2026-02-01,true,false,,false,true,zh,EUR,,2021-09-21T00:00:00,2023-01-21T00:00:00,customers.json,2026-02-10T22:25:28.068809
CUS-00000040,Robert,Patel,Robert Patel,robert.patel868@mail.com,UNLISTED,Prefer not to say,85,1941-02-19,6063 Oak Ave,Sydney,NSW,2000,Australia,Gold,130,8634.27,1233.47,1577660400,2023-11-21,yes,false,false,true,false,ja,GBP,social_media,2019-12-30T00:00:00,2021-04-29T00:00:00,customers.json,2026-02-10T22:25:28.068809
CUS-00000041,Priya,Patel,Priya Patel,priya.patel17@outlook.com,(398) 413-2965,male,57,1969-02-12,7434 Oak Rd,New York,NY,10001,USA,VIP,84,11839.1,910.7,2020-03-26,2022-04-10,false,true,false,true,false,de,CAD,partner,2020-03-26T00:00:00,2020-05-14T00:00:00,customers.json,2026-02-10T22:25:28.068809
CUS-00000042,Linda,Tanaka,Linda Tanaka,LindaTanaka,(913) 985-2787,Male,34,1992-02-07,4452 River Ave,Sydney,NSW,2000,Australia,VIP,61,34819.14,1055.13,1650232800,2025-09-08,0,false,true,true,false,ja,,social_media,2022-04-18T00:00:00,2022-11-17T00:00:00,customers.json,2026-02-10T22:25:28.068809
CUS-00000043,Mary,Chen,Mary Chen,mary.chen519@mail.com,UNLISTED,"",33,1993-02-06,7015 River St,Amsterdam,,1012 AB,Netherlands,Gold,35,35648.17,35648.17,2022-09-25,2023-06-15,true,true,false,false,true,ja,CAD,mobile_app,2022-09-25T00:00:00,2022-11-01T00:00:00,customers.json,2026-02-10T22:25:28.068809
CUS-00000044,Linda,Jones,Linda Jones,linda.jones819@gmail.com,768.855.3984,Prefer not to say,46,1980-02-10,7227 Lake Ln,Paris,,75001,France,VIP,106,31017.12,3101.71,2023-10-31,2029-03-25,true,false,,true,false,fr,EUR,website,2023-10-31T00:00:00,2024-07-26T00:00:00,customers.json,2026-02-10T22:25:28.068809
CUS-00000045,Michael,Garcia,Michael Garcia,michael.garcia828@mail.com,+1-404-721-3346,Female,69,1957-02-15,7472 Elm Ave,Toronto,ON,M5V 2H1,Canada,Platinum,90,35891.35,1157.79,2020-09-29T00:00:00,2021-09-02,0,false,,false,false,de,EUR,social_media,2020-09-29T00:00:00,2020-12-17T00:00:00,customers.json,2026-02-10T22:25:28.068809
CUS-00000046,Priya,O'Brien,Priya O'Brien,priya.o'brien334@gmail.com,UNLISTED,Male,41,1985-02-08,5339 Elm Ave,Sydney,NSW,2000,Australia,Platinum,40,10792.67,291.69,1557525600,2020-07-28,false,false,true,true,false,,GBP,,2019-05-11T00:00:00,2020-07-21T00:00:00,customers.json,2026-02-10T22:25:28.068809
CUS-00000047,Christopher,Williams,Christopher Williams,christopher.williams242@outlook.com,4735273001,FEMALE,50,1976-02-11,1909 Elm Blvd,Sydney,NSW,2000,Australia,Silver,155,,,1689199200,2025-05-24,no,true,true,true,false,en,EUR,website,2023-07-13T00:00:00,2023-12-29T00:00:00,customers.json,2026-02-10T22:25:28.068809
CUS-00000048,Linda,Anderson,Linda Anderson,linda.anderson778@company.com,3379126968,,77,1949-02-17,9322 Forest Rd,New York,NY,10001,USA,Silver,176,13302.31,950.16,02-23-2024,2029-05-31,0,true,true,false,true,,,website,2024-02-23T00:00:00,2024-06-05T00:00:00,customers.json,2026-02-10T22:25:28.068809
CUS-00000049,James,Rodriguez,James Rodriguez,james.rodriguez242@outlook.com,UNLISTED,F,42,1984-02-09,81 Hill Blvd,Amsterdam,,1012 AB,Netherlands,VIP,22,4669.13,333.51,1573945200,2024-09-28,no,true,,true,true,de,USD,,2019-11-17T00:00:00,2020-02-02T00:00:00,customers.json,2026-02-10T22:25:28.068809
CUS-00000050,Marie,Jones,Marie Jones,marie.jones213@gmail.com,(254) 217-2462,Other,49,1977-02-10,3508 Main Rd,New York,NY,10001,USA,VIP,147,36163.82,2781.83,2019-05-11T00:00:00,2023-08-14,yes,false,true,true,true,de,CAD,,2019-05-11T00:00:00,2020-06-29T00:00:00,customers.json,2026-02-10T22:25:28.068809
CUS-00000051,Elizabeth,Silva,Elizabeth Silva,elizabeth.silva154@gmail.com,(840) 637-3303,Female,66,1960-02-15,21 Park Ln,Chicago,IL,60601,USA,GOLD,171,41170.75,1112.72,1725746400,2030-02-10,0,true,,false,true,,USD,mobile_app,2024-09-08T00:00:00,2026-01-17T00:00:00,customers.json,2026-02-10T22:25:28.068809
CUS-00000052,Joseph,Brown,Joseph Brown,joseph.brown283@yahoo.com,+1-596-414-3135,Other,28,1998-02-05,367 Hill Ave,Tokyo,,100-0001,Japan,Gold,34,27898.54,3099.84,05-20-2019,2022-11-08,false,false,false,false,true,,CAD,,2019-05-20T00:00:00,2020-04-12T00:00:00,customers.json,2026-02-10T22:25:28.068809
CUS-00000053,James,Davis,James Davis,james.davis34@outlook.com,837.166.7076,Male,32,1994-02-06,1942 Oak St,Paris,,75001,France,Silver,54,42086.86,21043.43,2022-10-08T00:00:00,2025-05-10,false,true,false,false,false,,USD,social_media,2022-10-08T00:00:00,2022-12-29T00:00:00,customers.json,2026-02-10T22:25:28.068809
CUS-00000054,Susan,Silva,Susan Silva,priya.patel17@outlook.com,5508211996,male,24,2002-02-04,5917 Lake Blvd,Los Angeles,CA,90001,USA,vip,77,22675.51,1744.27,2020-03-11T00:00:00,2021-06-23,true,true,,true,true,en,AUD,social_media,2020-03-11T00:00:00,2020-06-12T00:00:00,customers.json,2026-02-10T22:25:28.068809
CUS-00000055,Barbara,Patel,Barbara Patel,barbara.patel693@mail.com,8215123565,male,-5,1998-09-13,6603 Hill Blvd,Paris,,75001,France,Platinum,26,17694.03,884.7,11-27-2022,2023-09-06,true,true,true,true,false,ja,JPY,,2022-11-27T00:00:00,2023-07-24T00:00:00,customers.json,2026-02-10T22:25:28.068809
CUS-00000056,Patricia,Rodriguez,Patricia Rodriguez,patricia.rodriguez21@gmail.com,+1-765-169-5416,Prefer not to say,85,1941-02-19,3665 Oak Ave,Paris,,75001,France,VIP,119,14916.56,392.54,2024-11-05T00:00:00,2030-01-21,false,false,false,false,true,de,JPY,website,2024-11-05T00:00:00,2025-01-20T00:00:00,customers.json,2026-02-10T22:25:28.068809
CUS-00000057,Michael,Dubois,Michael Dubois,michael.dubois976@outlook.com,,FEMALE,35,1991-02-07,836 Forest Dr,Amsterdam,,1012 AB,Netherlands,VIP,44,35588.77,5084.11,2019-04-12,2021-09-10,yes,true,true,true,false,en,,partner,2019-04-12T00:00:00,2020-08-07T00:00:00,customers.json,2026-02-10T22:25:28.068809
CUS-00000058,Fatima,Williams,Fatima Williams,fatima.williams379@yahoo.com,UNLISTED,"",63,1963-02-14,3820 Forest Dr,Toronto,ON,M5V 2H1,Canada,Bronze,96,44713.47,1541.84,2018-05-06,2022-08-05,true,true,true,false,true,de,JPY,referral,2018-05-06T00:00:00,2019-01-03T00:00:00,customers.json,2026-02-10T22:25:28.068809
CUS-00000059,Yuki,Williams,Yuki Williams,yuki.williams863@yahoo.com,,female,52,1974-02-11,3758 Oak Rd,Toronto,ON,M5V 2H1,Canada,Platinum,23,47166.34,1241.22,2019-09-09T00:00:00,2023-06-01,false,false,false,true,false,ja,CAD,mobile_app,2019-09-09T00:00:00,2019-12-08T00:00:00,customers.json,2026-02-10T22:25:28.068809
CUS-00000060,Jessica,Martinez,Jessica Martinez,jessica.martinez572@mail.com,,M,31,1995-02-06,5826 Park Ln,London,,SW1A 1AA,United Kingdom,VIP,105,25609.45,1422.75,1608418800,2021-10-29,true,true,,true,false,ja,JPY,partner,2020-12-20T00:00:00,2021-12-11T00:00:00,customers.json,2026-02-10T22:25:28.068809
CUS-00000061,Thomas,Davis,Thomas Davis,thomas.davis43@mail.com,(816) 689-2116,F,70,1956-02-16,7785 Hill St,Los Angeles,CA,90001,USA,Silver,88,30004.52,2500.38,30/07/2024,2029-06-22,true,false,false,true,false,fr,,,2024-07-30T00:00:00,2024-08-10T00:00:00,customers.json,2026-02-10T22:25:28.068809
CUS-00000062,Emma,Garcia,Emma Garcia,emma.garcia929@outlook.com,4801287822,"",23,2003-02-04,47 Hill Blvd,Los Angeles,CA,90001,USA,Platinum,142,3313.41,331.34,2023-04-10,2026-08-09,1,true,false,false,false,ja,,website,2023-04-10T00:00:00,2024-05-17T00:00:00,customers.json,2026-02-10T22:25:28.068809
CUS-00000063,Linda,Chen,Linda Chen,linda.chen190@mail.com,915.695.7485,Other,24,2002-02-04,2209 Elm St,Toronto,ON,M5V 2H1,Canada,VIP,176,4560.28,91.21,2022-04-11T00:00:00,2024-01-13,0,true,,false,true,fr,USD,website,2022-04-11T00:00:00,2022-12-09T00:00:00,customers.json,2026-02-10T22:25:28.068809
CUS-00000064,John,Tanaka,John Tanaka,john.tanaka233@gmail.com,5354811914,male,50,1976-02-11,6166 Hill Ln,Sydney,NSW,2000,Australia,bronze,71,32820.4,683.76,1517439600,2019-10-05,yes,false,false,false,true,fr,,social_media,2018-02-01T00:00:00,2018-06-15T00:00:00,customers.json,2026-02-10T22:25:28.068809
CUS-00000065,Jennifer,Smith,Jennifer Smith,jennifer.smith323@outlook.com,(515) 886-6225,MALE,55,1971-02-12,5473 River Ave,London,,SW1A 1AA,United Kingdom,Gold,14,39174.79,39174.79,2022-02-22T00:00:00,2024-06-28,true,true,true,true,true,fr,EUR,social_media,2022-02-22T00:00:00,2022-09-29T00:00:00,customers.json,2026-02-10T22:25:28.068809
CUS-00000066,Liam,Dubois,Liam Dubois,liam.dubois319@company.com,UNLISTED,M,81,1945-02-18,3210 Oak Ave,Tokyo,,100-0001,Japan,Bronze,148,799.95,20.51,09-03-2018,2020-11-22,no,true,false,false,true,zh,JPY,referral,2018-09-03T00:00:00,2019-11-13T00:00:00,customers.json,2026-02-10T22:25:28.068809
CUS-00000067,Jennifer,Tanaka,Jennifer Tanaka,jennifer.tanaka151@gmail.com,9706451787,male,47,1979-02-10,5932 Lake St,Toronto,ON,M5V 2H1,Canada,Silver,9,25727.1,584.71,2021-12-06T00:00:00,2025-01-20,1,false,,false,false,zh,JPY,referral,2021-12-06T00:00:00,2022-12-19T00:00:00,customers.json,2026-02-10T22:25:28.068809
CUS-00000068,Robert,Miller,Robert Miller,robert.miller115@gmail.com,(829) 883-9048,Male,78,1948-02-18,8895 Main St,London,,SW1A 1AA,United Kingdom,SILVER,156,43387.11,1735.48,17/04/2021,2022-03-30,true,false,false,true,true,de,AUD,mobile_app,2021-04-17T00:00:00,2021-09-30T00:00:00,customers.json,2026-02-10T22:25:28.068809
CUS-00000069,Marie,Patel,Marie Patel,marie.patel850@mail.com,727.170.7493,F,24,2002-02-04,8767 River Ln,Toronto,ON,M5V 2H1,Canada,Platinum,17,12742.43,411.05,1538431200,2020-03-20,false,false,,true,true,zh,CAD,,2018-10-02T00:00:00,2019-10-23T00:00:00,customers.json,2026-02-10T22:25:28.068809
CUS-00000070,Emma,Chen,Emma Chen,emma.chen660@yahoo.com,800.640.9429,"",22,2004-02-04,9802 Hill Ln,Berlin,,10115,Germany,VIP,65,5277.47,439.79,05-26-2023,2024-10-26,true,true,,true,false,es,AUD,mobile_app,2023-05-26T00:00:00,2023-09-24T00:00:00,customers.json,2026-02-10T22:25:28.068809
CUS-00000071,Christopher,Brown,Christopher Brown,christopher.brown116@yahoo.com,+1-360-680-4442,,23,2003-02-04,9780 Forest Ln,Los Angeles,CA,90001,USA,Silver,99,863.06,107.88,2018-03-03,2020-08-07,false,false,true,false,false,,USD,referral,2018-03-03T00:00:00,2018-04-03T00:00:00,customers.json,2026-02-10T22:25:28.068809
CUS-00000072,Emma,Davis,Emma Davis,emma.davis297@mail.com,3994226068,female,150,1876-03-06,9640 Hill Blvd,Amsterdam,,1012 AB,Netherlands,bronze,20,9967.86,453.08,2021-07-19,2026-03-25,true,false,false,false,false,fr,USD,website,2021-07-19T00:00:00,2021-07-25T00:00:00,customers.json,2026-02-10T22:25:28.068809
CUS-00000073,Liam,Kim,Liam Kim,liam.kim307@outlook.com,+1-430-388-1025,Other,69,1957-02-15,7523 Main Dr,Toronto,ON,M5V 2H1,Canada,Gold,60,21523.33,614.95,2018-03-03T00:00:00,2018-12-16,false,false,,false,true,fr,USD,referral,2018-03-03T00:00:00,2019-04-18T00:00:00,customers.json,2026-02-10T22:25:28.068809
CUS-00000074,Christopher,Tanaka,Christopher Tanaka,christopher.tanaka372@yahoo.com,,Female,65,1961-02-14,7553 River Rd,Toronto,ON,M5V 2H1,Canada,platinum,131,-48890.0,,02-05-2020,2025-05-21,false,false,false,false,false,zh,USD,,2020-02-05T00:00:00,2021-02-21T00:00:00,customers.json,2026-02-10T22:25:28.068809
CUS-00000075,Robert,Dubois,Robert Dubois,robert.dubois395@outlook.com,,M,64,1962-02-14,1725 River Ln,Sydney,NSW,2000,Australia,VIP,76,40567.58,1690.32,2021-10-01T00:00:00,2023-03-26,true,false,false,true,true,,AUD,mobile_app,2021-10-01T00:00:00,2021-12-04T00:00:00,customers.json,2026-02-10T22:25:28.068809
CUS-00000076,Priya,Wang,Priya Wang,ahmed.garcia622@yahoo.com,(847) 508-4597,FEMALE,-5,1998-09-13,8523 Elm Ave,London,,SW1A 1AA,United Kingdom,Gold,177,8922.38,524.85,2019-07-12T00:00:00,2021-05-13,false,true,true,false,true,de,AUD,referral,2019-07-12T00:00:00,2019-07-15T00:00:00,customers.json,2026-02-10T22:25:28.068809
CUS-00000077,Jessica,Williams,Jessica Williams,jessica.williams806@gmail.com,(201) 725-3916,Female,23,2003-02-04,7049 River Ln,Tokyo,,100-0001,Japan,Bronze,4,40856.18,40856.18,2018-11-28T00:00:00,2022-02-06,1,true,,false,false,zh,GBP,mobile_app,2018-11-28T00:00:00,2020-01-17T00:00:00,customers.json,2026-02-10T22:25:28.068809
CUS-00000078,Wei,Jones,Wei Jones,wei.jones535@mail.com,,M,51,1975-02-11,5764 Hill Ave,Toronto,ON,M5V 2H1,Canada,Platinum,176,26944.07,2245.34,2019-08-02,2023-12-03,no,false,true,false,false,fr,AUD,mobile_app,2019-08-02T00:00:00,2020-01-21T00:00:00,customers.json,2026-02-10T22:25:28.068809
CUS-00000079,Priya,Jones,Priya Jones,priya.jones543@company.com,(398) 702-9977,female,35,1991-02-07,5473 Main Blvd,Toronto,ON,M5V 2H1,Canada,Silver,114,46060.81,2558.93,2021-05-28,2026-03-03,yes,false,false,false,false,en,GBP,social_media,2021-05-28T00:00:00,2021-08-17T00:00:00,customers.json,2026-02-10T22:25:28.068809
CUS-00000080,Michael,O'Brien,Michael O'Brien,michael.o'brien747@yahoo.com,+1-984-432-2755,Male,74,1952-02-17,2903 Elm Ln,Sydney,NSW,2000,Australia,platinum,7,,,2023-09-10T00:00:00,2025-07-13,0,true,false,false,true,zh,EUR,website,2023-09-10T00:00:00,2024-12-10T00:00:00,customers.json,2026-02-10T22:25:28.068809
CUS-00000081,John,Jones,John Jones,john.jones449@yahoo.com,280.427.2818,M,74,1952-02-17,7598 Main Rd,Amsterdam,,1012 AB,Netherlands,Platinum,182,1647.93,34.33,1606604400,2023-09-03,0,true,true,true,true,en,JPY,referral,2020-11-29T00:00:00,2022-04-03T00:00:00,customers.json,2026-02-10T22:25:28.068809
CUS-00000082,Yuki,Anderson,Yuki Anderson,yuki.anderson994@yahoo.com,+1-321-103-5545,female,40,1986-02-08,5671 Park Rd,Los Angeles,CA,90001,USA,Gold,176,47772.82,1291.16,02-02-2024,2027-07-16,true,true,false,false,true,en,USD,social_media,2024-02-02T00:00:00,2025-06-09T00:00:00,customers.json,2026-02-10T22:25:28.068809
CUS-00000083,Jessica,O'Brien,Jessica O'Brien,jessica.o'brien14@mail.com,9968124958,Male,65,1961-02-14,46 Hill Blvd,Toronto,ON,M5V 2H1,Canada,Silver,118,33127.51,1325.1,29/12/2020,2024-04-01,0,false,true,true,true,zh,GBP,website,2020-12-29T00:00:00,2021-02-04T00:00:00,customers.json,2026-02-10T22:25:28.068809
CUS-00000084,Jessica,Miller,Jessica Miller,jessica.miller321@company.com,877.686.3448,Male,23,2003-02-04,8864 Hill Dr,Berlin,,10115,Germany,bronze,65,39383.37,2461.46,2019-01-26,2024-01-27,true,true,true,false,false,de,EUR,mobile_app,2019-01-26T00:00:00,2019-12-07T00:00:00,customers.json,2026-02-10T22:25:28.068809
CUS-00000085,Emma,Smith,Emma Smith,emma.smith918@outlook.com,+1-972-997-9897,FEMALE,41,1985-02-08,7592 Main Ln,London,,SW1A 1AA,United Kingdom,Platinum,153,39877.11,4430.79,2020-09-11,2022-10-08,no,true,true,false,true,es,CAD,partner,2020-09-11T00:00:00,2020-09-14T00:00:00,customers.json,2026-02-10T22:25:28.068809
CUS-00000086,Jennifer,Miller,Jennifer Miller,jennifer.miller718@company.com,,FEMALE,58,1968-02-13,7708 Elm Ln,Los Angeles,CA,90001,USA,Bronze,177,10611.23,1515.89,2022-11-12T00:00:00,2023-04-28,true,true,false,true,false,ja,,,2022-11-12T00:00:00,2023-09-17T00:00:00,customers.json,2026-02-10T22:25:28.068809
CUS-00000087,Priya,Miller,Priya Miller,priya.miller561@gmail.com,UNLISTED,M,47,1979-02-10,970 Lake St,Sydney,NSW,2000,Australia,bronze,72,27582.43,1532.36,2019-10-28T00:00:00,2023-04-30,1,true,,true,true,en,JPY,referral,2019-10-28T00:00:00,2020-08-18T00:00:00,customers.json,2026-02-10T22:25:28.068809
CUS-00000088,Karen,Miller,Karen Miller,,3338348191,MALE,24,2002-02-04,3229 Main Ln,Berlin,,10115,Germany,Bronze,15,2119.37,92.15,1559685600,2019-12-13,false,false,false,false,false,de,AUD,website,2019-06-05T00:00:00,2020-04-12T00:00:00,customers.json,2026-02-10T22:25:28.068809
CUS-00000089,Sarah,Davis,Sarah Davis,sarah.davis787@yahoo.com,(680) 405-7195,F,28,1998-02-05,1942 Hill Blvd,Los Angeles,CA,90001,USA,Gold,4,27083.55,820.71,2018-04-30,2020-07-10,0,false,,false,false,,JPY,social_media,2018-04-30T00:00:00,2019-08-31T00:00:00,customers.json,2026-02-10T22:25:28.068809
CUS-00000090,Carlos,Johnson,Carlos Johnson,carlos.johnson240@company.com,5077711592,F,66,1960-02-15,2122 Elm Blvd,Tokyo,,100-0001,Japan,Silver,35,9468.8,338.17,2022-05-23,2022-06-09,false,false,true,false,true,,JPY,,2022-05-23T00:00:00,2022-08-01T00:00:00,customers.json,2026-02-10T22:25:28.068809
CUS-00000091,Emma,Chen,Emma Chen,emma.chen713@mail.com,(746) 852-9077,male,35,1991-02-07,7552 Elm Rd,London,,SW1A 1AA,United Kingdom,Bronze,171,19044.3,4761.07,06-28-2021,2026-01-01,false,true,true,false,true,,USD,,2021-06-28T00:00:00,2021-10-29T00:00:00,customers.json,2026-02-10T22:25:28.068809
CUS-00000092,John,Williams,John Williams,john.williams869@outlook.com,7114388430,Other,67,1959-02-15,8238 Hill St,Amsterdam,,1012 AB,Netherlands,Gold,111,12034.46,859.6,01-03-2021,2025-10-24,true,true,true,false,false,fr,USD,partner,2021-01-03T00:00:00,2021-12-26T00:00:00,customers.json,2026-02-10T22:25:28.068809
CUS-00000093,Emma,Smith,Emma Smith,emma.smith341@mail.com,5806897247,MALE,33,1993-02-06,2008 Lake St,Paris,,75001,France,Silver,171,726.63,42.74,1672786800,2024-05-08,false,true,true,false,true,fr,,referral,2023-01-04T00:00:00,2024-04-01T00:00:00,customers.json,2026-02-10T22:25:28.068809
CUS-00000094,Elizabeth,Miller,Elizabeth Miller,elizabeth.miller464@gmail.com,+1-897-118-1491,M,53,1973-02-11,7094 Forest Rd,Berlin,,10115,Germany,platinum,69,46629.97,1059.77,2024-02-27T00:00:00,2026-03-10,true,true,false,true,true,,CAD,,2024-02-27T00:00:00,2024-03-10T00:00:00,customers.json,2026-02-10T22:25:28.068809
CUS-00000095,Hans,Silva,Hans Silva,hans.silva816@company.com,+1-673-563-3163,female,26,2000-02-05,5333 Main St,Los Angeles,CA,90001,USA,BRONZE,7,38171.45,3817.14,2021-02-15T00:00:00,2025-09-08,true,true,true,false,true,fr,JPY,,2021-02-15T00:00:00,2022-04-24T00:00:00,customers.json,2026-02-10T22:25:28.068809
CUS-00000096,Michael,Brown,Michael Brown,michael.brown28@company.com,4032244245,female,80,1946-02-18,2095 River Dr,Amsterdam,,1012 AB,Netherlands,Gold,91,19568.73,455.09,17/11/2021,2025-06-29,false,true,true,true,false,es,CAD,partner,2021-11-17T00:00:00,2022-02-22T00:00:00,customers.json,2026-02-10T22:25:28.068809
CUS-00000097,Liam,Silva,Liam Silva,liam.silva623@mail.com,7194581569,F,82,1944-02-19,6245 Main St,Tokyo,,100-0001,Japan,Bronze,4,25596.96,799.9,2019-01-11,2024-05-29,true,false,true,false,true,ja,CAD,partner,2019-01-11T00:00:00,2019-11-30T00:00:00,customers.json,2026-02-10T22:25:28.068809
CUS-00000098,Jennifer,Williams,Jennifer Williams,jennifer.williams683@company.com,(998) 512-8839,M,55,1971-02-12,5671 Elm Ln,London,,SW1A 1AA,United Kingdom,Silver,171,,,06/06/2020,2021-01-09,true,false,false,true,false,es,,partner,2020-06-06T00:00:00,2020-11-25T00:00:00,customers.json,2026-02-10T22:25:28.068809
CUS-00000099,Michael,Wang,Michael Wang,michael.wang922@gmail.com,+1-450-168-2879,MALE,27,1999-02-05,2860 Hill Ln,Sydney,NSW,2000,Australia,Silver,15,38619.9,1170.3,07-15-2021,2021-08-11,yes,true,,false,false,de,USD,referral,2021-07-15T00:00:00,2022-07-24T00:00:00,customers.json,2026-02-10T22:25:28.068809
CUS-00000100,William,Dubois,William Dubois,william.dubois371@gmail.com,+1-875-168-7034,Male,25,2001-02-04,2247 Main Rd,Amsterdam,,1012 AB,Netherlands,VIP,44,10615.42,379.12,10/01/2019,2021-01-11,true,true,,false,true,es,CAD,,2019-01-10T00:00:00,2019-02-24T00:00:00,customers.json,2026-02-10T22:25:28.068809
CUS-00000101,Robert,Martinez,Robert Martinez,robert.martinez964@gmail.com,(744) 680-8436,female,21,2005-02-03,9450 Forest Ln,Tokyo,,100-0001,Japan,Platinum,140,49255.24,1824.27,07-03-2023,2025-09-07,false,true,,false,true,en,AUD,website,2023-07-03T00:00:00,2024-05-20T00:00:00,customers.json,2026-02-10T22:25:28.068809
CUS-00000102,Carlos,Kim,Carlos Kim,carlos.kim317@outlook.com,+1-852-442-3976,,18,2008-02-03,7607 Hill Rd,Berlin,,10115,Germany,Platinum,80,32022.19,914.92,2023-06-15T00:00:00,2023-06-29,no,false,false,false,false,fr,USD,social_media,2023-06-15T00:00:00,2024-08-05T00:00:00,customers.json,2026-02-10T22:25:28.068809
CUS-00000103,Michael,Kim,Michael Kim,michael.kim437@outlook.com,681.303.1616,F,66,1960-02-15,812 River Dr,Amsterdam,,1012 AB,Netherlands,VIP,120,3999.96,85.11,2022-10-14,2024-10-16,true,false,false,true,true,ja,EUR,social_media,2022-10-14T00:00:00,2023-05-13T00:00:00,customers.json,2026-02-10T22:25:28.068809
CUS-00000104,Yuki,Miller,Yuki Miller,yuki.miller307@company.com,488.523.8120,F,49,1977-02-10,4235 Lake Dr,Paris,,75001,France,Gold,116,39595.77,2083.99,25/06/2020,2023-09-04,1,false,false,true,true,es,EUR,website,2020-06-25T00:00:00,2021-04-24T00:00:00,customers.json,2026-02-10T22:25:28.068809
CUS-00000105,David,Silva,David Silva,david.silva132@company.com,+1-885-937-9735,male,84,1942-02-19,6764 River Rd,New York,NY,10001,USA,Platinum,121,5801.42,152.67,27/05/2024,2026-03-27,true,true,true,true,true,fr,GBP,partner,2024-05-27T00:00:00,2025-01-03T00:00:00,customers.json,2026-02-10T22:25:28.068809
CUS-00000106,Priya,Martinez,Priya Martinez,priya.martinez952@company.com,408.851.8560,Other,28,1998-02-05,3579 Oak Rd,Toronto,ON,M5V 2H1,Canada,Platinum,181,31418.82,1309.12,1725228000,2027-10-14,1,true,false,false,false,de,EUR,website,2024-09-02T00:00:00,2024-10-09T00:00:00,customers.json,2026-02-10T22:25:28.068809
CUS-00000107,Linda,Patel,Linda Patel,linda.patel380@mail.com,4992875343,,68,1958-02-15,460 Main Dr,London,,SW1A 1AA,United Kingdom,Bronze,167,35724.57,1701.17,18/03/2019,2022-12-28,1,false,,true,true,,CAD,website,2019-03-18T00:00:00,2020-02-12T00:00:00,customers.json,2026-02-10T22:25:28.068809
CUS-00000108,Yuki,Dubois,Yuki Dubois,yuki.dubois911@company.com,,M,43,1983-02-09,3831 Main Ave,Amsterdam,,1012 AB,Netherlands,Platinum,5,37592.74,4176.97,02-22-2021,2025-05-25,yes,true,true,true,true,es,USD,mobile_app,2021-02-22T00:00:00,2021-06-03T00:00:00,customers.json,2026-02-10T22:25:28.068809
CUS-00000109,William,Tanaka,William Tanaka,william.tanaka452@company.com,345.894.8837,M,51,1975-02-11,3851 Main Ave,London,,SW1A 1AA,United Kingdom,Silver,70,2849.7,61.95,21/08/2018,2019-12-06,true,true,,false,false,en,,partner,2018-08-21T00:00:00,2019-10-09T00:00:00,customers.json,2026-02-10T22:25:28.068809
CUS-00000110,Marie,Smith,Marie Smith,marie.smith466@gmail.com,6738472664,F,64,1962-02-14,8796 Forest Ave,Sydney,NSW,2000,Australia,Gold,174,41628.61,1342.86,08/08/2021,2023-01-30,0,true,true,true,false,ja,USD,partner,2021-08-08T00:00:00,2022-09-12T00:00:00,customers.json,2026-02-10T22:25:28.068809
CUS-00000111,Hans,Chen,Hans Chen,hans.chen404@company.com,+1-957-250-5053,Female,24,2002-02-04,7446 Main Blvd,Los Angeles,CA,90001,USA,Bronze,75,2146.08,47.69,2018-07-13,2021-08-18,false,true,false,true,false,zh,GBP,mobile_app,2018-07-13T00:00:00,2019-05-15T00:00:00,customers.json,2026-02-10T22:25:28.068809
CUS-00000112,David,Brown,David Brown,david.brown105@company.com,+1-460-355-4609,Male,42,1984-02-09,8841 Park Ave,Tokyo,,100-0001,Japan,Platinum,75,13070.62,687.93,12-23-2019,2025-05-07,no,true,false,false,false,en,GBP,social_media,2019-12-23T00:00:00,2020-01-02T00:00:00,customers.json,2026-02-10T22:25:28.068809
CUS-00000113,Fatima,Garcia,Fatima Garcia,fatima.garcia881@gmail.com,(394) 906-8343,MALE,-5,1998-09-13,5723 Oak Ave,Amsterdam,,1012 AB,Netherlands,Platinum,155,46068.03,5118.67,2021-07-20,2022-06-12,0,true,true,false,true,en,GBP,social_media,2021-07-20T00:00:00,2021-11-08T00:00:00,customers.json,2026-02-10T22:25:28.068809
CUS-00000114,Mary,Jones,Mary Jones,mary.jones326@mail.com,+1-450-574-3525,,31,1995-02-06,663 Main Rd,Tokyo,,100-0001,Japan,Bronze,147,25742.88,735.51,25/03/2022,2022-10-09,true,true,,true,true,,EUR,website,2022-03-25T00:00:00,2023-07-24T00:00:00,customers.json,2026-02-10T22:25:28.068809
CUS-00000115,Ahmed,Garcia,Ahmed Garcia,ahmed.garcia382@gmail.com,,MALE,18,2008-02-03,2911 Forest Blvd,Los Angeles,CA,90001,USA,Gold,164,19503.7,573.64,2023-12-15T00:00:00,2028-08-24,false,false,,false,false,zh,JPY,referral,2023-12-15T00:00:00,2025-04-12T00:00:00,customers.json,2026-02-10T22:25:28.068809
CUS-00000116,Priya,Kim,Priya Kim,priya.kim794@outlook.com,348.283.2230,Other,32,1994-02-06,7316 Elm Blvd,Los Angeles,CA,90001,USA,Gold,151,10887.06,272.18,1530828000,2021-03-26,1,true,,true,true,en,CAD,partner,2018-07-06T00:00:00,2018-07-16T00:00:00,customers.json,2026-02-10T22:25:28.068809
CUS-00000117,Mary,Davis,Mary Davis,mary.davis433@company.com,+1-263-105-6698,Other,38,1988-02-08,2801 Main St,New York,NY,10001,USA,Bronze,116,12251.38,471.21,1628546400,2026-08-28,yes,true,false,false,true,,EUR,mobile_app,2021-08-10T00:00:00,2022-10-16T00:00:00,customers.json,2026-02-10T22:25:28.068809
CUS-00000118,Sarah,Miller,Sarah Miller,sarah.miller625@mail.com,+1-695-517-2364,"",43,1983-02-09,9975 Elm St,London,,SW1A 1AA,United Kingdom,VIP,173,90.98,2.6,1668294000,2025-09-13,false,false,true,false,true,ja,JPY,referral,2022-11-13T00:00:00,2023-11-10T00:00:00,customers.json,2026-02-10T22:25:28.068809
CUS-00000119,Carlos,Smith,Carlos Smith,carlos.smith976@company.com,(795) 271-1102,,71,1955-02-16,4047 Lake Rd,Los Angeles,CA,90001,USA,Platinum,170,5883.11,183.85,06/06/2019,2021-05-27,true,true,,false,false,fr,CAD,social_media,2019-06-06T00:00:00,2020-03-05T00:00:00,customers.json,2026-02-10T22:25:28.068809
CUS-00000120,Richard,Garcia,Richard Garcia,richard.garcia891@mail.com,UNLISTED,male,70,1956-02-16,1032 Forest Dr,New York,NY,10001,USA,Gold,159,30411.1,1169.66,2022-12-26T00:00:00,2023-10-14,true,true,,false,false,zh,CAD,social_media,2022-12-26T00:00:00,2023-05-05T00:00:00,customers.json,2026-02-10T22:25:28.068809
CUS-00000121,Sarah,Wang,Sarah Wang,sarah.wang872@mail.com,(509) 215-7733,M,19,2007-02-03,8434 Hill St,Tokyo,,100-0001,Japan,VIP,84,19071.99,1733.82,2024-07-09,2026-01-03,true,true,false,true,false,en,JPY,social_media,2024-07-09T00:00:00,2024-12-04T00:00:00,customers.json,2026-02-10T22:25:28.068809
CUS-00000122,Sarah,Anderson,Sarah Anderson,sarah.anderson19@gmail.com,786.668.4112,F,71,1955-02-16,239 Elm Blvd,Sydney,NSW,2000,Australia,VIP,95,36857.82,36857.82,2021-06-03,2022-01-06,true,true,true,false,false,,CAD,social_media,2021-06-03T00:00:00,2021-07-25T00:00:00,customers.json,2026-02-10T22:25:28.068809
CUS-00000123,Christopher,Anderson,Christopher Anderson,christopher.anderson661@outlook.com,,"",72,1954-02-16,2014 Main Ave,Sydney,NSW,2000,Australia,Bronze,70,43915.43,2311.34,03-21-2018,2021-10-03,1,true,,true,false,de,GBP,,2018-03-21T00:00:00,2018-09-12T00:00:00,customers.json,2026-02-10T22:25:28.068809
CUS-00000124,Susan,Patel,Susan Patel,susan.patel839@company.com,(531) 452-8146,male,21,2005-02-03,7871 Hill Rd,Chicago,IL,60601,USA,vip,139,11833.8,622.83,05-27-2019,2021-01-19,0,true,,false,false,es,USD,mobile_app,2019-05-27T00:00:00,2020-02-24T00:00:00,customers.json,2026-02-10T22:25:28.068809
CUS-00000125,Linda,Chen,Linda Chen,linda.chen501@gmail.com,+1-423-204-3723,,49,1977-02-10,5260 River Dr,Los Angeles,CA,90001,USA,Silver,84,31683.7,2880.34,19/04/2023,2027-08-17,1,true,,false,true,zh,,referral,2023-04-19T00:00:00,2023-06-09T00:00:00,customers.json,2026-02-10T22:25:28.068809
CUS-00000126,Richard,Brown,Richard Brown,richard.brown336@mail.com,(571) 415-2519,Other,77,1949-02-17,4920 Forest Ave,Berlin,,10115,Germany,Gold,67,43698.56,2299.92,1590703200,2022-01-24,false,true,false,true,false,ja,AUD,website,2020-05-29T00:00:00,2020-09-19T00:00:00,customers.json,2026-02-10T22:25:28.068809
CUS-00000127,Michael,Brown,Michael Brown,michael.brown223@mail.com,685.618.9764,male,33,1993-02-06,6695 River Ln,Chicago,IL,60601,USA,VIP,55,41369.14,1969.96,20/05/2023,2023-09-25,no,true,true,true,false,de,CAD,social_media,2023-05-20T00:00:00,2023-08-24T00:00:00,customers.json,2026-02-10T22:25:28.068809
CUS-00000128,Elizabeth,Rodriguez,Elizabeth Rodriguez,elizabeth.rodriguez509@company.com,3397015209,Other,61,1965-02-13,278 Park Ln,Tokyo,,100-0001,Japan,gold,182,29397.72,1336.26,09/12/2020,2021-02-22,false,true,,false,false,fr,EUR,,2020-12-09T00:00:00,2021-05-08T00:00:00,customers.json,2026-02-10T22:25:28.068809
CUS-00000129,Richard,Rodriguez,Richard Rodriguez,richard.rodriguez796@mail.com,UNLISTED,Other,77,1949-02-17,1213 Elm Rd,Amsterdam,,1012 AB,Netherlands,VIP,136,5602.54,160.07,28/11/2021,2022-04-23,no,true,false,true,false,,AUD,partner,2021-11-28T00:00:00,2022-04-30T00:00:00,customers.json,2026-02-10T22:25:28.068809
CUS-00000130,Emma,Rodriguez,Emma Rodriguez,emma.rodriguez831@outlook.com,(735) 500-9574,female,28,1998-02-05,9445 Main St,Toronto,ON,M5V 2H1,Canada,Gold,189,5748.14,143.7,1692655200,2026-05-24,true,true,false,false,true,fr,GBP,mobile_app,2023-08-22T00:00:00,2024-06-03T00:00:00,customers.json,2026-02-10T22:25:28.068809
CUS-00000131,Priya,Tanaka,Priya Tanaka,priya.tanaka600@company.com,(751) 868-1338,FEMALE,34,1992-02-07,5037 Elm Ln,Chicago,IL,60601,USA,Bronze,81,28804.88,1252.39,2022-06-05,2023-10-27,false,false,true,true,false,,AUD,website,2022-06-05T00:00:00,2023-08-17T00:00:00,customers.json,2026-02-10T22:25:28.068809
CUS-00000132,Thomas,Brown,Thomas Brown,thomas.brown291@gmail.com,9755113291,,18,2008-02-03,5272 Hill St,Los Angeles,CA,90001,USA,Gold,94,28439.08,693.64,06-07-2020,2023-11-26,no,true,true,false,false,,JPY,mobile_app,2020-06-07T00:00:00,2021-04-02T00:00:00,customers.json,2026-02-10T22:25:28.068809
CUS-00000133,Jessica,O'Brien,Jessica O'Brien,jessica.o'brien366@yahoo.com,(875) 237-9324,male,66,1960-02-15,1126 Hill St,Toronto,ON,M5V 2H1,Canada,Platinum,9,20522.47,2931.78,1725141600,2025-08-29,no,false,,true,false,ja,,,2024-09-01T00:00:00,2025-12-15T00:00:00,customers.json,2026-02-10T22:25:28.068809
CUS-00000134,Elizabeth,Tanaka,Elizabeth Tanaka,elizabeth.tanaka44@outlook.com,(702) 319-1135,Other,45,1981-02-09,6747 Main Blvd,Toronto,ON,M5V 2H1,Canada,Gold,127,22691.72,872.76,02-24-2019,2022-06-20,true,true,true,false,false,,GBP,referral,2019-02-24T00:00:00,2020-03-16T00:00:00,customers.json,2026-02-10T22:25:28.068809
CUS-00000135,Barbara,Brown,Barbara Brown,barbara.brown852@yahoo.com,857.535.2963,female,74,1952-02-17,8389 Park Ln,New York,NY,10001,USA,Gold,60,38012.33,2715.17,2020-04-11T00:00:00,2021-06-05,1,false,false,true,false,en,EUR,,2020-04-11T00:00:00,2020-04-15T00:00:00,customers.json,2026-02-10T22:25:28.068809
CUS-00000136,Karen,Smith,Karen Smith,karen.smith936@mail.com,+1-629-123-4052,"",20,2006-02-03,8106 Lake St,Chicago,IL,60601,USA,Bronze,145,-17837.17,,10/08/2020,2024-11-09,true,false,false,true,true,en,AUD,social_media,2020-08-10T00:00:00,2021-08-10T00:00:00,customers.json,2026-02-10T22:25:28.068809
CUS-00000137,Karen,Martinez,Karen Martinez,karen.martinez978@gmail.com,461.986.7666,,71,1955-02-16,846 Main Ave,Los Angeles,CA,90001,USA,Gold,79,748.74,29.95,1690236000,2027-05-04,yes,true,,false,true,en,JPY,website,2023-07-25T00:00:00,2023-10-09T00:00:00,customers.json,2026-02-10T22:25:28.068809
CUS-00000138,Sarah,Kim,Sarah Kim,sarah.kim712@company.com,,female,81,1945-02-18,9226 Main St,Berlin,,10115,Germany,Platinum,119,548.32,39.17,1584313200,2020-05-16,no,true,true,true,false,es,EUR,website,2020-03-16T00:00:00,2020-05-10T00:00:00,customers.json,2026-02-10T22:25:28.068809
CUS-00000139,Michael,Patel,Michael Patel,michael.patel580@company.com,9615172832,M,24,2002-02-04,3696 Lake Rd,Los Angeles,CA,90001,USA,Silver,34,3466.71,288.89,05-21-2024,2026-02-07,true,true,,false,true,es,GBP,mobile_app,2024-05-21T00:00:00,2024-09-07T00:00:00,customers.json,2026-02-10T22:25:28.068809
CUS-00000140,Emma,O'Brien,Emma O'Brien,emma.o'brien774@outlook.com,UNLISTED,Prefer not to say,21,2005-02-03,2195 Lake Rd,Chicago,IL,60601,USA,Gold,178,6570.97,285.69,1663624800,2026-02-05,0,true,false,true,true,en,USD,partner,2022-09-20T00:00:00,2023-08-27T00:00:00,customers.json,2026-02-10T22:25:28.068809
CUS-00000141,Patricia,Chen,Patricia Chen,patricia.chen596@mail.com,UNLISTED,FEMALE,83,1943-02-19,9134 Oak Dr,Tokyo,,100-0001,Japan,Silver,29,45397.34,1226.96,2019-06-04,2021-12-24,no,false,,true,true,de,GBP,website,2019-06-04T00:00:00,2019-06-29T00:00:00,customers.json,2026-02-10T22:25:28.068809
CUS-00000142,Richard,O'Brien,Richard O'Brien,richard.o'brien956@mail.com,435.385.9852,M,19,2007-02-03,3266 Forest Ln,Sydney,NSW,2000,Australia,VIP,191,48274.94,4827.49,2018-06-10,2019-06-28,0,false,true,true,true,en,USD,website,2018-06-10T00:00:00,2018-06-19T00:00:00,customers.json,2026-02-10T22:25:28.068809
CUS-00000143,Sarah,Silva,Sarah Silva,sarah.silva255@company.com,3243582951,FEMALE,81,1945-02-18,9536 Forest Ln,New York,NY,10001,USA,VIP,184,19254.93,481.37,2018-04-05,2022-11-10,yes,true,,false,false,ja,,website,2018-04-05T00:00:00,2019-07-31T00:00:00,customers.json,2026-02-10T22:25:28.068809
CUS-00000144,Priya,Patel,Priya Patel,priya.patel492@company.com,2998405002,male,36,1990-02-07,2459 Main Ave,Los Angeles,CA,90001,USA,VIP,163,33124.53,1948.5,2019-01-29,2020-07-12,false,false,true,false,true,fr,JPY,social_media,2019-01-29T00:00:00,2019-02-13T00:00:00,customers.json,2026-02-10T22:25:28.068809
CUS-00000145,Joseph,Chen,Joseph Chen,joseph.chen967@company.com,933.154.2564,M,54,1972-02-12,6408 Elm St,New York,NY,10001,USA,VIP,136,7652.77,332.73,1564005600,2022-01-24,false,false,false,false,true,de,EUR,referral,2019-07-25T00:00:00,2020-06-15T00:00:00,customers.json,2026-02-10T22:25:28.068809
CUS-00000146,Michael,Tanaka,Michael Tanaka,N/A,UNLISTED,Male,68,1958-02-15,997 Forest Dr,Tokyo,,100-0001,Japan,Silver,45,,,12/10/2018,2022-07-06,true,false,false,false,true,en,USD,mobile_app,2018-10-12T00:00:00,2019-07-26T00:00:00,customers.json,2026-02-10T22:25:28.068809
CUS-00000147,Linda,Silva,Linda Silva,linda.silva470@yahoo.com,+1-405-230-7999,male,66,1960-02-15,2912 Elm Blvd,Sydney,NSW,2000,Australia,Platinum,108,40754.09,2716.94,10-25-2022,2027-01-16,yes,true,true,true,false,es,USD,referral,2022-10-25T00:00:00,2023-07-07T00:00:00,customers.json,2026-02-10T22:25:28.068809
CUS-00000148,Marie,Miller,Marie Miller,marie.miller504@outlook.com,9677953067,M,69,1957-02-15,4523 Oak Dr,Chicago,IL,60601,USA,Platinum,114,42372.84,1569.36,1654207200,2024-05-22,no,false,,false,false,de,,website,2022-06-03T00:00:00,2023-05-08T00:00:00,customers.json,2026-02-10T22:25:28.068809
CUS-00000149,Jennifer,O'Brien,Jennifer O'Brien,JenniferO'Brien,(510) 612-8919,Other,73,1953-02-16,5838 Elm Rd,Paris,,75001,France,Gold,66,37707.31,1019.12,08/08/2018,2019-06-12,true,false,,false,false,zh,,website,2018-08-08T00:00:00,2019-09-04T00:00:00,customers.json,2026-02-10T22:25:28.068809
CUS-00000150,Patricia,Brown,Patricia Brown,patricia.brown505@mail.com,(439) 414-4692,Female,62,1964-02-14,717 Elm St,Los Angeles,CA,90001,USA,VIP,42,26865.18,1119.38,12-04-2023,2028-10-11,false,false,true,true,true,,USD,website,2023-12-04T00:00:00,2024-11-30T00:00:00,customers.json,2026-02-10T22:25:28.068809
CUS-00000151,Richard,Johnson,Richard Johnson,,UNLISTED,F,22,2004-02-04,4880 Forest St,London,,SW1A 1AA,United Kingdom,VIP,62,31163.74,4451.96,2019-03-07T00:00:00,2019-09-06,false,false,,false,true,,CAD,website,2019-03-07T00:00:00,2020-06-01T00:00:00,customers.json,2026-02-10T22:25:28.068809
CUS-00000152,Wei,Kim,Wei Kim,wei.kim779@yahoo.com,+1-252-839-9312,FEMALE,85,1941-02-19,8563 Main Blvd,Los Angeles,CA,90001,USA,Silver,36,16917.97,338.36,2018-11-12T00:00:00,2021-07-06,true,true,false,true,false,en,JPY,website,2018-11-12T00:00:00,2019-08-21T00:00:00,customers.json,2026-02-10T22:25:28.068809
CUS-00000153,Hans,Silva,Hans Silva,hans.silva798@gmail.com,(457) 592-9034,FEMALE,64,1962-02-14,8201 Main St,New York,NY,10001,USA,Platinum,44,45151.77,1075.04,01-07-2023,2023-02-06,1,true,true,true,false,es,EUR,website,2023-01-07T00:00:00,2023-07-26T00:00:00,customers.json,2026-02-10T22:25:28.068809
CUS-00000154,Christopher,Johnson,Christopher Johnson,christopher.johnson617@company.com,(220) 498-8249,FEMALE,67,1959-02-15,159 Park Ave,Amsterdam,,1012 AB,Netherlands,silver,94,2793.19,931.06,1643756400,2023-10-05,1,true,false,true,true,ja,AUD,mobile_app,2022-02-02T00:00:00,2022-11-24T00:00:00,customers.json,2026-02-10T22:25:28.068809
CUS-00000155,Robert,Martinez,Robert Martinez,robert.martinez876@mail.com,215.423.4745,Other,49,1977-02-10,5407 Park Rd,Los Angeles,CA,90001,USA,Platinum,141,35729.63,5954.94,2022-03-25,2024-06-29,true,false,true,true,false,de,JPY,referral,2022-03-25T00:00:00,2023-04-22T00:00:00,customers.json,2026-02-10T22:25:28.068809
CUS-00000156,Robert,Dubois,Robert Dubois,robert.dubois840@mail.com,+1-683-352-6520,Other,23,2003-02-04,7568 Elm Ave,Chicago,IL,60601,USA,VIP,188,25359.15,1014.37,2020-08-17,2022-09-26,true,false,false,false,false,,GBP,social_media,2020-08-17T00:00:00,2021-09-16T00:00:00,customers.json,2026-02-10T22:25:28.068809
CUS-00000157,Joseph,Mueller,Joseph Mueller,joseph.mueller38@yahoo.com,7447564766,male,55,1971-02-12,8246 River Ln,New York,NY,10001,USA,Bronze,118,,,05/06/2020,2021-06-20,yes,true,true,true,false,fr,,social_media,2020-06-05T00:00:00,2021-05-21T00:00:00,customers.json,2026-02-10T22:25:28.068809
CUS-00000158,Thomas,Kim,Thomas Kim,thomas.kim915@yahoo.com,8993113356,MALE,45,1981-02-09,8257 Forest Dr,Los Angeles,CA,90001,USA,Gold,14,46046.3,1705.42,2020-04-25,2022-04-28,1,false,,true,true,en,CAD,referral,2020-04-25T00:00:00,2021-05-29T00:00:00,customers.json,2026-02-10T22:25:28.068809
CUS-00000159,Barbara,Davis,Barbara Davis,barbara.davis7@outlook.com,8109748362,female,77,1949-02-17,5641 Lake Ave,Paris,,75001,France,Gold,112,16117.37,3223.47,1517871600,2020-11-26,true,true,,false,true,,EUR,social_media,2018-02-06T00:00:00,2018-05-24T00:00:00,customers.json,2026-02-10T22:25:28.068809
CUS-00000160,Priya,Kim,Priya Kim,priya.kim467@yahoo.com,,F,69,1957-02-15,531 River Ave,Los Angeles,CA,90001,USA,BRONZE,27,14761.67,527.2,1688767200,2024-02-26,true,true,,true,true,en,EUR,,2023-07-08T00:00:00,2024-02-04T00:00:00,customers.json,2026-02-10T22:25:28.068809
CUS-00000161,Christopher,Patel,Christopher Patel,christopher.patel98@gmail.com,(262) 532-9951,FEMALE,44,1982-02-09,3008 Lake Rd,Los Angeles,CA,90001,USA,Silver,97,44414.2,1200.38,27/06/2022,2024-02-13,false,false,true,false,false,de,EUR,partner,2022-06-27T00:00:00,2022-06-29T00:00:00,customers.json,2026-02-10T22:25:28.068809
CUS-00000162,Sarah,Davis,Sarah Davis,sarah.davis34@mail.com,3305733588,MALE,72,1954-02-16,6878 Forest Blvd,Chicago,IL,60601,USA,Bronze,166,41121.21,1869.15,25/01/2024,2025-09-27,no,true,,false,false,es,AUD,social_media,2024-01-25T00:00:00,2024-06-08T00:00:00,customers.json,2026-02-10T22:25:28.068809
CUS-00000163,Karen,O'Brien,Karen O'Brien,KarenO'Brien,,F,56,1970-02-12,534 Lake Rd,New York,NY,10001,USA,VIP,139,29771.34,804.63,2019-02-28,2024-03-24,false,true,true,false,true,es,EUR,mobile_app,2019-02-28T00:00:00,2019-03-03T00:00:00,customers.json,2026-02-10T22:25:28.068809
CUS-00000164,Jennifer,Davis,Jennifer Davis,jennifer.davis69@outlook.com,(316) 733-4706,male,42,1984-02-09,4036 Hill Ave,Tokyo,,100-0001,Japan,VIP,152,14277.61,509.91,07/07/2024,2028-09-30,true,true,false,true,true,es,,referral,2024-07-07T00:00:00,2025-07-27T00:00:00,customers.json,2026-02-10T22:25:28.068809
CUS-00000165,William,Williams,William Williams,william.williams901@yahoo.com,4021778882,female,44,1982-02-09,1603 Elm Ave,Paris,,75001,France,GOLD,102,793.63,27.37,2024-08-05,2026-02-05,false,true,false,false,true,zh,JPY,mobile_app,2024-08-05T00:00:00,2025-12-01T00:00:00,customers.json,2026-02-10T22:25:28.068809
CUS-00000166,Susan,Rodriguez,Susan Rodriguez,susan.rodriguez327@company.com,UNLISTED,female,60,1966-02-13,1542 Lake Ave,Toronto,ON,M5V 2H1,Canada,Gold,185,9593.04,191.86,05/01/2021,2024-11-20,false,true,false,true,true,ja,,social_media,2021-01-05T00:00:00,2021-09-10T00:00:00,customers.json,2026-02-10T22:25:28.068809
CUS-00000167,Emma,O'Brien,Emma O'Brien,emma.o'brien654@company.com,UNLISTED,F,66,1960-02-15,3424 Park Ave,Toronto,ON,M5V 2H1,Canada,VIP,151,420.81,11.07,1553468400,2019-06-17,yes,false,true,false,true,es,GBP,social_media,2019-03-25T00:00:00,2020-03-25T00:00:00,customers.json,2026-02-10T22:25:28.068809
CUS-00000168,Sarah,Martinez,Sarah Martinez,sarah.martinez282@company.com,(743) 296-9871,Prefer not to say,45,1981-02-09,5225 River St,Tokyo,,100-0001,Japan,Bronze,150,24138.64,928.41,06/12/2019,2021-12-17,true,true,true,false,true,,USD,partner,2019-12-06T00:00:00,2020-03-08T00:00:00,customers.json,2026-02-10T22:25:28.068809
CUS-00000169,Barbara,Kim,Barbara Kim,barbara.kim776@yahoo.com,+1-803-878-5127,MALE,74,1952-02-17,6530 Main Rd,Paris,,75001,France,VIP,88,721.56,180.39,1716328800,2025-05-05,0,false,true,true,true,de,,referral,2024-05-22T00:00:00,2025-04-18T00:00:00,customers.json,2026-02-10T22:25:28.068809
CUS-00000170,Mary,Smith,Mary Smith,mary.smith630@yahoo.com,,Female,69,1957-02-15,6849 Main Blvd,London,,SW1A 1AA,United Kingdom,Bronze,112,1112.32,123.59,2022-04-15T00:00:00,2025-12-24,1,true,,false,true,en,AUD,referral,2022-04-15T00:00:00,2022-08-09T00:00:00,customers.json,2026-02-10T22:25:28.068809
CUS-00000171,Joseph,Garcia,Joseph Garcia,joseph.garcia278@yahoo.com,620.217.1203,FEMALE,43,1983-02-09,7699 Hill Dr,Los Angeles,CA,90001,USA,Gold,93,5002.13,161.36,2022-11-18T00:00:00,2024-06-29,true,false,,true,false,ja,GBP,mobile_app,2022-11-18T00:00:00,2023-10-03T00:00:00,customers.json,2026-02-10T22:25:28.068809
CUS-00000172,Mary,Rodriguez,Mary Rodriguez,mary.rodriguez829@company.com,,MALE,43,1983-02-09,9382 Lake Blvd,London,,SW1A 1AA,United Kingdom,Gold,146,38440.69,784.5,2022-12-29,2025-05-24,true,false,false,false,true,de,,mobile_app,2022-12-29T00:00:00,2023-07-31T00:00:00,customers.json,2026-02-10T22:25:28.068809
CUS-00000173,Sarah,O'Brien,Sarah O'Brien,sarah.o'brien288@gmail.com,UNLISTED,Female,46,1980-02-10,4291 Hill St,Paris,,75001,France,Bronze,79,16098.29,503.07,2019-12-16T00:00:00,2024-06-06,false,false,true,false,false,fr,EUR,social_media,2019-12-16T00:00:00,2020-01-11T00:00:00,customers.json,2026-02-10T22:25:28.068809
CUS-00000174,Richard,Kim,Richard Kim,richard.kim556@gmail.com,973.339.7621,Female,39,1987-02-08,182 Lake Rd,Paris,,75001,France,VIP,11,30465.99,677.02,2018-12-23T00:00:00,2021-07-07,yes,true,false,true,false,de,,social_media,2018-12-23T00:00:00,2019-01-09T00:00:00,customers.json,2026-02-10T22:25:28.068809
CUS-00000175,David,Johnson,David Johnson,david.johnson723@yahoo.com,,Prefer not to say,83,1943-02-19,8308 Hill Rd,Chicago,IL,60601,USA,Silver,56,23794.98,721.06,01-20-2020,2020-07-04,true,false,false,true,false,es,GBP,,2020-01-20T00:00:00,2021-03-11T00:00:00,customers.json,2026-02-10T22:25:28.068809
CUS-00000176,Jennifer,Silva,Jennifer Silva,jennifer.silva890@mail.com,+1-522-917-6286,Male,44,1982-02-09,1143 Hill Ave,Paris,,75001,France,Platinum,148,27276.0,619.91,2024-04-16,2024-06-15,no,true,,true,true,zh,AUD,partner,2024-04-16T00:00:00,2025-08-05T00:00:00,customers.json,2026-02-10T22:25:28.068809
CUS-00000177,Jennifer,Dubois,Jennifer Dubois,jennifer.dubois576@gmail.com,,F,29,1997-02-05,5355 Lake Ln,Paris,,75001,France,Platinum,164,10352.03,265.44,2019-12-04,2025-04-09,false,false,false,false,false,en,JPY,partner,2019-12-04T00:00:00,2020-03-04T00:00:00,customers.json,2026-02-10T22:25:28.068809
CUS-00000178,John,Anderson,John Anderson,john.anderson840@outlook.com,+1-743-266-5449,Prefer not to say,52,1974-02-11,1867 River Ln,Chicago,IL,60601,USA,Platinum,136,-23600.23,,1541372400,2022-05-26,true,true,false,false,true,,CAD,partner,2018-11-05T00:00:00,2018-12-22T00:00:00,customers.json,2026-02-10T22:25:28.068809
CUS-00000179,David,Smith,David Smith,david.smith963@yahoo.com,,female,56,1970-02-12,495 Main Blvd,Los Angeles,CA,90001,USA,Silver,38,30051.88,883.88,1675465200,2027-12-22,0,true,,false,false,en,USD,social_media,2023-02-04T00:00:00,2023-11-07T00:00:00,customers.json,2026-02-10T22:25:28.068809
CUS-00000180,James,Tanaka,James Tanaka,james.tanaka702@mail.com,(615) 501-3169,F,51,1975-02-11,5343 Hill Ln,Amsterdam,,1012 AB,Netherlands,platinum,167,37882.63,3156.89,05-07-2019,2020-06-08,0,false,true,true,true,en,CAD,,2019-05-07T00:00:00,2019-10-05T00:00:00,customers.json,2026-02-10T22:25:28.068809
CUS-00000181,Fatima,Jones,Fatima Jones,N/A,UNLISTED,female,57,1969-02-12,3643 Hill Rd,New York,NY,10001,USA,VIP,129,88.42,1.8,2020-10-20,2022-11-27,no,false,false,true,true,,JPY,,2020-10-20T00:00:00,2021-03-08T00:00:00,customers.json,2026-02-10T22:25:28.068809
CUS-00000182,Ahmed,Silva,Ahmed Silva,ahmed.silva151@mail.com,+1-454-630-7052,Prefer not to say,80,1946-02-18,2854 Elm Ln,Tokyo,,100-0001,Japan,Platinum,13,26470.53,1557.09,10/07/2022,2024-08-11,yes,true,true,false,true,en,JPY,social_media,2022-07-10T00:00:00,2023-01-29T00:00:00,customers.json,2026-02-10T22:25:28.068809
CUS-00000183,John,Mueller,John Mueller,john.mueller598@mail.com,9696668822,Male,50,1976-02-11,8574 Lake Dr,Toronto,ON,M5V 2H1,Canada,Platinum,64,9405.19,1343.6,10-10-2023,2025-06-17,false,true,,true,true,es,JPY,website,2023-10-10T00:00:00,2023-10-25T00:00:00,customers.json,2026-02-10T22:25:28.068809
CUS-00000184,James,Williams,James Williams,james.williams305@outlook.com,(512) 858-4716,,22,2004-02-04,7124 River Ln,Paris,,75001,France,Bronze,99,24810.52,1240.53,30/04/2019,2022-05-17,true,false,true,false,true,en,AUD,mobile_app,2019-04-30T00:00:00,2019-08-27T00:00:00,customers.json,2026-02-10T22:25:28.068809
CUS-00000185,David,Davis,David Davis,david.davis584@gmail.com,2347647062,,70,1956-02-16,7056 River Blvd,Toronto,ON,M5V 2H1,Canada,bronze,40,32961.14,672.68,06-24-2019,2021-12-28,true,false,true,false,false,fr,USD,,2019-06-24T00:00:00,2019-09-15T00:00:00,customers.json,2026-02-10T22:25:28.068809
CUS-00000186,David,Davis,David Davis,david.davis673@gmail.com,(701) 607-4218,,27,1999-02-05,7935 Park Ave,Tokyo,,100-0001,Japan,VIP,118,2297.18,765.73,19/12/2018,2023-02-20,1,true,false,false,false,,JPY,referral,2018-12-19T00:00:00,2019-09-26T00:00:00,customers.json,2026-02-10T22:25:28.068809
CUS-00000187,Karen,Smith,Karen Smith,karen.smith506@outlook.com,,Other,39,1987-02-08,5688 Oak Rd,Los Angeles,CA,90001,USA,Bronze,91,42673.94,1706.96,15/04/2023,2027-03-08,1,true,,true,false,ja,USD,referral,2023-04-15T00:00:00,2023-10-09T00:00:00,customers.json,2026-02-10T22:25:28.068809
CUS-00000188,Sarah,Williams,Sarah Williams,sarah.williams329@gmail.com,607.148.9059,F,20,2006-02-03,9900 Elm Ave,New York,NY,10001,USA,Silver,21,35855.38,1024.44,2024-08-04,2027-08-14,false,false,false,true,true,es,AUD,referral,2024-08-04T00:00:00,2025-11-15T00:00:00,customers.json,2026-02-10T22:25:28.068809
CUS-00000189,Ahmed,Patel,Ahmed Patel,ahmed.patel409@mail.com,+1-875-555-9751,FEMALE,42,1984-02-09,4915 Lake St,Tokyo,,100-0001,Japan,Platinum,129,10226.0,309.88,2021-03-03,2021-11-28,yes,false,true,false,true,ja,EUR,website,2021-03-03T00:00:00,2022-02-13T00:00:00,customers.json,2026-02-10T22:25:28.068809
CUS-00000190,Hans,Brown,Hans Brown,hans.brown717@mail.com,+1-488-986-4643,FEMALE,69,1957-02-15,2604 Elm St,Berlin,,10115,Germany,Gold,81,17178.37,1145.22,1704841200,2027-09-18,no,true,false,false,false,fr,CAD,referral,2024-01-10T00:00:00,2024-06-09T00:00:00,customers.json,2026-02-10T22:25:28.068809
CUS-00000191,Jessica,Johnson,Jessica Johnson,jessica.johnson696@mail.com,9463495461,MALE,19,2007-02-03,1208 Lake St,Sydney,NSW,2000,Australia,Platinum,34,12447.45,518.64,2022-05-07T00:00:00,2026-06-26,no,true,true,false,false,en,GBP,website,2022-05-07T00:00:00,2022-11-24T00:00:00,customers.json,2026-02-10T22:25:28.068809
CUS-00000192,Linda,Johnson,Linda Johnson,linda.johnson406@company.com,+1-743-756-2437,female,20,2006-02-03,2590 Park Blvd,London,,SW1A 1AA,United Kingdom,Bronze,194,2982.18,124.26,1722290400,2025-05-19,no,false,true,true,true,de,USD,website,2024-07-30T00:00:00,2025-06-14T00:00:00,customers.json,2026-02-10T22:25:28.068809
CUS-00000193,Hans,Patel,Hans Patel,hans.patel45@company.com,UNLISTED,female,67,1959-02-15,8674 Park Rd,Toronto,ON,M5V 2H1,Canada,Gold,73,11295.2,230.51,10-13-2024,2028-04-26,yes,false,true,true,false,es,USD,social_media,2024-10-13T00:00:00,2025-08-24T00:00:00,customers.json,2026-02-10T22:25:28.068809
CUS-00000194,Jessica,Johnson,Jessica Johnson,JessicaJohnson,UNLISTED,F,27,1999-02-05,72 Oak Blvd,Chicago,IL,60601,USA,platinum,59,9877.18,224.48,2022-09-23,2025-07-21,yes,false,true,false,false,en,GBP,partner,2022-09-23T00:00:00,2023-05-06T00:00:00,customers.json,2026-02-10T22:25:28.068809
CUS-00000195,Christopher,Johnson,Christopher Johnson,christopher.johnson133@outlook.com,UNLISTED,"",68,1958-02-15,4921 Hill Dr,Sydney,NSW,2000,Australia,Bronze,55,28654.84,1023.39,07-18-2024,2029-10-09,yes,true,,true,true,fr,CAD,partner,2024-07-18T00:00:00,2025-03-28T00:00:00,customers.json,2026-02-10T22:25:28.068809
CUS-00000196,William,Patel,William Patel,WilliamPatel,,M,42,1984-02-09,9892 Forest Ave,Paris,,75001,France,Bronze,175,9321.15,1035.68,27/09/2020,2023-06-25,yes,false,false,true,true,,AUD,mobile_app,2020-09-27T00:00:00,2021-03-10T00:00:00,customers.json,2026-02-10T22:25:28.068809
CUS-00000197,Linda,Garcia,Linda Garcia,linda.garcia958@company.com,442.736.3612,M,42,1984-02-09,8459 Lake Rd,Chicago,IL,60601,USA,Silver,36,28782.82,2055.92,07-11-2018,2018-11-21,no,true,,true,true,,CAD,social_media,2018-07-11T00:00:00,2018-12-27T00:00:00,customers.json,2026-02-10T22:25:28.068809
CUS-00000198,Ahmed,Chen,Ahmed Chen,ahmed.chen337@gmail.com,UNLISTED,FEMALE,34,1992-02-07,7650 Park Ave,Tokyo,,100-0001,Japan,Silver,20,38684.17,1432.75,1615330800,2025-07-22,true,false,false,false,false,en,,social_media,2021-03-10T00:00:00,2021-03-11T00:00:00,customers.json,2026-02-10T22:25:28.068809
CUS-00000199,Michael,Patel,Michael Patel,michael.patel54@outlook.com,UNLISTED,female,76,1950-02-17,9326 Main Blvd,New York,NY,10001,USA,Platinum,41,43433.68,43433.68,2019-06-26,2022-04-27,false,false,true,false,false,,GBP,social_media,2019-06-26T00:00:00,2020-07-03T00:00:00,customers.json,2026-02-10T22:25:28.068809
CUS-00000200,John,Martinez,John Martinez,john.martinez459@mail.com,4637139291,MALE,71,1955-02-16,4860 Park Ave,New York,NY,10001,USA,VIP,34,759.59,15.82,10/08/2024,2028-04-26,1,false,true,true,true,es,CAD,partner,2024-08-10T00:00:00,2025-06-05T00:00:00,customers.json,2026-02-10T22:25:28.068809
CUS-00000201,Hans,Patel,Hans Patel,hans.patel677@gmail.com,(216) 104-2199,"",68,1958-02-15,8258 Forest St,London,,SW1A 1AA,United Kingdom,VIP,132,24910.5,498.21,1724104800,2028-03-16,true,true,true,false,false,en,GBP,,2024-08-20T00:00:00,2025-05-26T00:00:00,customers.json,2026-02-10T22:25:28.068809
CUS-00000202,Priya,Martinez,Priya Martinez,priya.martinez398@gmail.com,610.413.8660,Other,48,1978-02-10,7288 Elm Ave,Tokyo,,100-0001,Japan,Gold,102,31195.43,3899.43,2018-04-11,2019-05-10,true,true,false,true,false,de,EUR,website,2018-04-11T00:00:00,2018-05-31T00:00:00,customers.json,2026-02-10T22:25:28.068809
CUS-00000203,Susan,Chen,Susan Chen,susan.chen923@outlook.com,(608) 430-6370,male,85,1941-02-19,942 River St,Paris,,75001,France,PLATINUM,107,19351.42,774.06,04-11-2023,2027-10-24,1,false,true,true,true,fr,,referral,2023-04-11T00:00:00,2023-08-22T00:00:00,customers.json,2026-02-10T22:25:28.068809
CUS-00000204,John,Silva,John Silva,john.silva627@mail.com,+1-406-306-9671,MALE,45,1981-02-09,996 Elm St,Los Angeles,CA,90001,USA,Bronze,178,2326.81,105.76,2023-01-28,2024-07-29,false,true,,false,true,es,GBP,,2023-01-28T00:00:00,2023-11-20T00:00:00,customers.json,2026-02-10T22:25:28.068809
CUS-00000205,James,O'Brien,James O'Brien,james.o'brien654@company.com,3123146940,,80,1946-02-18,233 River Blvd,Amsterdam,,1012 AB,Netherlands,vip,164,15922.77,388.36,12/01/2021,2025-04-04,1,true,false,true,true,zh,JPY,website,2021-01-12T00:00:00,2021-04-08T00:00:00,customers.json,2026-02-10T22:25:28.068809
CUS-00000206,Hans,Anderson,Hans Anderson,hans.anderson277@outlook.com,8259611287,Other,73,1953-02-16,5986 Oak Ln,London,,SW1A 1AA,United Kingdom,silver,80,4863.63,972.73,1625176800,2024-02-21,yes,false,,true,true,en,AUD,partner,2021-07-02T00:00:00,2022-07-23T00:00:00,customers.json,2026-02-10T22:25:28.068809
CUS-00000207,Marie,Jones,Marie Jones,marie.jones328@mail.com,UNLISTED,Male,74,1952-02-17,6291 Hill Ave,Toronto,ON,M5V 2H1,Canada,VIP,152,21028.5,1502.04,2022-03-24,2023-05-27,0,true,,true,false,ja,AUD,mobile_app,2022-03-24T00:00:00,2022-08-21T00:00:00,customers.json,2026-02-10T22:25:28.068809
CUS-00000208,Carlos,Jones,Carlos Jones,carlos.jones844@company.com,+1-807-956-1383,MALE,22,2004-02-04,5184 Lake Ln,Sydney,NSW,2000,Australia,vip,139,7617.64,185.8,2023-08-21T00:00:00,2028-04-10,true,false,false,false,false,zh,GBP,website,2023-08-21T00:00:00,2024-07-07T00:00:00,customers.json,2026-02-10T22:25:28.068809
CUS-00000209,Fatima,Mueller,Fatima Mueller,fatima.mueller509@company.com,673.626.2086,,44,1982-02-09,8385 Forest Blvd,Sydney,NSW,2000,Australia,Bronze,53,25520.89,750.61,2024-10-03,2026-12-11,true,true,,false,false,en,EUR,mobile_app,2024-10-03T00:00:00,2025-08-02T00:00:00,customers.json,2026-02-10T22:25:28.068809
CUS-00000210,Richard,Brown,Richard Brown,richard.brown118@yahoo.com,UNLISTED,Male,22,2004-02-04,7450 Elm Ave,Los Angeles,CA,90001,USA,SILVER,124,,,24/09/2023,2025-12-24,true,false,,true,true,fr,CAD,partner,2023-09-24T00:00:00,2024-08-28T00:00:00,customers.json,2026-02-10T22:25:28.068809
CUS-00000211,Emma,Tanaka,Emma Tanaka,emma.tanaka623@outlook.com,UNLISTED,Prefer not to say,59,1967-02-13,700 River Blvd,Sydney,NSW,2000,Australia,Platinum,174,38308.81,12769.6,02-24-2018,2023-01-30,true,true,,false,true,ja,GBP,,2018-02-24T00:00:00,2019-04-20T00:00:00,customers.json,2026-02-10T22:25:28.068809
CUS-00000212,William,Rodriguez,William Rodriguez,william.rodriguez319@gmail.com,+1-518-165-6055,FEMALE,22,2004-02-04,7379 Forest Dr,London,,SW1A 1AA,United Kingdom,VIP,14,31407.87,3140.79,29/06/2022,2025-06-26,1,false,false,false,false,fr,JPY,social_media,2022-06-29T00:00:00,2023-04-19T00:00:00,customers.json,2026-02-10T22:25:28.068809
CUS-00000213,Fatima,Martinez,Fatima Martinez,fatima.martinez937@gmail.com,,,74,1952-02-17,6448 Park Ln,London,,SW1A 1AA,United Kingdom,Gold,10,22677.65,2519.74,1556834400,2023-04-12,false,false,,false,false,zh,EUR,mobile_app,2019-05-03T00:00:00,2019-08-27T00:00:00,customers.json,2026-02-10T22:25:28.068809
CUS-00000214,Jennifer,Martinez,Jennifer Martinez,jennifer.martinez385@gmail.com,4124075778,Other,80,1946-02-18,1883 Hill St,Sydney,NSW,2000,Australia,Platinum,114,37163.37,37163.37,11-08-2020,2024-07-01,true,true,true,true,true,de,AUD,partner,2020-11-08T00:00:00,2020-12-14T00:00:00,customers.json,2026-02-10T22:25:28.068809
CUS-00000215,Wei,Martinez,Wei Martinez,wei.martinez234@gmail.com,,Prefer not to say,21,2005-02-03,9587 Hill Ln,Tokyo,,100-0001,Japan,Silver,48,1482.16,185.27,1616886000,2024-10-17,false,false,false,false,false,en,AUD,,2021-03-28T00:00:00,2021-10-07T00:00:00,customers.json,2026-02-10T22:25:28.068809
CUS-00000216,Susan,Tanaka,Susan Tanaka,susan.tanaka976@company.com,+1-446-384-3849,female,75,1951-02-17,2454 Lake Rd,Los Angeles,CA,90001,USA,Platinum,104,44560.61,5570.08,05-05-2020,2020-06-07,1,true,,true,true,es,,referral,2020-05-05T00:00:00,2020-06-06T00:00:00,customers.json,2026-02-10T22:25:28.068809
CUS-00000217,Joseph,Martinez,Joseph Martinez,joseph.martinez930@company.com,UNLISTED,Male,29,1997-02-05,432 Park Dr,Tokyo,,100-0001,Japan,Gold,83,9176.25,9176.25,03/10/2021,2026-09-10,0,false,true,true,false,,GBP,,2021-10-03T00:00:00,2022-02-10T00:00:00,customers.json,2026-02-10T22:25:28.068809
CUS-00000218,Liam,Patel,Liam Patel,liam.patel493@company.com,569.382.7192,female,77,1949-02-17,3501 Oak Ave,Sydney,NSW,2000,Australia,VIP,177,4685.11,4685.11,04-12-2021,2023-11-05,true,false,false,true,false,de,CAD,social_media,2021-04-12T00:00:00,2021-11-15T00:00:00,customers.json,2026-02-10T22:25:28.068809
CUS-00000219,Patricia,Silva,Patricia Silva,patricia.silva54@yahoo.com,519.311.2381,Other,76,1950-02-17,6642 River Blvd,London,,SW1A 1AA,United Kingdom,Platinum,78,5239.04,582.12,11-10-2022,2025-12-07,no,true,false,true,true,,JPY,partner,2022-11-10T00:00:00,2023-10-12T00:00:00,customers.json,2026-02-10T22:25:28.068809
CUS-00000220,Michael,Davis,Michael Davis,N/A,UNLISTED,male,31,1995-02-06,5239 Elm St,New York,NY,10001,USA,Silver,25,4837.09,186.04,2021-08-30T00:00:00,2023-12-15,false,true,,true,true,es,,mobile_app,2021-08-30T00:00:00,2022-01-19T00:00:00,customers.json,2026-02-10T22:25:28.068809
CUS-00000221,Mary,Johnson,Mary Johnson,mary.johnson238@outlook.com,879.856.1759,M,32,1994-02-06,3986 Lake Rd,Toronto,ON,M5V 2H1,Canada,Silver,106,11429.85,259.77,06-10-2021,2023-07-25,0,true,true,false,true,ja,JPY,referral,2021-06-10T00:00:00,2022-07-10T00:00:00,customers.json,2026-02-10T22:25:28.068809
CUS-00000222,Fatima,Martinez,Fatima Martinez,FatimaMartinez,(640) 539-4167,female,78,1948-02-18,6632 Oak Rd,Tokyo,,100-0001,Japan,Platinum,177,12163.02,1013.59,2023-02-02T00:00:00,2026-08-05,yes,false,false,true,false,de,,social_media,2023-02-02T00:00:00,2024-06-07T00:00:00,customers.json,2026-02-10T22:25:28.068809
CUS-00000223,Jennifer,Wang,Jennifer Wang,jennifer.wang894@yahoo.com,614.969.7076,M,61,1965-02-13,4746 Park Ln,Tokyo,,100-0001,Japan,Gold,194,28081.59,1123.26,2022-11-14T00:00:00,2025-02-26,true,false,true,false,false,en,EUR,,2022-11-14T00:00:00,2023-07-06T00:00:00,customers.json,2026-02-10T22:25:28.068809
CUS-00000224,Priya,Tanaka,Priya Tanaka,priya.tanaka763@yahoo.com,8846911428,female,27,1999-02-05,3680 Oak St,Los Angeles,CA,90001,USA,VIP,101,29532.37,894.92,30/05/2022,2027-05-25,no,true,true,true,true,de,,mobile_app,2022-05-30T00:00:00,2023-01-27T00:00:00,customers.json,2026-02-10T22:25:28.068809
CUS-00000225,Robert,Kim,Robert Kim,robert.kim483@gmail.com,+1-480-649-7940,"",53,1973-02-11,9473 Elm Blvd,Chicago,IL,60601,USA,Gold,180,38422.28,2022.23,05-17-2019,2020-05-27,yes,true,true,true,false,es,CAD,partner,2019-05-17T00:00:00,2020-07-30T00:00:00,customers.json,2026-02-10T22:25:28.068809
CUS-00000226,Fatima,O'Brien,Fatima O'Brien,fatima.o'brien12@outlook.com,,female,67,1959-02-15,9359 Main St,Tokyo,,100-0001,Japan,Bronze,103,11248.61,224.97,24/01/2023,2023-04-01,1,true,true,true,true,es,GBP,referral,2023-01-24T00:00:00,2023-05-14T00:00:00,customers.json,2026-02-10T22:25:28.068809
CUS-00000227,Jessica,Tanaka,Jessica Tanaka,jessica.tanaka673@company.com,+1-488-146-9937,Male,28,1998-02-05,5105 Elm St,Los Angeles,CA,90001,USA,vip,39,20052.81,589.79,1603576800,2024-10-18,yes,false,true,false,true,zh,USD,partner,2020-10-25T00:00:00,2021-08-29T00:00:00,customers.json,2026-02-10T22:25:28.068809
CUS-00000228,Mary,Davis,Mary Davis,mary.davis148@outlook.com,+1-960-437-5953,"",79,1947-02-18,1416 Forest St,Sydney,NSW,2000,Australia,Bronze,53,29604.33,3289.37,2024-05-05,2024-09-02,1,true,true,false,false,zh,,website,2024-05-05T00:00:00,2024-07-26T00:00:00,customers.json,2026-02-10T22:25:28.068809
CUS-00000229,Emma,Silva,Emma Silva,emma.silva823@mail.com,913.176.4491,Female,81,1945-02-18,6209 Oak Dr,Sydney,NSW,2000,Australia,Gold,74,3633.79,330.34,08/04/2022,2022-06-23,true,true,false,false,true,en,CAD,mobile_app,2022-04-08T00:00:00,2022-05-20T00:00:00,customers.json,2026-02-10T22:25:28.068809
CUS-00000230,Emma,Chen,Emma Chen,emma.chen340@yahoo.com,UNLISTED,female,53,1973-02-11,6979 Hill Dr,Paris,,75001,France,Bronze,73,24353.61,737.99,1541286000,2021-06-16,false,true,true,false,true,ja,CAD,,2018-11-04T00:00:00,2019-11-13T00:00:00,customers.json,2026-02-10T22:25:28.068809
CUS-00000231,David,Tanaka,David Tanaka,david.tanaka357@company.com,6132366924,Male,32,1994-02-06,6195 Hill Ave,Berlin,,10115,Germany,GOLD,67,1176.64,392.21,1523916000,2021-12-16,no,true,true,true,false,de,AUD,partner,2018-04-17T00:00:00,2018-05-17T00:00:00,customers.json,2026-02-10T22:25:28.068809
CUS-00000232,Yuki,Rodriguez,Yuki Rodriguez,yuki.rodriguez498@gmail.com,(324) 459-3643,male,56,1970-02-12,1512 Main Ln,Toronto,ON,M5V 2H1,Canada,gold,193,13922.01,386.72,09-27-2019,2020-10-25,no,true,true,false,true,zh,USD,mobile_app,2019-09-27T00:00:00,2020-03-22T00:00:00,customers.json,2026-02-10T22:25:28.068809
CUS-00000233,Yuki,Smith,Yuki Smith,yuki.smith199@outlook.com,8548176888,male,56,1970-02-12,5398 Park Rd,Toronto,ON,M5V 2H1,Canada,VIP,20,1509.07,37.73,06-17-2018,2018-11-13,true,true,,false,false,de,AUD,social_media,2018-06-17T00:00:00,2019-07-31T00:00:00,customers.json,2026-02-10T22:25:28.068809
CUS-00000234,Joseph,Martinez,Joseph Martinez,joseph.martinez564@yahoo.com,,MALE,48,1978-02-10,9770 Main Rd,Amsterdam,,1012 AB,Netherlands,silver,85,41204.17,1144.56,04-18-2019,2021-10-14,0,false,false,false,true,ja,,referral,2019-04-18T00:00:00,2019-07-22T00:00:00,customers.json,2026-02-10T22:25:28.068809
CUS-00000235,Christopher,Smith,Christopher Smith,christopher.smith618@company.com,5974397887,,46,1980-02-10,1133 Lake Dr,London,,SW1A 1AA,United Kingdom,Platinum,142,44689.31,11172.33,14/08/2020,2023-02-09,0,true,,true,false,es,JPY,,2020-08-14T00:00:00,2021-03-06T00:00:00,customers.json,2026-02-10T22:25:28.068809
CUS-00000236,Karen,Anderson,Karen Anderson,karen.anderson656@yahoo.com,744.388.4017,MALE,61,1965-02-13,9837 Oak Rd,Chicago,IL,60601,USA,Gold,137,13731.64,624.17,05-20-2020,2021-01-01,no,false,,true,false,es,,social_media,2020-05-20T00:00:00,2021-03-04T00:00:00,customers.json,2026-02-10T22:25:28.068809
CUS-00000237,Fatima,Kim,Fatima Kim,fatima.kim167@gmail.com,+1-418-326-3365,Female,29,1997-02-05,7953 Lake Ave,Berlin,,10115,Germany,Silver,154,14012.73,1556.97,12/01/2024,2026-06-21,true,false,true,false,false,ja,,mobile_app,2024-01-12T00:00:00,2025-04-19T00:00:00,customers.json,2026-02-10T22:25:28.068809
CUS-00000238,Patricia,Wang,Patricia Wang,patricia.wang605@yahoo.com,,Male,30,1996-02-06,1741 Park Ln,Chicago,IL,60601,USA,Bronze,63,,,11/08/2023,2024-06-15,0,true,false,false,true,ja,USD,website,2023-08-11T00:00:00,2023-09-09T00:00:00,customers.json,2026-02-10T22:25:28.068809
CUS-00000239,Wei,Smith,Wei Smith,wei.smith726@yahoo.com,+1-548-485-5600,Female,35,1991-02-07,6309 Forest Blvd,Sydney,NSW,2000,Australia,VIP,137,73.5,1.47,2024-07-01,2029-01-02,1,false,false,false,false,zh,GBP,mobile_app,2024-07-01T00:00:00,2025-02-13T00:00:00,customers.json,2026-02-10T22:25:28.068809
CUS-00000240,James,Brown,James Brown,james.brown303@mail.com,UNLISTED,Female,25,2001-02-04,981 Elm Ave,Sydney,NSW,2000,Australia,Bronze,63,8048.04,1609.61,2022-09-09,2024-06-27,yes,false,,false,true,de,CAD,social_media,2022-09-09T00:00:00,2023-07-29T00:00:00,customers.json,2026-02-10T22:25:28.068809
CUS-00000241,Susan,Miller,Susan Miller,susan.miller252@outlook.com,5765244615,F,61,1965-02-13,9336 Elm Ave,Los Angeles,CA,90001,USA,Gold,180,9668.63,214.86,2018-12-07,2020-04-21,false,true,false,false,false,ja,CAD,,2018-12-07T00:00:00,2019-08-21T00:00:00,customers.json,2026-02-10T22:25:28.068809
CUS-00000242,Priya,Kim,Priya Kim,priya.kim628@company.com,899.608.7762,MALE,63,1963-02-14,6438 Lake Ave,London,,SW1A 1AA,United Kingdom,silver,111,4963.17,171.14,16/11/2023,2028-06-10,0,true,true,false,true,fr,GBP,referral,2023-11-16T00:00:00,2024-03-07T00:00:00,customers.json,2026-02-10T22:25:28.068809
CUS-00000243,Fatima,Davis,Fatima Davis,fatima.davis973@company.com,,,71,1955-02-16,5470 Oak Ave,Paris,,75001,France,bronze,173,-20369.46,,2022-02-14,2024-06-09,yes,true,false,false,false,es,AUD,mobile_app,2022-02-14T00:00:00,2023-02-27T00:00:00,customers.json,2026-02-10T22:25:28.068809
CUS-00000244,David,Smith,David Smith,david.smith452@mail.com,(789) 212-5934,"",62,1964-02-14,9294 Forest Ave,Paris,,75001,France,Platinum,96,46749.16,5843.65,1689372000,2023-07-27,1,true,false,true,true,es,CAD,partner,2023-07-15T00:00:00,2024-04-11T00:00:00,customers.json,2026-02-10T22:25:28.068809
CUS-00000245,Robert,Williams,Robert Williams,robert.williams464@outlook.com,5241657466,M,-5,1998-09-13,2483 Main St,Tokyo,,100-0001,Japan,Bronze,185,11024.5,250.56,1672268400,2027-07-10,1,false,true,false,false,,,partner,2022-12-29T00:00:00,2023-04-12T00:00:00,customers.json,2026-02-10T22:25:28.068809
CUS-00000246,Michael,Miller,Michael Miller,michael.miller870@company.com,+1-370-807-9851,Male,53,1973-02-11,1864 Park Ave,Berlin,,10115,Germany,VIP,67,43841.57,1096.04,11-03-2020,2022-12-01,false,true,false,true,true,en,USD,referral,2020-11-03T00:00:00,2021-04-01T00:00:00,customers.json,2026-02-10T22:25:28.068809
CUS-00000247,Richard,Brown,Richard Brown,richard.brown354@company.com,+1-261-653-1799,Prefer not to say,42,1984-02-09,1689 Lake Dr,Paris,,75001,France,Gold,166,19278.86,1377.06,2018-09-09T00:00:00,2019-11-20,1,false,false,false,true,es,USD,partner,2018-09-09T00:00:00,2019-08-02T00:00:00,customers.json,2026-02-10T22:25:28.068809
CUS-00000248,James,Brown,James Brown,james.brown529@company.com,UNLISTED,Other,72,1954-02-16,9360 Forest Blvd,Toronto,ON,M5V 2H1,Canada,Platinum,113,5379.82,233.91,1586988000,2024-10-08,false,true,true,false,true,de,,website,2020-04-16T00:00:00,2021-04-19T00:00:00,customers.json,2026-02-10T22:25:28.068809
CUS-00000249,David,Smith,David Smith,david.smith993@outlook.com,(632) 435-8204,Male,79,1947-02-18,1091 River Dr,London,,SW1A 1AA,United Kingdom,VIP,69,14150.32,505.37,2024-06-27T00:00:00,2025-01-06,no,true,true,true,true,es,,partner,2024-06-27T00:00:00,2024-12-18T00:00:00,customers.json,2026-02-10T22:25:28.068809
CUS-00000250,Michael,Garcia,Michael Garcia,michael.garcia184@company.com,,"",78,1948-02-18,131 Forest Ave,Berlin,,10115,Germany,Platinum,143,40199.4,873.9,13/05/2021,2026-12-13,no,false,false,false,true,en,,partner,2021-05-13T00:00:00,2021-10-09T00:00:00,customers.json,2026-02-10T22:25:28.068809
CUS-00000251,Robert,Chen,Robert Chen,robert.chen710@yahoo.com,(208) 553-2358,Female,75,1951-02-17,7000 Oak Ln,London,,SW1A 1AA,United Kingdom,Gold,149,48217.38,1268.88,2021-04-24T00:00:00,2026-01-26,false,false,false,false,false,,JPY,social_media,2021-04-24T00:00:00,2022-05-23T00:00:00,customers.json,2026-02-10T22:25:28.068809
CUS-00000252,Joseph,Tanaka,Joseph Tanaka,joseph.tanaka42@outlook.com,UNLISTED,female,19,2007-02-03,4662 Forest Ln,Berlin,,10115,Germany,Platinum,63,9155.83,339.1,2020-03-14,2024-06-17,false,false,false,true,true,fr,USD,,2020-03-14T00:00:00,2021-03-08T00:00:00,customers.json,2026-02-10T22:25:28.068809
CUS-00000253,Patricia,Johnson,Patricia Johnson,patricia.johnson407@gmail.com,,Female,69,1957-02-15,4132 Hill Ave,London,,SW1A 1AA,United Kingdom,Gold,182,10390.45,314.86,2020-06-22T00:00:00,2021-07-09,yes,false,,true,true,en,EUR,website,2020-06-22T00:00:00,2021-10-17T00:00:00,customers.json,2026-02-10T22:25:28.068809
CUS-00000254,Jessica,Jones,Jessica Jones,jessica.jones434@company.com,+1-541-370-3727,M,61,1965-02-13,8119 Oak Blvd,Toronto,ON,M5V 2H1,Canada,bronze,167,33343.66,2564.9,2022-05-22,2022-11-14,false,true,false,false,true,de,AUD,,2022-05-22T00:00:00,2023-06-16T00:00:00,customers.json,2026-02-10T22:25:28.068809
CUS-00000255,Ahmed,Miller,Ahmed Miller,ahmed.miller92@gmail.com,+1-809-702-4846,F,24,2002-02-04,809 Lake Ln,Chicago,IL,60601,USA,Silver,57,3270.22,79.76,2023-11-28T00:00:00,2028-02-23,yes,false,true,true,false,de,EUR,partner,2023-11-28T00:00:00,2025-03-11T00:00:00,customers.json,2026-02-10T22:25:28.068809
CUS-00000256,Wei,Smith,Wei Smith,wei.smith808@mail.com,998.569.5201,MALE,19,2007-02-03,8147 Park Dr,London,,SW1A 1AA,United Kingdom,bronze,115,17475.13,436.88,1540767600,2023-03-13,1,true,true,true,false,es,CAD,social_media,2018-10-29T00:00:00,2019-09-04T00:00:00,customers.json,2026-02-10T22:25:28.068809
CUS-00000257,Linda,Dubois,Linda Dubois,linda.dubois752@company.com,UNLISTED,Prefer not to say,68,1958-02-15,2646 Forest Blvd,Toronto,ON,M5V 2H1,Canada,Silver,45,27260.11,717.37,01/02/2024,2024-03-22,true,false,false,false,false,ja,,,2024-02-01T00:00:00,2024-10-21T00:00:00,customers.json,2026-02-10T22:25:28.068809
CUS-00000258,James,O'Brien,James O'Brien,james.o'brien459@yahoo.com,+1-373-291-9810,F,21,2005-02-03,9127 River Ln,Chicago,IL,60601,USA,Gold,137,7657.08,3828.54,08-17-2021,2024-05-28,true,true,,false,true,,JPY,website,2021-08-17T00:00:00,2022-11-16T00:00:00,customers.json,2026-02-10T22:25:28.068809
CUS-00000259,Carlos,Kim,Carlos Kim,carlos.kim495@outlook.com,747.645.8231,Prefer not to say,52,1974-02-11,2965 Forest Dr,Toronto,ON,M5V 2H1,Canada,bronze,126,-32591.84,,10-22-2022,2026-03-10,no,true,,true,true,,EUR,partner,2022-10-22T00:00:00,2023-01-30T00:00:00,customers.json,2026-02-10T22:25:28.068809
CUS-00000260,James,Brown,James Brown,,(840) 136-9083,Prefer not to say,,,3205 Main Ave,Chicago,IL,60601,USA,Silver,67,10580.49,881.71,2019-10-26T00:00:00,2021-12-21,yes,true,false,false,false,es,JPY,,2019-10-26T00:00:00,2020-09-15T00:00:00,customers.json,2026-02-10T22:25:28.068809
CUS-00000261,Elizabeth,Smith,Elizabeth Smith,elizabeth.smith507@outlook.com,461.150.7232,,71,1955-02-16,3255 Lake Dr,Paris,,75001,France,Gold,51,3325.89,175.05,1604271600,2023-12-01,false,false,,false,true,,JPY,social_media,2020-11-02T00:00:00,2021-02-20T00:00:00,customers.json,2026-02-10T22:25:28.068809
CUS-00000262,Susan,Kim,Susan Kim,susan.kim531@outlook.com,,"",63,1963-02-14,5007 River St,Toronto,ON,M5V 2H1,Canada,Gold,93,36453.57,775.61,2020-06-13,2025-04-22,true,false,false,false,true,zh,,website,2020-06-13T00:00:00,2020-07-09T00:00:00,customers.json,2026-02-10T22:25:28.068809
CUS-00000263,Joseph,Miller,Joseph Miller,joseph.miller177@outlook.com,UNLISTED,Prefer not to say,34,1992-02-07,80 Lake Rd,New York,NY,10001,USA,VIP,6,6928.48,161.13,16/09/2020,2022-09-11,false,false,true,false,true,en,EUR,social_media,2020-09-16T00:00:00,2021-07-18T00:00:00,customers.json,2026-02-10T22:25:28.068809
CUS-00000264,William,Davis,William Davis,william.davis769@yahoo.com,4819893733,,32,1994-02-06,5956 Forest Ave,Berlin,,10115,Germany,Platinum,136,21734.85,1671.91,1580079600,2024-08-03,0,false,false,false,true,fr,CAD,social_media,2020-01-27T00:00:00,2021-06-10T00:00:00,customers.json,2026-02-10T22:25:28.068809
CUS-00000265,Mary,Anderson,Mary Anderson,mary.anderson599@gmail.com,9835273223,female,58,1968-02-13,6934 Elm Blvd,Chicago,IL,60601,USA,Bronze,66,22140.98,3163.0,06/02/2024,2024-11-19,yes,true,,false,true,ja,,,2024-02-06T00:00:00,2024-09-19T00:00:00,customers.json,2026-02-10T22:25:28.068809
CUS-00000266,Richard,Garcia,Richard Garcia,richard.garcia604@gmail.com,+1-641-346-1330,F,30,1996-02-06,4595 Park Dr,Berlin,,10115,Germany,VIP,143,45723.26,1344.8,2024-08-14,2025-11-23,1,false,true,false,true,en,EUR,referral,2024-08-14T00:00:00,2025-06-21T00:00:00,customers.json,2026-02-10T22:25:28.068809
CUS-00000267,Ahmed,Davis,Ahmed Davis,ahmed.davis305@company.com,(452) 361-3171,F,84,1942-02-19,4902 Park Blvd,Amsterdam,,1012 AB,Netherlands,Bronze,158,29543.98,1231.0,02/11/2024,2025-12-04,false,true,,true,false,de,USD,,2024-11-02T00:00:00,2025-09-26T00:00:00,customers.json,2026-02-10T22:25:28.068809
CUS-00000268,Patricia,Chen,Patricia Chen,patricia.chen418@gmail.com,(547) 928-2052,FEMALE,27,1999-02-05,3569 Forest Blvd,Amsterdam,,1012 AB,Netherlands,Bronze,200,41013.84,1323.03,2018-12-08,2022-01-07,true,false,true,false,false,en,JPY,,2018-12-08T00:00:00,2019-05-06T00:00:00,customers.json,2026-02-10T22:25:28.068809
CUS-00000269,Barbara,Anderson,Barbara Anderson,barbara.anderson861@mail.com,(381) 106-3145,FEMALE,58,1968-02-13,6498 Main Ave,Toronto,ON,M5V 2H1,Canada,VIP,167,37251.57,745.03,2023-07-18,2023-11-08,1,true,,true,false,de,CAD,,2023-07-18T00:00:00,2024-03-09T00:00:00,customers.json,2026-02-10T22:25:28.068809
CUS-00000270,Yuki,Wang,Yuki Wang,yuki.wang641@outlook.com,+1-754-617-2577,F,39,1987-02-08,2848 Main Dr,Berlin,,10115,Germany,Silver,190,5072.47,390.19,2019-02-15,2019-09-04,yes,true,,false,true,de,,website,2019-02-15T00:00:00,2019-06-16T00:00:00,customers.json,2026-02-10T22:25:28.068809
CUS-00000271,Sarah,O'Brien,Sarah O'Brien,sarah.o'brien665@gmail.com,+1-212-577-9360,F,76,1950-02-17,4408 River St,New York,NY,10001,USA,silver,168,34952.53,812.85,1639868400,2024-08-15,0,true,true,true,false,en,AUD,referral,2021-12-19T00:00:00,2022-01-29T00:00:00,customers.json,2026-02-10T22:25:28.068809
CUS-00000272,Carlos,Brown,Carlos Brown,carlos.brown772@mail.com,3177144048,F,36,1990-02-07,9579 River Blvd,Tokyo,,100-0001,Japan,Bronze,28,34233.55,3803.73,2023-08-04T00:00:00,2026-05-26,yes,false,,true,true,fr,GBP,social_media,2023-08-04T00:00:00,2023-11-18T00:00:00,customers.json,2026-02-10T22:25:28.068809
CUS-00000273,Joseph,Brown,Joseph Brown,joseph.brown558@yahoo.com,5094047405,M,30,1996-02-06,1676 River Ave,Chicago,IL,60601,USA,Platinum,76,14878.0,450.85,18/07/2023,2026-02-08,false,false,,false,true,de,GBP,social_media,2023-07-18T00:00:00,2023-07-31T00:00:00,customers.json,2026-02-10T22:25:28.068809
CUS-00000274,Ahmed,Rodriguez,Ahmed Rodriguez,ahmed.rodriguez321@company.com,UNLISTED,M,32,1994-02-06,7907 Main Blvd,Amsterdam,,1012 AB,Netherlands,Platinum,85,3983.96,102.15,22/07/2020,2024-09-28,1,true,true,false,true,de,CAD,,2020-07-22T00:00:00,2020-10-04T00:00:00,customers.json,2026-02-10T22:25:28.068809
CUS-00000275,Christopher,Brown,Christopher Brown,christopher.brown557@gmail.com,657.813.7561,Male,75,1951-02-17,5173 Elm Ave,Sydney,NSW,2000,Australia,VIP,28,26055.96,814.25,2023-11-24,2028-11-28,false,false,,false,false,de,GBP,partner,2023-11-24T00:00:00,2024-12-05T00:00:00,customers.json,2026-02-10T22:25:28.068809
CUS-00000276,Patricia,Patel,Patricia Patel,N/A,+1-278-604-4461,Other,71,1955-02-16,6726 Park Blvd,Chicago,IL,60601,USA,Platinum,144,17652.34,534.92,2024-09-08,2028-11-28,false,true,,true,false,ja,EUR,,2024-09-08T00:00:00,2024-10-02T00:00:00,customers.json,2026-02-10T22:25:28.068809
CUS-00000277,Patricia,Miller,Patricia Miller,patricia.miller512@gmail.com,631.223.4966,female,63,1963-02-14,8453 River Dr,Paris,,75001,France,BRONZE,58,34477.89,1567.18,2024-06-27T00:00:00,2028-04-04,false,true,true,false,false,zh,EUR,partner,2024-06-27T00:00:00,2025-05-16T00:00:00,customers.json,2026-02-10T22:25:28.068809
CUS-00000278,Robert,Jones,Robert Jones,robert.jones796@outlook.com,(530) 671-2093,"",30,1996-02-06,9091 Lake Rd,Los Angeles,CA,90001,USA,SILVER,60,34825.86,4975.12,01-17-2020,2021-07-04,yes,true,true,true,true,,,social_media,2020-01-17T00:00:00,2020-11-18T00:00:00,customers.json,2026-02-10T22:25:28.068809
CUS-00000279,Richard,Silva,Richard Silva,richard.silva794@outlook.com,9192108551,FEMALE,72,1954-02-16,2230 Oak Blvd,London,,SW1A 1AA,United Kingdom,Bronze,169,3373.8,224.92,09-08-2021,2024-04-28,true,true,false,true,true,zh,EUR,,2021-09-08T00:00:00,2022-11-17T00:00:00,customers.json,2026-02-10T22:25:28.068809
CUS-00000280,William,Brown,William Brown,william.brown538@mail.com,+1-621-789-5024,female,53,1973-02-11,120 Lake Blvd,Paris,,75001,France,Gold,106,27659.71,1202.6,2021-04-03,2024-12-31,false,false,,true,false,de,GBP,website,2021-04-03T00:00:00,2022-02-10T00:00:00,customers.json,2026-02-10T22:25:28.068809
CUS-00000281,Fatima,O'Brien,Fatima O'Brien,fatima.o'brien106@outlook.com,,Other,41,1985-02-08,2875 Main Ln,Chicago,IL,60601,USA,Bronze,45,3576.43,223.53,2022-04-29T00:00:00,2024-02-12,yes,false,false,false,true,,EUR,partner,2022-04-29T00:00:00,2022-10-23T00:00:00,customers.json,2026-02-10T22:25:28.068809
CUS-00000282,Linda,Davis,Linda Davis,linda.davis393@mail.com,UNLISTED,F,84,1942-02-19,3902 Lake Ave,Chicago,IL,60601,USA,Bronze,121,25643.75,1068.49,2021-04-19,2022-06-05,yes,false,,false,true,ja,JPY,referral,2021-04-19T00:00:00,2022-06-08T00:00:00,customers.json,2026-02-10T22:25:28.068809
CUS-00000283,Elizabeth,Garcia,Elizabeth Garcia,elizabeth.garcia256@outlook.com,(221) 560-5407,Other,72,1954-02-16,6914 Lake Rd,Toronto,ON,M5V 2H1,Canada,VIP,54,43962.94,2093.47,1699830000,2026-12-16,false,false,false,false,true,fr,JPY,website,2023-11-13T00:00:00,2024-12-27T00:00:00,customers.json,2026-02-10T22:25:28.068809
CUS-00000284,Sarah,Silva,Sarah Silva,sarah.silva5@yahoo.com,8824869459,MALE,20,2006-02-03,9573 Main St,Tokyo,,100-0001,Japan,VIP,67,22876.41,571.91,2023-01-18T00:00:00,2026-12-22,false,true,true,true,false,,CAD,social_media,2023-01-18T00:00:00,2023-03-11T00:00:00,customers.json,2026-02-10T22:25:28.068809
CUS-00000285,David,Kim,David Kim,david.kim850@company.com,(632) 120-2571,Male,53,1973-02-11,5491 Hill Blvd,Paris,,75001,France,Gold,182,21775.12,588.52,29/04/2020,2025-10-19,no,false,false,true,true,,CAD,,2020-04-29T00:00:00,2021-08-03T00:00:00,customers.json,2026-02-10T22:25:28.068809
CUS-00000286,William,Garcia,William Garcia,william.garcia446@mail.com,,male,49,1977-02-10,9388 Park Ln,Berlin,,10115,Germany,Platinum,105,43733.49,1214.82,2023-07-03,2023-11-26,yes,true,false,false,true,en,CAD,website,2023-07-03T00:00:00,2023-07-14T00:00:00,customers.json,2026-02-10T22:25:28.068809
CUS-00000287,Carlos,Williams,Carlos Williams,carlos.williams450@yahoo.com,3509899023,male,72,1954-02-16,4609 Park Ln,Berlin,,10115,Germany,PLATINUM,153,10850.93,638.29,2023-11-18T00:00:00,2029-03-07,yes,true,true,true,true,zh,EUR,mobile_app,2023-11-18T00:00:00,2024-03-10T00:00:00,customers.json,2026-02-10T22:25:28.068809
CUS-00000288,Barbara,Mueller,Barbara Mueller,barbara.mueller91@company.com,(657) 408-5586,male,80,1946-02-18,8124 River Dr,Tokyo,,100-0001,Japan,Platinum,70,2104.95,47.84,09-30-2020,2025-11-16,false,false,,false,true,ja,GBP,mobile_app,2020-09-30T00:00:00,2021-05-16T00:00:00,customers.json,2026-02-10T22:25:28.068809
CUS-00000289,Marie,Mueller,Marie Mueller,marie.mueller900@outlook.com,2239878864,Other,44,1982-02-09,954 Main Ln,Sydney,NSW,2000,Australia,Bronze,184,10026.08,3342.03,1640214000,2024-08-13,1,true,false,false,false,fr,CAD,partner,2021-12-23T00:00:00,2022-03-09T00:00:00,customers.json,2026-02-10T22:25:28.068809
CUS-00000290,Linda,Martinez,Linda Martinez,linda.martinez352@outlook.com,+1-632-474-5030,Female,64,1962-02-14,1289 Hill Rd,Paris,,75001,France,Bronze,21,3980.13,663.36,1679785200,2024-12-15,false,false,,true,false,,GBP,social_media,2023-03-26T00:00:00,2023-10-30T00:00:00,customers.json,2026-02-10T22:25:28.068809
CUS-00000291,John,Martinez,John Martinez,john.martinez482@outlook.com,,M,26,2000-02-05,3813 Park St,Chicago,IL,60601,USA,Gold,187,17187.52,1432.29,1520290800,2021-02-16,true,false,false,false,true,fr,GBP,social_media,2018-03-06T00:00:00,2019-02-17T00:00:00,customers.json,2026-02-10T22:25:28.068809
CUS-00000292,Linda,Anderson,Linda Anderson,linda.anderson433@mail.com,(744) 497-7161,Other,150,1876-03-06,4301 Lake St,Toronto,ON,M5V 2H1,Canada,Bronze,5,25042.12,521.71,16/08/2024,2029-06-21,false,false,,true,false,en,AUD,,2024-08-16T00:00:00,2025-07-31T00:00:00,customers.json,2026-02-10T22:25:28.068809
CUS-00000293,Hans,Tanaka,Hans Tanaka,hans.tanaka318@company.com,208.244.6821,Other,33,1993-02-06,5372 River Dr,Tokyo,,100-0001,Japan,VIP,159,47545.77,11886.44,1627336800,2023-08-12,1,true,true,false,false,fr,,partner,2021-07-27T00:00:00,2022-09-29T00:00:00,customers.json,2026-02-10T22:25:28.068809
CUS-00000294,Liam,Brown,Liam Brown,liam.brown472@company.com,,"",65,1961-02-14,3968 Main Dr,Los Angeles,CA,90001,USA,Platinum,189,30354.68,4336.38,23/11/2020,2021-10-10,false,false,true,false,true,fr,USD,website,2020-11-23T00:00:00,2021-04-23T00:00:00,customers.json,2026-02-10T22:25:28.068809
CUS-00000295,Marie,Kim,Marie Kim,marie.kim202@gmail.com,5031108369,MALE,58,1968-02-13,7081 Park Ln,Toronto,ON,M5V 2H1,Canada,Bronze,79,44405.57,2114.55,12-27-2018,2020-09-07,false,true,,true,true,de,AUD,partner,2018-12-27T00:00:00,2019-05-12T00:00:00,customers.json,2026-02-10T22:25:28.068809
CUS-00000296,David,Jones,David Jones,david.jones427@gmail.com,UNLISTED,FEMALE,28,1998-02-05,5831 Hill Ave,Chicago,IL,60601,USA,Gold,167,20254.67,810.19,1571349600,2024-12-24,yes,true,true,true,false,de,AUD,,2019-10-18T00:00:00,2019-12-01T00:00:00,customers.json,2026-02-10T22:25:28.068809
CUS-00000297,Marie,Smith,Marie Smith,marie.smith354@gmail.com,(332) 878-3173,,50,1976-02-11,7588 Oak Ave,Chicago,IL,60601,USA,Bronze,157,45647.81,1984.69,2018-05-05,2021-02-08,1,false,true,true,false,zh,AUD,,2018-05-05T00:00:00,2018-05-16T00:00:00,customers.json,2026-02-10T22:25:28.068809
CUS-00000298,Hans,Jones,Hans Jones,william.brown538@mail.com,5679675922,Other,82,1944-02-19,8275 River Blvd,Paris,,75001,France,Platinum,101,17086.22,379.69,01-22-2023,2027-12-10,false,true,true,false,false,zh,,referral,2023-01-22T00:00:00,2023-08-30T00:00:00,customers.json,2026-02-10T22:25:28.068809
CUS-00000299,Fatima,Jones,Fatima Jones,fatima.jones528@yahoo.com,UNLISTED,FEMALE,19,2007-02-03,9653 Lake Ln,Chicago,IL,60601,USA,vip,193,4454.8,153.61,2019-07-20,2020-08-19,true,true,,true,true,fr,USD,,2019-07-20T00:00:00,2020-07-27T00:00:00,customers.json,2026-02-10T22:25:28.068809
CUS-00000300,William,Silva,William Silva,william.silva817@mail.com,5703386040,M,60,1966-02-13,6453 Forest St,Chicago,IL,60601,USA,Silver,143,47867.77,2815.75,1713218400,2024-08-09,yes,false,false,false,true,ja,EUR,referral,2024-04-16T00:00:00,2025-05-17T00:00:00,customers.json,2026-02-10T22:25:28.068809
CUS-00000301,Yuki,Patel,Yuki Patel,yuki.patel894@yahoo.com,,,69,1957-02-15,3585 Forest Rd,Berlin,,10115,Germany,VIP,188,41598.57,2311.03,1665871200,2025-07-26,0,false,false,true,true,es,GBP,,2022-10-16T00:00:00,2023-01-26T00:00:00,customers.json,2026-02-10T22:25:28.068809
CUS-00000302,John,Dubois,John Dubois,john.dubois919@outlook.com,,male,50,1976-02-11,6657 River Rd,Tokyo,,100-0001,Japan,Platinum,19,41959.57,839.19,10-03-2019,2023-03-23,yes,false,true,false,false,ja,AUD,social_media,2019-10-03T00:00:00,2020-02-01T00:00:00,customers.json,2026-02-10T22:25:28.068809
CUS-00000303,Emma,Smith,Emma Smith,emma.smith580@gmail.com,(238) 187-6362,MALE,84,1942-02-19,808 Oak Ln,Toronto,ON,M5V 2H1,Canada,VIP,130,38626.05,12875.35,02-24-2021,2023-06-14,true,true,true,false,true,en,,referral,2021-02-24T00:00:00,2022-05-15T00:00:00,customers.json,2026-02-10T22:25:28.068809
CUS-00000304,Linda,Mueller,Linda Mueller,linda.mueller384@yahoo.com,+1-306-454-6346,MALE,60,1966-02-13,4898 Oak St,Amsterdam,,1012 AB,Netherlands,Platinum,154,41243.54,916.52,27/11/2022,2025-09-07,0,false,false,true,false,zh,USD,mobile_app,2022-11-27T00:00:00,2023-01-09T00:00:00,customers.json,2026-02-10T22:25:28.068809
CUS-00000305,Liam,Wang,Liam Wang,liam.wang740@outlook.com,(889) 609-8438,Other,18,2008-02-03,367 Forest Rd,Tokyo,,100-0001,Japan,Platinum,22,18570.49,431.87,1579302000,2021-08-30,false,true,false,false,false,fr,USD,mobile_app,2020-01-18T00:00:00,2020-11-06T00:00:00,customers.json,2026-02-10T22:25:28.068809
CUS-00000306,Yuki,Rodriguez,Yuki Rodriguez,yuki.rodriguez99@outlook.com,UNLISTED,male,56,1970-02-12,3445 Lake Ave,Amsterdam,,1012 AB,Netherlands,Gold,197,18992.81,678.31,1683151200,2026-08-13,no,false,true,false,false,,AUD,mobile_app,2023-05-04T00:00:00,2024-09-01T00:00:00,customers.json,2026-02-10T22:25:28.068809
CUS-00000307,Robert,Smith,Robert Smith,robert.smith273@mail.com,UNLISTED,Prefer not to say,48,1978-02-10,4300 Forest Ave,New York,NY,10001,USA,Bronze,45,23144.07,1006.26,03-26-2019,2022-09-04,no,false,false,false,true,es,GBP,referral,2019-03-26T00:00:00,2020-02-20T00:00:00,customers.json,2026-02-10T22:25:28.068809
CUS-00000308,Marie,Dubois,Marie Dubois,marie.dubois98@outlook.com,UNLISTED,,37,1989-02-07,4301 Oak Ave,Amsterdam,,1012 AB,Netherlands,Platinum,106,24415.57,2219.6,10/11/2021,2024-02-25,false,false,false,true,false,en,JPY,website,2021-11-10T00:00:00,2022-03-18T00:00:00,customers.json,2026-02-10T22:25:28.068809
CUS-00000309,Richard,O'Brien,Richard O'Brien,richard.o'brien649@company.com,2426304551,Male,62,1964-02-14,645 Oak Blvd,Paris,,75001,France,platinum,192,23100.9,7700.3,2022-03-08T00:00:00,2026-10-21,no,false,,true,false,ja,JPY,,2022-03-08T00:00:00,2023-01-07T00:00:00,customers.json,2026-02-10T22:25:28.068809
CUS-00000310,Jennifer,Silva,Jennifer Silva,jennifer.silva322@outlook.com,5613028019,F,52,1974-02-11,3777 River St,London,,SW1A 1AA,United Kingdom,Gold,193,2321.5,178.58,1644966000,2025-02-13,true,true,false,true,true,ja,JPY,referral,2022-02-16T00:00:00,2022-05-11T00:00:00,customers.json,2026-02-10T22:25:28.068809
CUS-00000311,Jessica,Martinez,Jessica Martinez,jessica.martinez233@mail.com,UNLISTED,female,83,1943-02-19,2974 Hill Ave,New York,NY,10001,USA,Silver,187,21875.8,705.67,1676156400,2025-04-20,1,true,true,false,false,ja,USD,website,2023-02-12T00:00:00,2024-04-01T00:00:00,customers.json,2026-02-10T22:25:28.068809
CUS-00000312,Robert,Jones,Robert Jones,robert.jones816@yahoo.com,5419296015,Female,53,1973-02-11,1793 Oak Ln,Berlin,,10115,Germany,Gold,137,45739.94,1063.72,01-24-2023,2026-11-29,false,true,false,false,true,ja,USD,,2023-01-24T00:00:00,2023-07-16T00:00:00,customers.json,2026-02-10T22:25:28.068809
CUS-00000313,Robert,Johnson,Robert Johnson,robert.johnson566@yahoo.com,7081825262,FEMALE,30,1996-02-06,2769 Park Blvd,Chicago,IL,60601,USA,Bronze,3,26135.27,2010.41,2019-11-11,2025-04-29,no,false,false,false,false,en,CAD,partner,2019-11-11T00:00:00,2019-11-16T00:00:00,customers.json,2026-02-10T22:25:28.068809
CUS-00000314,Susan,Dubois,Susan Dubois,susan.dubois112@company.com,+1-818-482-1042,Prefer not to say,46,1980-02-10,2652 Hill Rd,Sydney,NSW,2000,Australia,Bronze,168,25831.47,1174.16,2019-08-27T00:00:00,2020-03-24,1,false,false,false,true,ja,AUD,website,2019-08-27T00:00:00,2020-03-19T00:00:00,customers.json,2026-02-10T22:25:28.068809
CUS-00000315,Mary,Chen,Mary Chen,mary.chen624@yahoo.com,UNLISTED,FEMALE,36,1990-02-07,177 Forest Rd,New York,NY,10001,USA,vip,45,43175.65,5396.96,05-21-2019,2021-08-11,false,true,,true,false,zh,EUR,referral,2019-05-21T00:00:00,2020-09-19T00:00:00,customers.json,2026-02-10T22:25:28.068809
CUS-00000316,Jennifer,Kim,Jennifer Kim,jennifer.kim144@gmail.com,726.110.3319,FEMALE,59,1967-02-13,5104 River Rd,Toronto,ON,M5V 2H1,Canada,VIP,97,-41967.84,,1596405600,2022-08-14,false,false,true,true,true,zh,USD,referral,2020-08-03T00:00:00,2020-08-27T00:00:00,customers.json,2026-02-10T22:25:28.068809
CUS-00000317,Emma,Williams,Emma Williams,emma.williams933@yahoo.com,+1-850-696-8900,"",34,1992-02-07,6259 Main Rd,Sydney,NSW,2000,Australia,silver,24,20569.74,791.14,04-20-2018,2021-07-06,false,false,true,true,false,de,AUD,referral,2018-04-20T00:00:00,2018-06-18T00:00:00,customers.json,2026-02-10T22:25:28.068809
CUS-00000318,Carlos,Patel,Carlos Patel,carlos.patel783@company.com,+1-262-109-7353,male,81,1945-02-18,5576 Oak St,Sydney,NSW,2000,Australia,Bronze,78,29028.2,829.38,08-26-2020,2024-09-19,true,false,,false,true,,USD,partner,2020-08-26T00:00:00,2020-10-12T00:00:00,customers.json,2026-02-10T22:25:28.068809
CUS-00000319,Barbara,Kim,Barbara Kim,barbara.kim878@gmail.com,3072101839,MALE,76,1950-02-17,9448 Park Rd,Amsterdam,,1012 AB,Netherlands,Platinum,130,14532.0,660.55,04-21-2023,2025-11-20,true,true,,true,false,zh,JPY,partner,2023-04-21T00:00:00,2024-07-03T00:00:00,customers.json,2026-02-10T22:25:28.068809
CUS-00000320,Barbara,Tanaka,Barbara Tanaka,barbara.tanaka864@gmail.com,6871348255,Other,46,1980-02-10,3011 Forest St,Sydney,NSW,2000,Australia,VIP,172,32730.01,5455.0,2022-12-04,2025-03-15,no,true,false,true,true,ja,AUD,social_media,2022-12-04T00:00:00,2023-03-02T00:00:00,customers.json,2026-02-10T22:25:28.068809
CUS-00000321,Jennifer,Johnson,Jennifer Johnson,jennifer.johnson553@company.com,+1-437-297-4962,FEMALE,34,1992-02-07,8810 Hill Rd,Tokyo,,100-0001,Japan,Platinum,200,-35400.51,,23/04/2018,2021-09-27,1,true,true,false,true,de,CAD,website,2018-04-23T00:00:00,2018-05-09T00:00:00,customers.json,2026-02-10T22:25:28.068809
CUS-00000322,Fatima,Kim,Fatima Kim,fatima.kim260@outlook.com,(309) 219-9524,MALE,79,1947-02-18,9022 Forest Dr,Toronto,ON,M5V 2H1,Canada,Gold,102,38018.63,19009.31,27/01/2018,2019-12-10,true,true,,true,true,en,EUR,website,2018-01-27T00:00:00,2019-05-11T00:00:00,customers.json,2026-02-10T22:25:28.068809
CUS-00000323,Jessica,Johnson,Jessica Johnson,jessica.johnson637@gmail.com,(752) 930-8732,Female,68,1958-02-15,6998 Main Ave,Los Angeles,CA,90001,USA,Silver,50,39870.32,813.68,27/10/2020,2023-06-24,true,false,true,true,false,en,CAD,website,2020-10-27T00:00:00,2021-01-26T00:00:00,customers.json,2026-02-10T22:25:28.068809
CUS-00000324,Thomas,Dubois,Thomas Dubois,thomas.dubois347@outlook.com,569.404.7005,"",77,1949-02-17,294 Oak Rd,Toronto,ON,M5V 2H1,Canada,VIP,44,3454.13,132.85,1691013600,2025-11-30,no,false,false,true,true,es,,,2023-08-03T00:00:00,2024-02-22T00:00:00,customers.json,2026-02-10T22:25:28.068809
CUS-00000325,Mary,Dubois,Mary Dubois,mary.dubois931@mail.com,9056684541,Female,35,1991-02-07,4390 River Dr,Toronto,ON,M5V 2H1,Canada,platinum,181,4441.83,634.55,1518390000,2021-06-13,no,true,true,false,true,zh,USD,partner,2018-02-12T00:00:00,2018-09-21T00:00:00,customers.json,2026-02-10T22:25:28.068809
CUS-00000326,Jessica,Anderson,Jessica Anderson,jessica.anderson686@company.com,+1-247-222-3535,Female,65,1961-02-14,1267 Hill Ave,Paris,,75001,France,Silver,155,25300.77,602.4,2024-06-14T00:00:00,2027-06-15,false,false,,true,true,,JPY,referral,2024-06-14T00:00:00,2025-08-13T00:00:00,customers.json,2026-02-10T22:25:28.068809
CUS-00000327,Emma,Mueller,Emma Mueller,emma.mueller713@outlook.com,,FEMALE,73,1953-02-16,7865 Elm Rd,Toronto,ON,M5V 2H1,Canada,Bronze,77,47625.86,3663.53,08-31-2020,2024-09-29,false,false,false,false,false,es,AUD,social_media,2020-08-31T00:00:00,2021-03-04T00:00:00,customers.json,2026-02-10T22:25:28.068809
CUS-00000328,Jessica,Brown,Jessica Brown,jessica.brown926@outlook.com,UNLISTED,female,26,2000-02-05,7913 Park Blvd,Paris,,75001,France,Gold,107,48052.39,5339.15,05-29-2019,2022-08-03,true,false,false,true,true,fr,GBP,partner,2019-05-29T00:00:00,2019-08-15T00:00:00,customers.json,2026-02-10T22:25:28.068809
CUS-00000329,Emma,Johnson,Emma Johnson,emma.johnson423@yahoo.com,3118272862,,19,2007-02-03,4357 Elm Dr,Chicago,IL,60601,USA,PLATINUM,58,24592.55,1756.61,01-17-2020,2025-06-24,1,false,false,true,true,ja,AUD,,2020-01-17T00:00:00,2020-05-20T00:00:00,customers.json,2026-02-10T22:25:28.068809
CUS-00000330,Ahmed,Chen,Ahmed Chen,ahmed.chen428@mail.com,UNLISTED,FEMALE,25,2001-02-04,6662 Oak Ln,London,,SW1A 1AA,United Kingdom,gold,80,35999.16,1799.96,08/07/2022,2025-09-26,no,false,true,false,false,fr,CAD,website,2022-07-08T00:00:00,2023-07-08T00:00:00,customers.json,2026-02-10T22:25:28.068809
CUS-00000331,Emma,Martinez,Emma Martinez,emma.martinez657@yahoo.com,572.930.5385,FEMALE,62,1964-02-14,9142 Park Rd,London,,SW1A 1AA,United Kingdom,Platinum,117,42690.9,3283.92,11/06/2024,2029-04-17,false,true,true,true,false,es,GBP,referral,2024-06-11T00:00:00,2024-10-16T00:00:00,customers.json,2026-02-10T22:25:28.068809
CUS-00000332,Wei,Miller,Wei Miller,wei.miller186@gmail.com,(459) 122-9826,female,29,1997-02-05,5313 Forest St,Berlin,,10115,Germany,Gold,151,6319.4,351.08,2018-07-03,2023-02-04,1,true,true,false,false,de,GBP,website,2018-07-03T00:00:00,2018-08-12T00:00:00,customers.json,2026-02-10T22:25:28.068809
CUS-00000333,Christopher,Anderson,Christopher Anderson,christopher.anderson381@yahoo.com,UNLISTED,MALE,33,1993-02-06,7082 Park Ave,Paris,,75001,France,Bronze,132,5548.26,135.32,06/11/2020,2022-08-11,1,false,true,true,false,en,CAD,social_media,2020-11-06T00:00:00,2021-01-13T00:00:00,customers.json,2026-02-10T22:25:28.068809
CUS-00000334,Priya,Williams,Priya Williams,priya.williams673@mail.com,,MALE,45,1981-02-09,393 Main Ln,Toronto,ON,M5V 2H1,Canada,VIP,196,21030.34,553.43,2022-04-28,2024-01-14,false,true,true,false,false,zh,USD,website,2022-04-28T00:00:00,2023-05-08T00:00:00,customers.json,2026-02-10T22:25:28.068809
CUS-00000335,Michael,Anderson,Michael Anderson,michael.anderson498@yahoo.com,3165179327,MALE,66,1960-02-15,9123 Elm Blvd,Toronto,ON,M5V 2H1,Canada,Bronze,123,46633.2,3886.1,1639436400,2023-12-01,true,true,false,true,false,es,,website,2021-12-14T00:00:00,2022-12-19T00:00:00,customers.json,2026-02-10T22:25:28.068809
CUS-00000336,Wei,Patel,Wei Patel,wei.patel690@gmail.com,,male,50,1976-02-11,9955 Park Blvd,London,,SW1A 1AA,United Kingdom,Platinum,119,26045.42,4340.9,07-23-2018,2021-10-01,yes,false,false,true,false,de,AUD,partner,2018-07-23T00:00:00,2019-07-28T00:00:00,customers.json,2026-02-10T22:25:28.068809
CUS-00000337,Susan,Mueller,Susan Mueller,susan.mueller71@outlook.com,(641) 146-6752,female,85,1941-02-19,7021 River Ave,Los Angeles,CA,90001,USA,Bronze,62,10514.98,210.3,2023-08-26T00:00:00,2023-10-31,no,false,true,true,true,en,JPY,social_media,2023-08-26T00:00:00,2024-08-12T00:00:00,customers.json,2026-02-10T22:25:28.068809
CUS-00000338,Sarah,Dubois,Sarah Dubois,sarah.dubois607@gmail.com,347.368.1943,FEMALE,44,1982-02-09,6578 Forest Ave,Berlin,,10115,Germany,Bronze,134,49627.99,1503.88,2018-04-08T00:00:00,2018-06-21,true,false,false,true,false,es,USD,mobile_app,2018-04-08T00:00:00,2019-05-21T00:00:00,customers.json,2026-02-10T22:25:28.068809
CUS-00000339,Fatima,Martinez,Fatima Martinez,fatima.martinez539@yahoo.com,+1-498-328-6126,,42,1984-02-09,9923 Hill Ave,Sydney,NSW,2000,Australia,VIP,38,49518.96,2250.86,16/05/2024,2027-03-30,no,false,,false,true,en,EUR,mobile_app,2024-05-16T00:00:00,2024-09-20T00:00:00,customers.json,2026-02-10T22:25:28.068809
CUS-00000340,Mary,Jones,Mary Jones,mary.jones919@yahoo.com,UNLISTED,,34,1992-02-07,4816 Lake Blvd,Chicago,IL,60601,USA,Bronze,163,21596.25,539.91,2023-09-08,2028-06-13,yes,true,false,true,false,es,JPY,social_media,2023-09-08T00:00:00,2024-07-17T00:00:00,customers.json,2026-02-10T22:25:28.068809
CUS-00000341,David,Patel,David Patel,DavidPatel,(910) 668-3444,MALE,22,2004-02-04,6237 Oak Rd,Sydney,NSW,2000,Australia,platinum,32,18381.21,471.31,19/08/2020,2025-04-26,yes,true,false,true,true,fr,JPY,website,2020-08-19T00:00:00,2021-11-09T00:00:00,customers.json,2026-02-10T22:25:28.068809
CUS-00000342,Thomas,O'Brien,Thomas O'Brien,thomas.o'brien851@gmail.com,511.843.8965,female,31,1995-02-06,1408 Park Ave,Los Angeles,CA,90001,USA,Silver,81,9940.31,242.45,2018-07-05,2023-10-20,no,true,false,false,false,en,AUD,referral,2018-07-05T00:00:00,2019-02-02T00:00:00,customers.json,2026-02-10T22:25:28.068809
CUS-00000343,James,O'Brien,James O'Brien,james.o'brien812@outlook.com,3073686794,Male,76,1950-02-17,3646 Park Blvd,Paris,,75001,France,Platinum,68,22913.35,1347.84,1626127200,2023-01-14,no,true,,true,true,ja,USD,,2021-07-13T00:00:00,2021-11-07T00:00:00,customers.json,2026-02-10T22:25:28.068809
CUS-00000344,Richard,Anderson,Richard Anderson,richard.anderson92@outlook.com,559.339.2070,Female,60,1966-02-13,2716 River Ave,Sydney,NSW,2000,Australia,silver,102,41833.97,13944.66,2022-06-13T00:00:00,2025-10-29,1,true,true,false,false,fr,AUD,social_media,2022-06-13T00:00:00,2023-02-05T00:00:00,customers.json,2026-02-10T22:25:28.068809
CUS-00000345,Karen,Martinez,Karen Martinez,karen.martinez388@mail.com,3091251877,Male,43,1983-02-09,7277 Oak St,Sydney,NSW,2000,Australia,Bronze,19,38272.69,1319.75,2018-01-17,2021-04-06,yes,true,true,false,true,es,USD,referral,2018-01-17T00:00:00,2018-06-12T00:00:00,customers.json,2026-02-10T22:25:28.068809
CUS-00000346,Elizabeth,Williams,Elizabeth Williams,elizabeth.williams343@outlook.com,3653342784,MALE,41,1985-02-08,5702 Park Ln,New York,NY,10001,USA,Silver,99,43827.88,952.78,2020-05-14,2024-04-05,no,false,true,true,false,es,AUD,referral,2020-05-14T00:00:00,2021-06-08T00:00:00,customers.json,2026-02-10T22:25:28.068809
CUS-00000347,Susan,Jones,Susan Jones,susan.jones519@outlook.com,,MALE,79,1947-02-18,7215 Main Blvd,Sydney,NSW,2000,Australia,Gold,2,47950.0,1997.92,01-14-2019,2019-09-25,false,false,true,false,false,ja,EUR,website,2019-01-14T00:00:00,2020-04-08T00:00:00,customers.json,2026-02-10T22:25:28.068809
CUS-00000348,Hans,Brown,Hans Brown,hans.brown140@company.com,+1-392-997-7078,MALE,30,1996-02-06,6514 Elm Rd,Los Angeles,CA,90001,USA,GOLD,83,43702.86,4855.87,1619474400,2025-01-10,true,false,true,true,false,en,USD,website,2021-04-27T00:00:00,2022-04-03T00:00:00,customers.json,2026-02-10T22:25:28.068809
CUS-00000349,John,Brown,John Brown,john.brown86@gmail.com,UNLISTED,F,69,1957-02-15,3573 Oak St,Toronto,ON,M5V 2H1,Canada,Silver,68,42692.04,992.84,09-29-2023,2026-12-15,false,false,,false,true,zh,JPY,referral,2023-09-29T00:00:00,2025-02-06T00:00:00,customers.json,2026-02-10T22:25:28.068809
CUS-00000350,David,Tanaka,David Tanaka,david.tanaka621@gmail.com,+1-339-999-3288,MALE,32,1994-02-06,9955 Park Blvd,Sydney,NSW,2000,Australia,Bronze,130,35903.31,2761.79,04-24-2022,2024-08-17,false,false,false,false,false,en,,mobile_app,2022-04-24T00:00:00,2022-07-08T00:00:00,customers.json,2026-02-10T22:25:28.068809
CUS-00000351,Linda,O'Brien,Linda O'Brien,linda.o'brien731@gmail.com,,male,56,1970-02-12,4069 Hill Ln,Amsterdam,,1012 AB,Netherlands,Gold,187,9365.68,267.59,2024-05-14T00:00:00,2028-08-20,false,true,true,false,true,es,USD,social_media,2024-05-14T00:00:00,2024-09-22T00:00:00,customers.json,2026-02-10T22:25:28.068809
CUS-00000352,James,Anderson,James Anderson,james.anderson26@mail.com,(989) 755-7367,"",70,1956-02-16,6502 Hill Ln,Berlin,,10115,Germany,BRONZE,6,36500.29,2607.16,21/06/2024,2027-02-04,false,false,,false,true,ja,,website,2024-06-21T00:00:00,2024-09-18T00:00:00,customers.json,2026-02-10T22:25:28.068809
CUS-00000353,Karen,Chen,Karen Chen,karen.chen674@outlook.com,,,19,2007-02-03,6975 Elm Rd,Chicago,IL,60601,USA,PLATINUM,101,3266.31,77.77,2020-11-09T00:00:00,2026-04-04,yes,true,true,true,false,ja,GBP,,2020-11-09T00:00:00,2022-01-18T00:00:00,customers.json,2026-02-10T22:25:28.068809
CUS-00000354,Jennifer,Miller,Jennifer Miller,jennifer.miller32@yahoo.com,(916) 249-3721,male,63,1963-02-14,8926 River Ave,Los Angeles,CA,90001,USA,Platinum,48,10176.0,10176.0,2018-06-11T00:00:00,2022-06-16,true,true,true,false,true,ja,GBP,mobile_app,2018-06-11T00:00:00,2019-03-16T00:00:00,customers.json,2026-02-10T22:25:28.068809
CUS-00000355,Jessica,Rodriguez,Jessica Rodriguez,jessica.rodriguez448@gmail.com,UNLISTED,M,34,1992-02-07,3408 Main St,New York,NY,10001,USA,GOLD,54,5785.43,214.28,2018-03-17,2019-08-23,no,true,true,true,false,en,EUR,,2018-03-17T00:00:00,2019-02-14T00:00:00,customers.json,2026-02-10T22:25:28.068809
CUS-00000356,Thomas,Davis,Thomas Davis,thomas.davis723@gmail.com,,male,78,1948-02-18,152 Park Ave,New York,NY,10001,USA,Bronze,1,11094.62,652.62,10-18-2024,2027-03-10,1,false,true,true,false,en,JPY,social_media,2024-10-18T00:00:00,2025-03-02T00:00:00,customers.json,2026-02-10T22:25:28.068809
CUS-00000357,Christopher,Mueller,Christopher Mueller,christopher.mueller32@gmail.com,UNLISTED,"",70,1956-02-16,6811 Oak Ln,Chicago,IL,60601,USA,Bronze,185,,,14/10/2023,2027-01-06,false,false,true,false,false,es,CAD,mobile_app,2023-10-14T00:00:00,2024-10-04T00:00:00,customers.json,2026-02-10T22:25:28.068809
CUS-00000358,Jennifer,Jones,Jennifer Jones,jennifer.jones958@mail.com,957.158.6014,MALE,58,1968-02-13,2975 Forest Blvd,London,,SW1A 1AA,United Kingdom,gold,181,5370.02,153.43,1725573600,2025-07-28,true,false,true,true,true,de,GBP,partner,2024-09-06T00:00:00,2025-07-03T00:00:00,customers.json,2026-02-10T22:25:28.068809
CUS-00000359,James,Davis,James Davis,james.davis261@gmail.com,642.169.6070,Female,81,1945-02-18,1753 Park Blvd,Berlin,,10115,Germany,Gold,152,16332.95,453.69,23/04/2021,2023-10-17,true,false,false,false,false,es,JPY,referral,2021-04-23T00:00:00,2021-10-06T00:00:00,customers.json,2026-02-10T22:25:28.068809
CUS-00000360,Carlos,Brown,Carlos Brown,james.williams305@outlook.com,(239) 917-2786,Prefer not to say,34,1992-02-07,9467 Park St,Tokyo,,100-0001,Japan,VIP,176,45774.89,1430.47,11-07-2023,2027-09-01,yes,true,,true,true,zh,,partner,2023-11-07T00:00:00,2024-09-11T00:00:00,customers.json,2026-02-10T22:25:28.068809
CUS-00000361,Carlos,Dubois,Carlos Dubois,carlos.dubois906@mail.com,UNLISTED,Other,51,1975-02-11,7659 Hill Ln,Berlin,,10115,Germany,VIP,63,47172.07,11793.02,1566252000,2022-07-04,true,true,false,true,false,ja,GBP,partner,2019-08-20T00:00:00,2020-06-13T00:00:00,customers.json,2026-02-10T22:25:28.068809
CUS-00000362,Karen,Martinez,Karen Martinez,karen.martinez321@outlook.com,9615363219,Other,51,1975-02-11,8445 Park Dr,Berlin,,10115,Germany,Silver,133,17765.09,807.5,1615503600,2021-05-14,true,false,,false,false,ja,,referral,2021-03-12T00:00:00,2021-10-28T00:00:00,customers.json,2026-02-10T22:25:28.068809
CUS-00000363,Thomas,Davis,Thomas Davis,thomas.davis338@company.com,UNLISTED,,18,2008-02-03,3571 Hill Dr,Sydney,NSW,2000,Australia,platinum,41,46064.23,4606.42,23/03/2023,2026-11-28,false,false,false,true,true,es,JPY,partner,2023-03-23T00:00:00,2024-01-17T00:00:00,customers.json,2026-02-10T22:25:28.068809
CUS-00000364,Karen,Chen,Karen Chen,karen.chen977@yahoo.com,UNLISTED,male,79,1947-02-18,6945 River St,Berlin,,10115,Germany,Gold,150,29732.06,1858.25,05-02-2019,2020-01-19,0,false,false,false,true,es,USD,website,2019-05-02T00:00:00,2019-11-28T00:00:00,customers.json,2026-02-10T22:25:28.068809
CUS-00000365,Patricia,Dubois,Patricia Dubois,patricia.dubois76@outlook.com,UNLISTED,M,31,1995-02-06,2449 Park Ln,Amsterdam,,1012 AB,Netherlands,Silver,182,39295.49,958.43,2019-01-17,2021-07-01,0,false,false,false,false,ja,CAD,referral,2019-01-17T00:00:00,2019-05-24T00:00:00,customers.json,2026-02-10T22:25:28.068809
CUS-00000366,Yuki,Smith,Yuki Smith,yuki.smith380@outlook.com,,,70,1956-02-16,2916 Park Blvd,Paris,,75001,France,Silver,145,42898.39,1715.94,05/06/2020,2020-10-09,yes,true,true,true,true,en,AUD,social_media,2020-06-05T00:00:00,2020-12-13T00:00:00,customers.json,2026-02-10T22:25:28.068809
CUS-00000367,David,Smith,David Smith,david.smith107@company.com,376.139.1914,Prefer not to say,42,1984-02-09,3789 Oak Ln,Paris,,75001,France,Platinum,153,8221.31,747.39,1526421600,2018-10-14,yes,true,true,true,false,es,USD,social_media,2018-05-16T00:00:00,2018-06-28T00:00:00,customers.json,2026-02-10T22:25:28.068809
CUS-00000368,Jennifer,Garcia,Jennifer Garcia,jennifer.garcia44@company.com,5233926310,"",84,1942-02-19,423 Oak Ave,Toronto,ON,M5V 2H1,Canada,Platinum,108,46679.94,1261.62,1704236400,2024-11-23,true,false,false,false,false,fr,AUD,partner,2024-01-03T00:00:00,2024-06-16T00:00:00,customers.json,2026-02-10T22:25:28.068809
CUS-00000369,Robert,Rodriguez,Robert Rodriguez,liam.patel493@company.com,5502816927,FEMALE,52,1974-02-11,7670 Forest St,London,,SW1A 1AA,United Kingdom,VIP,112,24766.16,4127.69,30/01/2023,2027-01-04,no,true,,false,true,de,AUD,website,2023-01-30T00:00:00,2024-03-12T00:00:00,customers.json,2026-02-10T22:25:28.068809
CUS-00000370,Karen,Jones,Karen Jones,karen.jones816@mail.com,+1-859-874-7187,FEMALE,69,1957-02-15,9458 River Ln,Toronto,ON,M5V 2H1,Canada,Bronze,17,19920.82,1992.08,2022-10-04T00:00:00,2023-03-05,false,true,true,false,true,ja,CAD,referral,2022-10-04T00:00:00,2023-02-02T00:00:00,customers.json,2026-02-10T22:25:28.068809
CUS-00000371,Barbara,Rodriguez,Barbara Rodriguez,BarbaraRodriguez,6501022941,male,25,2001-02-04,954 Lake Ave,New York,NY,10001,USA,Platinum,58,18382.6,656.52,1696802400,2024-05-07,0,false,,false,false,zh,EUR,,2023-10-09T00:00:00,2025-01-17T00:00:00,customers.json,2026-02-10T22:25:28.068809
CUS-00000372,Elizabeth,Tanaka,Elizabeth Tanaka,elizabeth.tanaka686@gmail.com,+1-784-100-1839,Male,40,1986-02-08,2821 Forest Rd,Berlin,,10115,Germany,Silver,160,23704.09,607.8,2018-07-16T00:00:00,2019-10-29,1,false,,false,true,,AUD,social_media,2018-07-16T00:00:00,2018-12-27T00:00:00,customers.json,2026-02-10T22:25:28.068809
CUS-00000373,Karen,Mueller,Karen Mueller,karen.mueller261@outlook.com,257.388.2366,Other,42,1984-02-09,3765 Forest Blvd,London,,SW1A 1AA,United Kingdom,gold,193,39677.59,1526.06,1670713200,2027-12-29,no,false,,true,false,,USD,partner,2022-12-11T00:00:00,2023-05-23T00:00:00,customers.json,2026-02-10T22:25:28.068809
CUS-00000374,David,Dubois,David Dubois,david.dubois828@gmail.com,481.379.1571,male,73,1953-02-16,6126 Park Rd,Toronto,ON,M5V 2H1,Canada,SILVER,38,17806.46,614.02,1656540000,2025-08-29,false,true,true,true,true,zh,AUD,referral,2022-06-30T00:00:00,2023-08-13T00:00:00,customers.json,2026-02-10T22:25:28.068809
CUS-00000375,Hans,Williams,Hans Williams,hans.williams257@mail.com,+1-944-429-4643,female,71,1955-02-16,8116 Elm St,Sydney,NSW,2000,Australia,Gold,86,465.29,21.15,03-24-2020,2021-01-20,true,false,,true,true,en,,referral,2020-03-24T00:00:00,2020-11-19T00:00:00,customers.json,2026-02-10T22:25:28.068809
CUS-00000376,Yuki,Rodriguez,Yuki Rodriguez,yuki.rodriguez747@mail.com,3841825296,MALE,72,1954-02-16,8249 Forest Dr,Los Angeles,CA,90001,USA,Silver,139,40443.18,1189.51,2023-02-20T00:00:00,2027-10-21,no,false,false,false,false,ja,GBP,social_media,2023-02-20T00:00:00,2024-03-14T00:00:00,customers.json,2026-02-10T22:25:28.068809
CUS-00000377,Elizabeth,Williams,Elizabeth Williams,james.chen459@mail.com,UNLISTED,male,85,1941-02-19,7841 Park Blvd,Los Angeles,CA,90001,USA,Silver,185,25820.83,600.48,07-09-2024,2026-01-30,yes,true,true,false,false,ja,,social_media,2024-07-09T00:00:00,2024-09-16T00:00:00,customers.json,2026-02-10T22:25:28.068809
CUS-00000378,Hans,Jones,Hans Jones,hans.jones889@yahoo.com,2352343138,MALE,80,1946-02-18,2654 Lake Rd,Paris,,75001,France,silver,117,41857.98,1819.91,2020-09-15T00:00:00,2025-09-01,false,true,true,true,true,es,AUD,,2020-09-15T00:00:00,2020-09-22T00:00:00,customers.json,2026-02-10T22:25:28.068809
CUS-00000379,Jessica,Patel,Jessica Patel,jessica.patel571@yahoo.com,5396257575,M,84,1942-02-19,1246 Elm Ln,London,,SW1A 1AA,United Kingdom,Platinum,134,4041.25,87.85,1639868400,2026-10-04,yes,false,,true,false,,AUD,referral,2021-12-19T00:00:00,2022-07-06T00:00:00,customers.json,2026-02-10T22:25:28.068809
CUS-00000380,Christopher,Anderson,Christopher Anderson,christopher.anderson780@mail.com,,MALE,44,1982-02-09,8569 Hill Rd,Toronto,ON,M5V 2H1,Canada,platinum,33,36692.65,1265.26,2024-03-25T00:00:00,2025-02-14,yes,true,false,false,true,de,EUR,partner,2024-03-25T00:00:00,2024-11-16T00:00:00,customers.json,2026-02-10T22:25:28.068809
CUS-00000381,Marie,Kim,Marie Kim,MarieKim,(475) 548-2310,Prefer not to say,72,1954-02-16,2115 Forest Blvd,London,,SW1A 1AA,United Kingdom,Gold,165,48932.52,1063.75,2020-12-25,2022-05-06,true,false,false,true,false,ja,GBP,,2020-12-25T00:00:00,2021-10-20T00:00:00,customers.json,2026-02-10T22:25:28.068809
CUS-00000382,Jessica,Miller,Jessica Miller,jessica.miller965@gmail.com,926.267.5170,male,76,1950-02-17,1709 Oak Blvd,Berlin,,10115,Germany,Gold,123,36335.94,1009.33,1634248800,2025-01-12,false,false,,false,false,de,,,2021-10-15T00:00:00,2022-06-07T00:00:00,customers.json,2026-02-10T22:25:28.068809
CUS-00000383,Linda,Silva,Linda Silva,N/A,,F,72,1954-02-16,4289 River Dr,Los Angeles,CA,90001,USA,Gold,152,26756.22,608.1,10-30-2019,2019-11-20,true,false,false,true,false,de,USD,,2019-10-30T00:00:00,2020-08-09T00:00:00,customers.json,2026-02-10T22:25:28.068809
CUS-00000384,Karen,Chen,Karen Chen,karen.chen61@yahoo.com,(229) 810-2922,female,20,2006-02-03,3580 Park Blvd,Toronto,ON,M5V 2H1,Canada,Silver,72,2714.38,208.8,07-05-2020,2020-12-07,yes,false,true,true,false,de,EUR,partner,2020-07-05T00:00:00,2021-08-01T00:00:00,customers.json,2026-02-10T22:25:28.068809
CUS-00000385,Joseph,Williams,Joseph Williams,joseph.williams949@outlook.com,781.451.7076,,54,1972-02-12,3675 River Ave,London,,SW1A 1AA,United Kingdom,Silver,177,22183.37,1056.35,04/05/2022,2027-04-30,0,true,true,false,true,,,website,2022-05-04T00:00:00,2022-11-21T00:00:00,customers.json,2026-02-10T22:25:28.068809
CUS-00000386,Wei,Chen,Wei Chen,wei.chen895@gmail.com,2419083220,F,64,1962-02-14,2824 Oak Ave,Tokyo,,100-0001,Japan,Platinum,189,38741.78,2039.04,12-09-2020,2021-12-30,true,true,,true,false,es,GBP,,2020-12-09T00:00:00,2022-02-09T00:00:00,customers.json,2026-02-10T22:25:28.068809
CUS-00000387,Fatima,Smith,Fatima Smith,fatima.smith257@mail.com,9241275625,Female,29,1997-02-05,3342 Lake Ln,Amsterdam,,1012 AB,Netherlands,Bronze,187,11871.51,791.43,11-01-2020,2020-11-17,0,false,true,true,true,ja,,,2020-11-01T00:00:00,2021-09-16T00:00:00,customers.json,2026-02-10T22:25:28.068809
CUS-00000388,Susan,Garcia,Susan Garcia,susan.garcia438@company.com,+1-331-218-2908,Other,85,1941-02-19,6224 Hill Rd,Los Angeles,CA,90001,USA,VIP,93,8179.92,743.63,02/04/2021,2024-05-14,false,true,,true,true,en,CAD,mobile_app,2021-04-02T00:00:00,2021-07-09T00:00:00,customers.json,2026-02-10T22:25:28.068809
CUS-00000389,David,Kim,David Kim,david.kim745@mail.com,UNLISTED,"",21,2005-02-03,3375 Elm St,London,,SW1A 1AA,United Kingdom,vip,196,5801.82,362.61,02-23-2024,2025-10-10,1,false,false,true,false,en,GBP,partner,2024-02-23T00:00:00,2024-10-23T00:00:00,customers.json,2026-02-10T22:25:28.068809
CUS-00000390,Carlos,Kim,Carlos Kim,carlos.kim60@outlook.com,(355) 331-2232,Male,74,1952-02-17,3080 Hill Ave,Sydney,NSW,2000,Australia,bronze,16,48622.37,1736.51,2023-08-26T00:00:00,2023-12-16,no,true,true,false,false,de,AUD,social_media,2023-08-26T00:00:00,2024-03-16T00:00:00,customers.json,2026-02-10T22:25:28.068809
CUS-00000391,Yuki,Anderson,Yuki Anderson,yuki.anderson882@yahoo.com,+1-260-129-9079,"",80,1946-02-18,8876 Park Dr,Paris,,75001,France,VIP,167,10849.32,986.3,18/07/2018,2022-10-06,no,false,,true,false,es,EUR,partner,2018-07-18T00:00:00,2019-09-26T00:00:00,customers.json,2026-02-10T22:25:28.068809
CUS-00000392,Liam,Chen,Liam Chen,liam.chen859@mail.com,(315) 316-2873,F,42,1984-02-09,8715 Main St,London,,SW1A 1AA,United Kingdom,Platinum,67,27412.82,609.17,21/10/2022,2025-12-16,yes,false,false,false,false,de,JPY,referral,2022-10-21T00:00:00,2023-07-12T00:00:00,customers.json,2026-02-10T22:25:28.068809
CUS-00000393,Susan,Dubois,Susan Dubois,susan.dubois101@outlook.com,788.552.8877,Female,74,1952-02-17,5106 Park Ln,Berlin,,10115,Germany,gold,98,5216.76,1043.35,2023-10-04,2028-03-27,yes,false,true,true,false,de,USD,mobile_app,2023-10-04T00:00:00,2024-12-26T00:00:00,customers.json,2026-02-10T22:25:28.068809
CUS-00000394,Richard,Williams,Richard Williams,richard.williams529@gmail.com,,female,58,1968-02-13,9284 River Ln,Paris,,75001,France,Platinum,106,40357.39,1441.34,2020-08-06,2024-05-22,true,true,true,true,true,ja,JPY,,2020-08-06T00:00:00,2020-10-15T00:00:00,customers.json,2026-02-10T22:25:28.068809
CUS-00000395,Robert,Dubois,Robert Dubois,robert.dubois980@yahoo.com,(907) 201-8291,Other,21,2005-02-03,9398 Oak Blvd,Toronto,ON,M5V 2H1,Canada,Bronze,175,33975.05,1415.63,2022-02-14,2025-05-28,false,true,true,false,false,,,website,2022-02-14T00:00:00,2022-06-17T00:00:00,customers.json,2026-02-10T22:25:28.068809
CUS-00000396,William,Silva,William Silva,william.silva576@outlook.com,(376) 929-8979,"",78,1948-02-18,5796 Hill Ave,Amsterdam,,1012 AB,Netherlands,Gold,122,21415.95,973.45,26/12/2021,2022-06-17,true,true,true,false,true,zh,JPY,mobile_app,2021-12-26T00:00:00,2022-05-13T00:00:00,customers.json,2026-02-10T22:25:28.068809
CUS-00000397,Elizabeth,Mueller,Elizabeth Mueller,elizabeth.mueller679@mail.com,,female,54,1972-02-12,7348 Hill St,Sydney,NSW,2000,Australia,bronze,189,22275.55,464.07,09/01/2019,2019-08-08,true,false,,false,false,en,CAD,referral,2019-01-09T00:00:00,2019-04-07T00:00:00,customers.json,2026-02-10T22:25:28.068809
CUS-00000398,Wei,Davis,Wei Davis,wei.davis731@outlook.com,,Female,78,1948-02-18,5598 Elm Ln,Toronto,ON,M5V 2H1,Canada,silver,187,6969.13,1393.83,1558821600,2022-12-21,no,true,,false,true,zh,USD,social_media,2019-05-26T00:00:00,2020-06-01T00:00:00,customers.json,2026-02-10T22:25:28.068809
CUS-00000399,Christopher,Brown,Christopher Brown,christopher.brown427@gmail.com,(305) 696-9271,"",41,1985-02-08,7912 Lake Dr,Paris,,75001,France,Silver,173,33542.15,713.66,2023-06-28T00:00:00,2027-10-12,no,true,true,false,true,zh,EUR,referral,2023-06-28T00:00:00,2023-10-30T00:00:00,customers.json,2026-02-10T22:25:28.068809
CUS-00000400,Jennifer,Chen,Jennifer Chen,jennifer.chen161@gmail.com,(615) 594-1989,Prefer not to say,70,1956-02-16,8678 Elm St,Toronto,ON,M5V 2H1,Canada,Gold,197,27488.22,597.57,2022-10-29,2024-11-06,true,true,,false,true,,,,2022-10-29T00:00:00,2023-08-28T00:00:00,customers.json,2026-02-10T22:25:28.068809
CUS-00000401,Ahmed,Smith,Ahmed Smith,ahmed.smith48@company.com,UNLISTED,Prefer not to say,74,1952-02-17,2884 Hill Rd,New York,NY,10001,USA,VIP,16,29713.7,958.51,05-26-2024,2027-02-27,1,false,false,false,false,es,JPY,social_media,2024-05-26T00:00:00,2024-12-14T00:00:00,customers.json,2026-02-10T22:25:28.068809
CUS-00000402,Barbara,Rodriguez,Barbara Rodriguez,barbara.rodriguez792@gmail.com,(791) 458-1057,female,50,1976-02-11,7264 Park Ave,New York,NY,10001,USA,Platinum,3,49585.19,1239.63,2020-02-01,2024-10-27,no,false,true,false,true,fr,USD,social_media,2020-02-01T00:00:00,2020-10-21T00:00:00,customers.json,2026-02-10T22:25:28.068809
CUS-00000403,David,Jones,David Jones,david.jones279@yahoo.com,,,38,1988-02-08,3783 Forest Ave,London,,SW1A 1AA,United Kingdom,Silver,57,49645.83,1551.43,06/03/2020,2022-03-02,true,false,,true,true,en,EUR,mobile_app,2020-03-06T00:00:00,2021-03-08T00:00:00,customers.json,2026-02-10T22:25:28.068809
CUS-00000404,Jessica,Johnson,Jessica Johnson,jessica.johnson557@gmail.com,,F,19,2007-02-03,7208 Oak Dr,London,,SW1A 1AA,United Kingdom,Gold,135,48414.9,1052.5,12-25-2023,2028-12-22,false,false,false,false,true,zh,CAD,social_media,2023-12-25T00:00:00,2024-05-24T00:00:00,customers.json,2026-02-10T22:25:28.068809
CUS-00000405,Barbara,Wang,Barbara Wang,barbara.wang310@outlook.com,UNLISTED,Other,45,1981-02-09,623 Park Dr,Sydney,NSW,2000,Australia,VIP,117,30856.18,771.4,1584831600,2023-03-04,no,true,,true,true,zh,GBP,website,2020-03-22T00:00:00,2020-07-21T00:00:00,customers.json,2026-02-10T22:25:28.068809
CUS-00000406,Jennifer,Brown,Jennifer Brown,jennifer.brown523@mail.com,UNLISTED,,72,1954-02-16,9562 River Ln,Toronto,ON,M5V 2H1,Canada,Bronze,158,49523.83,8253.97,2022-07-17,2027-06-04,false,false,true,false,true,,JPY,social_media,2022-07-17T00:00:00,2022-10-11T00:00:00,customers.json,2026-02-10T22:25:28.068809
CUS-00000407,Robert,Brown,Robert Brown,robert.brown361@outlook.com,829.444.5735,Female,24,2002-02-04,258 Elm Ln,Paris,,75001,France,Gold,120,18431.66,1316.55,2022-08-26T00:00:00,2025-05-26,yes,true,,true,false,zh,JPY,,2022-08-26T00:00:00,2023-10-06T00:00:00,customers.json,2026-02-10T22:25:28.068809
CUS-00000408,Joseph,Miller,Joseph Miller,joseph.miller175@yahoo.com,,male,37,1989-02-07,7329 Park Ln,New York,NY,10001,USA,VIP,121,48510.81,1470.02,05-23-2021,2026-11-12,0,false,true,false,false,,USD,partner,2021-05-23T00:00:00,2022-05-01T00:00:00,customers.json,2026-02-10T22:25:28.068809
CUS-00000409,James,Anderson,James Anderson,james.anderson508@yahoo.com,UNLISTED,Male,74,1952-02-17,5335 Elm Dr,Paris,,75001,France,Platinum,147,12784.33,6392.16,09-11-2022,2028-01-29,yes,false,false,true,true,de,AUD,referral,2022-09-11T00:00:00,2023-09-24T00:00:00,customers.json,2026-02-10T22:25:28.068809
CUS-00000410,Joseph,Mueller,Joseph Mueller,joseph.mueller608@gmail.com,(563) 144-7607,F,39,1987-02-08,4886 Park Rd,Berlin,,10115,Germany,Silver,65,28553.89,839.82,2018-08-25T00:00:00,2020-03-21,0,true,true,true,true,zh,GBP,social_media,2018-08-25T00:00:00,2018-09-10T00:00:00,customers.json,2026-02-10T22:25:28.068809
CUS-00000411,Ahmed,Davis,Ahmed Davis,ahmed.davis463@mail.com,506.701.1960,Male,32,1994-02-06,3896 Hill Ln,Sydney,NSW,2000,Australia,Platinum,81,6170.16,268.27,1612479600,2021-07-21,yes,true,,true,true,,,referral,2021-02-05T00:00:00,2021-04-08T00:00:00,customers.json,2026-02-10T22:25:28.068809
CUS-00000412,David,Silva,David Silva,david.silva227@mail.com,(201) 202-4660,Female,63,1963-02-14,8880 Oak Rd,Amsterdam,,1012 AB,Netherlands,Platinum,144,5341.1,1335.28,2021-10-19T00:00:00,2022-10-31,false,false,,true,true,de,CAD,,2021-10-19T00:00:00,2022-04-28T00:00:00,customers.json,2026-02-10T22:25:28.068809
CUS-00000413,Mary,Wang,Mary Wang,mary.wang124@outlook.com,,Other,-5,1998-09-13,6924 Oak Ave,New York,NY,10001,USA,VIP,152,10240.17,682.68,28/06/2021,2026-11-11,true,true,true,false,false,es,EUR,website,2021-06-28T00:00:00,2022-04-12T00:00:00,customers.json,2026-02-10T22:25:28.068809
CUS-00000414,Priya,Rodriguez,Priya Rodriguez,priya.rodriguez682@gmail.com,4616531113,Male,22,2004-02-04,6363 River St,Tokyo,,100-0001,Japan,Bronze,110,49082.99,2337.29,2019-03-12T00:00:00,2023-05-06,false,true,true,true,false,en,,,2019-03-12T00:00:00,2019-04-13T00:00:00,customers.json,2026-02-10T22:25:28.068809
CUS-00000415,Sarah,Williams,Sarah Williams,sarah.williams684@gmail.com,+1-895-729-4631,Other,31,1995-02-06,6340 Oak Dr,Tokyo,,100-0001,Japan,Silver,196,33154.36,1275.17,1568066400,2023-07-19,true,false,false,true,false,es,USD,website,2019-09-10T00:00:00,2019-11-21T00:00:00,customers.json,2026-02-10T22:25:28.068809
CUS-00000416,Carlos,Johnson,Carlos Johnson,carlos.johnson812@yahoo.com,+1-305-805-1218,,150,1876-03-06,570 Hill Ave,Paris,,75001,France,VIP,178,28217.95,940.6,06-06-2018,2020-05-27,0,false,false,true,false,ja,CAD,website,2018-06-06T00:00:00,2019-02-10T00:00:00,customers.json,2026-02-10T22:25:28.068809
CUS-00000417,William,Jones,William Jones,N/A,383.423.4121,,54,1972-02-12,6568 Oak Blvd,Sydney,NSW,2000,Australia,Platinum,76,40330.78,916.61,2022-07-22T00:00:00,2027-10-25,0,true,true,false,true,ja,,social_media,2022-07-22T00:00:00,2023-11-24T00:00:00,customers.json,2026-02-10T22:25:28.068809
CUS-00000418,Richard,Williams,Richard Williams,richard.williams777@gmail.com,7617087767,FEMALE,64,1962-02-14,2165 Park St,New York,NY,10001,USA,Platinum,184,24906.95,2490.7,05-27-2019,2019-08-26,true,false,true,true,false,es,GBP,,2019-05-27T00:00:00,2019-12-12T00:00:00,customers.json,2026-02-10T22:25:28.068809
CUS-00000419,Ahmed,Johnson,Ahmed Johnson,ahmed.johnson534@gmail.com,+1-599-999-2024,M,47,1979-02-10,3969 Elm Ave,Berlin,,10115,Germany,GOLD,186,35963.65,781.82,2020-07-21,2027-01-07,true,true,true,false,false,zh,EUR,,2020-07-21T00:00:00,2020-09-14T00:00:00,customers.json,2026-02-10T22:25:28.068809
CUS-00000420,Fatima,Rodriguez,Fatima Rodriguez,fatima.rodriguez288@gmail.com,(911) 919-4224,Female,84,1942-02-19,254 Main Ln,Paris,,75001,France,silver,146,5782.12,231.28,04/07/2018,2019-01-09,1,true,false,false,false,ja,,partner,2018-07-04T00:00:00,2019-07-25T00:00:00,customers.json,2026-02-10T22:25:28.068809
CUS-00000421,Fatima,Tanaka,Fatima Tanaka,fatima.tanaka696@yahoo.com,UNLISTED,M,85,1941-02-19,9070 Main Rd,Chicago,IL,60601,USA,Gold,12,31987.76,1999.23,07-12-2021,2026-07-27,0,false,true,true,false,es,USD,referral,2021-07-12T00:00:00,2022-02-22T00:00:00,customers.json,2026-02-10T22:25:28.068809
CUS-00000422,Richard,Dubois,Richard Dubois,richard.dubois389@company.com,657.180.3119,Prefer not to say,68,1958-02-15,565 Forest Rd,London,,SW1A 1AA,United Kingdom,Silver,183,18027.39,3004.57,10-23-2018,2023-01-06,1,true,true,true,true,,JPY,website,2018-10-23T00:00:00,2019-03-14T00:00:00,customers.json,2026-02-10T22:25:28.068809
CUS-00000423,Emma,Martinez,Emma Martinez,emma.martinez146@outlook.com,UNLISTED,Male,77,1949-02-17,749 Park Ln,Berlin,,10115,Germany,Silver,78,39285.28,2619.02,07-17-2020,2022-12-19,1,false,false,false,false,zh,USD,,2020-07-17T00:00:00,2021-04-14T00:00:00,customers.json,2026-02-10T22:25:28.068809
CUS-00000424,Thomas,Silva,Thomas Silva,thomas.silva858@gmail.com,(786) 704-3514,female,47,1979-02-10,4327 Main Blvd,Toronto,ON,M5V 2H1,Canada,Platinum,4,2299.56,121.03,2019-06-07T00:00:00,2020-04-30,false,true,false,true,false,ja,JPY,referral,2019-06-07T00:00:00,2020-01-28T00:00:00,customers.json,2026-02-10T22:25:28.068809
CUS-00000425,Jessica,Dubois,Jessica Dubois,jessica.dubois7@outlook.com,+1-980-461-7589,male,79,1947-02-18,7215 Elm Blvd,Chicago,IL,60601,USA,Silver,67,10665.71,231.86,16/01/2024,2029-05-31,false,true,true,false,false,zh,AUD,social_media,2024-01-16T00:00:00,2024-11-02T00:00:00,customers.json,2026-02-10T22:25:28.068809
CUS-00000426,Jennifer,Johnson,Jennifer Johnson,jennifer.johnson411@company.com,+1-437-196-3977,"",29,1997-02-05,311 Lake Dr,Toronto,ON,M5V 2H1,Canada,Platinum,182,13106.34,278.86,20/06/2021,2025-09-01,yes,false,,true,true,zh,JPY,,2021-06-20T00:00:00,2021-12-10T00:00:00,customers.json,2026-02-10T22:25:28.068809
CUS-00000427,Christopher,Wang,Christopher Wang,christopher.wang756@outlook.com,(837) 352-9186,MALE,64,1962-02-14,1179 Park Rd,Tokyo,,100-0001,Japan,VIP,23,23087.74,721.49,10-10-2021,2023-10-29,false,false,true,true,false,es,JPY,social_media,2021-10-10T00:00:00,2022-12-21T00:00:00,customers.json,2026-02-10T22:25:28.068809
CUS-00000428,Robert,Miller,Robert Miller,robert.miller623@yahoo.com,+1-572-986-1451,"",19,2007-02-03,8595 Hill St,Paris,,75001,France,Silver,99,12593.16,251.86,03-05-2021,2022-08-22,no,true,false,true,false,de,EUR,partner,2021-03-05T00:00:00,2022-02-06T00:00:00,customers.json,2026-02-10T22:25:28.068809
CUS-00000429,Emma,Smith,Emma Smith,emma.smith466@company.com,(798) 791-7461,FEMALE,64,1962-02-14,1697 River Rd,Tokyo,,100-0001,Japan,SILVER,175,25470.41,878.29,1622844000,2022-04-25,false,true,false,false,true,en,USD,,2021-06-05T00:00:00,2021-11-23T00:00:00,customers.json,2026-02-10T22:25:28.068809
CUS-00000430,Elizabeth,Anderson,Elizabeth Anderson,elizabeth.anderson854@gmail.com,UNLISTED,FEMALE,82,1944-02-19,9686 Lake Ave,Toronto,ON,M5V 2H1,Canada,bronze,179,37821.58,2909.35,2022-09-17T00:00:00,2023-11-01,1,false,false,true,true,de,EUR,mobile_app,2022-09-17T00:00:00,2023-05-25T00:00:00,customers.json,2026-02-10T22:25:28.068809
CUS-00000431,Richard,Dubois,Richard Dubois,richard.dubois907@company.com,7977485343,M,22,2004-02-04,4149 Main Rd,Los Angeles,CA,90001,USA,Gold,62,11968.74,412.72,2021-11-29T00:00:00,2026-10-02,true,true,,false,false,fr,EUR,,2021-11-29T00:00:00,2022-10-14T00:00:00,customers.json,2026-02-10T22:25:28.068809
CUS-00000432,William,Chen,William Chen,william.chen243@gmail.com,435.644.4537,Male,53,1973-02-11,7778 Park Blvd,Tokyo,,100-0001,Japan,Silver,54,12421.35,3105.34,07-05-2024,2028-08-29,false,false,true,false,true,es,,,2024-07-05T00:00:00,2024-11-13T00:00:00,customers.json,2026-02-10T22:25:28.068809
CUS-00000433,Ahmed,Smith,Ahmed Smith,ahmed.smith106@outlook.com,UNLISTED,female,78,1948-02-18,9743 Elm St,Tokyo,,100-0001,Japan,Platinum,182,12419.62,253.46,1609023600,2026-01-20,1,true,true,true,true,es,CAD,social_media,2020-12-27T00:00:00,2021-08-07T00:00:00,customers.json,2026-02-10T22:25:28.068809
CUS-00000434,Mary,Dubois,Mary Dubois,mary.dubois113@mail.com,4419831355,Male,44,1982-02-09,5636 Elm Blvd,Los Angeles,CA,90001,USA,Gold,9,43117.44,3593.12,2020-12-15T00:00:00,2023-08-10,true,false,,false,false,de,,social_media,2020-12-15T00:00:00,2021-01-14T00:00:00,customers.json,2026-02-10T22:25:28.068809
CUS-00000435,Jessica,Williams,Jessica Williams,jessica.williams697@mail.com,,female,82,1944-02-19,8275 Main Blvd,Amsterdam,,1012 AB,Netherlands,Gold,149,36834.15,7366.83,2023-11-04,2026-08-20,yes,false,true,true,false,fr,USD,social_media,2023-11-04T00:00:00,2023-11-22T00:00:00,customers.json,2026-02-10T22:25:28.068809
CUS-00000436,Joseph,Silva,Joseph Silva,joseph.silva780@yahoo.com,UNLISTED,,75,1951-02-17,4012 Hill Rd,Paris,,75001,France,Gold,63,23986.48,499.72,2018-01-30,2019-02-21,yes,false,,false,false,fr,GBP,website,2018-01-30T00:00:00,2018-11-08T00:00:00,customers.json,2026-02-10T22:25:28.068809
CUS-00000437,Sarah,O'Brien,Sarah O'Brien,sarah.o'brien761@outlook.com,(646) 105-6607,female,39,1987-02-08,6547 River Rd,London,,SW1A 1AA,United Kingdom,Silver,1,31141.41,1946.34,2018-06-04,2023-10-20,no,true,false,false,true,,EUR,,2018-06-04T00:00:00,2019-01-27T00:00:00,customers.json,2026-02-10T22:25:28.068809
CUS-00000438,Michael,Garcia,Michael Garcia,michael.garcia121@gmail.com,UNLISTED,female,25,2001-02-04,4872 Lake Ln,Tokyo,,100-0001,Japan,SILVER,115,26440.86,1888.63,1697752800,2026-12-23,0,false,false,false,true,ja,,partner,2023-10-20T00:00:00,2025-02-12T00:00:00,customers.json,2026-02-10T22:25:28.068809
CUS-00000439,Marie,Jones,Marie Jones,marie.jones851@outlook.com,9836273262,,71,1955-02-16,1299 River Rd,Paris,,75001,France,VIP,152,25246.94,8415.65,23/06/2019,2023-02-06,true,true,,false,false,,GBP,referral,2019-06-23T00:00:00,2020-07-06T00:00:00,customers.json,2026-02-10T22:25:28.068809
CUS-00000440,Thomas,Mueller,Thomas Mueller,thomas.mueller106@company.com,,female,64,1962-02-14,9853 Park Rd,Chicago,IL,60601,USA,Gold,86,11904.49,360.74,1605049200,2025-08-19,false,true,,true,true,de,JPY,referral,2020-11-11T00:00:00,2021-04-13T00:00:00,customers.json,2026-02-10T22:25:28.068809
CUS-00000441,Joseph,Mueller,Joseph Mueller,joseph.mueller957@company.com,9547005068,male,54,1972-02-12,9326 Hill Blvd,Amsterdam,,1012 AB,Netherlands,vip,68,24698.32,525.5,2023-04-09,2028-04-10,yes,false,true,true,false,,JPY,,2023-04-09T00:00:00,2024-06-14T00:00:00,customers.json,2026-02-10T22:25:28.068809
CUS-00000442,Jessica,Brown,Jessica Brown,jessica.brown338@yahoo.com,3588943507,Prefer not to say,53,1973-02-11,810 Main Rd,Chicago,IL,60601,USA,Platinum,73,47098.59,1962.44,06-01-2023,2027-04-21,false,false,false,false,false,,GBP,social_media,2023-06-01T00:00:00,2024-07-15T00:00:00,customers.json,2026-02-10T22:25:28.068809
CUS-00000443,Jennifer,Brown,Jennifer Brown,jennifer.brown572@company.com,UNLISTED,M,78,1948-02-18,1532 Forest Dr,Amsterdam,,1012 AB,Netherlands,Bronze,60,2588.21,172.55,2019-01-11T00:00:00,2021-02-07,yes,true,,true,true,zh,CAD,social_media,2019-01-11T00:00:00,2019-01-29T00:00:00,customers.json,2026-02-10T22:25:28.068809
CUS-00000444,Thomas,O'Brien,Thomas O'Brien,thomas.o'brien519@mail.com,3771443650,M,81,1945-02-18,40 Park Dr,Paris,,75001,France,Bronze,144,33909.4,827.06,2018-07-18T00:00:00,2021-09-28,true,true,,true,false,fr,JPY,partner,2018-07-18T00:00:00,2018-09-06T00:00:00,customers.json,2026-02-10T22:25:28.068809
CUS-00000445,Carlos,Tanaka,Carlos Tanaka,carlos.tanaka443@company.com,UNLISTED,M,42,1984-02-09,8109 Hill Blvd,Tokyo,,100-0001,Japan,Gold,62,40817.79,1407.51,1668639600,2024-04-27,0,true,,false,false,,,referral,2022-11-17T00:00:00,2023-04-05T00:00:00,customers.json,2026-02-10T22:25:28.068809
CUS-00000446,Karen,O'Brien,Karen O'Brien,karen.o'brien319@yahoo.com,5389278162,Other,66,1960-02-15,6367 Hill Blvd,Paris,,75001,France,SILVER,171,7672.19,225.65,2019-08-14,2026-12-09,false,true,true,true,true,zh,,,2019-08-14T00:00:00,2020-07-01T00:00:00,customers.json,2026-02-10T22:25:28.068809
CUS-00000447,Liam,Jones,Liam Jones,liam.jones393@outlook.com,4086277777,FEMALE,59,1967-02-13,6544 River Blvd,Paris,,75001,France,Gold,129,46415.7,1856.63,1699052400,2025-12-31,true,true,false,false,true,,CAD,mobile_app,2023-11-04T00:00:00,2025-02-15T00:00:00,customers.json,2026-02-10T22:25:28.068809
CUS-00000448,Richard,Dubois,Richard Dubois,richard.dubois268@company.com,309.361.8117,F,65,1961-02-14,5338 Oak Ln,Chicago,IL,60601,USA,BRONZE,148,34265.63,5710.94,1529704800,2022-06-27,0,true,false,false,false,zh,USD,mobile_app,2018-06-23T00:00:00,2018-10-15T00:00:00,customers.json,2026-02-10T22:25:28.068809
CUS-00000449,David,Patel,David Patel,david.patel51@outlook.com,927.309.4050,female,80,1946-02-18,2476 Elm Dr,Chicago,IL,60601,USA,SILVER,21,2075.84,61.05,04-28-2020,2023-10-10,0,false,,false,false,fr,AUD,partner,2020-04-28T00:00:00,2020-05-08T00:00:00,customers.json,2026-02-10T22:25:28.068809
CUS-00000450,David,Jones,David Jones,david.jones20@company.com,2067428929,Other,31,1995-02-06,7468 Lake Rd,Berlin,,10115,Germany,silver,52,3886.69,129.56,2019-05-21,2024-05-15,1,false,true,true,true,fr,EUR,website,2019-05-21T00:00:00,2020-03-28T00:00:00,customers.json,2026-02-10T22:25:28.068809
CUS-00000451,Robert,Mueller,Robert Mueller,robert.mueller255@outlook.com,(406) 511-2416,M,78,1948-02-18,7450 River St,Paris,,75001,France,Gold,2,22872.3,22872.3,02-02-2023,2024-06-11,yes,false,true,false,true,fr,JPY,website,2023-02-02T00:00:00,2024-03-03T00:00:00,customers.json,2026-02-10T22:25:28.068809
CUS-00000452,John,Garcia,John Garcia,john.garcia715@gmail.com,+1-407-929-3952,Other,25,2001-02-04,4863 Park Ave,Berlin,,10115,Germany,VIP,28,16017.6,348.21,1611183600,2022-11-29,false,true,true,false,true,de,CAD,referral,2021-01-21T00:00:00,2021-08-20T00:00:00,customers.json,2026-02-10T22:25:28.068809
CUS-00000453,Marie,Silva,Marie Silva,marie.silva644@outlook.com,530.827.5993,"",,,6035 Lake Ave,Los Angeles,CA,90001,USA,VIP,120,38745.74,861.02,2018-07-24,2020-11-23,true,false,true,false,false,es,JPY,social_media,2018-07-24T00:00:00,2018-08-09T00:00:00,customers.json,2026-02-10T22:25:28.068809
CUS-00000454,Wei,Jones,Wei Jones,wei.jones806@gmail.com,+1-313-938-4013,Other,48,1978-02-10,3916 Main Ln,Sydney,NSW,2000,Australia,Gold,18,18960.63,4740.16,01-18-2024,2027-06-08,0,true,false,true,true,zh,CAD,website,2024-01-18T00:00:00,2024-09-23T00:00:00,customers.json,2026-02-10T22:25:28.068809
CUS-00000455,Christopher,Miller,Christopher Miller,christopher.miller295@company.com,563.947.3445,Prefer not to say,19,2007-02-03,5249 Hill Ave,Sydney,NSW,2000,Australia,Platinum,168,,,29/03/2018,2019-09-14,no,true,,true,false,en,,mobile_app,2018-03-29T00:00:00,2019-08-11T00:00:00,customers.json,2026-02-10T22:25:28.068809
CUS-00000456,Emma,Kim,Emma Kim,emma.kim125@gmail.com,,Prefer not to say,21,2005-02-03,8584 Forest Blvd,Los Angeles,CA,90001,USA,bronze,126,9855.42,307.98,2023-03-30,2026-12-24,false,false,,false,true,zh,JPY,partner,2023-03-30T00:00:00,2023-06-04T00:00:00,customers.json,2026-02-10T22:25:28.068809
CUS-00000457,Liam,Brown,Liam Brown,liam.brown577@gmail.com,UNLISTED,"",69,1957-02-15,9322 Forest Rd,Amsterdam,,1012 AB,Netherlands,VIP,188,17737.35,521.69,1554415200,2024-09-13,true,false,true,true,false,fr,USD,social_media,2019-04-05T00:00:00,2019-11-30T00:00:00,customers.json,2026-02-10T22:25:28.068809
CUS-00000458,Marie,Rodriguez,Marie Rodriguez,marie.rodriguez427@mail.com,721.560.5622,Male,62,1964-02-14,1315 Park St,Amsterdam,,1012 AB,Netherlands,VIP,179,18673.54,746.94,09-26-2021,2025-12-13,yes,true,true,false,false,en,AUD,website,2021-09-26T00:00:00,2022-07-14T00:00:00,customers.json,2026-02-10T22:25:28.068809
CUS-00000459,Susan,O'Brien,Susan O'Brien,susan.o'brien194@mail.com,UNLISTED,,80,1946-02-18,2030 Oak Ave,Sydney,NSW,2000,Australia,Silver,143,8937.9,812.54,2022-03-12T00:00:00,2025-07-19,false,false,,false,true,de,EUR,partner,2022-03-12T00:00:00,2023-07-23T00:00:00,customers.json,2026-02-10T22:25:28.068809
CUS-00000460,Jennifer,Jones,Jennifer Jones,jennifer.jones593@yahoo.com,902.838.8198,Prefer not to say,56,1970-02-12,5231 Park Rd,Berlin,,10115,Germany,Platinum,64,28149.07,853.0,2023-05-30,2028-07-15,false,false,false,false,true,,AUD,mobile_app,2023-05-30T00:00:00,2024-09-01T00:00:00,customers.json,2026-02-10T22:25:28.068809
CUS-00000461,Joseph,Garcia,Joseph Garcia,joseph.garcia634@gmail.com,4013042645,Female,52,1974-02-11,991 Oak St,Toronto,ON,M5V 2H1,Canada,Platinum,77,26878.5,2687.85,2022-03-27T00:00:00,2026-06-28,no,false,,true,false,fr,,partner,2022-03-27T00:00:00,2022-06-11T00:00:00,customers.json,2026-02-10T22:25:28.068809
CUS-00000462,Patricia,Smith,Patricia Smith,patricia.smith872@gmail.com,,Prefer not to say,70,1956-02-16,2644 Hill Ave,Los Angeles,CA,90001,USA,Bronze,78,42761.8,1943.72,02-17-2019,2019-06-05,1,false,true,true,true,en,,mobile_app,2019-02-17T00:00:00,2019-08-10T00:00:00,customers.json,2026-02-10T22:25:28.068809
CUS-00000463,Hans,Rodriguez,Hans Rodriguez,hans.rodriguez638@company.com,+1-204-601-2365,Female,85,1941-02-19,844 Forest Dr,Amsterdam,,1012 AB,Netherlands,GOLD,199,33116.46,1439.85,2021-10-26,2023-03-21,yes,true,false,true,true,fr,CAD,,2021-10-26T00:00:00,2021-12-08T00:00:00,customers.json,2026-02-10T22:25:28.068809
CUS-00000464,Marie,Garcia,Marie Garcia,marie.garcia935@gmail.com,646.359.2407,MALE,26,2000-02-05,5235 Oak Blvd,Los Angeles,CA,90001,USA,Silver,166,18014.84,450.37,2020-02-25,2022-01-22,0,false,,true,true,zh,GBP,mobile_app,2020-02-25T00:00:00,2021-03-08T00:00:00,customers.json,2026-02-10T22:25:28.068809
CUS-00000465,Fatima,Martinez,Fatima Martinez,fatima.martinez183@mail.com,+1-305-766-5638,Female,59,1967-02-13,2659 Main St,London,,SW1A 1AA,United Kingdom,Gold,116,28883.46,1444.17,2023-10-04,2028-07-19,true,true,,false,false,de,AUD,partner,2023-10-04T00:00:00,2024-06-22T00:00:00,customers.json,2026-02-10T22:25:28.068809
CUS-00000466,Thomas,Kim,Thomas Kim,thomas.kim373@company.com,668.784.6356,Male,30,1996-02-06,8477 River Ave,Paris,,75001,France,Bronze,56,9609.87,1372.84,06-20-2024,2028-02-20,yes,true,true,false,true,ja,GBP,,2024-06-20T00:00:00,2025-10-31T00:00:00,customers.json,2026-02-10T22:25:28.068809
CUS-00000467,James,Jones,James Jones,james.jones903@yahoo.com,(844) 348-3590,Prefer not to say,43,1983-02-09,9668 Forest Ln,London,,SW1A 1AA,United Kingdom,PLATINUM,181,22437.02,801.32,2024-01-09T00:00:00,2024-10-10,no,false,true,false,false,,EUR,website,2024-01-09T00:00:00,2024-01-29T00:00:00,customers.json,2026-02-10T22:25:28.068809
CUS-00000468,Joseph,Chen,Joseph Chen,joseph.chen813@yahoo.com,(274) 119-9078,MALE,80,1946-02-18,3833 River Ln,Tokyo,,100-0001,Japan,Gold,48,40550.6,2703.37,1637276400,2023-01-17,false,true,,true,false,zh,EUR,,2021-11-19T00:00:00,2022-10-05T00:00:00,customers.json,2026-02-10T22:25:28.068809
CUS-00000469,Jennifer,Mueller,Jennifer Mueller,jennifer.mueller667@mail.com,,female,77,1949-02-17,113 Forest Ln,London,,SW1A 1AA,United Kingdom,Bronze,1,29678.88,927.47,2018-10-17T00:00:00,2020-07-30,0,true,,false,false,zh,AUD,partner,2018-10-17T00:00:00,2019-08-26T00:00:00,customers.json,2026-02-10T22:25:28.068809
CUS-00000470,Fatima,Kim,Fatima Kim,fatima.kim802@yahoo.com,,"",42,1984-02-09,5365 Oak Rd,Paris,,75001,France,Gold,76,18570.83,2652.98,1641769200,2026-08-10,yes,true,,false,true,zh,CAD,website,2022-01-10T00:00:00,2022-01-23T00:00:00,customers.json,2026-02-10T22:25:28.068809
CUS-00000471,Karen,Tanaka,Karen Tanaka,karen.tanaka317@company.com,(974) 464-1160,F,23,2003-02-04,2827 Park Ln,Sydney,NSW,2000,Australia,Silver,140,43315.32,5414.41,07/08/2019,2024-02-20,false,false,true,true,false,,GBP,,2019-08-07T00:00:00,2020-03-20T00:00:00,customers.json,2026-02-10T22:25:28.068809
CUS-00000472,Marie,Chen,Marie Chen,marie.chen978@yahoo.com,(975) 977-9159,Male,51,1975-02-11,439 Park Dr,Los Angeles,CA,90001,USA,VIP,25,12074.85,365.9,2018-03-08,2020-01-21,false,false,false,false,true,zh,USD,website,2018-03-08T00:00:00,2018-05-13T00:00:00,customers.json,2026-02-10T22:25:28.068809
CUS-00000473,John,Silva,John Silva,john.silva312@yahoo.com,(632) 164-7956,Prefer not to say,20,2006-02-03,5102 Forest Rd,Los Angeles,CA,90001,USA,VIP,55,,,27/02/2021,2024-11-19,1,false,true,true,true,de,GBP,website,2021-02-27T00:00:00,2022-05-18T00:00:00,customers.json,2026-02-10T22:25:28.068809
CUS-00000474,Mary,Smith,Mary Smith,mary.smith864@outlook.com,(575) 441-8458,Other,27,1999-02-05,9164 Forest Ln,Chicago,IL,60601,USA,VIP,142,43038.23,1434.61,2020-08-08T00:00:00,2021-01-29,yes,false,,false,false,,USD,mobile_app,2020-08-08T00:00:00,2021-04-21T00:00:00,customers.json,2026-02-10T22:25:28.068809
CUS-00000475,Jessica,Mueller,Jessica Mueller,jessica.mueller132@gmail.com,242.384.9301,F,76,1950-02-17,4597 Oak Dr,Berlin,,10115,Germany,VIP,143,25089.5,570.22,2019-04-24,2019-10-14,no,false,false,true,true,zh,CAD,website,2019-04-24T00:00:00,2019-10-19T00:00:00,customers.json,2026-02-10T22:25:28.068809
CUS-00000476,Liam,Dubois,Liam Dubois,liam.dubois523@outlook.com,,Male,71,1955-02-16,2299 Main Ln,London,,SW1A 1AA,United Kingdom,VIP,120,28198.86,687.78,2020-08-22,2021-12-01,0,true,false,false,true,en,CAD,referral,2020-08-22T00:00:00,2021-02-21T00:00:00,customers.json,2026-02-10T22:25:28.068809
CUS-00000477,Yuki,Wang,Yuki Wang,yuki.wang774@outlook.com,UNLISTED,Female,57,1969-02-12,2045 Elm Rd,Chicago,IL,60601,USA,Bronze,104,7034.92,1004.99,2019-03-10T00:00:00,2019-04-23,0,false,,true,false,en,USD,,2019-03-10T00:00:00,2019-08-16T00:00:00,customers.json,2026-02-10T22:25:28.068809
CUS-00000478,Sarah,Tanaka,Sarah Tanaka,sarah.tanaka496@company.com,7766617789,"",77,1949-02-17,4674 Lake Ave,Los Angeles,CA,90001,USA,Bronze,194,,,2019-04-16,2020-08-24,no,true,true,false,false,zh,JPY,partner,2019-04-16T00:00:00,2020-01-30T00:00:00,customers.json,2026-02-10T22:25:28.068809
CUS-00000479,Karen,Dubois,Karen Dubois,karen.dubois616@outlook.com,652.739.9195,male,29,1997-02-05,4016 Elm Ave,Tokyo,,100-0001,Japan,SILVER,22,42760.9,2515.35,06-07-2024,2028-03-30,yes,false,true,true,true,de,GBP,partner,2024-06-07T00:00:00,2024-07-18T00:00:00,customers.json,2026-02-10T22:25:28.068809
CUS-00000480,Liam,Dubois,Liam Dubois,liam.dubois23@gmail.com,503.129.6416,Male,21,2005-02-03,6213 Main Blvd,Los Angeles,CA,90001,USA,Silver,27,12928.83,808.05,2019-09-27T00:00:00,2024-06-04,false,true,true,false,true,es,USD,,2019-09-27T00:00:00,2020-03-03T00:00:00,customers.json,2026-02-10T22:25:28.068809
CUS-00000481,William,Garcia,William Garcia,william.garcia803@company.com,+1-574-935-4279,female,58,1968-02-13,8771 Elm Blvd,Berlin,,10115,Germany,VIP,136,20683.7,2298.19,1716760800,2029-03-04,0,true,,true,false,,AUD,partner,2024-05-27T00:00:00,2025-07-19T00:00:00,customers.json,2026-02-10T22:25:28.068809
CUS-00000482,Priya,Martinez,Priya Martinez,priya.martinez188@gmail.com,,female,75,1951-02-17,4248 Lake Ave,New York,NY,10001,USA,Bronze,92,2326.28,193.86,10-08-2021,2022-04-06,no,false,false,false,false,fr,,referral,2021-10-08T00:00:00,2022-07-24T00:00:00,customers.json,2026-02-10T22:25:28.068809
CUS-00000483,Richard,Rodriguez,Richard Rodriguez,richard.rodriguez252@mail.com,504.659.8117,Female,66,1960-02-15,2290 Oak St,Berlin,,10115,Germany,Platinum,66,44304.08,22152.04,2020-05-01T00:00:00,2023-12-26,true,false,false,false,true,ja,JPY,website,2020-05-01T00:00:00,2020-06-17T00:00:00,customers.json,2026-02-10T22:25:28.068809
CUS-00000484,Carlos,Tanaka,Carlos Tanaka,carlos.tanaka588@gmail.com,UNLISTED,Prefer not to say,56,1970-02-12,9790 Lake Rd,Sydney,NSW,2000,Australia,Silver,40,2885.75,96.19,1619733600,2025-12-15,0,true,,true,false,en,,social_media,2021-04-30T00:00:00,2022-02-26T00:00:00,customers.json,2026-02-10T22:25:28.068809
CUS-00000485,Emma,Rodriguez,Emma Rodriguez,emma.rodriguez425@mail.com,9422972789,F,45,1981-02-09,6458 Elm Blvd,Paris,,75001,France,Platinum,100,6679.5,954.21,2019-08-12T00:00:00,2024-09-01,yes,false,,true,false,en,GBP,,2019-08-12T00:00:00,2020-11-26T00:00:00,customers.json,2026-02-10T22:25:28.068809
CUS-00000486,Richard,Chen,Richard Chen,richard.chen102@outlook.com,UNLISTED,male,71,1955-02-16,2992 Park Dr,Berlin,,10115,Germany,Gold,54,26318.14,1253.24,08-04-2024,2028-12-18,false,true,,false,true,zh,,mobile_app,2024-08-04T00:00:00,2025-08-05T00:00:00,customers.json,2026-02-10T22:25:28.068809
CUS-00000487,Joseph,Silva,Joseph Silva,joseph.silva623@yahoo.com,201.601.8225,female,81,1945-02-18,7806 Park St,London,,SW1A 1AA,United Kingdom,VIP,7,33340.82,1449.6,26/10/2020,2025-06-24,true,true,true,false,true,en,CAD,partner,2020-10-26T00:00:00,2021-04-29T00:00:00,customers.json,2026-02-10T22:25:28.068809
CUS-00000488,Mary,Dubois,Mary Dubois,mary.dubois215@mail.com,UNLISTED,Male,78,1948-02-18,9188 Forest St,Sydney,NSW,2000,Australia,VIP,41,1388.68,28.34,2022-03-09,2026-03-30,1,false,true,true,false,ja,JPY,website,2022-03-09T00:00:00,2022-05-15T00:00:00,customers.json,2026-02-10T22:25:28.068809
CUS-00000489,Linda,Miller,Linda Miller,linda.miller833@gmail.com,+1-938-575-6747,Male,26,2000-02-05,2774 Lake St,Toronto,ON,M5V 2H1,Canada,vip,57,,,2023-11-24,2027-04-16,true,false,,false,false,zh,GBP,partner,2023-11-24T00:00:00,2024-11-16T00:00:00,customers.json,2026-02-10T22:25:28.068809
CUS-00000490,Fatima,Dubois,Fatima Dubois,fatima.dubois349@outlook.com,3803547403,F,35,1991-02-07,9068 Lake Ln,Amsterdam,,1012 AB,Netherlands,Platinum,83,21490.97,7163.66,04-08-2021,2021-12-19,yes,true,true,false,false,fr,CAD,mobile_app,2021-04-08T00:00:00,2022-07-27T00:00:00,customers.json,2026-02-10T22:25:28.068809
CUS-00000491,Elizabeth,Anderson,Elizabeth Anderson,elizabeth.anderson879@yahoo.com,,male,37,1989-02-07,1502 Forest Dr,Berlin,,10115,Germany,Gold,61,4347.85,103.52,1672700400,2025-06-15,no,false,true,false,false,en,USD,mobile_app,2023-01-03T00:00:00,2023-05-25T00:00:00,customers.json,2026-02-10T22:25:28.068809
CUS-00000492,Christopher,Miller,Christopher Miller,christopher.miller442@gmail.com,UNLISTED,F,35,1991-02-07,2606 Forest Ave,Amsterdam,,1012 AB,Netherlands,Platinum,88,41908.24,838.16,2020-04-02T00:00:00,2021-04-02,false,true,false,false,false,es,USD,mobile_app,2020-04-02T00:00:00,2021-06-12T00:00:00,customers.json,2026-02-10T22:25:28.068809
CUS-00000493,Linda,Smith,Linda Smith,linda.smith566@gmail.com,,male,43,1983-02-09,1199 Park Ln,Toronto,ON,M5V 2H1,Canada,Gold,104,10682.23,485.56,04/01/2018,2023-05-11,true,false,false,false,false,,CAD,social_media,2018-01-04T00:00:00,2019-02-25T00:00:00,customers.json,2026-02-10T22:25:28.068809
CUS-00000494,James,Dubois,James Dubois,james.dubois437@gmail.com,UNLISTED,FEMALE,82,1944-02-19,7155 Elm St,Sydney,NSW,2000,Australia,Gold,92,4168.29,134.46,2021-06-19T00:00:00,2026-07-12,1,true,,false,false,fr,,partner,2021-06-19T00:00:00,2022-01-28T00:00:00,customers.json,2026-02-10T22:25:28.068809
CUS-00000495,Susan,Brown,Susan Brown,susan.brown153@mail.com,7125813836,M,85,1941-02-19,2010 River Dr,London,,SW1A 1AA,United Kingdom,VIP,7,6860.83,6860.83,2020-11-23T00:00:00,2024-03-05,false,true,true,true,false,zh,GBP,partner,2020-11-23T00:00:00,2021-04-04T00:00:00,customers.json,2026-02-10T22:25:28.068809
CUS-00000496,Emma,Wang,Emma Wang,emma.wang465@company.com,,MALE,75,1951-02-17,6103 Forest Ln,London,,SW1A 1AA,United Kingdom,Bronze,111,40948.7,1637.95,2024-06-20T00:00:00,2026-09-18,1,false,false,true,false,es,USD,partner,2024-06-20T00:00:00,2025-05-29T00:00:00,customers.json,2026-02-10T22:25:28.068809
CUS-00000497,Marie,Chen,Marie Chen,marie.chen601@yahoo.com,3377079212,Other,23,2003-02-04,2789 Forest Ln,Chicago,IL,60601,USA,Gold,60,8372.23,199.34,1680386400,2026-05-10,yes,false,true,true,false,,JPY,mobile_app,2023-04-02T00:00:00,2023-09-05T00:00:00,customers.json,2026-02-10T22:25:28.068809
CUS-00000498,Susan,Tanaka,Susan Tanaka,susan.tanaka599@yahoo.com,+1-256-298-2457,male,65,1961-02-14,5825 Elm Dr,Los Angeles,CA,90001,USA,VIP,101,17714.41,2530.63,04-04-2019,2022-03-10,false,false,true,false,false,fr,GBP,social_media,2019-04-04T00:00:00,2020-03-31T00:00:00,customers.json,2026-02-10T22:25:28.068809
CUS-00000499,Thomas,Miller,Thomas Miller,thomas.miller75@outlook.com,UNLISTED,Prefer not to say,36,1990-02-07,6342 Main Ln,London,,SW1A 1AA,United Kingdom,VIP,32,26883.05,689.31,1706742000,2027-10-01,false,false,true,false,false,ja,GBP,,2024-02-01T00:00:00,2024-09-28T00:00:00,customers.json,2026-02-10T22:25:28.068809
CUS-00000500,Susan,Garcia,Susan Garcia,susan.garcia201@mail.com,+1-641-637-6929,F,34,1992-02-07,8848 Forest Ave,New York,NY,10001,USA,Platinum,26,2953.5,328.17,2019-06-22,2024-04-09,0,true,,true,false,fr,CAD,social_media,2019-06-22T00:00:00,2019-09-17T00:00:00,customers.json,2026-02-10T22:25:28.068809
CUS-00000501,Ahmed,Martinez,Ahmed Martinez,ahmed.martinez428@outlook.com,4942933154,Female,85,1941-02-19,4484 Elm St,Chicago,IL,60601,USA,SILVER,37,13861.94,729.58,1629064800,2023-05-20,1,true,false,true,false,fr,GBP,website,2021-08-16T00:00:00,2022-09-09T00:00:00,customers.json,2026-02-10T22:25:28.068809
CUS-00000502,Marie,Anderson,Marie Anderson,marie.anderson756@yahoo.com,,FEMALE,34,1992-02-07,7778 Park Blvd,New York,NY,10001,USA,platinum,112,27885.25,1212.4,04-02-2023,2027-02-12,1,false,false,true,false,es,JPY,referral,2023-04-02T00:00:00,2023-12-01T00:00:00,customers.json,2026-02-10T22:25:28.068809
CUS-00000503,Linda,Chen,Linda Chen,linda.chen318@outlook.com,8213723936,FEMALE,24,2002-02-04,8841 River Dr,New York,NY,10001,USA,Bronze,47,4956.19,260.85,2019-07-23T00:00:00,2020-10-20,no,true,true,true,true,ja,,partner,2019-07-23T00:00:00,2020-10-07T00:00:00,customers.json,2026-02-10T22:25:28.068809
CUS-00000504,Mary,Davis,Mary Davis,mary.davis942@company.com,2869082467,F,53,1973-02-11,6454 Lake Ave,Chicago,IL,60601,USA,Bronze,101,42825.93,2379.22,12-28-2019,2020-06-26,1,true,true,false,true,fr,EUR,mobile_app,2019-12-28T00:00:00,2020-12-15T00:00:00,customers.json,2026-02-10T22:25:28.068809
CUS-00000505,Carlos,Smith,Carlos Smith,carlos.smith475@gmail.com,UNLISTED,F,25,2001-02-04,2303 River Dr,Sydney,NSW,2000,Australia,Bronze,188,27043.33,965.83,2019-03-12T00:00:00,2019-06-09,no,false,false,false,false,ja,JPY,website,2019-03-12T00:00:00,2019-11-12T00:00:00,customers.json,2026-02-10T22:25:28.068809
CUS-00000506,Jennifer,Patel,Jennifer Patel,jennifer.patel988@outlook.com,587.462.7768,"",83,1943-02-19,8188 Hill Dr,Paris,,75001,France,Silver,173,24779.26,991.17,08-10-2022,2022-12-27,0,false,false,false,true,en,,,2022-08-10T00:00:00,2023-11-24T00:00:00,customers.json,2026-02-10T22:25:28.068809
CUS-00000507,Carlos,Davis,Carlos Davis,carlos.davis459@yahoo.com,+1-478-628-5199,male,68,1958-02-15,1149 Lake Ave,Paris,,75001,France,Gold,110,18444.89,922.24,18/10/2021,2022-07-12,true,true,,false,true,ja,USD,mobile_app,2021-10-18T00:00:00,2022-11-26T00:00:00,customers.json,2026-02-10T22:25:28.068809
CUS-00000508,Jessica,Jones,Jessica Jones,jessica.jones605@yahoo.com,+1-853-875-3434,Male,60,1966-02-13,8942 Forest Dr,Los Angeles,CA,90001,USA,VIP,55,13051.98,303.53,06-05-2021,2025-01-18,no,false,false,true,true,de,AUD,mobile_app,2021-06-05T00:00:00,2021-11-11T00:00:00,customers.json,2026-02-10T22:25:28.068809
CUS-00000509,Elizabeth,Kim,Elizabeth Kim,elizabeth.kim402@company.com,UNLISTED,M,66,1960-02-15,3453 Elm Rd,New York,NY,10001,USA,Gold,115,39367.13,820.15,09/12/2023,2028-05-19,no,true,,false,false,ja,,,2023-12-09T00:00:00,2024-10-14T00:00:00,customers.json,2026-02-10T22:25:28.068809
CUS-00000510,Hans,Garcia,Hans Garcia,hans.garcia985@company.com,+1-888-796-4947,"",67,1959-02-15,8519 Forest Dr,Paris,,75001,France,platinum,44,2457.45,136.52,09-21-2024,2025-09-01,1,true,true,false,true,ja,JPY,partner,2024-09-21T00:00:00,2025-09-18T00:00:00,customers.json,2026-02-10T22:25:28.068809
CUS-00000511,David,Tanaka,David Tanaka,david.tanaka236@gmail.com,757.128.2987,Other,49,1977-02-10,9029 Main St,Sydney,NSW,2000,Australia,vip,199,6804.24,154.64,20/09/2022,2025-06-27,true,true,true,false,true,en,AUD,referral,2022-09-20T00:00:00,2022-12-21T00:00:00,customers.json,2026-02-10T22:25:28.068809
CUS-00000512,James,Smith,James Smith,james.smith247@yahoo.com,+1-448-933-7471,F,62,1964-02-14,1601 Forest Blvd,Chicago,IL,60601,USA,Bronze,163,29760.48,1417.17,2023-06-10T00:00:00,2028-02-11,true,true,,true,true,zh,AUD,,2023-06-10T00:00:00,2024-06-28T00:00:00,customers.json,2026-02-10T22:25:28.068809
CUS-00000513,Marie,Williams,Marie Williams,marie.williams386@company.com,423.902.9360,M,,,8734 Elm St,Los Angeles,CA,90001,USA,Gold,66,30959.38,7739.85,2021-07-04,2021-10-31,false,true,,true,false,zh,CAD,partner,2021-07-04T00:00:00,2022-05-28T00:00:00,customers.json,2026-02-10T22:25:28.068809
CUS-00000514,Patricia,Garcia,Patricia Garcia,,(382) 371-2246,M,62,1964-02-14,8670 Park Ave,Sydney,NSW,2000,Australia,Silver,99,2194.41,68.58,2022-04-24,2022-11-12,false,true,false,false,true,en,,social_media,2022-04-24T00:00:00,2023-08-09T00:00:00,customers.json,2026-02-10T22:25:28.068809
CUS-00000515,Joseph,Patel,Joseph Patel,joseph.patel755@company.com,(462) 872-3773,Male,54,1972-02-12,5915 Park St,New York,NY,10001,USA,gold,156,34304.18,1008.95,06-06-2024,2028-01-09,false,true,,false,true,de,GBP,referral,2024-06-06T00:00:00,2024-06-07T00:00:00,customers.json,2026-02-10T22:25:28.068809
CUS-00000516,Thomas,Rodriguez,Thomas Rodriguez,thomas.rodriguez328@mail.com,,M,18,2008-02-03,7240 Elm Blvd,London,,SW1A 1AA,United Kingdom,Platinum,165,41547.35,1065.32,2018-04-08T00:00:00,2020-01-27,false,true,,true,true,en,,,2018-04-08T00:00:00,2019-01-13T00:00:00,customers.json,2026-02-10T22:25:28.068809
CUS-00000517,Emma,Davis,Emma Davis,emma.davis12@yahoo.com,746.131.2195,"",78,1948-02-18,1454 Forest St,New York,NY,10001,USA,gold,172,15774.17,606.7,01-03-2020,2024-01-02,0,false,,false,false,es,CAD,,2020-01-03T00:00:00,2020-02-17T00:00:00,customers.json,2026-02-10T22:25:28.068809
CUS-00000518,Jennifer,Rodriguez,Jennifer Rodriguez,jennifer.rodriguez459@gmail.com,323.691.2023,Male,21,2005-02-03,9311 Elm St,Tokyo,,100-0001,Japan,Platinum,116,3607.77,128.85,08-10-2023,2026-10-09,0,true,false,false,true,es,EUR,,2023-08-10T00:00:00,2023-11-23T00:00:00,customers.json,2026-02-10T22:25:28.068809
CUS-00000519,Sarah,Smith,Sarah Smith,sarah.smith721@outlook.com,UNLISTED,Other,76,1950-02-17,9957 Park Ave,Amsterdam,,1012 AB,Netherlands,VIP,161,23741.35,505.14,01-18-2020,2022-11-04,no,true,true,false,true,,AUD,mobile_app,2020-01-18T00:00:00,2020-11-07T00:00:00,customers.json,2026-02-10T22:25:28.068809
CUS-00000520,Thomas,Kim,Thomas Kim,thomas.kim201@company.com,UNLISTED,F,78,1948-02-18,3845 Lake St,Berlin,,10115,Germany,Silver,100,27665.21,674.76,21/06/2019,2023-11-22,true,true,false,false,true,es,GBP,website,2019-06-21T00:00:00,2019-08-19T00:00:00,customers.json,2026-02-10T22:25:28.068809
CUS-00000521,William,Jones,William Jones,william.jones384@gmail.com,740.669.7874,male,44,1982-02-09,2414 Oak St,Sydney,NSW,2000,Australia,Gold,27,39970.67,1332.36,05-12-2018,2022-01-07,1,false,false,false,false,zh,GBP,mobile_app,2018-05-12T00:00:00,2019-06-07T00:00:00,customers.json,2026-02-10T22:25:28.068809
CUS-00000522,Ahmed,Williams,Ahmed Williams,ahmed.williams545@mail.com,UNLISTED,Prefer not to say,44,1982-02-09,8656 Forest Rd,Amsterdam,,1012 AB,Netherlands,Gold,196,29352.46,698.87,1576191600,2020-12-02,false,false,true,true,true,de,GBP,website,2019-12-13T00:00:00,2020-04-24T00:00:00,customers.json,2026-02-10T22:25:28.068809
CUS-00000523,Barbara,Williams,Barbara Williams,barbara.williams226@mail.com,+1-440-149-6564,"",39,1987-02-08,778 Oak Rd,Chicago,IL,60601,USA,Platinum,162,11968.67,443.28,2020-10-25,2025-06-12,yes,false,,false,true,zh,USD,social_media,2020-10-25T00:00:00,2021-12-13T00:00:00,customers.json,2026-02-10T22:25:28.068809
CUS-00000524,Priya,Anderson,Priya Anderson,priya.anderson249@company.com,6341795362,Male,28,1998-02-05,4167 Main Ave,Los Angeles,CA,90001,USA,vip,124,-5418.68,,04/12/2021,2026-01-01,yes,true,,true,true,es,USD,partner,2021-12-04T00:00:00,2022-06-22T00:00:00,customers.json,2026-02-10T22:25:28.068809
CUS-00000525,Liam,Williams,Liam Williams,liam.williams766@outlook.com,UNLISTED,"",80,1946-02-18,8737 Hill St,Los Angeles,CA,90001,USA,Bronze,184,,,03-17-2021,2023-11-16,0,true,,false,false,de,GBP,,2021-03-17T00:00:00,2021-11-12T00:00:00,customers.json,2026-02-10T22:25:28.068809
CUS-00000526,Hans,Tanaka,Hans Tanaka,hans.tanaka917@yahoo.com,(548) 421-9174,,52,1974-02-11,1694 River St,Tokyo,,100-0001,Japan,platinum,198,15628.55,868.25,22/12/2022,2026-04-06,true,true,false,false,true,,EUR,partner,2022-12-22T00:00:00,2023-06-22T00:00:00,customers.json,2026-02-10T22:25:28.068809
CUS-00000527,Carlos,Patel,Carlos Patel,carlos.patel634@company.com,(514) 792-8667,M,31,1995-02-06,4546 River Dr,Los Angeles,CA,90001,USA,Bronze,76,8301.47,2075.37,1534888800,2022-04-25,0,true,false,false,false,es,GBP,mobile_app,2018-08-22T00:00:00,2019-10-06T00:00:00,customers.json,2026-02-10T22:25:28.068809
CUS-00000528,William,Davis,William Davis,william.davis792@company.com,UNLISTED,FEMALE,24,2002-02-04,5319 Elm Ave,Chicago,IL,60601,USA,Bronze,123,46913.66,1234.57,14/09/2021,2024-01-20,1,false,false,true,true,,AUD,social_media,2021-09-14T00:00:00,2022-05-26T00:00:00,customers.json,2026-02-10T22:25:28.068809
CUS-00000529,William,O'Brien,William O'Brien,william.o'brien632@mail.com,(200) 160-5296,Other,43,1983-02-09,7899 Hill Ln,Paris,,75001,France,Platinum,64,44452.68,2020.58,11/08/2019,2021-07-08,1,false,true,false,true,zh,JPY,,2019-08-11T00:00:00,2019-11-04T00:00:00,customers.json,2026-02-10T22:25:28.068809
CUS-00000530,James,Rodriguez,James Rodriguez,james.rodriguez524@gmail.com,(739) 713-9162,MALE,26,2000-02-05,791 Park Ave,Tokyo,,100-0001,Japan,VIP,189,10964.68,249.2,01/12/2021,2025-11-27,true,false,false,false,true,ja,CAD,referral,2021-12-01T00:00:00,2022-04-07T00:00:00,customers.json,2026-02-10T22:25:28.068809
CUS-00000531,Susan,Tanaka,Susan Tanaka,SusanTanaka,,FEMALE,71,1955-02-16,6185 Lake Rd,London,,SW1A 1AA,United Kingdom,Platinum,90,20689.12,1034.46,08-29-2022,2025-03-17,true,true,false,true,false,,,,2022-08-29T00:00:00,2023-01-04T00:00:00,customers.json,2026-02-10T22:25:28.068809
CUS-00000532,Michael,Wang,Michael Wang,michael.wang111@gmail.com,(250) 650-3216,MALE,20,2006-02-03,233 Hill Blvd,Berlin,,10115,Germany,Gold,73,16851.24,366.33,2018-10-14,2019-08-03,0,true,,false,false,,AUD,social_media,2018-10-14T00:00:00,2019-05-25T00:00:00,customers.json,2026-02-10T22:25:28.068809
CUS-00000533,Jennifer,Brown,Jennifer Brown,jennifer.brown983@company.com,6476806360,M,77,1949-02-17,6132 Elm Dr,Chicago,IL,60601,USA,Silver,68,37039.32,1089.39,1636758000,2025-05-05,false,false,,false,true,de,CAD,,2021-11-13T00:00:00,2022-05-02T00:00:00,customers.json,2026-02-10T22:25:28.068809
CUS-00000534,Karen,O'Brien,Karen O'Brien,karen.o'brien768@gmail.com,347.343.1096,,19,2007-02-03,9633 Forest Blvd,Chicago,IL,60601,USA,Silver,154,36883.82,838.27,05-26-2021,2023-04-02,true,true,,false,false,de,USD,,2021-05-26T00:00:00,2022-09-15T00:00:00,customers.json,2026-02-10T22:25:28.068809
CUS-00000535,Karen,Davis,Karen Davis,karen.davis502@company.com,UNLISTED,M,80,1946-02-18,1439 Hill Rd,Sydney,NSW,2000,Australia,Gold,90,33662.39,1085.88,09-15-2020,2024-06-05,true,false,false,false,true,zh,AUD,,2020-09-15T00:00:00,2021-12-30T00:00:00,customers.json,2026-02-10T22:25:28.068809
CUS-00000536,Yuki,Miller,Yuki Miller,yuki.miller779@yahoo.com,+1-292-463-1855,"",48,1978-02-10,3916 Hill Rd,Berlin,,10115,Germany,PLATINUM,105,21097.33,514.57,2022-02-03,2023-10-13,0,false,false,true,false,en,,website,2022-02-03T00:00:00,2022-05-26T00:00:00,customers.json,2026-02-10T22:25:28.068809
CUS-00000537,Michael,O'Brien,Michael O'Brien,michael.o'brien426@outlook.com,,MALE,82,1944-02-19,3248 Oak Dr,Sydney,NSW,2000,Australia,VIP,109,19422.25,1294.82,2021-07-01,2024-03-13,0,true,false,true,false,zh,EUR,social_media,2021-07-01T00:00:00,2022-04-19T00:00:00,customers.json,2026-02-10T22:25:28.068809
CUS-00000538,Liam,Garcia,Liam Garcia,liam.garcia781@yahoo.com,(337) 594-5613,F,64,1962-02-14,6363 Main Blvd,Los Angeles,CA,90001,USA,Bronze,39,21291.1,1774.26,17/10/2024,2024-11-20,true,false,true,false,false,de,EUR,,2024-10-17T00:00:00,2025-10-29T00:00:00,customers.json,2026-02-10T22:25:28.068809
CUS-00000539,Barbara,Dubois,Barbara Dubois,barbara.dubois383@company.com,4229753610,female,44,1982-02-09,2087 Park Rd,London,,SW1A 1AA,United Kingdom,Silver,106,26211.86,4368.64,2018-03-17,2022-02-06,true,true,true,true,false,,,,2018-03-17T00:00:00,2019-03-12T00:00:00,customers.json,2026-02-10T22:25:28.068809
CUS-00000540,Marie,O'Brien,Marie O'Brien,marie.o'brien518@outlook.com,9801808645,Prefer not to say,40,1986-02-08,4035 Elm Blvd,Amsterdam,,1012 AB,Netherlands,Silver,84,19692.54,518.22,1525298400,2021-10-16,1,false,true,true,true,zh,JPY,partner,2018-05-03T00:00:00,2018-05-28T00:00:00,customers.json,2026-02-10T22:25:28.068809
CUS-00000541,Hans,Garcia,Hans Garcia,hans.garcia285@mail.com,(882) 860-2763,,24,2002-02-04,7452 Main Blvd,Sydney,NSW,2000,Australia,PLATINUM,18,31586.4,3509.6,2021-09-13T00:00:00,2026-02-03,0,true,false,false,true,ja,GBP,mobile_app,2021-09-13T00:00:00,2022-10-27T00:00:00,customers.json,2026-02-10T22:25:28.068809
CUS-00000542,Marie,Anderson,Marie Anderson,marie.anderson244@mail.com,(483) 701-8648,Other,67,1959-02-15,5371 Lake Ln,Tokyo,,100-0001,Japan,Platinum,145,41965.29,975.94,2018-12-14,2019-11-20,true,false,,false,false,es,CAD,,2018-12-14T00:00:00,2020-02-03T00:00:00,customers.json,2026-02-10T22:25:28.068809
CUS-00000543,William,Chen,William Chen,william.chen492@company.com,UNLISTED,Other,64,1962-02-14,3085 Hill St,Berlin,,10115,Germany,Gold,30,25802.64,679.02,08-31-2024,2028-07-28,false,true,,false,true,de,JPY,website,2024-08-31T00:00:00,2025-06-14T00:00:00,customers.json,2026-02-10T22:25:28.068809
CUS-00000544,Carlos,Chen,Carlos Chen,carlos.chen420@yahoo.com,+1-648-239-1011,male,74,1952-02-17,8246 Park Blvd,Chicago,IL,60601,USA,VIP,93,23862.95,883.81,2018-02-16T00:00:00,2027-01-25,true,false,,true,true,fr,JPY,,2018-02-16T00:00:00,2019-04-30T00:00:00,customers.json,2026-02-10T22:25:28.068809
CUS-00000545,David,Dubois,David Dubois,david.dubois860@outlook.com,,MALE,84,1942-02-19,8746 Oak St,Berlin,,10115,Germany,Platinum,42,24782.95,1126.5,13/01/2021,2021-04-25,false,true,,true,false,,JPY,mobile_app,2021-01-13T00:00:00,2021-06-23T00:00:00,customers.json,2026-02-10T22:25:28.068809
CUS-00000546,William,Dubois,William Dubois,william.dubois917@mail.com,UNLISTED,female,84,1942-02-19,4222 Hill Blvd,New York,NY,10001,USA,bronze,195,29016.35,630.79,17/06/2018,2018-08-27,1,false,false,true,false,,AUD,mobile_app,2018-06-17T00:00:00,2019-08-10T00:00:00,customers.json,2026-02-10T22:25:28.068809
CUS-00000547,Christopher,Johnson,Christopher Johnson,christopher.johnson619@mail.com,(269) 636-4588,Male,56,1970-02-12,9468 Lake Ave,Toronto,ON,M5V 2H1,Canada,SILVER,170,4375.0,118.24,11-02-2020,2021-12-09,false,true,false,false,true,zh,CAD,mobile_app,2020-11-02T00:00:00,2021-11-26T00:00:00,customers.json,2026-02-10T22:25:28.068809
CUS-00000548,Carlos,Jones,Carlos Jones,carlos.jones572@yahoo.com,+1-640-137-7344,,20,2006-02-03,3221 Hill Ave,London,,SW1A 1AA,United Kingdom,VIP,42,10932.48,242.94,1714341600,2028-04-01,false,false,,true,true,de,,social_media,2024-04-29T00:00:00,2024-08-31T00:00:00,customers.json,2026-02-10T22:25:28.068809
CUS-00000549,Thomas,Garcia,Thomas Garcia,thomas.garcia484@gmail.com,5495488357,Male,22,2004-02-04,2558 Forest Rd,Sydney,NSW,2000,Australia,Bronze,113,39122.64,2173.48,2023-07-14,2026-12-07,0,true,true,true,true,de,USD,social_media,2023-07-14T00:00:00,2024-02-23T00:00:00,customers.json,2026-02-10T22:25:28.068809
CUS-00000550,Jessica,Silva,Jessica Silva,jessica.silva114@company.com,4886907786,,56,1970-02-12,8714 Elm Rd,Paris,,75001,France,Bronze,36,11482.53,244.31,2022-01-28T00:00:00,2024-07-24,true,true,,false,true,,USD,website,2022-01-28T00:00:00,2022-07-08T00:00:00,customers.json,2026-02-10T22:25:28.068809
CUS-00000551,Marie,Tanaka,Marie Tanaka,marie.tanaka915@company.com,,FEMALE,25,2001-02-04,5244 Hill St,New York,NY,10001,USA,VIP,64,49624.85,1210.36,10-28-2024,2027-04-04,0,false,true,true,true,,AUD,partner,2024-10-28T00:00:00,2025-01-13T00:00:00,customers.json,2026-02-10T22:25:28.068809
CUS-00000552,Linda,Martinez,Linda Martinez,linda.martinez995@mail.com,,MALE,85,1941-02-19,2633 Hill Dr,New York,NY,10001,USA,Silver,119,36962.33,770.05,04-09-2020,2022-05-22,no,false,,true,true,zh,JPY,website,2020-04-09T00:00:00,2020-07-25T00:00:00,customers.json,2026-02-10T22:25:28.068809
CUS-00000553,Yuki,Patel,Yuki Patel,yuki.patel668@outlook.com,+1-911-289-7770,Female,50,1976-02-11,8222 River Rd,Chicago,IL,60601,USA,Silver,88,43358.66,1806.61,07-02-2020,2021-07-16,false,true,false,true,true,fr,,website,2020-07-02T00:00:00,2020-07-28T00:00:00,customers.json,2026-02-10T22:25:28.068809
CUS-00000554,Liam,Davis,Liam Davis,liam.davis412@outlook.com,6576939956,MALE,64,1962-02-14,2829 Hill Dr,Berlin,,10115,Germany,Bronze,81,29231.45,1169.26,12-20-2022,2024-01-22,false,false,false,false,true,zh,CAD,partner,2022-12-20T00:00:00,2024-02-14T00:00:00,customers.json,2026-02-10T22:25:28.068809
CUS-00000555,Priya,Patel,Priya Patel,priya.patel216@yahoo.com,+1-733-712-5742,F,19,2007-02-03,6640 Lake Dr,Toronto,ON,M5V 2H1,Canada,platinum,13,23481.02,711.55,04-17-2021,2022-02-22,no,false,,true,true,de,,mobile_app,2021-04-17T00:00:00,2021-08-25T00:00:00,customers.json,2026-02-10T22:25:28.068809
CUS-00000556,Priya,Davis,Priya Davis,priya.davis235@gmail.com,736.380.6944,,31,1995-02-06,5116 Hill St,New York,NY,10001,USA,Gold,10,42684.15,1707.37,2023-12-25T00:00:00,2027-03-16,true,true,true,false,true,fr,JPY,partner,2023-12-25T00:00:00,2024-01-03T00:00:00,customers.json,2026-02-10T22:25:28.068809
CUS-00000557,Wei,Brown,Wei Brown,wei.brown269@company.com,,male,40,1986-02-08,2505 Park Dr,Toronto,ON,M5V 2H1,Canada,Gold,147,11081.4,852.42,03-25-2021,2023-08-23,1,false,true,false,true,,USD,,2021-03-25T00:00:00,2022-07-11T00:00:00,customers.json,2026-02-10T22:25:28.068809
CUS-00000558,James,Mueller,James Mueller,james.mueller632@yahoo.com,UNLISTED,Other,39,1987-02-08,2913 Elm St,London,,SW1A 1AA,United Kingdom,Platinum,47,28766.8,871.72,1557871200,2023-11-29,false,false,,true,true,ja,AUD,,2019-05-15T00:00:00,2019-11-12T00:00:00,customers.json,2026-02-10T22:25:28.068809
CUS-00000559,Robert,Brown,Robert Brown,RobertBrown,UNLISTED,"",39,1987-02-08,2759 Forest Rd,Chicago,IL,60601,USA,vip,154,44375.69,1706.76,14/02/2021,2025-09-16,false,true,,false,false,en,,,2021-02-14T00:00:00,2022-04-19T00:00:00,customers.json,2026-02-10T22:25:28.068809
CUS-00000560,Linda,Dubois,Linda Dubois,linda.dubois364@company.com,+1-948-675-6838,male,25,2001-02-04,8375 Forest Ln,Paris,,75001,France,Platinum,28,29559.62,1343.62,1711666800,2024-05-09,true,false,true,true,true,de,JPY,mobile_app,2024-03-29T00:00:00,2024-05-21T00:00:00,customers.json,2026-02-10T22:25:28.068809
CUS-00000561,Mary,Anderson,Mary Anderson,mary.anderson495@gmail.com,457.974.1161,Other,55,1971-02-12,6200 Hill Blvd,Tokyo,,100-0001,Japan,VIP,2,26521.37,914.53,03/12/2023,2028-02-24,false,false,false,true,false,,,social_media,2023-12-03T00:00:00,2024-04-15T00:00:00,customers.json,2026-02-10T22:25:28.068809
CUS-00000562,Patricia,Jones,Patricia Jones,PatriciaJones,+1-646-629-4452,"",74,1952-02-17,7055 Hill Dr,Paris,,75001,France,VIP,75,20137.58,559.38,2020-06-03,2024-05-24,false,true,false,true,false,de,AUD,website,2020-06-03T00:00:00,2021-01-24T00:00:00,customers.json,2026-02-10T22:25:28.068809
CUS-00000563,David,Jones,David Jones,david.jones855@outlook.com,(435) 874-4607,Male,55,1971-02-12,1524 Oak Rd,Tokyo,,100-0001,Japan,VIP,159,9450.89,242.33,2018-06-21T00:00:00,2021-02-03,1,false,false,false,false,es,CAD,,2018-06-21T00:00:00,2019-02-06T00:00:00,customers.json,2026-02-10T22:25:28.068809
CUS-00000564,Priya,Mueller,Priya Mueller,priya.mueller283@gmail.com,(817) 417-6973,"",69,1957-02-15,9512 Oak St,Amsterdam,,1012 AB,Netherlands,BRONZE,133,10068.5,209.76,2022-04-26,2024-12-13,1,true,,false,false,de,AUD,,2022-04-26T00:00:00,2022-09-15T00:00:00,customers.json,2026-02-10T22:25:28.068809
CUS-00000565,Liam,Miller,Liam Miller,liam.miller486@gmail.com,7907022652,"",74,1952-02-17,6875 Forest St,Berlin,,10115,Germany,Platinum,38,15444.73,617.79,09-05-2023,2026-09-10,no,true,,true,true,,,partner,2023-09-05T00:00:00,2024-11-08T00:00:00,customers.json,2026-02-10T22:25:28.068809
CUS-00000566,Patricia,Garcia,Patricia Garcia,patricia.garcia777@company.com,+1-864-268-5231,,71,1955-02-16,5258 River Dr,Berlin,,10115,Germany,Gold,104,35677.45,1114.92,2024-04-13,2025-06-26,no,true,false,false,false,ja,CAD,website,2024-04-13T00:00:00,2024-08-29T00:00:00,customers.json,2026-02-10T22:25:28.068809
CUS-00000567,Marie,Martinez,Marie Martinez,marie.martinez5@gmail.com,5198941661,F,57,1969-02-12,4381 Lake Dr,Amsterdam,,1012 AB,Netherlands,Silver,183,8108.36,253.39,1686780000,2028-06-27,true,false,true,false,true,,JPY,social_media,2023-06-15T00:00:00,2024-05-03T00:00:00,customers.json,2026-02-10T22:25:28.068809
CUS-00000568,Ahmed,Chen,Ahmed Chen,ahmed.chen457@outlook.com,261.959.6285,F,31,1995-02-06,329 Lake St,Amsterdam,,1012 AB,Netherlands,Platinum,41,6062.59,263.59,2018-08-14T00:00:00,2018-08-18,true,true,false,true,true,en,JPY,,2018-08-14T00:00:00,2019-03-05T00:00:00,customers.json,2026-02-10T22:25:28.068809
CUS-00000569,Priya,Dubois,Priya Dubois,,+1-313-259-8338,"",30,1996-02-06,6672 Forest Blvd,Tokyo,,100-0001,Japan,Silver,35,28495.02,2590.46,2021-04-25T00:00:00,2022-12-18,true,true,,false,false,es,USD,social_media,2021-04-25T00:00:00,2022-03-18T00:00:00,customers.json,2026-02-10T22:25:28.068809
CUS-00000570,Linda,O'Brien,Linda O'Brien,linda.o'brien327@gmail.com,,Other,50,1976-02-11,7722 Park St,New York,NY,10001,USA,Bronze,35,17578.51,1757.85,2022-05-20,2027-06-27,yes,false,false,false,false,fr,GBP,,2022-05-20T00:00:00,2022-05-22T00:00:00,customers.json,2026-02-10T22:25:28.068809
CUS-00000571,David,Davis,David Davis,david.davis285@yahoo.com,712.863.8116,Prefer not to say,74,1952-02-17,9177 Hill Rd,Toronto,ON,M5V 2H1,Canada,Silver,92,47680.89,2167.31,10-05-2018,2020-01-05,true,false,true,false,true,en,JPY,website,2018-10-05T00:00:00,2019-10-16T00:00:00,customers.json,2026-02-10T22:25:28.068809
CUS-00000572,Barbara,Wang,Barbara Wang,barbara.wang9@company.com,UNLISTED,Male,49,1977-02-10,574 Hill Ln,Amsterdam,,1012 AB,Netherlands,VIP,48,46642.24,2120.1,07-14-2024,2025-05-18,false,false,true,false,false,zh,GBP,website,2024-07-14T00:00:00,2025-09-30T00:00:00,customers.json,2026-02-10T22:25:28.068809
CUS-00000573,Christopher,Miller,Christopher Miller,christopher.miller899@company.com,8851679069,F,73,1953-02-16,2477 Elm Ave,Chicago,IL,60601,USA,Silver,173,4504.52,264.97,2019-04-04T00:00:00,2021-01-18,true,true,true,true,false,ja,CAD,website,2019-04-04T00:00:00,2019-06-28T00:00:00,customers.json,2026-02-10T22:25:28.068809
CUS-00000574,Christopher,Mueller,Christopher Mueller,christopher.mueller631@gmail.com,+1-874-357-5034,Prefer not to say,19,2007-02-03,8321 Main Dr,Sydney,NSW,2000,Australia,silver,31,759.54,42.2,2024-09-29,2027-10-13,false,true,false,true,false,en,AUD,,2024-09-29T00:00:00,2024-11-25T00:00:00,customers.json,2026-02-10T22:25:28.068809
CUS-00000575,Hans,Johnson,Hans Johnson,hans.johnson386@outlook.com,+1-937-943-8079,MALE,73,1953-02-16,4232 Elm Dr,Tokyo,,100-0001,Japan,VIP,30,6897.98,689.8,08-27-2022,2028-01-05,false,false,true,true,false,,,referral,2022-08-27T00:00:00,2023-07-11T00:00:00,customers.json,2026-02-10T22:25:28.068809
CUS-00000576,Thomas,Patel,Thomas Patel,thomas.patel599@outlook.com,9625437052,Other,54,1972-02-12,5659 Main Rd,Berlin,,10115,Germany,Bronze,61,24573.88,744.66,1690063200,2024-02-05,yes,false,,true,false,fr,GBP,website,2023-07-23T00:00:00,2024-04-18T00:00:00,customers.json,2026-02-10T22:25:28.068809
CUS-00000577,Richard,Jones,Richard Jones,richard.jones899@mail.com,(351) 377-9015,male,43,1983-02-09,593 Park Rd,Amsterdam,,1012 AB,Netherlands,Gold,70,19873.2,484.71,01-31-2022,2023-11-23,true,false,,false,true,ja,EUR,website,2022-01-31T00:00:00,2022-09-09T00:00:00,customers.json,2026-02-10T22:25:28.068809
CUS-00000578,Karen,Kim,Karen Kim,karen.kim391@outlook.com,4411843851,"",78,1948-02-18,537 Elm Ave,Berlin,,10115,Germany,Gold,132,36989.52,18494.76,2020-08-02,2025-12-30,no,false,true,true,false,es,AUD,referral,2020-08-02T00:00:00,2021-02-03T00:00:00,customers.json,2026-02-10T22:25:28.068809
CUS-00000579,Priya,Smith,Priya Smith,priya.smith767@yahoo.com,(484) 197-5618,"",72,1954-02-16,4211 Forest Blvd,London,,SW1A 1AA,United Kingdom,VIP,166,21376.26,521.37,22/05/2019,2019-09-01,true,true,true,true,false,en,AUD,mobile_app,2019-05-22T00:00:00,2020-02-06T00:00:00,customers.json,2026-02-10T22:25:28.068809
CUS-00000580,William,Davis,William Davis,william.davis867@company.com,(835) 871-6665,male,41,1985-02-08,5933 Forest Ln,Berlin,,10115,Germany,VIP,87,6739.92,1684.98,17/05/2020,2023-02-19,false,false,true,true,true,fr,AUD,referral,2020-05-17T00:00:00,2020-12-24T00:00:00,customers.json,2026-02-10T22:25:28.068809
CUS-00000581,Mary,Davis,Mary Davis,mary.davis195@company.com,976.866.5675,F,40,1986-02-08,2144 Main Ave,Toronto,ON,M5V 2H1,Canada,Gold,82,44028.98,2201.45,2024-08-30T00:00:00,2029-04-24,false,false,,false,false,de,CAD,social_media,2024-08-30T00:00:00,2025-07-26T00:00:00,customers.json,2026-02-10T22:25:28.068809
CUS-00000582,Joseph,Silva,Joseph Silva,joseph.silva533@gmail.com,,FEMALE,29,1997-02-05,3503 Forest Blvd,Chicago,IL,60601,USA,Bronze,147,21939.47,783.55,22/09/2018,2024-02-11,yes,true,,false,false,fr,,partner,2018-09-22T00:00:00,2020-01-18T00:00:00,customers.json,2026-02-10T22:25:28.068809
CUS-00000583,Karen,Dubois,Karen Dubois,karen.dubois584@company.com,(763) 835-3020,MALE,23,2003-02-04,7296 Oak Ln,Toronto,ON,M5V 2H1,Canada,Platinum,179,16020.85,372.58,2022-07-29,2024-06-24,true,true,,false,false,ja,CAD,social_media,2022-07-29T00:00:00,2023-11-01T00:00:00,customers.json,2026-02-10T22:25:28.068809
CUS-00000584,Jennifer,Rodriguez,Jennifer Rodriguez,jennifer.rodriguez675@yahoo.com,834.404.9458,MALE,48,1978-02-10,7591 River Ln,Los Angeles,CA,90001,USA,Bronze,115,16627.78,377.9,2023-02-14T00:00:00,2028-03-22,no,false,true,false,true,de,,referral,2023-02-14T00:00:00,2023-11-13T00:00:00,customers.json,2026-02-10T22:25:28.068809
CUS-00000585,Priya,Dubois,Priya Dubois,priya.dubois50@outlook.com,+1-648-713-2509,"",52,1974-02-11,1477 Forest St,Amsterdam,,1012 AB,Netherlands,Bronze,193,19746.69,1795.15,09-08-2024,2028-01-28,false,false,false,false,true,,CAD,website,2024-09-08T00:00:00,2024-12-28T00:00:00,customers.json,2026-02-10T22:25:28.068809
CUS-00000586,Robert,Wang,Robert Wang,robert.wang397@yahoo.com,,Female,71,1955-02-16,3006 Hill St,Los Angeles,CA,90001,USA,Platinum,67,32640.31,816.01,1534284000,2020-10-13,false,false,,true,true,,AUD,social_media,2018-08-15T00:00:00,2018-11-13T00:00:00,customers.json,2026-02-10T22:25:28.068809
CUS-00000587,Priya,Mueller,Priya Mueller,priya.mueller404@outlook.com,(844) 719-6519,,25,2001-02-04,1772 Oak Ave,Tokyo,,100-0001,Japan,BRONZE,190,33957.19,808.5,08-18-2019,2022-06-28,false,false,,true,false,fr,EUR,social_media,2019-08-18T00:00:00,2020-12-02T00:00:00,customers.json,2026-02-10T22:25:28.068809
CUS-00000588,Wei,Garcia,Wei Garcia,wei.garcia325@mail.com,,"",49,1977-02-10,1719 Park Ave,Amsterdam,,1012 AB,Netherlands,Gold,101,-48699.0,,1548716400,2022-10-05,false,false,false,false,true,es,USD,mobile_app,2019-01-29T00:00:00,2019-09-08T00:00:00,customers.json,2026-02-10T22:25:28.068809
CUS-00000589,Carlos,Patel,Carlos Patel,carlos.patel295@mail.com,6238702392,MALE,80,1946-02-18,3195 Main Ln,Tokyo,,100-0001,Japan,Gold,39,11044.72,220.89,02/02/2022,2025-12-17,true,true,true,false,true,ja,,social_media,2022-02-02T00:00:00,2022-10-29T00:00:00,customers.json,2026-02-10T22:25:28.068809
CUS-00000590,Karen,Dubois,Karen Dubois,karen.dubois384@gmail.com,UNLISTED,Male,63,1963-02-14,8624 Main Dr,Berlin,,10115,Germany,Bronze,123,-26020.04,,08-07-2021,2027-01-04,yes,false,false,true,false,ja,USD,,2021-08-07T00:00:00,2021-08-13T00:00:00,customers.json,2026-02-10T22:25:28.068809
CUS-00000591,David,Silva,David Silva,joseph.brown283@yahoo.com,6576449979,Other,74,1952-02-17,6692 Park Ave,Tokyo,,100-0001,Japan,Platinum,123,38151.55,1031.12,05/03/2020,2021-11-10,true,false,true,true,true,fr,USD,mobile_app,2020-03-05T00:00:00,2020-06-24T00:00:00,customers.json,2026-02-10T22:25:28.068809
CUS-00000592,Jessica,Martinez,Jessica Martinez,jessica.martinez563@yahoo.com,4585843139,Other,70,1956-02-16,8727 River Dr,New York,NY,10001,USA,VIP,30,13520.58,346.68,1683928800,2024-09-07,false,false,false,false,true,de,JPY,referral,2023-05-13T00:00:00,2023-08-25T00:00:00,customers.json,2026-02-10T22:25:28.068809
CUS-00000593,Karen,Mueller,Karen Mueller,karen.mueller540@mail.com,663.219.5009,male,79,1947-02-18,3884 Forest Ln,Paris,,75001,France,VIP,41,21785.28,3630.88,17/12/2020,2022-11-11,false,false,,false,false,fr,JPY,website,2020-12-17T00:00:00,2022-01-23T00:00:00,customers.json,2026-02-10T22:25:28.068809
CUS-00000594,Priya,Anderson,Priya Anderson,priya.anderson951@gmail.com,808.141.1466,M,46,1980-02-10,4759 Hill Ave,Paris,,75001,France,Bronze,169,27548.93,573.94,2021-12-07T00:00:00,2025-02-10,false,true,true,true,true,en,,social_media,2021-12-07T00:00:00,2022-05-28T00:00:00,customers.json,2026-02-10T22:25:28.068809
CUS-00000595,Linda,Miller,Linda Miller,linda.miller899@outlook.com,,FEMALE,78,1948-02-18,6962 Park St,Tokyo,,100-0001,Japan,VIP,151,31478.84,1015.45,2018-01-01T00:00:00,2022-10-27,false,true,false,false,false,en,AUD,social_media,2018-01-01T00:00:00,2018-12-03T00:00:00,customers.json,2026-02-10T22:25:28.068809
CUS-00000596,Christopher,Dubois,Christopher Dubois,,,male,84,1942-02-19,6322 Park St,New York,NY,10001,USA,Bronze,86,35547.98,888.7,12-01-2018,2020-11-28,false,false,false,false,true,en,JPY,social_media,2018-12-01T00:00:00,2019-05-13T00:00:00,customers.json,2026-02-10T22:25:28.068809
CUS-00000597,Michael,O'Brien,Michael O'Brien,michael.o'brien861@mail.com,+1-852-423-2483,,79,1947-02-18,3555 River St,Sydney,NSW,2000,Australia,Gold,197,40330.37,1344.35,2021-09-10,2023-08-04,0,true,true,true,false,ja,JPY,social_media,2021-09-10T00:00:00,2021-12-12T00:00:00,customers.json,2026-02-10T22:25:28.068809
CUS-00000598,John,Jones,John Jones,john.jones110@mail.com,782.998.3549,F,85,1941-02-19,547 Hill Dr,Los Angeles,CA,90001,USA,Platinum,67,43546.26,989.69,1593554400,2020-09-11,false,false,,true,false,de,EUR,mobile_app,2020-07-01T00:00:00,2021-04-01T00:00:00,customers.json,2026-02-10T22:25:28.068809
CUS-00000599,Richard,Tanaka,Richard Tanaka,richard.tanaka683@outlook.com,952.871.6359,Male,82,1944-02-19,8857 River Rd,Sydney,NSW,2000,Australia,SILVER,136,2003.01,69.07,26/05/2023,2027-08-06,false,false,false,false,false,,JPY,,2023-05-26T00:00:00,2023-08-10T00:00:00,customers.json,2026-02-10T22:25:28.068809
CUS-00000600,Mary,Silva,Mary Silva,mary.silva157@gmail.com,,FEMALE,150,1876-03-06,5838 Main St,Los Angeles,CA,90001,USA,bronze,11,31778.84,1588.94,10-20-2022,2023-04-20,1,true,,true,true,zh,JPY,website,2022-10-20T00:00:00,2023-05-15T00:00:00,customers.json,2026-02-10T22:25:28.068809
CUS-00000601,Priya,O'Brien,Priya O'Brien,priya.o'brien699@mail.com,UNLISTED,,30,1996-02-06,3620 Park Rd,Tokyo,,100-0001,Japan,VIP,17,7048.23,143.84,05-14-2020,2024-09-09,true,false,false,false,false,zh,EUR,,2020-05-14T00:00:00,2021-03-21T00:00:00,customers.json,2026-02-10T22:25:28.068809
CUS-00000602,Mary,Johnson,Mary Johnson,mary.johnson267@gmail.com,UNLISTED,MALE,82,1944-02-19,6657 Oak Ave,Amsterdam,,1012 AB,Netherlands,BRONZE,5,28998.5,1933.23,1647990000,2025-01-05,1,false,,true,true,ja,USD,referral,2022-03-23T00:00:00,2022-04-19T00:00:00,customers.json,2026-02-10T22:25:28.068809
CUS-00000603,Patricia,Kim,Patricia Kim,patricia.kim334@outlook.com,6127079201,female,57,1969-02-12,609 Main Ln,Tokyo,,100-0001,Japan,Silver,145,29220.97,695.74,1575673200,2023-07-07,no,true,false,true,true,en,,referral,2019-12-07T00:00:00,2021-01-06T00:00:00,customers.json,2026-02-10T22:25:28.068809
CUS-00000604,Jessica,Brown,Jessica Brown,jessica.brown38@company.com,540.137.5340,female,54,1972-02-12,4210 Oak Ln,Chicago,IL,60601,USA,Gold,173,32996.92,891.81,2022-10-28,2027-11-20,false,false,,true,false,ja,AUD,social_media,2022-10-28T00:00:00,2023-12-26T00:00:00,customers.json,2026-02-10T22:25:28.068809
CUS-00000605,Susan,Jones,Susan Jones,susan.jones618@gmail.com,886.526.1039,female,42,1984-02-09,5788 River Blvd,Los Angeles,CA,90001,USA,Platinum,23,13549.52,376.38,27/06/2021,2022-03-07,true,false,,true,true,es,AUD,referral,2021-06-27T00:00:00,2022-10-20T00:00:00,customers.json,2026-02-10T22:25:28.068809
CUS-00000606,Patricia,Wang,Patricia Wang,patricia.wang75@outlook.com,,F,41,1985-02-08,8008 Oak Ln,Paris,,75001,France,Silver,64,23567.11,2356.71,2023-11-23T00:00:00,2025-08-12,no,true,false,true,true,es,JPY,mobile_app,2023-11-23T00:00:00,2024-07-09T00:00:00,customers.json,2026-02-10T22:25:28.068809
CUS-00000607,Joseph,Tanaka,Joseph Tanaka,joseph.tanaka299@company.com,,male,69,1957-02-15,9889 Main Ln,Paris,,75001,France,VIP,85,10102.63,673.51,2021-01-04T00:00:00,2023-10-14,yes,false,,true,true,en,EUR,website,2021-01-04T00:00:00,2021-07-26T00:00:00,customers.json,2026-02-10T22:25:28.068809
CUS-00000608,Patricia,Miller,Patricia Miller,PatriciaMiller,UNLISTED,Other,25,2001-02-04,3639 River Ave,Los Angeles,CA,90001,USA,Bronze,19,,,2023-09-29,2025-02-21,0,false,,true,false,ja,USD,referral,2023-09-29T00:00:00,2024-06-03T00:00:00,customers.json,2026-02-10T22:25:28.068809
CUS-00000609,Linda,Rodriguez,Linda Rodriguez,linda.rodriguez881@gmail.com,5611615746,female,34,1992-02-07,1717 Elm Blvd,New York,NY,10001,USA,Platinum,165,40496.47,5785.21,02/08/2019,2022-09-05,0,true,false,true,true,en,AUD,referral,2019-08-02T00:00:00,2019-08-18T00:00:00,customers.json,2026-02-10T22:25:28.068809
CUS-00000610,John,Chen,John Chen,N/A,6326437482,F,55,1971-02-12,7718 Park St,Berlin,,10115,Germany,VIP,135,38151.87,867.09,2018-07-23T00:00:00,2023-10-15,false,false,true,true,true,ja,USD,partner,2018-07-23T00:00:00,2019-10-23T00:00:00,customers.json,2026-02-10T22:25:28.068809
CUS-00000611,Robert,Smith,Robert Smith,robert.smith350@gmail.com,,F,37,1989-02-07,2834 Elm Dr,Toronto,ON,M5V 2H1,Canada,VIP,117,8453.5,196.59,29/12/2023,2025-11-04,0,false,true,true,false,ja,CAD,,2023-12-29T00:00:00,2024-05-04T00:00:00,customers.json,2026-02-10T22:25:28.068809
CUS-00000612,Sarah,Martinez,Sarah Martinez,sarah.martinez790@company.com,UNLISTED,male,64,1962-02-14,5509 Park Dr,Paris,,75001,France,Silver,127,41800.05,1741.67,2022-10-22,2024-10-27,true,false,,false,true,ja,AUD,website,2022-10-22T00:00:00,2023-10-31T00:00:00,customers.json,2026-02-10T22:25:28.068809
CUS-00000613,Michael,Brown,Michael Brown,michael.brown809@company.com,,Male,44,1982-02-09,7124 Elm Ave,Tokyo,,100-0001,Japan,BRONZE,99,20314.99,5078.75,1608332400,2022-02-01,false,true,false,false,true,,JPY,social_media,2020-12-19T00:00:00,2022-02-20T00:00:00,customers.json,2026-02-10T22:25:28.068809
CUS-00000614,Emma,Davis,Emma Davis,emma.davis120@yahoo.com,907.559.2983,MALE,150,1876-03-06,7225 Park Ln,Sydney,NSW,2000,Australia,Bronze,92,33310.59,3028.24,2020-10-21T00:00:00,2021-03-20,false,false,,false,true,de,,social_media,2020-10-21T00:00:00,2021-02-20T00:00:00,customers.json,2026-02-10T22:25:28.068809
CUS-00000615,Barbara,Garcia,Barbara Garcia,barbara.garcia113@outlook.com,(690) 200-1890,FEMALE,65,1961-02-14,5524 Park Ave,Paris,,75001,France,Silver,33,22315.27,485.11,2024-07-08T00:00:00,2026-03-16,no,false,true,false,true,fr,AUD,social_media,2024-07-08T00:00:00,2025-11-03T00:00:00,customers.json,2026-02-10T22:25:28.068809
CUS-00000616,Emma,Silva,Emma Silva,emma.silva721@mail.com,(301) 588-2734,F,27,1999-02-05,7270 Oak Ln,Paris,,75001,France,Silver,121,15622.11,339.61,04-21-2019,2021-08-20,false,true,,false,false,ja,GBP,referral,2019-04-21T00:00:00,2020-07-27T00:00:00,customers.json,2026-02-10T22:25:28.068809
CUS-00000617,David,Johnson,David Johnson,N/A,+1-325-765-2487,F,38,1988-02-08,5209 Forest Dr,Los Angeles,CA,90001,USA,Platinum,98,4569.19,198.66,2019-05-30T00:00:00,2023-01-20,1,true,true,true,true,zh,,,2019-05-30T00:00:00,2020-09-17T00:00:00,customers.json,2026-02-10T22:25:28.068809
CUS-00000618,Marie,Chen,Marie Chen,marie.chen877@outlook.com,631.990.5590,F,85,1941-02-19,1024 Hill Rd,Los Angeles,CA,90001,USA,Gold,33,43888.62,914.35,2019-05-16,2020-03-06,false,false,,false,false,en,EUR,partner,2019-05-16T00:00:00,2020-07-02T00:00:00,customers.json,2026-02-10T22:25:28.068809
CUS-00000619,Karen,Wang,Karen Wang,karen.wang643@gmail.com,+1-632-500-6219,Prefer not to say,45,1981-02-09,1708 Park Ln,Tokyo,,100-0001,Japan,VIP,173,1734.95,91.31,2021-01-12T00:00:00,2021-08-11,false,true,,true,false,ja,AUD,,2021-01-12T00:00:00,2021-02-04T00:00:00,customers.json,2026-02-10T22:25:28.068809
CUS-00000620,Wei,Dubois,Wei Dubois,wei.dubois439@mail.com,UNLISTED,Other,78,1948-02-18,7829 Main St,Paris,,75001,France,Gold,171,13409.86,478.92,1687557600,2028-02-17,0,true,false,true,true,zh,,,2023-06-24T00:00:00,2024-02-26T00:00:00,customers.json,2026-02-10T22:25:28.068809
CUS-00000621,Fatima,Chen,Fatima Chen,N/A,UNLISTED,,37,1989-02-07,4373 Forest Ln,Amsterdam,,1012 AB,Netherlands,Silver,40,39402.72,1576.11,2022-01-08T00:00:00,2023-12-26,true,false,true,true,false,en,JPY,,2022-01-08T00:00:00,2022-02-25T00:00:00,customers.json,2026-02-10T22:25:28.068809
CUS-00000622,John,Anderson,John Anderson,john.anderson883@outlook.com,7226451883,M,37,1989-02-07,3436 Park St,Toronto,ON,M5V 2H1,Canada,Bronze,48,33403.73,1518.35,2020-04-04T00:00:00,2022-02-13,no,false,true,false,true,,CAD,,2020-04-04T00:00:00,2021-06-04T00:00:00,customers.json,2026-02-10T22:25:28.068809
CUS-00000623,Michael,Silva,Michael Silva,michael.silva966@outlook.com,378.608.9102,Other,41,1985-02-08,3907 Forest Rd,Sydney,NSW,2000,Australia,Platinum,29,39228.74,1634.53,1597010400,2026-07-07,no,true,,false,true,fr,USD,,2020-08-10T00:00:00,2021-01-25T00:00:00,customers.json,2026-02-10T22:25:28.068809
CUS-00000624,Christopher,Jones,Christopher Jones,N/A,6044023984,M,27,1999-02-05,1394 Park Rd,London,,SW1A 1AA,United Kingdom,VIP,27,26052.55,3721.79,2023-03-01,2026-12-24,false,true,true,true,true,de,GBP,mobile_app,2023-03-01T00:00:00,2023-09-07T00:00:00,customers.json,2026-02-10T22:25:28.068809
CUS-00000625,Carlos,Johnson,Carlos Johnson,carlos.johnson890@yahoo.com,(928) 849-2697,Female,56,1970-02-12,4073 Forest St,Chicago,IL,60601,USA,VIP,135,37642.82,1636.64,1526508000,2021-01-12,no,true,false,true,true,es,USD,social_media,2018-05-17T00:00:00,2019-07-08T00:00:00,customers.json,2026-02-10T22:25:28.068809
CUS-00000626,Marie,Patel,Marie Patel,,839.337.2220,F,74,1952-02-17,8909 Oak St,Paris,,75001,France,VIP,58,,,17/09/2024,2027-03-15,no,true,,false,false,de,EUR,referral,2024-09-17T00:00:00,2025-11-22T00:00:00,customers.json,2026-02-10T22:25:28.068809
CUS-00000627,Barbara,Chen,Barbara Chen,N/A,UNLISTED,,35,1991-02-07,4593 Forest Blvd,Los Angeles,CA,90001,USA,Bronze,152,28254.3,784.84,25/09/2023,2025-07-15,0,false,,false,true,de,USD,referral,2023-09-25T00:00:00,2024-04-30T00:00:00,customers.json,2026-02-10T22:25:28.068809
CUS-00000628,Carlos,Martinez,Carlos Martinez,carlos.martinez329@gmail.com,(590) 520-7817,Male,61,1965-02-13,9748 Park Blvd,London,,SW1A 1AA,United Kingdom,Bronze,53,35945.75,764.8,2019-01-07,2024-06-01,false,false,,true,true,de,JPY,partner,2019-01-07T00:00:00,2019-02-15T00:00:00,customers.json,2026-02-10T22:25:28.068809
CUS-00000629,Joseph,Smith,Joseph Smith,joseph.smith498@yahoo.com,+1-751-694-3246,female,64,1962-02-14,994 Hill Rd,Tokyo,,100-0001,Japan,Gold,35,6392.59,172.77,1579302000,2022-09-23,true,false,,true,false,,JPY,partner,2020-01-18T00:00:00,2020-12-08T00:00:00,customers.json,2026-02-10T22:25:28.068809
CUS-00000630,Patricia,Jones,Patricia Jones,patricia.jones834@gmail.com,,FEMALE,28,1998-02-05,4318 Lake Ave,Amsterdam,,1012 AB,Netherlands,VIP,9,37385.57,1780.27,08-25-2022,2027-12-25,true,false,true,false,false,de,JPY,referral,2022-08-25T00:00:00,2022-08-29T00:00:00,customers.json,2026-02-10T22:25:28.068809
CUS-00000631,Christopher,Garcia,Christopher Garcia,christopher.garcia120@gmail.com,429.363.2285,Male,57,1969-02-12,804 Main St,Toronto,ON,M5V 2H1,Canada,PLATINUM,76,3654.44,1218.15,2018-08-02,2023-12-06,1,false,false,false,false,ja,JPY,social_media,2018-08-02T00:00:00,2019-04-29T00:00:00,customers.json,2026-02-10T22:25:28.068809
CUS-00000632,Fatima,Miller,Fatima Miller,fatima.miller750@outlook.com,(488) 505-7963,Prefer not to say,67,1959-02-15,6110 Main Dr,Toronto,ON,M5V 2H1,Canada,Platinum,173,4504.39,563.05,06-11-2018,2023-06-12,0,true,false,true,true,fr,USD,social_media,2018-06-11T00:00:00,2019-08-29T00:00:00,customers.json,2026-02-10T22:25:28.068809
CUS-00000633,Ahmed,Williams,Ahmed Williams,ahmed.williams263@company.com,UNLISTED,Other,55,1971-02-12,6872 Lake Rd,London,,SW1A 1AA,United Kingdom,VIP,195,8149.96,194.05,1557784800,2021-09-06,true,false,,false,true,zh,AUD,mobile_app,2019-05-14T00:00:00,2019-08-16T00:00:00,customers.json,2026-02-10T22:25:28.068809
CUS-00000634,Thomas,Williams,Thomas Williams,thomas.williams877@gmail.com,,,67,1959-02-15,4180 Hill Ave,Los Angeles,CA,90001,USA,Gold,149,28783.95,2878.39,12-26-2020,2024-03-16,no,true,,false,true,de,JPY,,2020-12-26T00:00:00,2021-11-17T00:00:00,customers.json,2026-02-10T22:25:28.068809
CUS-00000635,Yuki,Dubois,Yuki Dubois,yuki.dubois823@company.com,7505653008,Other,28,1998-02-05,3109 River Ave,Chicago,IL,60601,USA,VIP,98,40346.23,2373.31,14/01/2024,2026-04-12,0,true,true,false,false,,AUD,social_media,2024-01-14T00:00:00,2025-03-21T00:00:00,customers.json,2026-02-10T22:25:28.068809
CUS-00000636,Emma,Smith,Emma Smith,emma.smith813@mail.com,951.705.7810,female,25,2001-02-04,300 Oak Rd,Sydney,NSW,2000,Australia,Platinum,95,13621.0,716.89,05-10-2023,2028-02-08,1,true,,false,false,,GBP,mobile_app,2023-05-10T00:00:00,2023-11-15T00:00:00,customers.json,2026-02-10T22:25:28.068809
CUS-00000637,Richard,Miller,Richard Miller,richard.miller265@company.com,UNLISTED,"",75,1951-02-17,7703 Elm Dr,Paris,,75001,France,Bronze,161,1367.91,29.74,23/01/2020,2021-04-08,no,false,,false,false,en,CAD,partner,2020-01-23T00:00:00,2020-11-15T00:00:00,customers.json,2026-02-10T22:25:28.068809
CUS-00000638,William,Garcia,William Garcia,william.garcia837@company.com,UNLISTED,FEMALE,46,1980-02-10,8610 Lake Ave,Amsterdam,,1012 AB,Netherlands,SILVER,72,48027.25,1500.85,2021-03-15,2021-10-11,yes,false,,true,true,de,EUR,,2021-03-15T00:00:00,2021-10-20T00:00:00,customers.json,2026-02-10T22:25:28.068809
CUS-00000639,Christopher,Chen,Christopher Chen,christopher.chen876@gmail.com,,Other,57,1969-02-12,302 Elm Ave,Toronto,ON,M5V 2H1,Canada,silver,198,33511.04,1081.0,08-05-2019,2020-10-19,false,true,false,true,false,ja,GBP,website,2019-08-05T00:00:00,2020-05-13T00:00:00,customers.json,2026-02-10T22:25:28.068809
CUS-00000640,James,Williams,James Williams,james.williams689@company.com,,F,36,1990-02-07,3777 Main Rd,Chicago,IL,60601,USA,Platinum,155,13195.22,527.81,2024-03-16T00:00:00,2024-09-28,yes,false,true,true,false,,EUR,partner,2024-03-16T00:00:00,2025-02-24T00:00:00,customers.json,2026-02-10T22:25:28.068809
CUS-00000641,Michael,Dubois,Michael Dubois,michael.dubois902@outlook.com,+1-742-612-5913,female,27,1999-02-05,764 River Rd,London,,SW1A 1AA,United Kingdom,Silver,51,6875.26,625.02,2018-02-09T00:00:00,2021-05-02,no,true,false,false,true,zh,JPY,mobile_app,2018-02-09T00:00:00,2018-08-30T00:00:00,customers.json,2026-02-10T22:25:28.068809
CUS-00000642,Sarah,Mueller,Sarah Mueller,sarah.mueller604@company.com,646.553.3715,MALE,66,1960-02-15,5137 Elm Ln,Sydney,NSW,2000,Australia,PLATINUM,73,14763.47,2109.07,01-15-2024,2028-11-03,no,true,true,true,true,en,GBP,website,2024-01-15T00:00:00,2024-05-29T00:00:00,customers.json,2026-02-10T22:25:28.068809
CUS-00000643,John,Smith,John Smith,john.smith826@company.com,,,32,1994-02-06,4951 River Blvd,Tokyo,,100-0001,Japan,GOLD,114,10515.19,701.01,2020-06-28,2020-12-07,false,false,true,true,true,zh,CAD,social_media,2020-06-28T00:00:00,2020-11-15T00:00:00,customers.json,2026-02-10T22:25:28.068809
CUS-00000644,Christopher,Miller,Christopher Miller,christopher.miller927@gmail.com,UNLISTED,M,38,1988-02-08,4278 Main St,New York,NY,10001,USA,bronze,107,44062.7,8812.54,08/12/2018,2019-10-24,yes,false,false,false,false,en,EUR,,2018-12-08T00:00:00,2019-05-17T00:00:00,customers.json,2026-02-10T22:25:28.068809
CUS-00000645,Priya,Williams,Priya Williams,priya.williams256@outlook.com,UNLISTED,F,79,1947-02-18,4490 Forest Blvd,Los Angeles,CA,90001,USA,Gold,156,48106.38,1718.08,2024-06-01T00:00:00,2029-01-26,true,false,false,false,false,es,GBP,social_media,2024-06-01T00:00:00,2024-11-27T00:00:00,customers.json,2026-02-10T22:25:28.068809
CUS-00000646,James,Rodriguez,James Rodriguez,james.rodriguez184@yahoo.com,+1-469-778-9195,Male,65,1961-02-14,1240 Forest Ln,Toronto,ON,M5V 2H1,Canada,Platinum,85,5834.66,253.68,2019-10-15T00:00:00,2020-04-30,true,true,false,false,false,,GBP,website,2019-10-15T00:00:00,2020-02-26T00:00:00,customers.json,2026-02-10T22:25:28.068809
CUS-00000647,William,Martinez,William Martinez,william.martinez924@gmail.com,+1-466-884-3374,M,74,1952-02-17,4175 Oak Blvd,Los Angeles,CA,90001,USA,Bronze,186,32913.41,889.55,1630965600,2023-12-27,false,false,true,true,false,de,CAD,partner,2021-09-07T00:00:00,2021-10-17T00:00:00,customers.json,2026-02-10T22:25:28.068809
CUS-00000648,Joseph,Smith,Joseph Smith,joseph.smith440@gmail.com,600.520.2716,Female,76,1950-02-17,8797 Main St,Los Angeles,CA,90001,USA,BRONZE,115,,,2023-02-24T00:00:00,2027-01-02,1,true,,false,false,fr,JPY,social_media,2023-02-24T00:00:00,2023-04-17T00:00:00,customers.json,2026-02-10T22:25:28.068809
CUS-00000649,Thomas,Tanaka,Thomas Tanaka,thomas.tanaka494@company.com,UNLISTED,male,77,1949-02-17,892 Oak Ave,Amsterdam,,1012 AB,Netherlands,Bronze,176,8876.45,177.53,2019-09-11,2020-12-08,0,false,false,false,false,ja,CAD,partner,2019-09-11T00:00:00,2020-11-24T00:00:00,customers.json,2026-02-10T22:25:28.068809
CUS-00000650,Sarah,Smith,Sarah Smith,sarah.smith181@gmail.com,UNLISTED,Other,65,1961-02-14,5763 Oak Rd,New York,NY,10001,USA,Platinum,32,2410.91,92.73,2018-10-14T00:00:00,2021-05-08,yes,true,false,false,true,ja,JPY,referral,2018-10-14T00:00:00,2019-07-18T00:00:00,customers.json,2026-02-10T22:25:28.068809
CUS-00000651,Priya,Kim,Priya Kim,priya.kim396@yahoo.com,833.251.3912,,81,1945-02-18,3279 Lake St,New York,NY,10001,USA,Bronze,194,30645.97,7661.49,2024-03-01,2028-10-04,true,false,false,false,false,ja,GBP,mobile_app,2024-03-01T00:00:00,2025-05-11T00:00:00,customers.json,2026-02-10T22:25:28.068809
CUS-00000652,Hans,O'Brien,Hans O'Brien,HansO'Brien,,Male,77,1949-02-17,5160 Park St,Sydney,NSW,2000,Australia,Platinum,68,34177.92,1102.51,2018-06-06,2018-06-16,true,false,,true,true,,JPY,social_media,2018-06-06T00:00:00,2018-10-18T00:00:00,customers.json,2026-02-10T22:25:28.068809
CUS-00000653,Barbara,Brown,Barbara Brown,barbara.brown5@yahoo.com,,M,62,1964-02-14,216 River Ln,New York,NY,10001,USA,Gold,36,19171.31,547.75,01-29-2024,2026-05-22,false,false,false,true,true,es,GBP,mobile_app,2024-01-29T00:00:00,2024-06-06T00:00:00,customers.json,2026-02-10T22:25:28.068809
CUS-00000654,Joseph,Williams,Joseph Williams,joseph.williams821@gmail.com,743.750.5378,"",23,2003-02-04,6123 Oak Rd,Los Angeles,CA,90001,USA,Bronze,110,,,1617141600,2022-09-10,false,true,true,false,false,zh,AUD,mobile_app,2021-03-31T00:00:00,2022-05-06T00:00:00,customers.json,2026-02-10T22:25:28.068809
CUS-00000655,Carlos,Kim,Carlos Kim,carlos.kim586@mail.com,+1-826-307-1688,male,44,1982-02-09,1419 Elm Ln,Berlin,,10115,Germany,SILVER,81,4093.63,116.96,2022-08-18,2023-04-27,false,false,false,false,true,de,GBP,mobile_app,2022-08-18T00:00:00,2023-12-26T00:00:00,customers.json,2026-02-10T22:25:28.068809
CUS-00000656,Susan,Wang,Susan Wang,susan.wang87@yahoo.com,576.132.9897,Male,23,2003-02-04,4608 Elm Ave,Tokyo,,100-0001,Japan,Bronze,62,28967.95,1931.2,1597096800,2021-12-15,false,true,,false,true,,EUR,referral,2020-08-11T00:00:00,2020-08-24T00:00:00,customers.json,2026-02-10T22:25:28.068809
CUS-00000657,Karen,Jones,Karen Jones,karen.jones17@company.com,+1-759-545-7218,Male,80,1946-02-18,9090 Elm Ave,Chicago,IL,60601,USA,Gold,49,20952.32,6984.11,1678921200,2023-05-14,no,true,true,true,false,de,JPY,website,2023-03-16T00:00:00,2024-02-02T00:00:00,customers.json,2026-02-10T22:25:28.068809
CUS-00000658,Yuki,Mueller,Yuki Mueller,N/A,7177642114,M,85,1941-02-19,7969 Main Rd,Toronto,ON,M5V 2H1,Canada,platinum,187,18951.16,1722.83,06-09-2024,2028-11-18,true,false,false,false,true,de,AUD,website,2024-06-09T00:00:00,2025-05-21T00:00:00,customers.json,2026-02-10T22:25:28.068809
CUS-00000659,Joseph,Anderson,Joseph Anderson,joseph.anderson161@yahoo.com,,MALE,49,1977-02-10,5216 Hill Ln,Toronto,ON,M5V 2H1,Canada,Gold,118,22829.9,475.62,17/11/2021,2026-05-09,yes,true,true,true,true,en,CAD,partner,2021-11-17T00:00:00,2022-11-04T00:00:00,customers.json,2026-02-10T22:25:28.068809
CUS-00000660,James,Tanaka,James Tanaka,james.tanaka766@company.com,,female,28,1998-02-05,7973 Oak Ave,Chicago,IL,60601,USA,Silver,162,36760.89,782.15,2021-10-01T00:00:00,2021-11-17,false,true,false,true,true,,JPY,,2021-10-01T00:00:00,2022-03-23T00:00:00,customers.json,2026-02-10T22:25:28.068809
CUS-00000661,Richard,Jones,Richard Jones,richard.jones493@outlook.com,5607648824,female,19,2007-02-03,7246 Forest Rd,Tokyo,,100-0001,Japan,Bronze,105,46083.3,1843.33,07/07/2019,2024-08-23,false,false,,false,false,fr,CAD,mobile_app,2019-07-07T00:00:00,2019-12-15T00:00:00,customers.json,2026-02-10T22:25:28.068809
CUS-00000662,Liam,Chen,Liam Chen,liam.chen154@outlook.com,8303771715,,70,1956-02-16,3583 Park Dr,New York,NY,10001,USA,Gold,35,11421.85,878.6,1549753200,2024-04-24,yes,true,true,false,false,de,CAD,partner,2019-02-10T00:00:00,2020-02-23T00:00:00,customers.json,2026-02-10T22:25:28.068809
CUS-00000663,Susan,Garcia,Susan Garcia,susan.garcia423@mail.com,UNLISTED,MALE,27,1999-02-05,6760 Lake Blvd,Paris,,75001,France,Silver,163,,,2024-07-02,2026-09-26,yes,true,false,true,true,en,USD,partner,2024-07-02T00:00:00,2024-08-25T00:00:00,customers.json,2026-02-10T22:25:28.068809
CUS-00000664,Susan,Kim,Susan Kim,susan.kim855@outlook.com,UNLISTED,F,76,1950-02-17,926 Forest Ave,Paris,,75001,France,Bronze,41,41076.15,5868.02,2019-10-03T00:00:00,2022-11-02,yes,false,false,true,true,zh,JPY,website,2019-10-03T00:00:00,2020-08-19T00:00:00,customers.json,2026-02-10T22:25:28.068809
CUS-00000665,Sarah,Kim,Sarah Kim,sarah.kim886@gmail.com,616.376.3885,F,25,2001-02-04,4661 Forest Blvd,London,,SW1A 1AA,United Kingdom,VIP,173,20724.18,1219.07,2021-06-24,2025-04-28,false,false,true,true,false,zh,AUD,referral,2021-06-24T00:00:00,2021-09-30T00:00:00,customers.json,2026-02-10T22:25:28.068809
CUS-00000666,Hans,Patel,Hans Patel,hans.patel739@mail.com,UNLISTED,FEMALE,35,1991-02-07,7504 Lake Rd,Chicago,IL,60601,USA,BRONZE,165,46185.4,923.71,07-24-2020,2025-08-31,false,true,,true,false,fr,CAD,social_media,2020-07-24T00:00:00,2021-04-18T00:00:00,customers.json,2026-02-10T22:25:28.068809
CUS-00000667,Susan,Dubois,Susan Dubois,susan.dubois900@outlook.com,(851) 751-7444,male,74,1952-02-17,2847 Elm Dr,Paris,,75001,France,VIP,146,31409.56,1963.1,2019-02-25,2019-04-10,yes,false,true,true,true,ja,EUR,social_media,2019-02-25T00:00:00,2019-08-26T00:00:00,customers.json,2026-02-10T22:25:28.068809
CUS-00000668,Thomas,Wang,Thomas Wang,thomas.wang482@mail.com,UNLISTED,male,44,1982-02-09,916 Forest Ln,Paris,,75001,France,Gold,7,18976.31,575.04,2020-07-25,2024-11-19,yes,true,true,true,false,ja,CAD,referral,2020-07-25T00:00:00,2020-11-24T00:00:00,customers.json,2026-02-10T22:25:28.068809
CUS-00000669,David,Mueller,David Mueller,david.mueller768@mail.com,+1-960-583-4428,FEMALE,82,1944-02-19,7467 Main Blvd,Chicago,IL,60601,USA,GOLD,15,33017.35,1375.72,2022-05-31,2026-09-20,no,true,,false,true,zh,JPY,mobile_app,2022-05-31T00:00:00,2022-12-14T00:00:00,customers.json,2026-02-10T22:25:28.068809
CUS-00000670,Yuki,Miller,Yuki Miller,yuki.miller455@yahoo.com,203.887.9126,M,81,1945-02-18,3127 Hill Ave,Sydney,NSW,2000,Australia,Platinum,100,37137.86,1003.73,2018-06-14,2023-08-20,1,false,false,false,true,,CAD,partner,2018-06-14T00:00:00,2019-03-20T00:00:00,customers.json,2026-02-10T22:25:28.068809
CUS-00000671,Yuki,Davis,Yuki Davis,yuki.davis937@mail.com,(960) 719-1292,F,46,1980-02-10,1158 Forest Dr,Sydney,NSW,2000,Australia,Platinum,199,37062.1,2470.81,2021-03-09,2024-10-15,false,false,false,false,false,en,AUD,social_media,2021-03-09T00:00:00,2022-03-27T00:00:00,customers.json,2026-02-10T22:25:28.068809
CUS-00000672,Patricia,Mueller,Patricia Mueller,patricia.mueller370@company.com,+1-244-275-9170,"",42,1984-02-09,46 River Ave,New York,NY,10001,USA,Bronze,127,11403.88,456.16,1638918000,2025-07-30,false,true,,false,true,zh,,social_media,2021-12-08T00:00:00,2022-05-03T00:00:00,customers.json,2026-02-10T22:25:28.068809
CUS-00000673,Yuki,Kim,Yuki Kim,yuki.kim184@yahoo.com,UNLISTED,Other,32,1994-02-06,6154 Lake Rd,New York,NY,10001,USA,Gold,174,4896.44,132.34,2022-12-26T00:00:00,2026-08-26,true,false,,true,false,en,AUD,,2022-12-26T00:00:00,2024-02-23T00:00:00,customers.json,2026-02-10T22:25:28.068809
CUS-00000674,Robert,Dubois,Robert Dubois,robert.dubois964@company.com,,Other,20,2006-02-03,1728 Lake Rd,Chicago,IL,60601,USA,Bronze,190,1574.37,65.6,2021-12-02T00:00:00,2024-05-09,yes,true,,false,false,zh,JPY,,2021-12-02T00:00:00,2022-06-12T00:00:00,customers.json,2026-02-10T22:25:28.068809
CUS-00000675,Fatima,Smith,Fatima Smith,fatima.smith738@gmail.com,550.564.7201,MALE,25,2001-02-04,8514 River Dr,Tokyo,,100-0001,Japan,Gold,6,36269.62,740.2,06/06/2022,2027-11-22,false,true,true,false,false,,CAD,mobile_app,2022-06-06T00:00:00,2022-08-05T00:00:00,customers.json,2026-02-10T22:25:28.068809
CUS-00000676,Elizabeth,Dubois,Elizabeth Dubois,elizabeth.dubois885@gmail.com,3686561001,Male,79,1947-02-18,7076 Hill St,Toronto,ON,M5V 2H1,Canada,Platinum,102,46730.95,1198.23,2018-10-15,2020-10-04,false,false,false,true,false,ja,USD,referral,2018-10-15T00:00:00,2018-12-14T00:00:00,customers.json,2026-02-10T22:25:28.068809
CUS-00000677,Patricia,Mueller,Patricia Mueller,patricia.mueller656@mail.com,781.736.7344,FEMALE,84,1942-02-19,7411 Elm Rd,Amsterdam,,1012 AB,Netherlands,Bronze,200,43147.85,3081.99,2022-09-18T00:00:00,2026-06-20,0,false,,false,false,es,JPY,referral,2022-09-18T00:00:00,2024-01-02T00:00:00,customers.json,2026-02-10T22:25:28.068809
CUS-00000678,Thomas,Garcia,Thomas Garcia,thomas.garcia13@yahoo.com,9799214540,,20,2006-02-03,2991 Lake Blvd,Sydney,NSW,2000,Australia,bronze,79,16410.11,420.77,2019-09-13,2025-02-13,false,false,true,false,false,en,AUD,referral,2019-09-13T00:00:00,2020-08-21T00:00:00,customers.json,2026-02-10T22:25:28.068809
CUS-00000679,Wei,Garcia,Wei Garcia,wei.garcia677@yahoo.com,9441764953,,62,1964-02-14,1064 River St,Amsterdam,,1012 AB,Netherlands,Bronze,155,2455.54,50.11,06/04/2018,2021-08-13,1,true,false,true,true,ja,CAD,mobile_app,2018-04-06T00:00:00,2018-11-14T00:00:00,customers.json,2026-02-10T22:25:28.068809
CUS-00000680,Fatima,Patel,Fatima Patel,fatima.patel56@mail.com,UNLISTED,Male,78,1948-02-18,5609 River Dr,Tokyo,,100-0001,Japan,Bronze,40,7648.01,424.89,2019-01-29,2019-02-02,1,false,false,false,false,es,GBP,website,2019-01-29T00:00:00,2019-02-15T00:00:00,customers.json,2026-02-10T22:25:28.068809
CUS-00000681,Linda,Johnson,Linda Johnson,linda.johnson86@yahoo.com,902.417.5976,M,22,2004-02-04,6612 Park Ave,Los Angeles,CA,90001,USA,Gold,68,43199.06,1079.98,03/11/2024,2026-11-16,true,false,false,false,true,ja,GBP,partner,2024-11-03T00:00:00,2025-04-08T00:00:00,customers.json,2026-02-10T22:25:28.068809
CUS-00000682,Priya,Garcia,Priya Garcia,priya.garcia519@company.com,+1-470-303-5558,F,64,1962-02-14,2574 Park Blvd,Berlin,,10115,Germany,Platinum,93,5027.71,5027.71,1634680800,2022-05-18,false,false,true,true,false,fr,EUR,referral,2021-10-20T00:00:00,2022-01-04T00:00:00,customers.json,2026-02-10T22:25:28.068809
CUS-00000683,Yuki,Davis,Yuki Davis,yuki.davis286@yahoo.com,647.269.1106,male,84,1942-02-19,683 Forest Ln,New York,NY,10001,USA,Platinum,139,16318.51,1483.5,1519081200,2023-02-23,yes,true,false,false,false,zh,EUR,partner,2018-02-20T00:00:00,2018-05-27T00:00:00,customers.json,2026-02-10T22:25:28.068809
CUS-00000684,Priya,Mueller,Priya Mueller,priya.mueller785@gmail.com,7512363226,F,75,1951-02-17,4928 Oak Rd,Chicago,IL,60601,USA,Bronze,114,18695.12,603.07,04-10-2020,2021-05-20,yes,false,true,false,true,es,JPY,partner,2020-04-10T00:00:00,2021-02-04T00:00:00,customers.json,2026-02-10T22:25:28.068809
CUS-00000685,Sarah,Dubois,Sarah Dubois,sarah.dubois538@gmail.com,UNLISTED,M,54,1972-02-12,5369 Hill Ave,Amsterdam,,1012 AB,Netherlands,Gold,44,42259.64,4225.96,2022-05-18,2026-08-20,false,false,false,false,false,,EUR,partner,2022-05-18T00:00:00,2023-03-03T00:00:00,customers.json,2026-02-10T22:25:28.068809
CUS-00000686,Yuki,Kim,Yuki Kim,yuki.kim215@gmail.com,5481761605,FEMALE,57,1969-02-12,8305 River Ln,Toronto,ON,M5V 2H1,Canada,VIP,127,3576.63,510.95,2020-03-28,2024-05-02,false,false,,true,true,fr,JPY,partner,2020-03-28T00:00:00,2020-09-14T00:00:00,customers.json,2026-02-10T22:25:28.068809
CUS-00000687,Wei,Tanaka,Wei Tanaka,wei.tanaka324@yahoo.com,,F,40,1986-02-08,6558 Main Ave,Tokyo,,100-0001,Japan,vip,200,,,2018-05-08T00:00:00,2018-11-27,true,false,,false,false,,,referral,2018-05-08T00:00:00,2018-08-23T00:00:00,customers.json,2026-02-10T22:25:28.068809
CUS-00000688,Fatima,Dubois,Fatima Dubois,fatima.dubois799@yahoo.com,994.174.2243,male,66,1960-02-15,2894 Oak Dr,London,,SW1A 1AA,United Kingdom,GOLD,32,29584.08,821.78,2023-10-01,2025-08-05,false,false,false,false,true,ja,USD,,2023-10-01T00:00:00,2025-01-31T00:00:00,customers.json,2026-02-10T22:25:28.068809
CUS-00000689,Hans,Davis,Hans Davis,hans.davis126@gmail.com,7016402856,M,58,1968-02-13,397 Hill Ave,New York,NY,10001,USA,Silver,7,24721.8,1454.22,2021-06-17,2021-12-22,yes,false,true,false,true,de,USD,partner,2021-06-17T00:00:00,2022-09-14T00:00:00,customers.json,2026-02-10T22:25:28.068809
CUS-00000690,Christopher,Brown,Christopher Brown,christopher.brown589@gmail.com,UNLISTED,male,29,1997-02-05,81 Oak Rd,New York,NY,10001,USA,Silver,100,8872.52,221.81,2018-11-04T00:00:00,2021-12-24,false,true,false,true,false,de,EUR,social_media,2018-11-04T00:00:00,2019-01-23T00:00:00,customers.json,2026-02-10T22:25:28.068809
CUS-00000691,Mary,Martinez,Mary Martinez,mary.martinez50@outlook.com,6118274071,female,22,2004-02-04,1223 River St,Chicago,IL,60601,USA,bronze,53,42161.99,2810.8,26/08/2021,2022-04-27,true,false,false,true,true,,,partner,2021-08-26T00:00:00,2022-10-27T00:00:00,customers.json,2026-02-10T22:25:28.068809
CUS-00000692,Emma,Jones,Emma Jones,john.martinez482@outlook.com,(546) 680-7874,Male,20,2006-02-03,9055 Lake St,Tokyo,,100-0001,Japan,VIP,101,13933.62,1393.36,2020-07-11T00:00:00,2022-04-27,no,false,true,true,false,de,AUD,mobile_app,2020-07-11T00:00:00,2021-06-07T00:00:00,customers.json,2026-02-10T22:25:28.068809
CUS-00000693,Patricia,Rodriguez,Patricia Rodriguez,marie.smith354@gmail.com,UNLISTED,,62,1964-02-14,8972 Main Blvd,Chicago,IL,60601,USA,Bronze,191,45747.12,22873.56,1535493600,2018-09-02,false,false,false,true,false,fr,USD,,2018-08-29T00:00:00,2019-06-21T00:00:00,customers.json,2026-02-10T22:25:28.068809
CUS-00000694,Emma,Garcia,Emma Garcia,emma.garcia835@company.com,UNLISTED,male,-5,1998-09-13,9105 Forest St,Amsterdam,,1012 AB,Netherlands,Gold,8,43526.2,2901.75,2022-11-02T00:00:00,2025-08-20,0,true,false,false,false,,GBP,website,2022-11-02T00:00:00,2023-03-11T00:00:00,customers.json,2026-02-10T22:25:28.068809
CUS-00000695,Elizabeth,Jones,Elizabeth Jones,elizabeth.jones118@company.com,2502481302,Prefer not to say,50,1976-02-11,1522 Main Dr,Amsterdam,,1012 AB,Netherlands,Gold,7,21265.03,574.73,1638572400,2024-06-10,true,false,false,true,true,fr,CAD,social_media,2021-12-04T00:00:00,2022-11-09T00:00:00,customers.json,2026-02-10T22:25:28.068809
CUS-00000696,Elizabeth,Mueller,Elizabeth Mueller,elizabeth.mueller155@gmail.com,(213) 271-3841,Male,65,1961-02-14,1577 Hill Ave,Paris,,75001,France,Platinum,115,27322.18,683.05,2019-01-18,2024-03-28,0,false,,true,true,de,EUR,partner,2019-01-18T00:00:00,2019-05-02T00:00:00,customers.json,2026-02-10T22:25:28.068809
CUS-00000697,Michael,Anderson,Michael Anderson,michael.anderson634@company.com,644.211.3238,female,24,2002-02-04,950 Oak Ln,Tokyo,,100-0001,Japan,Platinum,79,18832.38,1177.02,1612998000,2023-04-05,true,false,false,true,true,ja,JPY,website,2021-02-11T00:00:00,2021-02-15T00:00:00,customers.json,2026-02-10T22:25:28.068809
CUS-00000698,Robert,Silva,Robert Silva,robert.silva644@outlook.com,,female,23,2003-02-04,3191 Main Blvd,Los Angeles,CA,90001,USA,Bronze,126,42726.66,2848.44,2024-01-08,2026-12-28,false,true,true,false,true,en,CAD,social_media,2024-01-08T00:00:00,2024-11-29T00:00:00,customers.json,2026-02-10T22:25:28.068809
CUS-00000699,Jessica,Mueller,Jessica Mueller,jessica.mueller607@company.com,2357166799,MALE,49,1977-02-10,7714 Park Dr,Paris,,75001,France,Gold,165,42490.62,2124.53,09/06/2021,2022-02-02,false,false,,false,false,de,JPY,partner,2021-06-09T00:00:00,2021-11-17T00:00:00,customers.json,2026-02-10T22:25:28.068809
CUS-00000700,Karen,Mueller,Karen Mueller,karen.mueller168@mail.com,,FEMALE,57,1969-02-12,6508 Park Ave,New York,NY,10001,USA,Platinum,148,40297.5,805.95,1630274400,2022-01-05,no,false,,true,false,en,GBP,,2021-08-30T00:00:00,2022-07-17T00:00:00,customers.json,2026-02-10T22:25:28.068809
CUS-00000701,John,O'Brien,John O'Brien,john.o'brien483@gmail.com,+1-638-867-4937,Female,36,1990-02-07,1781 Lake Blvd,Toronto,ON,M5V 2H1,Canada,Silver,98,42981.41,3907.4,2020-12-12,2023-05-26,no,true,false,false,false,,,mobile_app,2020-12-12T00:00:00,2021-12-22T00:00:00,customers.json,2026-02-10T22:25:28.068809
CUS-00000702,Barbara,Martinez,Barbara Martinez,barbara.martinez288@gmail.com,7464343885,male,42,1984-02-09,8963 River Blvd,Tokyo,,100-0001,Japan,PLATINUM,130,27294.6,568.64,2020-08-05,2022-02-05,yes,false,false,true,true,zh,,referral,2020-08-05T00:00:00,2021-11-07T00:00:00,customers.json,2026-02-10T22:25:28.068809
CUS-00000703,John,Silva,John Silva,john.silva39@mail.com,,Other,35,1991-02-07,3301 Main Rd,Sydney,NSW,2000,Australia,PLATINUM,87,28220.52,28220.52,10/06/2020,2021-07-04,true,true,false,true,true,de,GBP,social_media,2020-06-10T00:00:00,2021-01-07T00:00:00,customers.json,2026-02-10T22:25:28.068809
CUS-00000704,William,O'Brien,William O'Brien,william.o'brien743@yahoo.com,,FEMALE,29,1997-02-05,1040 Hill St,Los Angeles,CA,90001,USA,Gold,167,9310.89,581.93,30/01/2022,2022-04-09,1,true,,false,false,de,USD,mobile_app,2022-01-30T00:00:00,2022-10-18T00:00:00,customers.json,2026-02-10T22:25:28.068809
CUS-00000705,Jessica,Martinez,Jessica Martinez,jessica.martinez15@mail.com,+1-721-172-1062,Male,46,1980-02-10,9113 Elm Ave,Chicago,IL,60601,USA,VIP,115,31703.48,754.84,1702681200,2029-01-12,false,false,false,false,true,ja,GBP,mobile_app,2023-12-16T00:00:00,2025-02-11T00:00:00,customers.json,2026-02-10T22:25:28.068809
CUS-00000706,Carlos,Tanaka,Carlos Tanaka,carlos.tanaka529@mail.com,(723) 524-2624,,27,1999-02-05,15 Lake Rd,New York,NY,10001,USA,PLATINUM,113,28821.38,4117.34,12/05/2022,2022-11-01,true,true,false,true,false,ja,JPY,referral,2022-05-12T00:00:00,2023-01-24T00:00:00,customers.json,2026-02-10T22:25:28.068809
CUS-00000707,David,Kim,David Kim,david.kim220@yahoo.com,,male,70,1956-02-16,3594 Hill Blvd,Berlin,,10115,Germany,Silver,182,29127.37,1820.46,29/09/2018,2020-05-18,no,false,false,true,false,fr,EUR,referral,2018-09-29T00:00:00,2019-06-02T00:00:00,customers.json,2026-02-10T22:25:28.068809
CUS-00000708,Joseph,Dubois,Joseph Dubois,joseph.dubois911@company.com,897.923.9405,MALE,150,1876-03-06,8136 Main Ave,Paris,,75001,France,VIP,31,30992.44,999.76,1706310000,2024-10-20,true,false,,true,false,,USD,,2024-01-27T00:00:00,2024-01-28T00:00:00,customers.json,2026-02-10T22:25:28.068809
CUS-00000709,Linda,Mueller,Linda Mueller,,+1-720-939-1507,"",18,2008-02-03,8232 Park Dr,Toronto,ON,M5V 2H1,Canada,Gold,53,26224.26,596.01,2022-03-18,2026-11-02,false,true,,false,true,es,CAD,social_media,2022-03-18T00:00:00,2023-04-28T00:00:00,customers.json,2026-02-10T22:25:28.068809
CUS-00000710,Barbara,O'Brien,Barbara O'Brien,barbara.o'brien186@outlook.com,+1-659-473-6978,Other,54,1972-02-12,6632 Main St,Sydney,NSW,2000,Australia,Gold,192,16902.33,603.65,2018-01-14T00:00:00,2022-01-21,false,false,,true,false,es,USD,social_media,2018-01-14T00:00:00,2018-07-26T00:00:00,customers.json,2026-02-10T22:25:28.068809
CUS-00000711,Richard,Smith,Richard Smith,richard.smith301@yahoo.com,8345626376,,42,1984-02-09,8955 Elm Ln,Berlin,,10115,Germany,GOLD,80,27851.89,714.15,1642806000,2024-05-26,yes,false,false,true,true,ja,JPY,referral,2022-01-22T00:00:00,2022-10-13T00:00:00,customers.json,2026-02-10T22:25:28.068809
CUS-00000712,Sarah,Johnson,Sarah Johnson,SarahJohnson,,Female,55,1971-02-12,2676 Oak Ave,London,,SW1A 1AA,United Kingdom,vip,71,8277.55,179.95,01-18-2023,2024-03-19,0,false,,true,true,de,EUR,referral,2023-01-18T00:00:00,2023-08-11T00:00:00,customers.json,2026-02-10T22:25:28.068809
CUS-00000713,Richard,Patel,Richard Patel,richard.patel135@company.com,862.797.7066,"",43,1983-02-09,2173 Lake Dr,Los Angeles,CA,90001,USA,Platinum,99,19013.3,613.33,25/08/2020,2023-11-25,no,true,,false,false,fr,GBP,social_media,2020-08-25T00:00:00,2021-06-19T00:00:00,customers.json,2026-02-10T22:25:28.068809
CUS-00000714,Patricia,Jones,Patricia Jones,patricia.jones858@gmail.com,+1-751-821-5551,FEMALE,19,2007-02-03,8491 Hill Ave,London,,SW1A 1AA,United Kingdom,Platinum,145,26069.28,4344.88,05-11-2022,2025-08-17,false,true,false,true,false,ja,USD,,2022-05-11T00:00:00,2022-10-02T00:00:00,customers.json,2026-02-10T22:25:28.068809
CUS-00000715,Fatima,Martinez,Fatima Martinez,fatima.martinez478@outlook.com,,,18,2008-02-03,2759 Main Ave,Sydney,NSW,2000,Australia,Bronze,81,43610.59,1615.21,1612825200,2022-07-11,false,true,,false,false,de,JPY,website,2021-02-09T00:00:00,2022-05-11T00:00:00,customers.json,2026-02-10T22:25:28.068809
CUS-00000716,Marie,Dubois,Marie Dubois,marie.dubois31@outlook.com,(530) 503-8403,MALE,85,1941-02-19,3809 Park Dr,Los Angeles,CA,90001,USA,platinum,101,20192.6,1442.33,1684274400,2027-06-29,false,true,true,true,true,zh,,social_media,2023-05-17T00:00:00,2023-07-22T00:00:00,customers.json,2026-02-10T22:25:28.068809
CUS-00000717,Elizabeth,Anderson,Elizabeth Anderson,elizabeth.anderson432@mail.com,430.503.5865,,27,1999-02-05,4089 Lake Dr,Amsterdam,,1012 AB,Netherlands,Gold,42,23280.62,665.16,2021-10-10,2025-06-06,true,true,true,false,true,,JPY,referral,2021-10-10T00:00:00,2021-10-23T00:00:00,customers.json,2026-02-10T22:25:28.068809
CUS-00000718,Elizabeth,Wang,Elizabeth Wang,elizabeth.wang538@company.com,336.925.5922,"",40,1986-02-08,9350 Park Ave,Sydney,NSW,2000,Australia,VIP,58,7312.3,457.02,09-01-2021,2026-05-29,yes,false,true,true,true,ja,GBP,referral,2021-09-01T00:00:00,2022-10-13T00:00:00,customers.json,2026-02-10T22:25:28.068809
CUS-00000719,David,Mueller,David Mueller,david.mueller987@company.com,488.166.1227,"",64,1962-02-14,1042 Elm Ln,Los Angeles,CA,90001,USA,Silver,16,18461.66,1230.78,1687039200,2025-11-10,1,false,false,true,false,fr,GBP,,2023-06-18T00:00:00,2023-07-14T00:00:00,customers.json,2026-02-10T22:25:28.068809
CUS-00000720,John,Anderson,John Anderson,john.anderson633@mail.com,(541) 317-6564,Female,76,1950-02-17,4012 Lake St,Toronto,ON,M5V 2H1,Canada,Bronze,119,4278.65,97.24,09-28-2022,2025-07-31,false,false,true,false,true,zh,GBP,website,2022-09-28T00:00:00,2023-10-21T00:00:00,customers.json,2026-02-10T22:25:28.068809
CUS-00000721,Barbara,Chen,Barbara Chen,barbara.chen428@outlook.com,(311) 198-6714,M,52,1974-02-11,8963 Main Ln,Berlin,,10115,Germany,Bronze,83,13679.94,804.7,2020-09-03,2024-01-06,true,true,,true,true,ja,GBP,website,2020-09-03T00:00:00,2022-01-05T00:00:00,customers.json,2026-02-10T22:25:28.068809
CUS-00000722,Jessica,Patel,Jessica Patel,david.davis584@gmail.com,3908633606,FEMALE,82,1944-02-19,6087 Hill Rd,Chicago,IL,60601,USA,Gold,188,18416.15,635.04,1523570400,2020-06-04,false,true,,true,false,es,USD,website,2018-04-13T00:00:00,2019-02-03T00:00:00,customers.json,2026-02-10T22:25:28.068809
CUS-00000723,Yuki,Wang,Yuki Wang,yuki.wang995@gmail.com,,Prefer not to say,55,1971-02-12,291 Forest Rd,London,,SW1A 1AA,United Kingdom,Bronze,88,40690.48,1507.05,19/02/2018,2022-06-08,0,false,,false,true,es,EUR,social_media,2018-02-19T00:00:00,2018-04-10T00:00:00,customers.json,2026-02-10T22:25:28.068809
CUS-00000724,Sarah,Silva,Sarah Silva,sarah.silva366@company.com,4585091769,Male,42,1984-02-09,2442 Lake Ln,Paris,,75001,France,vip,66,19975.07,399.5,05-02-2020,2023-01-10,true,false,true,true,false,en,AUD,,2020-05-02T00:00:00,2021-03-17T00:00:00,customers.json,2026-02-10T22:25:28.068809
CUS-00000725,Marie,Smith,Marie Smith,marie.smith70@gmail.com,8538957427,"",71,1955-02-16,409 Park St,Tokyo,,100-0001,Japan,platinum,176,1508.08,30.78,29/01/2021,2022-02-07,true,true,true,false,true,zh,,partner,2021-01-29T00:00:00,2021-05-22T00:00:00,customers.json,2026-02-10T22:25:28.068809
CUS-00000726,Jennifer,Williams,Jennifer Williams,jennifer.williams163@outlook.com,(586) 828-5387,Male,53,1973-02-11,6239 Main Blvd,Toronto,ON,M5V 2H1,Canada,Bronze,16,6578.64,234.95,2020-08-21T00:00:00,2024-10-13,false,false,false,true,true,fr,USD,partner,2020-08-21T00:00:00,2020-10-20T00:00:00,customers.json,2026-02-10T22:25:28.068809
CUS-00000727,Mary,Johnson,Mary Johnson,mary.johnson165@company.com,9855005447,"",69,1957-02-15,5247 Lake Blvd,Tokyo,,100-0001,Japan,VIP,155,18264.78,3044.13,2021-09-17,2026-03-24,false,false,,false,false,fr,EUR,mobile_app,2021-09-17T00:00:00,2022-10-16T00:00:00,customers.json,2026-02-10T22:25:28.068809
CUS-00000728,Mary,Patel,Mary Patel,mary.patel296@gmail.com,233.102.1384,M,72,1954-02-16,5596 Oak St,Berlin,,10115,Germany,Platinum,121,38802.14,3880.21,08/12/2020,2024-12-03,true,true,false,true,true,de,,mobile_app,2020-12-08T00:00:00,2021-06-24T00:00:00,customers.json,2026-02-10T22:25:28.068809
CUS-00000729,Linda,Davis,Linda Davis,linda.davis558@gmail.com,,M,34,1992-02-07,7295 Oak Ln,New York,NY,10001,USA,Gold,104,19920.5,585.9,2021-05-24,2023-12-31,true,true,,false,false,de,EUR,referral,2021-05-24T00:00:00,2021-07-28T00:00:00,customers.json,2026-02-10T22:25:28.068809
CUS-00000730,John,Chen,John Chen,john.chen955@yahoo.com,+1-212-562-1107,female,41,1985-02-08,7527 Forest Blvd,Paris,,75001,France,Silver,138,15577.55,409.94,1682028000,2026-11-13,no,false,true,false,true,de,CAD,social_media,2023-04-21T00:00:00,2023-05-08T00:00:00,customers.json,2026-02-10T22:25:28.068809
CUS-00000731,Linda,Garcia,Linda Garcia,linda.garcia673@yahoo.com,,female,27,1999-02-05,9972 River Ln,Amsterdam,,1012 AB,Netherlands,SILVER,176,15382.49,375.18,06/04/2022,2026-04-14,false,false,true,false,true,,CAD,partner,2022-04-06T00:00:00,2023-03-21T00:00:00,customers.json,2026-02-10T22:25:28.068809
CUS-00000732,Emma,Smith,Emma Smith,emma.smith190@company.com,UNLISTED,Other,84,1942-02-19,4077 Lake Blvd,Toronto,ON,M5V 2H1,Canada,Gold,38,28392.95,1494.37,06-01-2020,2023-05-17,false,false,false,false,true,en,,partner,2020-06-01T00:00:00,2021-02-07T00:00:00,customers.json,2026-02-10T22:25:28.068809
CUS-00000733,Marie,Martinez,Marie Martinez,marie.martinez22@yahoo.com,,FEMALE,66,1960-02-15,3371 Park St,Berlin,,10115,Germany,Platinum,48,29482.15,1340.1,1551567600,2022-02-12,false,true,,false,false,de,EUR,referral,2019-03-03T00:00:00,2019-03-06T00:00:00,customers.json,2026-02-10T22:25:28.068809
CUS-00000734,William,Brown,William Brown,william.brown453@mail.com,+1-635-449-3983,Prefer not to say,56,1970-02-12,7443 Main Ln,Tokyo,,100-0001,Japan,silver,161,18566.8,884.13,2024-08-24,2028-07-02,true,false,false,false,false,zh,AUD,website,2024-08-24T00:00:00,2025-04-29T00:00:00,customers.json,2026-02-10T22:25:28.068809
CUS-00000735,Susan,Tanaka,Susan Tanaka,susan.tanaka548@outlook.com,,F,42,1984-02-09,5067 Oak Blvd,Chicago,IL,60601,USA,Gold,109,47675.97,1059.47,06-07-2019,2021-08-07,1,false,true,false,true,en,CAD,partner,2019-06-07T00:00:00,2020-05-07T00:00:00,customers.json,2026-02-10T22:25:28.068809
CUS-00000736,Patricia,Johnson,Patricia Johnson,patricia.johnson300@gmail.com,UNLISTED,F,82,1944-02-19,9857 Main Dr,Los Angeles,CA,90001,USA,Platinum,25,22149.97,503.41,2019-07-06T00:00:00,2021-04-24,1,false,false,false,true,ja,USD,,2019-07-06T00:00:00,2019-10-12T00:00:00,customers.json,2026-02-10T22:25:28.068809
CUS-00000737,James,Patel,James Patel,james.patel752@mail.com,233.258.5015,MALE,71,1955-02-16,717 Main Dr,Chicago,IL,60601,USA,Gold,3,26257.72,1094.07,1661896800,2027-08-04,true,true,,true,true,zh,EUR,website,2022-08-31T00:00:00,2022-08-31T00:00:00,customers.json,2026-02-10T22:25:28.068809
CUS-00000738,David,Miller,David Miller,david.miller551@company.com,+1-844-264-3532,female,64,1962-02-14,1111 Main Blvd,Tokyo,,100-0001,Japan,Silver,1,35394.82,707.9,28/05/2024,2026-08-07,no,true,,true,false,,,mobile_app,2024-05-28T00:00:00,2025-05-02T00:00:00,customers.json,2026-02-10T22:25:28.068809
CUS-00000739,Sarah,Tanaka,Sarah Tanaka,sarah.tanaka341@yahoo.com,,Prefer not to say,46,1980-02-10,3532 Oak Blvd,Chicago,IL,60601,USA,Silver,21,25232.4,586.8,1595973600,2025-07-30,true,false,false,false,false,es,USD,,2020-07-29T00:00:00,2021-06-19T00:00:00,customers.json,2026-02-10T22:25:28.068809
CUS-00000740,Robert,O'Brien,Robert O'Brien,robert.o'brien89@company.com,8671434065,M,33,1993-02-06,8411 Lake Rd,Amsterdam,,1012 AB,Netherlands,VIP,133,13778.18,688.91,1694469600,2024-02-24,no,false,,false,true,,USD,partner,2023-09-12T00:00:00,2024-11-29T00:00:00,customers.json,2026-02-10T22:25:28.068809
CUS-00000741,Jennifer,Tanaka,Jennifer Tanaka,jennifer.tanaka566@yahoo.com,+1-222-605-4037,"",34,1992-02-07,6122 Hill Dr,Amsterdam,,1012 AB,Netherlands,Gold,7,32896.92,731.04,1690840800,2027-06-05,1,false,,true,true,en,GBP,,2023-08-01T00:00:00,2024-06-30T00:00:00,customers.json,2026-02-10T22:25:28.068809
CUS-00000742,Sarah,Brown,Sarah Brown,sarah.brown800@yahoo.com,3186851651,,38,1988-02-08,7852 Forest Rd,Sydney,NSW,2000,Australia,Gold,118,2578.34,103.13,24/07/2019,2022-03-18,true,true,false,false,true,zh,AUD,partner,2019-07-24T00:00:00,2019-08-08T00:00:00,customers.json,2026-02-10T22:25:28.068809
CUS-00000743,Karen,Brown,Karen Brown,karen.brown38@gmail.com,(717) 114-5327,FEMALE,41,1985-02-08,6196 River Blvd,New York,NY,10001,USA,VIP,93,12497.16,265.9,07-18-2021,2024-08-28,0,true,false,false,false,de,AUD,referral,2021-07-18T00:00:00,2021-07-30T00:00:00,customers.json,2026-02-10T22:25:28.068809
CUS-00000744,Marie,Tanaka,Marie Tanaka,marie.tanaka274@company.com,246.152.1880,FEMALE,83,1943-02-19,100 Lake St,Tokyo,,100-0001,Japan,Gold,177,22263.95,494.75,12-21-2020,2022-06-17,0,true,false,false,true,,EUR,social_media,2020-12-21T00:00:00,2021-01-10T00:00:00,customers.json,2026-02-10T22:25:28.068809
CUS-00000745,Susan,Anderson,Susan Anderson,susan.anderson665@outlook.com,(860) 551-6963,FEMALE,76,1950-02-17,1428 Oak Dr,Chicago,IL,60601,USA,VIP,2,12345.24,1763.61,2024-06-12T00:00:00,2024-11-15,no,false,false,true,false,en,,referral,2024-06-12T00:00:00,2025-03-18T00:00:00,customers.json,2026-02-10T22:25:28.068809
CUS-00000746,Karen,Smith,Karen Smith,karen.smith533@mail.com,,"",67,1959-02-15,5184 Main Dr,Amsterdam,,1012 AB,Netherlands,VIP,75,36878.58,2836.81,2020-05-19,2023-01-28,yes,false,true,true,false,,AUD,,2020-05-19T00:00:00,2020-06-06T00:00:00,customers.json,2026-02-10T22:25:28.068809
CUS-00000747,Wei,Smith,Wei Smith,wei.smith199@outlook.com,,,47,1979-02-10,3962 Forest Ave,Berlin,,10115,Germany,Platinum,28,28285.7,831.93,12/01/2024,2026-05-12,0,false,true,true,true,,CAD,referral,2024-01-12T00:00:00,2024-06-27T00:00:00,customers.json,2026-02-10T22:25:28.068809
CUS-00000748,Christopher,Garcia,Christopher Garcia,christopher.garcia181@yahoo.com,(711) 179-2665,Male,77,1949-02-17,2126 Oak St,Berlin,,10115,Germany,Gold,98,20612.14,20612.14,2019-02-25T00:00:00,2020-01-06,yes,true,false,false,true,es,GBP,,2019-02-25T00:00:00,2019-09-25T00:00:00,customers.json,2026-02-10T22:25:28.068809
CUS-00000749,James,Garcia,James Garcia,james.garcia994@company.com,+1-927-513-3936,,43,1983-02-09,5995 Main Rd,Berlin,,10115,Germany,Gold,187,11426.77,238.06,12-28-2018,2021-08-26,0,true,false,true,true,,CAD,mobile_app,2018-12-28T00:00:00,2019-06-16T00:00:00,customers.json,2026-02-10T22:25:28.068809
CUS-00000750,Elizabeth,Dubois,Elizabeth Dubois,elizabeth.dubois899@yahoo.com,278.218.4697,Prefer not to say,65,1961-02-14,3695 Park Rd,Berlin,,10115,Germany,VIP,94,31746.23,1380.27,2023-12-15T00:00:00,2026-09-17,false,false,,true,true,ja,GBP,mobile_app,2023-12-15T00:00:00,2024-10-23T00:00:00,customers.json,2026-02-10T22:25:28.068809
CUS-00000751,Christopher,Mueller,Christopher Mueller,christopher.mueller543@outlook.com,8388523060,Prefer not to say,,,6418 River Rd,Tokyo,,100-0001,Japan,VIP,133,12630.84,323.87,1515020400,2018-08-02,true,false,false,false,false,,,,2018-01-04T00:00:00,2019-01-03T00:00:00,customers.json,2026-02-10T22:25:28.068809
CUS-00000752,Hans,Jones,Hans Jones,N/A,3038565034,M,24,2002-02-04,8972 Hill St,London,,SW1A 1AA,United Kingdom,vip,35,33599.19,3359.92,24/10/2021,2025-11-03,true,false,,true,false,en,CAD,mobile_app,2021-10-24T00:00:00,2022-09-14T00:00:00,customers.json,2026-02-10T22:25:28.068809
CUS-00000753,Elizabeth,Chen,Elizabeth Chen,elizabeth.chen140@outlook.com,,F,30,1996-02-06,5500 Park Ave,Amsterdam,,1012 AB,Netherlands,VIP,155,33131.53,1577.69,2019-12-03T00:00:00,2024-08-10,false,false,false,true,false,zh,CAD,partner,2019-12-03T00:00:00,2020-04-21T00:00:00,customers.json,2026-02-10T22:25:28.068809
CUS-00000754,Susan,Dubois,Susan Dubois,susan.dubois293@company.com,+1-810-989-8443,"",42,1984-02-09,5479 Hill Blvd,Sydney,NSW,2000,Australia,vip,186,12336.89,1121.54,2018-06-12T00:00:00,2019-03-02,false,false,,true,false,es,AUD,mobile_app,2018-06-12T00:00:00,2018-11-08T00:00:00,customers.json,2026-02-10T22:25:28.068809
CUS-00000755,David,Anderson,David Anderson,david.anderson586@mail.com,(398) 614-3559,Other,38,1988-02-08,458 Hill Ave,Chicago,IL,60601,USA,VIP,125,36049.99,819.32,2019-10-20,2025-01-01,1,true,,true,false,fr,USD,mobile_app,2019-10-20T00:00:00,2020-03-27T00:00:00,customers.json,2026-02-10T22:25:28.068809
CUS-00000756,David,Garcia,David Garcia,david.garcia605@yahoo.com,(789) 823-4714,,47,1979-02-10,7321 River Dr,Amsterdam,,1012 AB,Netherlands,Silver,21,5691.2,121.09,1581634800,2023-03-22,true,false,true,true,false,fr,AUD,social_media,2020-02-14T00:00:00,2020-08-17T00:00:00,customers.json,2026-02-10T22:25:28.068809
CUS-00000757,Christopher,Wang,Christopher Wang,christopher.wang521@gmail.com,,"",52,1974-02-11,6009 Hill Rd,Paris,,75001,France,Gold,11,23345.6,648.49,2023-08-23T00:00:00,2027-10-22,true,true,false,true,true,fr,,mobile_app,2023-08-23T00:00:00,2024-08-03T00:00:00,customers.json,2026-02-10T22:25:28.068809
CUS-00000758,Yuki,Wang,Yuki Wang,yuki.wang914@outlook.com,UNLISTED,male,58,1968-02-13,7928 Main Ave,Tokyo,,100-0001,Japan,Platinum,52,39308.29,1403.87,12-31-2022,2028-04-27,true,false,false,true,true,en,JPY,referral,2022-12-31T00:00:00,2023-05-18T00:00:00,customers.json,2026-02-10T22:25:28.068809
CUS-00000759,Priya,Davis,Priya Davis,priya.davis418@yahoo.com,+1-912-781-4403,Female,64,1962-02-14,3053 Elm Rd,Amsterdam,,1012 AB,Netherlands,Gold,42,26698.15,556.21,2018-09-24T00:00:00,2023-11-08,1,false,false,false,false,en,JPY,social_media,2018-09-24T00:00:00,2019-08-23T00:00:00,customers.json,2026-02-10T22:25:28.068809
CUS-00000760,Wei,Kim,Wei Kim,wei.kim289@outlook.com,(671) 636-2299,Other,79,1947-02-18,324 Main Rd,Paris,,75001,France,VIP,66,30319.76,797.89,2021-04-02,2021-11-18,true,true,false,true,true,zh,USD,,2021-04-02T00:00:00,2022-06-06T00:00:00,customers.json,2026-02-10T22:25:28.068809
CUS-00000761,Fatima,Martinez,Fatima Martinez,N/A,UNLISTED,MALE,58,1968-02-13,253 Hill Blvd,London,,SW1A 1AA,United Kingdom,Bronze,92,516.18,12.29,2018-11-04,2021-09-20,1,true,false,true,false,en,GBP,social_media,2018-11-04T00:00:00,2018-11-14T00:00:00,customers.json,2026-02-10T22:25:28.068809
CUS-00000762,Christopher,Wang,Christopher Wang,christopher.wang273@gmail.com,(752) 497-2881,"",150,1876-03-06,8175 Elm Rd,Sydney,NSW,2000,Australia,Gold,90,9680.76,691.48,2019-01-30,2022-09-16,true,false,true,false,true,es,EUR,website,2019-01-30T00:00:00,2019-09-11T00:00:00,customers.json,2026-02-10T22:25:28.068809
CUS-00000763,Robert,Chen,Robert Chen,robert.chen559@gmail.com,957.724.8020,Other,48,1978-02-10,1612 Lake St,London,,SW1A 1AA,United Kingdom,platinum,7,33624.04,862.15,1597788000,2024-04-21,false,true,,false,true,,AUD,mobile_app,2020-08-19T00:00:00,2021-07-23T00:00:00,customers.json,2026-02-10T22:25:28.068809
CUS-00000764,Hans,Garcia,Hans Garcia,hans.garcia534@mail.com,+1-805-984-5208,,73,1953-02-16,1025 Oak St,Chicago,IL,60601,USA,Platinum,86,12180.3,2436.06,18/07/2022,2025-11-18,true,false,true,false,true,en,CAD,social_media,2022-07-18T00:00:00,2023-03-27T00:00:00,customers.json,2026-02-10T22:25:28.068809
CUS-00000765,Jessica,Dubois,Jessica Dubois,jessica.dubois530@mail.com,UNLISTED,MALE,28,1998-02-05,2687 Main St,London,,SW1A 1AA,United Kingdom,Bronze,115,8961.82,896.18,1582326000,2024-07-30,0,true,,true,false,zh,,social_media,2020-02-22T00:00:00,2020-03-22T00:00:00,customers.json,2026-02-10T22:25:28.068809
CUS-00000766,Liam,Patel,Liam Patel,liam.patel974@company.com,8747708823,MALE,62,1964-02-14,6626 Forest Blvd,Sydney,NSW,2000,Australia,platinum,3,26455.16,575.11,06-05-2020,2021-08-26,0,true,,true,true,fr,,website,2020-06-05T00:00:00,2021-05-18T00:00:00,customers.json,2026-02-10T22:25:28.068809
CUS-00000767,Karen,Johnson,Karen Johnson,karen.johnson224@mail.com,+1-926-704-9274,Female,23,2003-02-04,9524 Oak Ln,Chicago,IL,60601,USA,Silver,130,18621.51,2327.69,12-06-2020,2025-02-22,false,false,false,false,true,es,EUR,website,2020-12-06T00:00:00,2021-07-24T00:00:00,customers.json,2026-02-10T22:25:28.068809
CUS-00000768,Joseph,Rodriguez,Joseph Rodriguez,joseph.rodriguez854@mail.com,UNLISTED,MALE,49,1977-02-10,587 Park Dr,Los Angeles,CA,90001,USA,Platinum,16,42990.73,3070.77,2021-09-23T00:00:00,2022-01-08,no,false,,false,false,,GBP,social_media,2021-09-23T00:00:00,2022-05-22T00:00:00,customers.json,2026-02-10T22:25:28.068809
CUS-00000769,Barbara,Miller,Barbara Miller,barbara.miller966@outlook.com,,F,18,2008-02-03,4213 Oak Blvd,New York,NY,10001,USA,SILVER,3,,,1523829600,2021-11-04,true,false,false,false,false,en,JPY,social_media,2018-04-16T00:00:00,2018-05-29T00:00:00,customers.json,2026-02-10T22:25:28.068809
CUS-00000770,Christopher,Smith,Christopher Smith,christopher.smith902@company.com,UNLISTED,,0,1998-09-13,4953 Hill Rd,Chicago,IL,60601,USA,Platinum,185,17056.84,775.31,1679698800,2028-07-14,true,true,,false,false,ja,AUD,social_media,2023-03-25T00:00:00,2024-06-29T00:00:00,customers.json,2026-02-10T22:25:28.068809
CUS-00000771,William,Anderson,William Anderson,william.anderson920@mail.com,+1-560-294-2038,Male,22,2004-02-04,8391 River Blvd,Paris,,75001,France,Gold,87,11268.46,751.23,2021-05-28T00:00:00,2022-09-14,1,false,false,true,true,ja,CAD,mobile_app,2021-05-28T00:00:00,2022-04-27T00:00:00,customers.json,2026-02-10T22:25:28.068809
CUS-00000772,William,Garcia,William Garcia,patricia.johnson407@gmail.com,360.967.4320,Male,70,1956-02-16,6195 Hill Rd,Los Angeles,CA,90001,USA,Bronze,130,,,1571176800,2022-09-21,no,true,,false,true,zh,GBP,social_media,2019-10-16T00:00:00,2020-04-17T00:00:00,customers.json,2026-02-10T22:25:28.068809
CUS-00000773,Sarah,Jones,Sarah Jones,sarah.jones224@mail.com,(939) 401-6517,Male,85,1941-02-19,2252 Hill Rd,Toronto,ON,M5V 2H1,Canada,Gold,58,19533.14,1627.76,1585004400,2021-09-02,false,true,false,true,true,de,USD,social_media,2020-03-24T00:00:00,2021-06-23T00:00:00,customers.json,2026-02-10T22:25:28.068809
CUS-00000774,Karen,Brown,Karen Brown,karen.brown44@mail.com,(263) 627-4701,"",80,1946-02-18,5040 Elm Rd,Amsterdam,,1012 AB,Netherlands,GOLD,7,10476.33,349.21,10-27-2020,2021-06-05,false,true,true,true,false,,CAD,website,2020-10-27T00:00:00,2021-09-24T00:00:00,customers.json,2026-02-10T22:25:28.068809
CUS-00000775,Hans,Johnson,Hans Johnson,N/A,9301614603,"",29,1997-02-05,3669 Elm Dr,Sydney,NSW,2000,Australia,SILVER,81,9079.14,324.25,2020-05-05T00:00:00,2022-05-04,false,false,,true,false,zh,EUR,social_media,2020-05-05T00:00:00,2020-10-06T00:00:00,customers.json,2026-02-10T22:25:28.068809
CUS-00000776,Sarah,Chen,Sarah Chen,sarah.chen455@gmail.com,UNLISTED,Prefer not to say,83,1943-02-19,5408 Hill Ave,Paris,,75001,France,VIP,115,36298.62,1067.61,19/12/2018,2019-11-01,no,false,false,false,false,fr,USD,mobile_app,2018-12-19T00:00:00,2019-04-12T00:00:00,customers.json,2026-02-10T22:25:28.068809
CUS-00000777,Elizabeth,Dubois,Elizabeth Dubois,elizabeth.dubois290@gmail.com,628.938.6833,Other,150,1876-03-06,8359 Park Dr,Chicago,IL,60601,USA,Silver,115,18129.15,755.38,1716501600,2025-10-21,0,false,true,false,false,zh,EUR,mobile_app,2024-05-24T00:00:00,2025-05-10T00:00:00,customers.json,2026-02-10T22:25:28.068809
CUS-00000778,Mary,O'Brien,Mary O'Brien,mary.o'brien449@outlook.com,5948913693,,63,1963-02-14,3824 Lake Ln,New York,NY,10001,USA,Silver,167,36148.58,722.97,01-21-2021,2021-05-29,false,true,true,false,true,ja,GBP,referral,2021-01-21T00:00:00,2021-06-08T00:00:00,customers.json,2026-02-10T22:25:28.068809
CUS-00000779,Priya,Garcia,Priya Garcia,priya.garcia63@outlook.com,,FEMALE,31,1995-02-06,9010 Forest Ave,Sydney,NSW,2000,Australia,Silver,123,46907.86,1340.22,2022-06-29,2024-12-14,0,false,true,false,true,en,CAD,social_media,2022-06-29T00:00:00,2022-10-15T00:00:00,customers.json,2026-02-10T22:25:28.068809
CUS-00000780,Richard,Dubois,Richard Dubois,richard.dubois241@gmail.com,9938352970,Female,40,1986-02-08,8229 Elm Ave,Chicago,IL,60601,USA,Platinum,80,36162.86,1205.43,1624658400,2026-06-02,true,true,false,false,false,zh,AUD,social_media,2021-06-26T00:00:00,2022-02-06T00:00:00,customers.json,2026-02-10T22:25:28.068809
CUS-00000781,Mary,Mueller,Mary Mueller,mary.mueller402@gmail.com,,FEMALE,34,1992-02-07,1571 Oak Rd,Toronto,ON,M5V 2H1,Canada,Bronze,81,37935.34,1115.75,14/08/2018,2020-01-10,true,true,,true,false,en,JPY,website,2018-08-14T00:00:00,2019-09-18T00:00:00,customers.json,2026-02-10T22:25:28.068809
CUS-00000782,Karen,Smith,Karen Smith,karen.smith843@company.com,7663014164,Female,40,1986-02-08,542 Oak Ave,Paris,,75001,France,GOLD,87,11184.04,559.2,2019-10-23T00:00:00,2024-12-15,no,false,,true,false,ja,AUD,,2019-10-23T00:00:00,2020-08-27T00:00:00,customers.json,2026-02-10T22:25:28.068809
CUS-00000783,Barbara,O'Brien,Barbara O'Brien,N/A,391.142.2097,MALE,47,1979-02-10,3855 Hill Ln,Paris,,75001,France,Platinum,77,39290.85,913.74,02-28-2022,2025-01-18,1,true,true,false,true,,EUR,social_media,2022-02-28T00:00:00,2023-05-14T00:00:00,customers.json,2026-02-10T22:25:28.068809
CUS-00000784,Joseph,Miller,Joseph Miller,joseph.miller143@mail.com,974.178.2467,"",25,2001-02-04,3393 Forest Ave,Sydney,NSW,2000,Australia,Silver,31,17092.85,2441.84,11/12/2020,2023-12-24,true,true,,true,true,ja,,partner,2020-12-11T00:00:00,2022-03-06T00:00:00,customers.json,2026-02-10T22:25:28.068809
CUS-00000785,Ahmed,Johnson,Ahmed Johnson,ahmed.johnson378@gmail.com,,Female,71,1955-02-16,3287 Oak Rd,New York,NY,10001,USA,Bronze,55,1588.65,99.29,2020-08-30T00:00:00,2024-07-27,true,false,false,false,true,es,USD,,2020-08-30T00:00:00,2021-11-24T00:00:00,customers.json,2026-02-10T22:25:28.068809
CUS-00000786,Patricia,Brown,Patricia Brown,patricia.brown273@outlook.com,,male,65,1961-02-14,8881 Park Blvd,Los Angeles,CA,90001,USA,Platinum,7,20844.05,563.35,2020-08-20,2020-09-26,false,false,,true,true,,USD,referral,2020-08-20T00:00:00,2021-11-20T00:00:00,customers.json,2026-02-10T22:25:28.068809
CUS-00000787,Ahmed,Miller,Ahmed Miller,ahmed.miller19@company.com,+1-400-770-5370,male,73,1953-02-16,9185 Main Rd,Berlin,,10115,Germany,Gold,153,48729.79,1522.81,2020-03-15,2024-08-27,1,false,false,false,false,fr,USD,,2020-03-15T00:00:00,2020-10-08T00:00:00,customers.json,2026-02-10T22:25:28.068809
CUS-00000788,Christopher,Miller,Christopher Miller,christopher.miller735@yahoo.com,,female,82,1944-02-19,8263 Hill Dr,Amsterdam,,1012 AB,Netherlands,Platinum,184,22058.39,7352.8,10-29-2018,2020-11-04,false,false,true,true,true,,AUD,,2018-10-29T00:00:00,2019-10-02T00:00:00,customers.json,2026-02-10T22:25:28.068809
CUS-00000789,Thomas,O'Brien,Thomas O'Brien,thomas.o'brien335@yahoo.com,2243198408,"",84,1942-02-19,1009 Forest Rd,London,,SW1A 1AA,United Kingdom,silver,134,48359.77,1611.99,1543964400,2022-07-12,false,true,false,true,false,zh,CAD,website,2018-12-05T00:00:00,2020-03-22T00:00:00,customers.json,2026-02-10T22:25:28.068809
CUS-00000790,William,Smith,William Smith,william.smith59@outlook.com,UNLISTED,MALE,49,1977-02-10,2394 River Rd,Chicago,IL,60601,USA,Gold,111,43740.6,7290.1,02-27-2020,2021-01-30,1,true,true,false,true,en,,website,2020-02-27T00:00:00,2021-01-05T00:00:00,customers.json,2026-02-10T22:25:28.068809
CUS-00000791,Michael,Jones,Michael Jones,michael.jones342@gmail.com,(727) 339-3581,M,-5,1998-09-13,3393 Park Ln,Tokyo,,100-0001,Japan,Silver,6,20675.89,2584.49,2018-11-09T00:00:00,2019-05-08,no,false,false,false,false,zh,JPY,mobile_app,2018-11-09T00:00:00,2019-02-12T00:00:00,customers.json,2026-02-10T22:25:28.068809
CUS-00000792,Linda,Patel,Linda Patel,linda.patel398@yahoo.com,UNLISTED,F,26,2000-02-05,6509 Elm Rd,Amsterdam,,1012 AB,Netherlands,Gold,115,30757.3,961.17,25/02/2018,2019-09-01,false,true,,false,true,de,GBP,website,2018-02-25T00:00:00,2019-06-28T00:00:00,customers.json,2026-02-10T22:25:28.068809
CUS-00000793,Mary,Wang,Mary Wang,mary.wang82@mail.com,(582) 447-6507,Prefer not to say,85,1941-02-19,2812 Main Ln,Amsterdam,,1012 AB,Netherlands,Gold,42,6929.51,3464.76,04/10/2022,2024-06-20,false,false,true,false,false,,USD,,2022-10-04T00:00:00,2023-08-31T00:00:00,customers.json,2026-02-10T22:25:28.068809
CUS-00000794,Linda,Rodriguez,Linda Rodriguez,linda.rodriguez34@yahoo.com,+1-450-209-5767,FEMALE,28,1998-02-05,7834 Main Rd,Chicago,IL,60601,USA,BRONZE,86,5700.41,132.57,1614034800,2025-10-25,true,true,false,false,true,zh,EUR,social_media,2021-02-23T00:00:00,2021-03-22T00:00:00,customers.json,2026-02-10T22:25:28.068809
CUS-00000795,Marie,Martinez,Marie Martinez,marie.martinez478@mail.com,863.898.6008,Male,70,1956-02-16,7257 Oak St,New York,NY,10001,USA,Platinum,158,19046.59,1002.45,2023-01-09T00:00:00,2025-04-13,0,true,,false,true,es,USD,website,2023-01-09T00:00:00,2023-02-11T00:00:00,customers.json,2026-02-10T22:25:28.068809
CUS-00000796,Robert,Dubois,Robert Dubois,robert.dubois750@gmail.com,+1-942-328-4857,Male,70,1956-02-16,7992 Oak St,Tokyo,,100-0001,Japan,Platinum,155,31091.66,914.46,1541026800,2020-07-22,0,true,true,true,false,de,AUD,social_media,2018-11-01T00:00:00,2019-01-05T00:00:00,customers.json,2026-02-10T22:25:28.068809
CUS-00000797,Linda,O'Brien,Linda O'Brien,linda.o'brien936@gmail.com,333.315.7606,Male,81,1945-02-18,8506 Main Rd,Toronto,ON,M5V 2H1,Canada,Gold,166,42541.26,945.36,2024-01-12T00:00:00,2026-08-14,false,true,false,false,false,fr,USD,website,2024-01-12T00:00:00,2024-03-31T00:00:00,customers.json,2026-02-10T22:25:28.068809
CUS-00000798,Marie,Dubois,Marie Dubois,marie.dubois793@outlook.com,UNLISTED,FEMALE,55,1971-02-12,4723 Hill Blvd,Sydney,NSW,2000,Australia,BRONZE,133,3439.15,71.65,04-24-2019,2021-10-12,0,true,false,true,true,zh,CAD,,2019-04-24T00:00:00,2019-06-15T00:00:00,customers.json,2026-02-10T22:25:28.068809
CUS-00000799,Wei,Silva,Wei Silva,wei.silva108@mail.com,UNLISTED,Female,21,2005-02-03,7946 Park St,Sydney,NSW,2000,Australia,Bronze,199,2810.73,165.34,2024-09-28,2026-08-19,true,false,true,false,true,en,CAD,mobile_app,2024-09-28T00:00:00,2025-07-19T00:00:00,customers.json,2026-02-10T22:25:28.068809
CUS-00000800,Wei,Patel,Wei Patel,wei.patel392@outlook.com,8496446819,Male,35,1991-02-07,3029 Elm St,Berlin,,10115,Germany,Platinum,71,43964.45,8792.89,2019-10-02,2020-08-13,yes,false,,false,true,de,EUR,social_media,2019-10-02T00:00:00,2020-03-24T00:00:00,customers.json,2026-02-10T22:25:28.068809
CUS-00000801,Jennifer,Johnson,Jennifer Johnson,jennifer.johnson742@gmail.com,3208526611,Female,67,1959-02-15,5502 Lake Rd,Amsterdam,,1012 AB,Netherlands,silver,172,36636.81,1592.9,10/03/2020,2022-05-31,false,false,false,false,true,en,CAD,website,2020-03-10T00:00:00,2021-04-23T00:00:00,customers.json,2026-02-10T22:25:28.068809
CUS-00000802,Mary,Garcia,Mary Garcia,mary.garcia551@gmail.com,5222277165,M,52,1974-02-11,538 Forest St,Amsterdam,,1012 AB,Netherlands,VIP,74,21548.95,1539.21,2020-01-03,2023-10-24,true,false,false,true,true,es,AUD,social_media,2020-01-03T00:00:00,2020-05-11T00:00:00,customers.json,2026-02-10T22:25:28.068809
CUS-00000803,Karen,Anderson,Karen Anderson,karen.anderson935@outlook.com,8839879680,,37,1989-02-07,3646 River Ave,London,,SW1A 1AA,United Kingdom,vip,38,5236.36,374.03,2023-08-21T00:00:00,2025-08-06,no,false,true,false,false,,AUD,website,2023-08-21T00:00:00,2024-03-11T00:00:00,customers.json,2026-02-10T22:25:28.068809
CUS-00000804,Wei,Davis,Wei Davis,wei.davis271@yahoo.com,(930) 273-7850,Other,27,1999-02-05,571 Lake Blvd,Sydney,NSW,2000,Australia,Silver,172,23467.99,938.72,2024-07-26,2026-03-27,true,true,,false,false,fr,GBP,website,2024-07-26T00:00:00,2025-05-22T00:00:00,customers.json,2026-02-10T22:25:28.068809
CUS-00000805,Marie,Johnson,Marie Johnson,marie.johnson204@outlook.com,529.523.3758,Male,28,1998-02-05,6629 River Blvd,Tokyo,,100-0001,Japan,Gold,188,529.99,33.12,04/01/2021,2023-01-05,true,false,false,true,true,en,,social_media,2021-01-04T00:00:00,2021-09-21T00:00:00,customers.json,2026-02-10T22:25:28.068809
CUS-00000806,David,Brown,David Brown,david.brown356@yahoo.com,(811) 398-3287,Prefer not to say,80,1946-02-18,4233 River Dr,Toronto,ON,M5V 2H1,Canada,Bronze,134,43060.49,2691.28,2020-11-19T00:00:00,2023-08-19,yes,true,false,true,true,zh,GBP,website,2020-11-19T00:00:00,2021-08-09T00:00:00,customers.json,2026-02-10T22:25:28.068809
CUS-00000807,Michael,Miller,Michael Miller,michael.miller524@company.com,2246551362,Male,70,1956-02-16,4603 Forest St,Amsterdam,,1012 AB,Netherlands,PLATINUM,159,2520.6,252.06,1645398000,2026-06-11,true,true,true,false,true,fr,EUR,,2022-02-21T00:00:00,2022-04-19T00:00:00,customers.json,2026-02-10T22:25:28.068809
CUS-00000808,Michael,Dubois,Michael Dubois,michael.dubois461@outlook.com,4662619171,,78,1948-02-18,1401 River Dr,Chicago,IL,60601,USA,Silver,129,43614.06,6230.58,2020-10-06T00:00:00,2022-07-01,false,true,,true,true,fr,USD,partner,2020-10-06T00:00:00,2021-01-20T00:00:00,customers.json,2026-02-10T22:25:28.068809
CUS-00000809,Linda,Kim,Linda Kim,linda.kim449@yahoo.com,(816) 365-3229,M,42,1984-02-09,9285 Forest Rd,Chicago,IL,60601,USA,Bronze,93,11943.73,1706.25,2019-08-28,2021-11-08,yes,false,,true,false,en,AUD,social_media,2019-08-28T00:00:00,2019-11-24T00:00:00,customers.json,2026-02-10T22:25:28.068809
CUS-00000810,Carlos,Martinez,Carlos Martinez,carlos.martinez803@mail.com,6048615994,Female,33,1993-02-06,8804 Lake Blvd,Los Angeles,CA,90001,USA,vip,85,-45632.72,,01-18-2019,2019-12-01,true,false,true,false,false,,USD,social_media,2019-01-18T00:00:00,2019-09-09T00:00:00,customers.json,2026-02-10T22:25:28.068809
CUS-00000811,Liam,Tanaka,Liam Tanaka,liam.tanaka364@outlook.com,262.858.4011,male,43,1983-02-09,2541 Lake Dr,Paris,,75001,France,VIP,27,5251.85,194.51,01/06/2024,2024-06-10,yes,true,true,false,false,de,,referral,2024-06-01T00:00:00,2025-05-29T00:00:00,customers.json,2026-02-10T22:25:28.068809
CUS-00000812,Liam,Rodriguez,Liam Rodriguez,liam.rodriguez186@yahoo.com,(396) 625-2517,F,82,1944-02-19,2758 Forest St,Los Angeles,CA,90001,USA,Gold,7,29566.52,1478.33,02-02-2023,2026-03-23,false,false,true,true,false,zh,JPY,,2023-02-02T00:00:00,2023-05-16T00:00:00,customers.json,2026-02-10T22:25:28.068809
CUS-00000813,Yuki,Martinez,Yuki Martinez,yuki.martinez68@yahoo.com,(400) 877-6705,,22,2004-02-04,2179 Lake Rd,London,,SW1A 1AA,United Kingdom,Silver,198,40050.57,1112.52,2023-09-04,2027-07-16,true,false,false,false,true,zh,AUD,social_media,2023-09-04T00:00:00,2024-06-23T00:00:00,customers.json,2026-02-10T22:25:28.068809
CUS-00000814,Yuki,Brown,Yuki Brown,yuki.brown680@mail.com,(309) 409-6279,F,19,2007-02-03,3712 Forest Ln,Toronto,ON,M5V 2H1,Canada,Bronze,6,34631.98,1117.16,12/11/2022,2023-06-05,yes,false,true,true,false,zh,GBP,social_media,2022-11-12T00:00:00,2022-11-14T00:00:00,customers.json,2026-02-10T22:25:28.068809
CUS-00000815,Susan,Anderson,Susan Anderson,susan.anderson987@outlook.com,3437087982,,66,1960-02-15,7410 River Ln,Chicago,IL,60601,USA,gold,177,21530.14,598.06,2018-08-04T00:00:00,2022-10-30,1,false,false,true,true,ja,,mobile_app,2018-08-04T00:00:00,2019-06-26T00:00:00,customers.json,2026-02-10T22:25:28.068809
CUS-00000816,Barbara,Wang,Barbara Wang,N/A,(644) 214-5832,M,55,1971-02-12,5830 Main Dr,Amsterdam,,1012 AB,Netherlands,Silver,91,14103.01,542.42,24/03/2023,2026-10-08,yes,true,true,false,false,es,AUD,partner,2023-03-24T00:00:00,2023-06-27T00:00:00,customers.json,2026-02-10T22:25:28.068809
CUS-00000817,Michael,Brown,Michael Brown,michael.brown153@yahoo.com,8215748637,"",52,1974-02-11,6669 Park Blvd,London,,SW1A 1AA,United Kingdom,Gold,104,40052.18,3337.68,1696024800,2027-09-28,no,true,true,false,true,,JPY,referral,2023-09-30T00:00:00,2024-12-13T00:00:00,customers.json,2026-02-10T22:25:28.068809
CUS-00000818,Michael,Chen,Michael Chen,michael.chen776@mail.com,8213699816,Other,44,1982-02-09,4903 Park St,London,,SW1A 1AA,United Kingdom,VIP,80,7565.93,204.48,2018-09-08,2020-03-27,1,true,true,false,false,fr,CAD,website,2018-09-08T00:00:00,2019-07-01T00:00:00,customers.json,2026-02-10T22:25:28.068809
CUS-00000819,Richard,Mueller,Richard Mueller,richard.mueller151@company.com,+1-467-133-6066,Other,74,1952-02-17,8004 River St,London,,SW1A 1AA,United Kingdom,Gold,171,46699.31,1111.89,2022-02-17,2027-07-16,true,false,,false,true,ja,,referral,2022-02-17T00:00:00,2022-02-28T00:00:00,customers.json,2026-02-10T22:25:28.068809
CUS-00000820,Jessica,Garcia,Jessica Garcia,jessica.garcia288@yahoo.com,356.677.3482,Prefer not to say,56,1970-02-12,7304 Elm Dr,Los Angeles,CA,90001,USA,vip,147,9007.86,2251.97,05-12-2020,2024-10-01,0,false,true,true,false,ja,EUR,,2020-05-12T00:00:00,2021-03-24T00:00:00,customers.json,2026-02-10T22:25:28.068809
CUS-00000821,James,Rodriguez,James Rodriguez,james.rodriguez984@mail.com,437.300.4452,Female,29,1997-02-05,6918 Main Blvd,Tokyo,,100-0001,Japan,BRONZE,170,35661.58,713.23,11-04-2021,2024-12-23,1,true,true,false,true,,GBP,website,2021-11-04T00:00:00,2023-03-13T00:00:00,customers.json,2026-02-10T22:25:28.068809
CUS-00000822,Jessica,Dubois,Jessica Dubois,jessica.dubois209@yahoo.com,UNLISTED,Prefer not to say,32,1994-02-06,447 Main Ave,New York,NY,10001,USA,Silver,61,3398.08,97.09,1668207600,2026-06-04,false,false,,false,true,,CAD,mobile_app,2022-11-12T00:00:00,2023-12-25T00:00:00,customers.json,2026-02-10T22:25:28.068809
CUS-00000823,Ahmed,Wang,Ahmed Wang,ahmed.wang623@company.com,9102899574,Female,36,1990-02-07,7781 River Dr,London,,SW1A 1AA,United Kingdom,VIP,20,40372.24,2374.84,08-21-2024,2028-07-29,true,true,,true,true,ja,CAD,referral,2024-08-21T00:00:00,2025-09-17T00:00:00,customers.json,2026-02-10T22:25:28.068809
CUS-00000824,Jessica,Jones,Jessica Jones,jessica.jones917@mail.com,7322888285,,39,1987-02-08,5935 River Ln,Berlin,,10115,Germany,GOLD,85,8941.35,186.28,05/06/2020,2023-05-08,true,true,true,true,false,zh,GBP,referral,2020-06-05T00:00:00,2021-07-06T00:00:00,customers.json,2026-02-10T22:25:28.068809
CUS-00000825,Elizabeth,Patel,Elizabeth Patel,ElizabethPatel,3742058406,F,21,2005-02-03,2883 Main Ln,Berlin,,10115,Germany,Silver,71,44849.41,6407.06,2018-08-12,2019-12-18,false,false,true,true,true,es,,partner,2018-08-12T00:00:00,2019-04-01T00:00:00,customers.json,2026-02-10T22:25:28.068809
CUS-00000826,Jennifer,Anderson,Jennifer Anderson,jennifer.anderson838@outlook.com,(674) 157-1913,MALE,39,1987-02-08,2628 Oak Ave,New York,NY,10001,USA,Silver,55,21499.37,1074.97,01-11-2020,2021-01-01,0,true,,false,false,fr,JPY,mobile_app,2020-01-11T00:00:00,2020-02-12T00:00:00,customers.json,2026-02-10T22:25:28.068809
CUS-00000827,Christopher,Garcia,Christopher Garcia,christopher.garcia958@mail.com,(276) 868-5891,Other,81,1945-02-18,5868 River Ln,Sydney,NSW,2000,Australia,Silver,128,14640.99,457.53,2024-03-25,2029-05-01,0,true,,false,false,,USD,social_media,2024-03-25T00:00:00,2024-11-17T00:00:00,customers.json,2026-02-10T22:25:28.068809
CUS-00000828,Karen,O'Brien,Karen O'Brien,karen.o'brien946@company.com,3695345298,Prefer not to say,18,2008-02-03,6386 Park Dr,Amsterdam,,1012 AB,Netherlands,VIP,181,27295.67,2274.64,1691532000,2025-10-30,0,true,,false,true,de,EUR,social_media,2023-08-09T00:00:00,2024-01-25T00:00:00,customers.json,2026-02-10T22:25:28.068809
CUS-00000829,James,Garcia,James Garcia,james.garcia655@gmail.com,(774) 112-3859,Female,29,1997-02-05,2156 River Rd,Sydney,NSW,2000,Australia,Silver,95,44348.77,905.08,1648504800,2025-07-19,false,false,true,true,false,ja,,,2022-03-29T00:00:00,2022-08-26T00:00:00,customers.json,2026-02-10T22:25:28.068809
CUS-00000830,Christopher,Anderson,Christopher Anderson,christopher.anderson699@mail.com,,Other,28,1998-02-05,6935 Park Ave,New York,NY,10001,USA,vip,109,33384.99,16692.49,1537999200,2023-01-13,false,true,false,true,false,zh,,referral,2018-09-27T00:00:00,2019-08-02T00:00:00,customers.json,2026-02-10T22:25:28.068809
CUS-00000831,Carlos,Kim,Carlos Kim,carlos.kim634@gmail.com,(575) 895-9516,Other,70,1956-02-16,591 Forest Dr,Los Angeles,CA,90001,USA,Gold,114,45246.84,3770.57,03-09-2018,2019-03-26,0,true,,false,false,en,GBP,website,2018-03-09T00:00:00,2019-01-13T00:00:00,customers.json,2026-02-10T22:25:28.068809
CUS-00000832,Mary,O'Brien,Mary O'Brien,N/A,(873) 130-7585,female,64,1962-02-14,8817 Elm Blvd,Berlin,,10115,Germany,Silver,119,43119.38,898.32,2019-02-16,2020-11-18,yes,true,true,false,true,,GBP,social_media,2019-02-16T00:00:00,2019-12-01T00:00:00,customers.json,2026-02-10T22:25:28.068809
CUS-00000833,Yuki,Rodriguez,Yuki Rodriguez,yuki.rodriguez30@mail.com,,,51,1975-02-11,5671 Hill Ave,Paris,,75001,France,VIP,53,5528.42,178.34,02-05-2022,2026-01-16,1,true,true,false,false,,USD,website,2022-02-05T00:00:00,2022-11-19T00:00:00,customers.json,2026-02-10T22:25:28.068809
CUS-00000834,Thomas,Williams,Thomas Williams,thomas.williams123@gmail.com,+1-884-263-4415,"",23,2003-02-04,1124 Park Ln,Sydney,NSW,2000,Australia,Silver,45,30104.55,2508.71,2019-02-07,2021-10-27,true,true,true,false,false,ja,GBP,,2019-02-07T00:00:00,2020-03-29T00:00:00,customers.json,2026-02-10T22:25:28.068809
CUS-00000835,Hans,Davis,Hans Davis,hans.davis115@outlook.com,+1-625-361-6787,Female,46,1980-02-10,3909 Forest Blvd,Chicago,IL,60601,USA,Gold,174,4919.99,273.33,25/09/2023,2028-03-21,1,true,true,true,false,zh,CAD,social_media,2023-09-25T00:00:00,2024-07-14T00:00:00,customers.json,2026-02-10T22:25:28.068809
CUS-00000836,Jennifer,Chen,Jennifer Chen,jennifer.chen510@gmail.com,,M,39,1987-02-08,1733 Elm Rd,Tokyo,,100-0001,Japan,Gold,3,4112.59,137.09,2024-03-15T00:00:00,2027-10-04,yes,false,,false,true,de,EUR,partner,2024-03-15T00:00:00,2024-05-19T00:00:00,customers.json,2026-02-10T22:25:28.068809
CUS-00000837,Patricia,Davis,Patricia Davis,patricia.davis45@outlook.com,227.704.3172,M,55,1971-02-12,903 Lake Blvd,Toronto,ON,M5V 2H1,Canada,VIP,65,45576.8,2278.84,26/07/2024,2027-01-11,false,false,false,false,true,ja,GBP,partner,2024-07-26T00:00:00,2024-07-26T00:00:00,customers.json,2026-02-10T22:25:28.068809
CUS-00000838,William,Kim,William Kim,william.kim104@outlook.com,,,28,1998-02-05,4813 Elm St,Toronto,ON,M5V 2H1,Canada,Gold,61,44244.71,1134.48,2022-06-02,2023-10-27,false,false,,false,false,fr,AUD,mobile_app,2022-06-02T00:00:00,2023-04-13T00:00:00,customers.json,2026-02-10T22:25:28.068809
CUS-00000839,Michael,Dubois,Michael Dubois,michael.dubois496@company.com,UNLISTED,male,36,1990-02-07,1128 Forest Rd,London,,SW1A 1AA,United Kingdom,SILVER,56,14434.2,465.62,2023-11-29,2028-10-04,true,false,true,true,true,ja,AUD,partner,2023-11-29T00:00:00,2024-11-02T00:00:00,customers.json,2026-02-10T22:25:28.068809
CUS-00000840,Wei,Patel,Wei Patel,wei.patel961@company.com,(742) 293-8537,"",82,1944-02-19,9477 Oak Dr,Los Angeles,CA,90001,USA,VIP,32,38305.37,5472.2,1701385200,2027-01-14,1,true,,true,false,,CAD,partner,2023-12-01T00:00:00,2024-03-30T00:00:00,customers.json,2026-02-10T22:25:28.068809
CUS-00000841,Elizabeth,Jones,Elizabeth Jones,elizabeth.jones422@gmail.com,(516) 300-4073,Other,22,2004-02-04,1328 Forest Ave,New York,NY,10001,USA,Bronze,29,33765.26,1350.61,12/01/2021,2022-08-02,false,true,false,true,true,zh,AUD,,2021-01-12T00:00:00,2022-02-23T00:00:00,customers.json,2026-02-10T22:25:28.068809
CUS-00000842,Yuki,Dubois,Yuki Dubois,yuki.dubois314@yahoo.com,+1-697-221-3217,Male,64,1962-02-14,7220 Hill Dr,Chicago,IL,60601,USA,Bronze,150,40774.16,994.49,2021-05-27,2022-12-23,0,true,,true,true,en,,partner,2021-05-27T00:00:00,2022-01-19T00:00:00,customers.json,2026-02-10T22:25:28.068809
CUS-00000843,Jessica,Silva,Jessica Silva,jessica.silva366@mail.com,+1-309-647-1791,MALE,20,2006-02-03,8806 River Blvd,Los Angeles,CA,90001,USA,silver,80,6923.91,432.74,1559426400,2019-07-22,no,true,,false,false,zh,,website,2019-06-02T00:00:00,2020-06-17T00:00:00,customers.json,2026-02-10T22:25:28.068809
CUS-00000844,Hans,Patel,Hans Patel,hans.patel822@outlook.com,(378) 706-2274,M,24,2002-02-04,3809 Forest St,Berlin,,10115,Germany,Bronze,93,46714.88,15571.63,2019-04-09T00:00:00,2023-07-02,no,false,,true,false,es,,mobile_app,2019-04-09T00:00:00,2020-01-28T00:00:00,customers.json,2026-02-10T22:25:28.068809
CUS-00000845,Jennifer,Chen,Jennifer Chen,jennifer.chen870@outlook.com,,male,74,1952-02-17,7160 Hill Blvd,New York,NY,10001,USA,Platinum,99,37406.3,779.3,25/04/2020,2024-12-26,true,false,,false,false,en,JPY,referral,2020-04-25T00:00:00,2021-03-20T00:00:00,customers.json,2026-02-10T22:25:28.068809
CUS-00000846,Joseph,O'Brien,Joseph O'Brien,joseph.o'brien285@gmail.com,811.900.7992,Prefer not to say,68,1958-02-15,3098 Lake Dr,Amsterdam,,1012 AB,Netherlands,vip,160,13627.11,425.85,17/01/2023,2028-04-30,false,true,false,true,true,fr,JPY,referral,2023-01-17T00:00:00,2023-05-17T00:00:00,customers.json,2026-02-10T22:25:28.068809
CUS-00000847,Liam,O'Brien,Liam O'Brien,liam.o'brien380@mail.com,(387) 361-1079,Prefer not to say,63,1963-02-14,3677 Hill Rd,Sydney,NSW,2000,Australia,VIP,83,26584.63,1563.8,1536271200,2022-09-17,no,false,,false,false,fr,EUR,referral,2018-09-07T00:00:00,2019-09-17T00:00:00,customers.json,2026-02-10T22:25:28.068809
CUS-00000848,Elizabeth,Garcia,Elizabeth Garcia,elizabeth.garcia664@mail.com,+1-742-271-8822,FEMALE,,,8560 Lake Rd,Sydney,NSW,2000,Australia,Platinum,28,9106.55,1300.94,1699657200,2026-09-23,false,true,false,false,false,en,CAD,,2023-11-11T00:00:00,2024-10-04T00:00:00,customers.json,2026-02-10T22:25:28.068809
CUS-00000849,Christopher,Anderson,Christopher Anderson,christopher.anderson159@mail.com,,Male,46,1980-02-10,1067 Lake Rd,Sydney,NSW,2000,Australia,platinum,105,10235.3,568.63,2021-12-08,2023-04-25,no,true,,false,true,zh,USD,mobile_app,2021-12-08T00:00:00,2022-07-14T00:00:00,customers.json,2026-02-10T22:25:28.068809
CUS-00000850,Jessica,Chen,Jessica Chen,jessica.brown926@outlook.com,+1-999-837-4639,FEMALE,25,2001-02-04,3836 Forest Ave,London,,SW1A 1AA,United Kingdom,Silver,164,30974.48,4424.93,2018-05-19T00:00:00,2023-01-20,true,false,false,true,false,fr,JPY,website,2018-05-19T00:00:00,2018-07-01T00:00:00,customers.json,2026-02-10T22:25:28.068809
CUS-00000851,Mary,Smith,Mary Smith,mary.smith653@company.com,8447917524,M,20,2006-02-03,2302 Elm Ln,Los Angeles,CA,90001,USA,BRONZE,30,45524.87,4138.62,2024-02-07T00:00:00,2026-03-31,false,true,false,true,true,en,,website,2024-02-07T00:00:00,2025-03-02T00:00:00,customers.json,2026-02-10T22:25:28.068809
CUS-00000852,Emma,Patel,Emma Patel,emma.patel752@gmail.com,688.963.2061,female,37,1989-02-07,1837 Hill Rd,Amsterdam,,1012 AB,Netherlands,bronze,198,40173.87,4463.76,1622584800,2026-02-08,0,false,true,false,false,es,USD,website,2021-06-02T00:00:00,2022-09-04T00:00:00,customers.json,2026-02-10T22:25:28.068809
CUS-00000853,Priya,Dubois,Priya Dubois,priya.dubois889@gmail.com,UNLISTED,male,39,1987-02-08,2267 Hill Ave,Chicago,IL,60601,USA,GOLD,63,34781.04,1449.21,26/08/2021,2027-02-04,false,true,,false,false,fr,AUD,social_media,2021-08-26T00:00:00,2022-05-07T00:00:00,customers.json,2026-02-10T22:25:28.068809
CUS-00000854,Patricia,Miller,Patricia Miller,patricia.miller3@yahoo.com,625.560.7968,F,56,1970-02-12,513 Hill Blvd,Paris,,75001,France,Silver,101,27754.24,957.04,2023-10-23T00:00:00,2024-02-26,true,false,true,true,false,zh,GBP,partner,2023-10-23T00:00:00,2024-08-24T00:00:00,customers.json,2026-02-10T22:25:28.068809
CUS-00000855,John,Johnson,John Johnson,john.johnson812@outlook.com,6164528664,FEMALE,84,1942-02-19,3523 Elm Ave,Los Angeles,CA,90001,USA,Platinum,120,8407.24,168.14,2020-10-01T00:00:00,2024-04-24,yes,false,false,false,true,de,,referral,2020-10-01T00:00:00,2021-10-29T00:00:00,customers.json,2026-02-10T22:25:28.068809
CUS-00000856,Karen,Martinez,Karen Martinez,karen.martinez706@company.com,507.339.7303,MALE,45,1981-02-09,8433 Elm Ave,London,,SW1A 1AA,United Kingdom,VIP,199,6865.69,140.12,1710802800,2026-01-29,yes,false,false,false,false,ja,CAD,mobile_app,2024-03-19T00:00:00,2025-02-22T00:00:00,customers.json,2026-02-10T22:25:28.068809
CUS-00000857,James,Davis,James Davis,william.silva576@outlook.com,+1-438-928-8646,Other,26,2000-02-05,4479 Elm Dr,Los Angeles,CA,90001,USA,BRONZE,19,37447.31,4680.91,06-26-2021,2026-03-07,no,false,false,true,true,de,EUR,partner,2021-06-26T00:00:00,2022-02-10T00:00:00,customers.json,2026-02-10T22:25:28.068809
CUS-00000858,Liam,Wang,Liam Wang,liam.wang378@gmail.com,+1-340-223-7072,,70,1956-02-16,140 Elm Blvd,Chicago,IL,60601,USA,Platinum,51,33882.88,3080.26,2023-02-25T00:00:00,2023-12-21,no,false,,true,true,en,GBP,mobile_app,2023-02-25T00:00:00,2023-04-06T00:00:00,customers.json,2026-02-10T22:25:28.068809
CUS-00000859,Marie,Johnson,Marie Johnson,marie.johnson348@company.com,+1-687-180-5527,male,26,2000-02-05,2202 River Rd,Tokyo,,100-0001,Japan,Platinum,14,9977.68,433.81,1605740400,2024-12-18,1,false,false,true,false,de,GBP,mobile_app,2020-11-19T00:00:00,2021-12-31T00:00:00,customers.json,2026-02-10T22:25:28.068809
CUS-00000860,Thomas,O'Brien,Thomas O'Brien,thomas.o'brien821@company.com,(382) 291-5714,male,85,1941-02-19,6091 Park Dr,Los Angeles,CA,90001,USA,Bronze,190,30573.81,727.95,2018-03-29,2022-12-06,0,false,,false,false,es,CAD,social_media,2018-03-29T00:00:00,2019-01-27T00:00:00,customers.json,2026-02-10T22:25:28.068809
CUS-00000861,Jennifer,Miller,Jennifer Miller,jennifer.miller581@yahoo.com,8742877049,Female,80,1946-02-18,3619 Oak Ln,London,,SW1A 1AA,United Kingdom,Platinum,30,8826.76,1765.35,2023-02-05T00:00:00,2026-01-27,0,true,false,true,true,fr,AUD,mobile_app,2023-02-05T00:00:00,2023-09-03T00:00:00,customers.json,2026-02-10T22:25:28.068809
CUS-00000862,Robert,Martinez,Robert Martinez,robert.martinez648@mail.com,668.170.4784,"",60,1966-02-13,7929 Park Dr,Toronto,ON,M5V 2H1,Canada,Bronze,109,39183.77,2176.88,22/07/2024,2028-11-27,false,true,false,true,true,en,CAD,partner,2024-07-22T00:00:00,2025-06-02T00:00:00,customers.json,2026-02-10T22:25:28.068809
CUS-00000863,Robert,Patel,Robert Patel,robert.patel677@company.com,+1-882-811-8735,"",58,1968-02-13,6485 River Dr,Amsterdam,,1012 AB,Netherlands,gold,71,19222.2,1011.69,2022-12-06,2028-02-29,yes,false,,true,true,en,,website,2022-12-06T00:00:00,2023-01-19T00:00:00,customers.json,2026-02-10T22:25:28.068809
CUS-00000864,David,Kim,David Kim,david.kim326@mail.com,UNLISTED,"",25,2001-02-04,3940 Forest St,Berlin,,10115,Germany,VIP,166,29754.98,691.98,05-17-2019,2021-08-11,1,false,false,false,true,en,USD,social_media,2019-05-17T00:00:00,2020-04-11T00:00:00,customers.json,2026-02-10T22:25:28.068809
CUS-00000865,Elizabeth,Chen,Elizabeth Chen,elizabeth.chen756@company.com,299.511.5005,Male,25,2001-02-04,3062 River St,London,,SW1A 1AA,United Kingdom,Platinum,117,36743.1,781.77,2020-09-19T00:00:00,2022-11-05,yes,false,true,false,false,en,AUD,referral,2020-09-19T00:00:00,2021-09-18T00:00:00,customers.json,2026-02-10T22:25:28.068809
CUS-00000866,Robert,Tanaka,Robert Tanaka,robert.tanaka972@gmail.com,+1-952-314-3227,Male,67,1959-02-15,1102 Elm St,Chicago,IL,60601,USA,Bronze,132,9814.94,306.72,2021-01-19,2025-10-13,yes,true,,true,true,zh,CAD,partner,2021-01-19T00:00:00,2021-12-08T00:00:00,customers.json,2026-02-10T22:25:28.068809
CUS-00000867,Wei,Jones,Wei Jones,wei.jones84@company.com,+1-308-725-9753,M,58,1968-02-13,6742 Elm Rd,Sydney,NSW,2000,Australia,PLATINUM,153,25595.25,4265.88,01-22-2022,2024-07-10,true,true,true,true,false,,JPY,referral,2022-01-22T00:00:00,2023-03-04T00:00:00,customers.json,2026-02-10T22:25:28.068809
CUS-00000868,Marie,Williams,Marie Williams,marie.williams971@company.com,340.830.9010,female,72,1954-02-16,1807 Hill Ave,Berlin,,10115,Germany,Platinum,153,4686.75,585.84,2020-10-08T00:00:00,2023-03-22,true,false,true,false,false,ja,CAD,mobile_app,2020-10-08T00:00:00,2021-05-07T00:00:00,customers.json,2026-02-10T22:25:28.068809
CUS-00000869,Jennifer,Patel,Jennifer Patel,jennifer.patel890@gmail.com,UNLISTED,FEMALE,32,1994-02-06,3567 Elm St,Toronto,ON,M5V 2H1,Canada,Gold,195,14823.88,1647.1,12-12-2022,2024-05-13,0,false,false,false,true,,GBP,website,2022-12-12T00:00:00,2023-04-02T00:00:00,customers.json,2026-02-10T22:25:28.068809
CUS-00000870,Carlos,Williams,Carlos Williams,carlos.williams68@outlook.com,,Prefer not to say,84,1942-02-19,4079 Lake St,Sydney,NSW,2000,Australia,Gold,7,11462.2,409.36,12-27-2020,2022-04-29,no,true,,false,false,,JPY,referral,2020-12-27T00:00:00,2021-07-30T00:00:00,customers.json,2026-02-10T22:25:28.068809
CUS-00000871,Carlos,Garcia,Carlos Garcia,carlos.garcia898@gmail.com,(584) 551-8978,"",53,1973-02-11,4023 River Ln,Amsterdam,,1012 AB,Netherlands,Bronze,194,26012.61,788.26,06/04/2023,2023-05-01,no,true,false,true,true,,USD,mobile_app,2023-04-06T00:00:00,2023-05-16T00:00:00,customers.json,2026-02-10T22:25:28.068809
CUS-00000872,Yuki,Smith,Yuki Smith,yuki.smith407@company.com,710.833.8651,Other,29,1997-02-05,4813 Hill St,Berlin,,10115,Germany,Platinum,166,23288.88,582.22,2023-08-13,2025-04-02,yes,true,true,false,true,en,AUD,,2023-08-13T00:00:00,2024-12-17T00:00:00,customers.json,2026-02-10T22:25:28.068809
CUS-00000873,Priya,Miller,Priya Miller,priya.miller781@yahoo.com,+1-635-655-9604,F,65,1961-02-14,3539 River Ave,London,,SW1A 1AA,United Kingdom,Gold,145,4877.18,256.69,1532296800,2021-01-15,0,false,false,true,true,zh,CAD,partner,2018-07-23T00:00:00,2019-02-21T00:00:00,customers.json,2026-02-10T22:25:28.068809
CUS-00000874,Priya,Williams,Priya Williams,priya.williams553@gmail.com,+1-973-835-8829,Female,59,1967-02-13,4600 Park St,Chicago,IL,60601,USA,Platinum,89,5721.04,119.19,14/05/2024,2026-03-31,false,false,,false,true,en,EUR,website,2024-05-14T00:00:00,2024-05-30T00:00:00,customers.json,2026-02-10T22:25:28.068809
CUS-00000875,Thomas,Chen,Thomas Chen,thomas.chen945@mail.com,UNLISTED,FEMALE,83,1943-02-19,6448 Elm St,London,,SW1A 1AA,United Kingdom,Bronze,195,7497.72,241.86,2020-06-10T00:00:00,2022-11-27,1,true,,true,true,en,,website,2020-06-10T00:00:00,2021-02-18T00:00:00,customers.json,2026-02-10T22:25:28.068809
CUS-00000876,Robert,Dubois,Robert Dubois,robert.dubois555@outlook.com,(220) 849-9033,FEMALE,68,1958-02-15,1506 Lake Rd,Paris,,75001,France,Gold,124,31134.74,7783.69,2018-09-05T00:00:00,2022-03-24,0,false,,false,true,,,mobile_app,2018-09-05T00:00:00,2019-04-19T00:00:00,customers.json,2026-02-10T22:25:28.068809
CUS-00000877,Thomas,Wang,Thomas Wang,thomas.wang474@company.com,UNLISTED,male,74,1952-02-17,3211 Main Ln,New York,NY,10001,USA,Silver,3,43097.32,2873.15,1515193200,2019-09-24,no,true,false,false,false,fr,,partner,2018-01-06T00:00:00,2018-06-12T00:00:00,customers.json,2026-02-10T22:25:28.068809
CUS-00000878,Marie,Anderson,Marie Anderson,marie.anderson675@gmail.com,(698) 813-5452,"",65,1961-02-14,8047 River Rd,Amsterdam,,1012 AB,Netherlands,Silver,84,20162.85,650.41,2019-08-02T00:00:00,2020-09-28,0,true,true,true,false,zh,JPY,referral,2019-08-02T00:00:00,2019-11-15T00:00:00,customers.json,2026-02-10T22:25:28.068809
CUS-00000879,James,Silva,James Silva,james.silva228@gmail.com,UNLISTED,MALE,37,1989-02-07,6913 Elm Ave,New York,NY,10001,USA,Gold,169,48386.6,2846.27,2024-05-31T00:00:00,2024-12-17,no,false,true,true,true,,CAD,partner,2024-05-31T00:00:00,2024-06-30T00:00:00,customers.json,2026-02-10T22:25:28.068809
CUS-00000880,Jessica,Williams,Jessica Williams,jessica.williams51@gmail.com,,F,82,1944-02-19,8635 Forest Blvd,Sydney,NSW,2000,Australia,Silver,142,39456.46,1195.65,06/10/2024,2029-01-21,yes,true,false,true,false,es,AUD,,2024-10-06T00:00:00,2025-05-16T00:00:00,customers.json,2026-02-10T22:25:28.068809
CUS-00000881,Sarah,Brown,Sarah Brown,sarah.brown357@company.com,+1-850-717-4860,MALE,62,1964-02-14,7598 Elm Ln,Tokyo,,100-0001,Japan,Gold,40,1572.51,58.24,2023-10-17T00:00:00,2025-05-31,true,true,true,false,false,de,JPY,,2023-10-17T00:00:00,2024-05-31T00:00:00,customers.json,2026-02-10T22:25:28.068809
CUS-00000882,Fatima,Patel,Fatima Patel,fatima.patel985@company.com,(567) 767-8173,male,48,1978-02-10,9112 Forest Blvd,New York,NY,10001,USA,Silver,49,33448.23,1337.93,01-20-2022,2024-03-24,false,false,,true,false,,JPY,website,2022-01-20T00:00:00,2022-05-08T00:00:00,customers.json,2026-02-10T22:25:28.068809
CUS-00000883,Robert,O'Brien,Robert O'Brien,robert.o'brien22@outlook.com,687.883.3415,Male,85,1941-02-19,443 Hill Blvd,New York,NY,10001,USA,Platinum,176,35360.3,785.78,1518735600,2022-02-13,true,false,,false,true,fr,USD,referral,2018-02-16T00:00:00,2018-12-28T00:00:00,customers.json,2026-02-10T22:25:28.068809
CUS-00000884,James,Martinez,James Martinez,james.martinez774@mail.com,3028322007,female,28,1998-02-05,3965 Park St,Sydney,NSW,2000,Australia,VIP,3,7517.47,751.75,2024-06-08T00:00:00,2029-04-25,true,true,false,false,true,,,social_media,2024-06-08T00:00:00,2025-08-13T00:00:00,customers.json,2026-02-10T22:25:28.068809
CUS-00000885,Susan,Anderson,Susan Anderson,susan.anderson783@company.com,+1-908-139-6229,female,28,1998-02-05,8680 River Dr,Tokyo,,100-0001,Japan,Bronze,57,-1922.19,,1697234400,2023-12-04,true,true,false,false,false,fr,JPY,referral,2023-10-14T00:00:00,2024-01-15T00:00:00,customers.json,2026-02-10T22:25:28.068809
CUS-00000886,Michael,Garcia,Michael Garcia,michael.garcia99@yahoo.com,(836) 920-7121,Male,65,1961-02-14,7068 Park Blvd,New York,NY,10001,USA,vip,29,21725.89,517.28,2020-09-03,2026-10-08,true,false,false,true,true,en,JPY,mobile_app,2020-09-03T00:00:00,2020-09-15T00:00:00,customers.json,2026-02-10T22:25:28.068809
CUS-00000887,Yuki,Kim,Yuki Kim,yuki.kim814@mail.com,,M,31,1995-02-06,6692 Main Rd,Paris,,75001,France,Gold,180,2414.37,51.37,1534716000,2023-11-18,0,false,false,false,true,ja,GBP,referral,2018-08-20T00:00:00,2019-12-25T00:00:00,customers.json,2026-02-10T22:25:28.068809
CUS-00000888,James,Anderson,James Anderson,james.anderson557@yahoo.com,,male,18,2008-02-03,4460 Hill St,Sydney,NSW,2000,Australia,Gold,93,1421.07,1421.07,2018-06-01,2023-02-02,true,true,false,true,false,de,CAD,referral,2018-06-01T00:00:00,2019-08-15T00:00:00,customers.json,2026-02-10T22:25:28.068809
CUS-00000889,Richard,Tanaka,Richard Tanaka,richard.tanaka867@gmail.com,7506884485,female,23,2003-02-04,2498 Oak Ln,Amsterdam,,1012 AB,Netherlands,vip,197,30111.94,602.24,1602712800,2021-08-22,yes,true,,true,true,es,JPY,social_media,2020-10-15T00:00:00,2022-01-22T00:00:00,customers.json,2026-02-10T22:25:28.068809
CUS-00000890,Fatima,Rodriguez,Fatima Rodriguez,fatima.rodriguez73@company.com,UNLISTED,,18,2008-02-03,3988 Oak Rd,Chicago,IL,60601,USA,Platinum,95,46593.65,4235.79,18/08/2020,2025-06-06,no,true,true,false,false,es,,mobile_app,2020-08-18T00:00:00,2021-08-30T00:00:00,customers.json,2026-02-10T22:25:28.068809
CUS-00000891,Liam,Garcia,Liam Garcia,liam.garcia454@mail.com,+1-765-502-7781,female,24,2002-02-04,4417 Park Ln,Berlin,,10115,Germany,VIP,140,34992.61,777.61,03-28-2024,2026-11-13,no,true,,true,false,de,AUD,,2024-03-28T00:00:00,2025-05-11T00:00:00,customers.json,2026-02-10T22:25:28.068809
CUS-00000892,William,Anderson,William Anderson,william.anderson819@gmail.com,+1-555-785-2870,F,58,1968-02-13,6538 Park Blvd,New York,NY,10001,USA,Platinum,128,7118.03,254.22,2018-01-16T00:00:00,2021-02-22,0,false,,true,true,zh,EUR,referral,2018-01-16T00:00:00,2018-06-09T00:00:00,customers.json,2026-02-10T22:25:28.068809
CUS-00000893,Emma,Jones,Emma Jones,emma.jones916@yahoo.com,(517) 728-2764,F,64,1962-02-14,1266 Park Rd,Toronto,ON,M5V 2H1,Canada,Silver,111,26897.95,3362.24,2023-10-18,2024-12-14,no,true,true,false,false,de,EUR,referral,2023-10-18T00:00:00,2024-03-23T00:00:00,customers.json,2026-02-10T22:25:28.068809
CUS-00000894,Joseph,O'Brien,Joseph O'Brien,joseph.o'brien457@yahoo.com,824.815.7673,Prefer not to say,58,1968-02-13,8120 Lake St,Toronto,ON,M5V 2H1,Canada,Gold,136,47387.76,1634.06,02-16-2024,2024-10-19,no,false,true,false,true,ja,JPY,mobile_app,2024-02-16T00:00:00,2024-12-06T00:00:00,customers.json,2026-02-10T22:25:28.068809
CUS-00000895,Wei,Tanaka,Wei Tanaka,wei.tanaka764@gmail.com,+1-256-494-3043,F,83,1943-02-19,5100 Lake St,Amsterdam,,1012 AB,Netherlands,GOLD,18,44900.18,1603.58,2021-07-19,2023-08-13,no,true,,false,false,ja,USD,referral,2021-07-19T00:00:00,2021-12-22T00:00:00,customers.json,2026-02-10T22:25:28.068809
CUS-00000896,David,Miller,David Miller,david.miller505@yahoo.com,(482) 545-2788,Other,82,1944-02-19,95 Forest St,London,,SW1A 1AA,United Kingdom,Platinum,147,409.92,17.08,2023-05-01T00:00:00,2023-09-24,false,false,false,true,false,ja,GBP,website,2023-05-01T00:00:00,2023-09-21T00:00:00,customers.json,2026-02-10T22:25:28.068809
CUS-00000897,Christopher,Wang,Christopher Wang,christopher.wang545@outlook.com,636.843.2276,Male,43,1983-02-09,9741 Main Blvd,London,,SW1A 1AA,United Kingdom,VIP,5,27066.91,1353.35,2023-11-02T00:00:00,2027-11-02,1,false,false,true,true,en,CAD,website,2023-11-02T00:00:00,2024-05-13T00:00:00,customers.json,2026-02-10T22:25:28.068809
CUS-00000898,Yuki,Smith,Yuki Smith,yuki.smith367@outlook.com,(690) 336-4457,Prefer not to say,44,1982-02-09,6322 Main Rd,Chicago,IL,60601,USA,Silver,150,11138.04,2784.51,02-15-2023,2023-06-16,no,true,false,true,false,,EUR,mobile_app,2023-02-15T00:00:00,2023-09-17T00:00:00,customers.json,2026-02-10T22:25:28.068809
CUS-00000899,Carlos,Wang,Carlos Wang,carlos.wang604@outlook.com,,male,76,1950-02-17,182 River St,Amsterdam,,1012 AB,Netherlands,GOLD,67,19023.24,452.93,15/11/2022,2026-01-08,false,false,false,true,true,ja,AUD,website,2022-11-15T00:00:00,2023-11-09T00:00:00,customers.json,2026-02-10T22:25:28.068809
CUS-00000900,Michael,Tanaka,Michael Tanaka,michael.tanaka430@outlook.com,(377) 538-1667,,56,1970-02-12,9261 Elm Ave,London,,SW1A 1AA,United Kingdom,Gold,84,30480.37,6096.07,2023-11-03T00:00:00,2027-03-09,1,false,false,true,false,ja,JPY,social_media,2023-11-03T00:00:00,2024-05-02T00:00:00,customers.json,2026-02-10T22:25:28.068809
CUS-00000901,Richard,Wang,Richard Wang,richard.wang105@outlook.com,6175336686,F,84,1942-02-19,4289 Elm St,New York,NY,10001,USA,BRONZE,78,6424.63,338.14,1589061600,2024-08-13,false,false,false,false,false,fr,AUD,partner,2020-05-10T00:00:00,2021-02-03T00:00:00,customers.json,2026-02-10T22:25:28.068809
CUS-00000902,Hans,Davis,Hans Davis,hans.davis436@mail.com,+1-354-480-5691,male,37,1989-02-07,7705 Oak Rd,Berlin,,10115,Germany,Platinum,122,39498.19,789.96,09-16-2018,2023-12-24,yes,true,true,true,true,en,,mobile_app,2018-09-16T00:00:00,2019-11-09T00:00:00,customers.json,2026-02-10T22:25:28.068809
CUS-00000903,James,Garcia,James Garcia,james.garcia912@yahoo.com,429.239.4129,F,55,1971-02-12,7780 Oak Rd,Los Angeles,CA,90001,USA,Silver,166,11572.36,3857.45,12-08-2020,2025-02-13,0,true,,false,false,ja,,social_media,2020-12-08T00:00:00,2021-08-17T00:00:00,customers.json,2026-02-10T22:25:28.068809
CUS-00000904,Sarah,Silva,Sarah Silva,sarah.silva785@gmail.com,(382) 532-9793,female,29,1997-02-05,7282 Oak Dr,Berlin,,10115,Germany,Gold,117,10420.78,651.3,26/12/2021,2025-02-20,false,true,false,false,false,fr,EUR,social_media,2021-12-26T00:00:00,2023-05-05T00:00:00,customers.json,2026-02-10T22:25:28.068809
CUS-00000905,Sarah,Dubois,Sarah Dubois,,2147379750,Female,45,1981-02-09,9331 Oak Ln,Toronto,ON,M5V 2H1,Canada,Bronze,146,24111.06,1269.0,1729548000,2027-12-31,no,false,false,true,true,es,CAD,website,2024-10-22T00:00:00,2025-08-24T00:00:00,customers.json,2026-02-10T22:25:28.068809
CUS-00000906,Hans,Smith,Hans Smith,hans.smith146@gmail.com,(422) 563-4452,Female,52,1974-02-11,6312 Elm St,Toronto,ON,M5V 2H1,Canada,VIP,16,25106.05,545.78,2024-08-26T00:00:00,2026-09-20,0,true,false,false,false,es,,partner,2024-08-26T00:00:00,2025-12-17T00:00:00,customers.json,2026-02-10T22:25:28.068809
CUS-00000907,Richard,Wang,Richard Wang,RichardWang,8778913357,female,75,1951-02-17,8543 Lake Ave,Berlin,,10115,Germany,platinum,66,46037.37,4185.22,06/06/2024,2026-04-14,false,false,,false,false,es,CAD,website,2024-06-06T00:00:00,2024-08-31T00:00:00,customers.json,2026-02-10T22:25:28.068809
CUS-00000908,Barbara,Patel,Barbara Patel,barbara.patel47@company.com,UNLISTED,Other,52,1974-02-11,6579 Park Blvd,Los Angeles,CA,90001,USA,BRONZE,66,17465.45,3493.09,10/04/2021,2025-01-20,true,false,false,false,true,fr,CAD,referral,2021-04-10T00:00:00,2022-03-28T00:00:00,customers.json,2026-02-10T22:25:28.068809
CUS-00000909,Linda,O'Brien,Linda O'Brien,N/A,,,30,1996-02-06,1673 Elm Ave,Tokyo,,100-0001,Japan,Gold,79,39684.8,793.7,2023-12-03T00:00:00,2028-09-20,yes,true,false,true,true,ja,,social_media,2023-12-03T00:00:00,2023-12-03T00:00:00,customers.json,2026-02-10T22:25:28.068809
CUS-00000910,Jennifer,Smith,Jennifer Smith,,UNLISTED,Prefer not to say,67,1959-02-15,3862 Forest Blvd,London,,SW1A 1AA,United Kingdom,Bronze,89,42286.89,1174.64,2020-08-23T00:00:00,2023-12-31,true,false,true,false,true,de,EUR,website,2020-08-23T00:00:00,2021-08-08T00:00:00,customers.json,2026-02-10T22:25:28.068809
CUS-00000911,Patricia,Chen,Patricia Chen,PatriciaChen,+1-390-444-7271,MALE,36,1990-02-07,3236 Oak Rd,Los Angeles,CA,90001,USA,Bronze,78,30528.9,2180.64,2022-01-01,2025-11-18,true,true,,false,true,es,USD,referral,2022-01-01T00:00:00,2023-02-25T00:00:00,customers.json,2026-02-10T22:25:28.068809
CUS-00000912,Richard,Chen,Richard Chen,richard.chen880@yahoo.com,(536) 185-5939,Other,45,1981-02-09,6658 River Blvd,Chicago,IL,60601,USA,Silver,117,16083.68,765.89,1629756000,2024-02-25,false,true,false,true,true,zh,AUD,social_media,2021-08-24T00:00:00,2021-08-24T00:00:00,customers.json,2026-02-10T22:25:28.068809
CUS-00000913,Yuki,Kim,Yuki Kim,yuki.kim7@outlook.com,+1-955-756-2250,Male,50,1976-02-11,5673 Elm Blvd,Sydney,NSW,2000,Australia,Bronze,155,24897.57,607.26,2021-09-30T00:00:00,2023-04-04,false,false,false,true,false,es,CAD,website,2021-09-30T00:00:00,2022-01-03T00:00:00,customers.json,2026-02-10T22:25:28.068809
CUS-00000914,Emma,Kim,Emma Kim,emma.kim701@outlook.com,6907444046,FEMALE,35,1991-02-07,20 Elm Ln,Amsterdam,,1012 AB,Netherlands,PLATINUM,107,39407.81,916.46,2023-10-06T00:00:00,2024-07-03,false,false,true,false,false,ja,USD,partner,2023-10-06T00:00:00,2024-04-03T00:00:00,customers.json,2026-02-10T22:25:28.068809
CUS-00000915,Patricia,Martinez,Patricia Martinez,patricia.martinez364@company.com,,Other,65,1961-02-14,3113 Elm Ln,Sydney,NSW,2000,Australia,GOLD,87,38944.91,1342.93,1715119200,2026-06-25,true,false,true,false,true,es,USD,,2024-05-08T00:00:00,2025-07-31T00:00:00,customers.json,2026-02-10T22:25:28.068809
CUS-00000916,Carlos,Davis,Carlos Davis,carlos.davis754@outlook.com,(280) 288-1807,M,22,2004-02-04,3228 Main Ave,Toronto,ON,M5V 2H1,Canada,VIP,63,41049.75,1710.41,1643065200,2025-07-30,true,true,true,false,true,en,CAD,website,2022-01-25T00:00:00,2023-05-30T00:00:00,customers.json,2026-02-10T22:25:28.068809
CUS-00000917,Linda,Anderson,Linda Anderson,linda.anderson510@mail.com,+1-877-568-3577,,50,1976-02-11,6174 River Blvd,Toronto,ON,M5V 2H1,Canada,Silver,70,40499.88,3115.38,2021-04-15,2023-02-17,yes,true,true,false,true,fr,CAD,,2021-04-15T00:00:00,2022-08-26T00:00:00,customers.json,2026-02-10T22:25:28.068809
CUS-00000918,Priya,Patel,Priya Patel,priya.patel829@outlook.com,264.313.1165,F,74,1952-02-17,3196 Main Ln,London,,SW1A 1AA,United Kingdom,VIP,87,4254.25,4254.25,2020-06-13T00:00:00,2020-11-14,1,false,true,false,false,es,,mobile_app,2020-06-13T00:00:00,2021-01-24T00:00:00,customers.json,2026-02-10T22:25:28.068809
CUS-00000919,Patricia,O'Brien,Patricia O'Brien,,(865) 370-2826,Female,34,1992-02-07,3209 Forest St,Paris,,75001,France,VIP,189,49088.32,2337.54,2018-08-27T00:00:00,2022-04-22,1,true,true,true,false,de,EUR,mobile_app,2018-08-27T00:00:00,2019-03-27T00:00:00,customers.json,2026-02-10T22:25:28.068809
CUS-00000920,Priya,Chen,Priya Chen,priya.chen275@mail.com,7291752943,Female,25,2001-02-04,965 Elm Dr,Paris,,75001,France,Platinum,167,40305.42,5757.92,02-12-2021,2024-12-15,0,true,true,false,true,en,,website,2021-02-12T00:00:00,2021-04-01T00:00:00,customers.json,2026-02-10T22:25:28.068809
CUS-00000921,Elizabeth,Kim,Elizabeth Kim,elizabeth.kim135@gmail.com,(366) 622-1241,Prefer not to say,41,1985-02-08,9090 Lake Blvd,London,,SW1A 1AA,United Kingdom,PLATINUM,132,24784.18,495.68,2021-10-10T00:00:00,2024-04-24,false,true,,true,true,fr,JPY,,2021-10-10T00:00:00,2023-01-12T00:00:00,customers.json,2026-02-10T22:25:28.068809
CUS-00000922,Joseph,Johnson,Joseph Johnson,joseph.johnson999@outlook.com,UNLISTED,Other,55,1971-02-12,7610 Lake Ave,Los Angeles,CA,90001,USA,VIP,84,42794.99,1156.62,2021-05-05T00:00:00,2022-08-27,false,false,,true,true,en,AUD,social_media,2021-05-05T00:00:00,2021-12-05T00:00:00,customers.json,2026-02-10T22:25:28.068809
CUS-00000923,Thomas,Anderson,Thomas Anderson,ThomasAnderson,4191268262,male,52,1974-02-11,8823 Elm Ln,Tokyo,,100-0001,Japan,platinum,8,35156.92,901.46,1539640800,2021-01-16,no,true,,false,true,ja,USD,partner,2018-10-16T00:00:00,2019-05-03T00:00:00,customers.json,2026-02-10T22:25:28.068809
CUS-00000924,Christopher,Kim,Christopher Kim,christopher.kim144@mail.com,(516) 610-8556,FEMALE,55,1971-02-12,2582 Park St,Tokyo,,100-0001,Japan,Bronze,160,20437.89,10218.94,2019-09-18,2022-12-27,no,true,,false,false,,AUD,social_media,2019-09-18T00:00:00,2020-01-20T00:00:00,customers.json,2026-02-10T22:25:28.068809
CUS-00000925,Ahmed,Mueller,Ahmed Mueller,ahmed.mueller103@yahoo.com,UNLISTED,MALE,72,1954-02-16,6875 Forest St,Sydney,NSW,2000,Australia,Silver,86,48072.6,1602.42,2018-12-28,2020-07-19,false,true,true,true,false,en,USD,partner,2018-12-28T00:00:00,2019-12-15T00:00:00,customers.json,2026-02-10T22:25:28.068809
CUS-00000926,Yuki,Smith,Yuki Smith,yuki.smith642@outlook.com,3404538543,,83,1943-02-19,773 Hill St,Los Angeles,CA,90001,USA,Bronze,130,49386.34,1763.8,1638399600,2026-07-18,false,true,false,true,false,es,EUR,partner,2021-12-02T00:00:00,2022-10-06T00:00:00,customers.json,2026-02-10T22:25:28.068809
CUS-00000927,Priya,Dubois,Priya Dubois,priya.dubois383@mail.com,778.946.4558,male,20,2006-02-03,695 River Blvd,New York,NY,10001,USA,Silver,86,21047.43,438.49,2018-07-14,2023-09-09,true,false,false,false,true,zh,CAD,partner,2018-07-14T00:00:00,2018-08-06T00:00:00,customers.json,2026-02-10T22:25:28.068809
CUS-00000928,Karen,Chen,Karen Chen,karen.chen58@mail.com,,FEMALE,42,1984-02-09,7783 Oak Blvd,Tokyo,,100-0001,Japan,VIP,182,6697.43,223.25,12-28-2020,2021-06-08,true,false,,false,true,zh,JPY,partner,2020-12-28T00:00:00,2021-02-16T00:00:00,customers.json,2026-02-10T22:25:28.068809
CUS-00000929,Barbara,Rodriguez,Barbara Rodriguez,barbara.rodriguez648@mail.com,+1-851-371-2577,"",28,1998-02-05,8793 Hill Blvd,Berlin,,10115,Germany,VIP,133,46604.38,1226.43,06-06-2018,2019-12-01,true,true,true,true,true,ja,JPY,website,2018-06-06T00:00:00,2019-01-16T00:00:00,customers.json,2026-02-10T22:25:28.068809
CUS-00000930,Emma,Rodriguez,Emma Rodriguez,emma.rodriguez306@gmail.com,5181175799,FEMALE,70,1956-02-16,3724 Park St,Chicago,IL,60601,USA,Platinum,129,9841.17,228.86,1625090400,2025-09-19,true,true,false,false,false,fr,JPY,,2021-07-01T00:00:00,2022-03-14T00:00:00,customers.json,2026-02-10T22:25:28.068809
CUS-00000931,Elizabeth,Davis,Elizabeth Davis,elizabeth.davis856@yahoo.com,+1-808-429-5848,male,82,1944-02-19,6502 Forest Blvd,Sydney,NSW,2000,Australia,BRONZE,18,43525.04,1450.83,2024-05-08,2029-10-18,0,true,true,true,true,zh,,referral,2024-05-08T00:00:00,2024-11-30T00:00:00,customers.json,2026-02-10T22:25:28.068809
CUS-00000932,Marie,Garcia,Marie Garcia,marie.garcia495@outlook.com,+1-840-709-1551,M,65,1961-02-14,8141 River Blvd,Paris,,75001,France,gold,40,21350.52,1779.21,2021-05-04,2025-02-24,true,true,false,false,true,,AUD,mobile_app,2021-05-04T00:00:00,2022-02-16T00:00:00,customers.json,2026-02-10T22:25:28.068809
CUS-00000933,Hans,Smith,Hans Smith,hans.smith199@outlook.com,,MALE,52,1974-02-11,8935 River Ave,Amsterdam,,1012 AB,Netherlands,Silver,48,46177.12,2565.4,2020-03-02,2022-11-01,1,false,true,false,true,de,JPY,referral,2020-03-02T00:00:00,2020-10-31T00:00:00,customers.json,2026-02-10T22:25:28.068809
CUS-00000934,Priya,Martinez,Priya Martinez,priya.martinez813@company.com,7813475347,Female,44,1982-02-09,9024 Forest Blvd,Toronto,ON,M5V 2H1,Canada,VIP,136,4605.49,177.13,06/06/2019,2022-05-08,1,true,false,false,false,zh,JPY,social_media,2019-06-06T00:00:00,2019-11-06T00:00:00,customers.json,2026-02-10T22:25:28.068809
CUS-00000935,Joseph,Tanaka,Joseph Tanaka,joseph.tanaka599@yahoo.com,UNLISTED,male,59,1967-02-13,6610 Elm Ave,Toronto,ON,M5V 2H1,Canada,VIP,18,35742.54,1374.71,02/09/2023,2026-03-15,1,false,false,true,false,,GBP,website,2023-09-02T00:00:00,2024-02-26T00:00:00,customers.json,2026-02-10T22:25:28.068809
CUS-00000936,Linda,Williams,Linda Williams,linda.williams66@yahoo.com,UNLISTED,Other,150,1876-03-06,3882 Hill Blvd,Toronto,ON,M5V 2H1,Canada,Gold,10,12710.56,1815.79,10-16-2022,2027-03-08,0,true,true,false,false,en,CAD,mobile_app,2022-10-16T00:00:00,2023-02-27T00:00:00,customers.json,2026-02-10T22:25:28.068809
CUS-00000937,Richard,Wang,Richard Wang,richard.wang158@outlook.com,(524) 217-7215,,22,2004-02-04,4162 Forest Ln,Sydney,NSW,2000,Australia,BRONZE,81,2557.08,116.23,05-25-2019,2022-10-06,no,false,true,false,true,es,AUD,mobile_app,2019-05-25T00:00:00,2019-09-19T00:00:00,customers.json,2026-02-10T22:25:28.068809
CUS-00000938,Liam,Anderson,Liam Anderson,liam.anderson193@gmail.com,UNLISTED,female,58,1968-02-13,6996 Elm Blvd,New York,NY,10001,USA,Gold,28,37706.56,897.78,18/11/2023,2028-04-05,no,true,,true,false,fr,JPY,partner,2023-11-18T00:00:00,2024-08-12T00:00:00,customers.json,2026-02-10T22:25:28.068809
CUS-00000939,William,Wang,William Wang,william.wang555@mail.com,255.935.7826,F,67,1959-02-15,1346 Elm Ln,Tokyo,,100-0001,Japan,VIP,136,29533.21,671.21,09-20-2021,2023-03-22,true,true,,true,false,fr,AUD,mobile_app,2021-09-20T00:00:00,2022-09-05T00:00:00,customers.json,2026-02-10T22:25:28.068809
CUS-00000940,Christopher,Johnson,Christopher Johnson,christopher.johnson529@mail.com,5621804444,FEMALE,18,2008-02-03,8162 Forest Rd,Toronto,ON,M5V 2H1,Canada,Bronze,20,35768.26,894.21,2021-02-16,2022-06-01,true,true,true,true,false,en,JPY,mobile_app,2021-02-16T00:00:00,2021-07-12T00:00:00,customers.json,2026-02-10T22:25:28.068809
CUS-00000941,Carlos,Mueller,Carlos Mueller,carlos.mueller765@mail.com,(478) 751-4591,MALE,40,1986-02-08,4549 River Dr,Toronto,ON,M5V 2H1,Canada,Gold,157,47929.82,1775.18,1639954800,2023-12-18,true,true,false,true,true,es,CAD,,2021-12-20T00:00:00,2023-03-15T00:00:00,customers.json,2026-02-10T22:25:28.068809
CUS-00000942,John,Jones,John Jones,john.jones976@outlook.com,688.656.2957,male,41,1985-02-08,4156 River Rd,Sydney,NSW,2000,Australia,PLATINUM,189,24936.03,804.39,03-26-2018,2023-09-07,no,true,true,true,true,fr,,,2018-03-26T00:00:00,2018-10-24T00:00:00,customers.json,2026-02-10T22:25:28.068809
CUS-00000943,Fatima,Silva,Fatima Silva,fatima.silva216@company.com,UNLISTED,M,66,1960-02-15,7759 River St,Los Angeles,CA,90001,USA,vip,48,42851.71,1339.12,2018-02-21,2022-02-18,true,false,false,true,true,zh,USD,mobile_app,2018-02-21T00:00:00,2018-06-21T00:00:00,customers.json,2026-02-10T22:25:28.068809
CUS-00000944,Sarah,Mueller,Sarah Mueller,sarah.mueller952@yahoo.com,UNLISTED,Male,42,1984-02-09,2821 Oak St,Los Angeles,CA,90001,USA,Platinum,31,11070.45,335.47,2024-04-25T00:00:00,2026-04-02,true,true,true,true,true,es,EUR,website,2024-04-25T00:00:00,2024-10-25T00:00:00,customers.json,2026-02-10T22:25:28.068809
CUS-00000945,Linda,Jones,Linda Jones,linda.jones44@yahoo.com,+1-984-150-9669,FEMALE,30,1996-02-06,3137 Main Blvd,New York,NY,10001,USA,Gold,108,13214.87,629.28,2019-01-13,2022-03-15,yes,false,false,false,true,es,JPY,mobile_app,2019-01-13T00:00:00,2019-03-16T00:00:00,customers.json,2026-02-10T22:25:28.068809
CUS-00000946,Susan,Smith,Susan Smith,susan.smith850@yahoo.com,+1-548-115-7453,Prefer not to say,68,1958-02-15,4168 Hill Dr,Tokyo,,100-0001,Japan,Gold,31,15732.54,874.03,28/10/2024,2027-02-26,1,true,true,true,true,,CAD,website,2024-10-28T00:00:00,2025-02-13T00:00:00,customers.json,2026-02-10T22:25:28.068809
CUS-00000947,Carlos,Mueller,Carlos Mueller,N/A,9063284656,FEMALE,81,1945-02-18,8832 Hill Blvd,Tokyo,,100-0001,Japan,Silver,21,11803.83,3934.61,2019-11-05,2021-05-23,true,true,false,true,true,ja,JPY,mobile_app,2019-11-05T00:00:00,2020-09-29T00:00:00,customers.json,2026-02-10T22:25:28.068809
CUS-00000948,Marie,Rodriguez,Marie Rodriguez,marie.rodriguez623@company.com,UNLISTED,F,30,1996-02-06,1797 Park Ln,Berlin,,10115,Germany,vip,186,992.27,27.56,08/12/2021,2023-11-01,false,false,true,false,false,fr,JPY,partner,2021-12-08T00:00:00,2023-03-30T00:00:00,customers.json,2026-02-10T22:25:28.068809
CUS-00000949,Wei,Chen,Wei Chen,wei.chen108@gmail.com,381.730.4699,MALE,22,2004-02-04,5921 Park Blvd,Sydney,NSW,2000,Australia,Bronze,12,48083.84,2090.6,07-08-2018,2023-05-25,no,true,true,false,true,en,CAD,website,2018-07-08T00:00:00,2019-04-07T00:00:00,customers.json,2026-02-10T22:25:28.068809
CUS-00000950,Robert,Kim,Robert Kim,robert.kim663@yahoo.com,+1-944-712-1004,FEMALE,29,1997-02-05,5132 Hill Rd,Amsterdam,,1012 AB,Netherlands,Platinum,57,4292.93,178.87,1641942000,2025-02-12,false,true,,false,false,es,EUR,,2022-01-12T00:00:00,2022-07-24T00:00:00,customers.json,2026-02-10T22:25:28.068809
CUS-00000951,Michael,Brown,Michael Brown,michael.brown593@outlook.com,8625049936,Other,71,1955-02-16,9395 Elm Rd,London,,SW1A 1AA,United Kingdom,Gold,199,47971.62,2180.53,1603317600,2021-10-04,false,true,true,true,false,ja,USD,,2020-10-22T00:00:00,2021-10-16T00:00:00,customers.json,2026-02-10T22:25:28.068809
CUS-00000952,Hans,Patel,Hans Patel,hans.patel378@company.com,4451874054,,82,1944-02-19,1458 Hill Ln,Chicago,IL,60601,USA,Platinum,122,2401.8,400.3,2023-01-29T00:00:00,2027-08-14,no,true,true,true,true,fr,USD,mobile_app,2023-01-29T00:00:00,2023-02-25T00:00:00,customers.json,2026-02-10T22:25:28.068809
CUS-00000953,Emma,Dubois,Emma Dubois,emma.dubois448@yahoo.com,+1-308-585-2087,F,28,1998-02-05,9351 Elm St,London,,SW1A 1AA,United Kingdom,Bronze,91,8467.17,196.91,1599256800,2026-03-04,false,true,false,false,true,fr,GBP,mobile_app,2020-09-05T00:00:00,2021-08-01T00:00:00,customers.json,2026-02-10T22:25:28.068809
CUS-00000954,Joseph,Tanaka,Joseph Tanaka,joseph.tanaka331@outlook.com,,"",33,1993-02-06,9978 Main Dr,Sydney,NSW,2000,Australia,Platinum,58,31495.19,2099.68,1624226400,2024-01-21,true,false,false,false,true,ja,JPY,partner,2021-06-21T00:00:00,2022-05-12T00:00:00,customers.json,2026-02-10T22:25:28.068809
CUS-00000955,Fatima,O'Brien,Fatima O'Brien,fatima.o'brien557@company.com,UNLISTED,female,75,1951-02-17,9838 Forest Blvd,Toronto,ON,M5V 2H1,Canada,Platinum,112,39573.13,1276.55,05/10/2022,2024-11-03,true,true,false,false,true,zh,,social_media,2022-10-05T00:00:00,2023-06-30T00:00:00,customers.json,2026-02-10T22:25:28.068809
CUS-00000956,Robert,Miller,Robert Miller,robert.miller800@yahoo.com,6149356535,FEMALE,64,1962-02-14,3443 Elm St,New York,NY,10001,USA,Silver,64,46975.76,3355.41,2023-01-04,2027-03-07,0,false,,true,true,es,CAD,,2023-01-04T00:00:00,2024-04-30T00:00:00,customers.json,2026-02-10T22:25:28.068809
CUS-00000957,Jennifer,O'Brien,Jennifer O'Brien,jennifer.o'brien342@outlook.com,UNLISTED,FEMALE,28,1998-02-05,5084 Forest St,Amsterdam,,1012 AB,Netherlands,Platinum,164,32478.96,927.97,02-11-2018,2022-06-12,yes,false,true,true,false,,,mobile_app,2018-02-11T00:00:00,2018-07-11T00:00:00,customers.json,2026-02-10T22:25:28.068809
CUS-00000958,Karen,Silva,Karen Silva,karen.silva849@outlook.com,+1-941-978-1770,Male,68,1958-02-15,1033 Oak Dr,Toronto,ON,M5V 2H1,Canada,Platinum,120,2887.48,360.94,2024-10-21T00:00:00,2029-07-22,false,true,false,false,true,zh,USD,social_media,2024-10-21T00:00:00,2025-12-09T00:00:00,customers.json,2026-02-10T22:25:28.068809
CUS-00000959,John,Silva,John Silva,john.silva564@mail.com,3119882472,Female,64,1962-02-14,3004 Park Ave,London,,SW1A 1AA,United Kingdom,Bronze,88,35351.65,1472.99,1619215200,2025-12-29,false,false,false,true,false,zh,JPY,social_media,2021-04-24T00:00:00,2021-08-01T00:00:00,customers.json,2026-02-10T22:25:28.068809
CUS-00000960,James,Miller,James Miller,james.miller205@company.com,,Prefer not to say,79,1947-02-18,1624 Park Rd,Los Angeles,CA,90001,USA,Gold,17,1033.03,51.65,08-20-2022,2025-01-10,true,false,false,false,false,,AUD,website,2022-08-20T00:00:00,2023-08-05T00:00:00,customers.json,2026-02-10T22:25:28.068809
CUS-00000961,Ahmed,Chen,Ahmed Chen,ahmed.chen355@yahoo.com,UNLISTED,MALE,31,1995-02-06,4592 Park Dr,Tokyo,,100-0001,Japan,Bronze,68,45882.29,936.37,2022-01-30T00:00:00,2025-07-19,true,true,,true,true,fr,USD,partner,2022-01-30T00:00:00,2022-03-19T00:00:00,customers.json,2026-02-10T22:25:28.068809
CUS-00000962,Richard,Miller,Richard Miller,richard.miller581@yahoo.com,+1-600-230-6207,F,72,1954-02-16,8717 Oak Dr,Amsterdam,,1012 AB,Netherlands,Gold,55,7042.9,167.69,1574463600,2026-03-13,true,false,false,true,false,de,AUD,website,2019-11-23T00:00:00,2020-08-01T00:00:00,customers.json,2026-02-10T22:25:28.068809
CUS-00000963,Joseph,Kim,Joseph Kim,joseph.kim699@gmail.com,UNLISTED,"",76,1950-02-17,5098 River Ln,London,,SW1A 1AA,United Kingdom,silver,163,18698.4,9349.2,01-20-2022,2026-04-13,true,false,true,false,false,zh,JPY,website,2022-01-20T00:00:00,2023-02-11T00:00:00,customers.json,2026-02-10T22:25:28.068809
CUS-00000964,Ahmed,Tanaka,Ahmed Tanaka,ahmed.tanaka170@mail.com,+1-331-397-5676,"",47,1979-02-10,2661 Park Ave,London,,SW1A 1AA,United Kingdom,Platinum,36,43336.14,2549.18,13/11/2023,2027-06-13,yes,true,false,true,false,ja,CAD,website,2023-11-13T00:00:00,2024-02-02T00:00:00,customers.json,2026-02-10T22:25:28.068809
CUS-00000965,David,Rodriguez,David Rodriguez,david.rodriguez301@gmail.com,4898132479,female,59,1967-02-13,3555 Elm Dr,Tokyo,,100-0001,Japan,SILVER,64,17242.02,420.54,02/07/2021,2021-09-08,1,false,false,true,false,zh,GBP,website,2021-07-02T00:00:00,2022-04-23T00:00:00,customers.json,2026-02-10T22:25:28.068809
CUS-00000966,Christopher,Wang,Christopher Wang,sarah.smith721@outlook.com,UNLISTED,FEMALE,56,1970-02-12,7268 Oak Rd,Sydney,NSW,2000,Australia,Platinum,157,35674.94,1877.63,1524520800,2019-04-13,no,true,false,false,true,de,USD,referral,2018-04-24T00:00:00,2018-07-21T00:00:00,customers.json,2026-02-10T22:25:28.068809
CUS-00000967,Emma,Silva,Emma Silva,emma.silva6@yahoo.com,,female,36,1990-02-07,4248 Forest Dr,Chicago,IL,60601,USA,Bronze,21,8887.95,634.85,2019-12-02,2024-05-30,true,false,,true,true,es,GBP,website,2019-12-02T00:00:00,2019-12-13T00:00:00,customers.json,2026-02-10T22:25:28.068809
CUS-00000968,James,Garcia,James Garcia,james.garcia491@yahoo.com,+1-674-685-9396,female,31,1995-02-06,807 Hill Dr,London,,SW1A 1AA,United Kingdom,Silver,84,42791.15,4279.11,12-31-2019,2020-01-25,yes,true,,false,true,zh,USD,partner,2019-12-31T00:00:00,2020-06-15T00:00:00,customers.json,2026-02-10T22:25:28.068809
CUS-00000969,Patricia,Wang,Patricia Wang,patricia.wang800@gmail.com,(906) 396-5598,Other,31,1995-02-06,9435 Hill Dr,Tokyo,,100-0001,Japan,VIP,72,6335.3,186.33,26/04/2021,2025-01-12,1,true,,true,false,ja,CAD,social_media,2021-04-26T00:00:00,2022-03-13T00:00:00,customers.json,2026-02-10T22:25:28.068809
CUS-00000970,Jessica,Williams,Jessica Williams,jessica.williams320@outlook.com,+1-949-941-6566,female,69,1957-02-15,2434 Oak Ln,New York,NY,10001,USA,BRONZE,121,32228.31,2685.69,31/03/2023,2025-04-19,1,true,false,true,false,fr,AUD,,2023-03-31T00:00:00,2024-07-19T00:00:00,customers.json,2026-02-10T22:25:28.068809
CUS-00000971,Sarah,Tanaka,Sarah Tanaka,sarah.tanaka254@company.com,+1-426-654-8639,female,59,1967-02-13,1927 Forest Ave,Toronto,ON,M5V 2H1,Canada,VIP,60,29890.62,1149.64,2023-08-11T00:00:00,2027-09-04,yes,false,,true,false,es,USD,mobile_app,2023-08-11T00:00:00,2024-09-17T00:00:00,customers.json,2026-02-10T22:25:28.068809
CUS-00000972,Joseph,Rodriguez,Joseph Rodriguez,joseph.rodriguez783@gmail.com,(204) 519-5063,Other,82,1944-02-19,7981 River Rd,Chicago,IL,60601,USA,Gold,17,28449.46,981.02,1650751200,2025-03-11,false,false,false,true,false,ja,AUD,website,2022-04-24T00:00:00,2023-07-24T00:00:00,customers.json,2026-02-10T22:25:28.068809
CUS-00000973,Wei,Miller,Wei Miller,wei.miller376@outlook.com,,M,68,1958-02-15,6380 Hill Rd,Berlin,,10115,Germany,VIP,5,35090.89,716.14,30/06/2022,2027-07-07,true,false,false,true,false,ja,,partner,2022-06-30T00:00:00,2023-04-16T00:00:00,customers.json,2026-02-10T22:25:28.068809
CUS-00000974,James,Tanaka,James Tanaka,james.tanaka22@outlook.com,533.719.3657,"",73,1953-02-16,5444 Lake Dr,London,,SW1A 1AA,United Kingdom,Gold,63,17900.66,1052.98,2023-08-06T00:00:00,2024-01-27,false,true,false,true,true,de,CAD,,2023-08-06T00:00:00,2024-08-19T00:00:00,customers.json,2026-02-10T22:25:28.068809
CUS-00000975,Sarah,Kim,Sarah Kim,sarah.kim181@yahoo.com,,,21,2005-02-03,4360 Lake Ave,Los Angeles,CA,90001,USA,VIP,68,22021.78,880.87,2018-12-14T00:00:00,2023-09-22,yes,true,true,false,true,,GBP,partner,2018-12-14T00:00:00,2019-07-29T00:00:00,customers.json,2026-02-10T22:25:28.068809
CUS-00000976,Liam,Tanaka,Liam Tanaka,liam.tanaka509@outlook.com,+1-508-916-8216,Female,65,1961-02-14,6898 River Ave,Paris,,75001,France,VIP,142,46545.81,1163.65,2018-04-25T00:00:00,2020-09-06,false,true,false,false,false,zh,JPY,social_media,2018-04-25T00:00:00,2018-10-24T00:00:00,customers.json,2026-02-10T22:25:28.068809
CUS-00000977,Hans,Jones,Hans Jones,HansJones,(692) 703-9090,Female,83,1943-02-19,9320 Elm Ave,Paris,,75001,France,Bronze,118,11727.52,1465.94,2022-02-19T00:00:00,2026-08-10,yes,true,true,true,false,es,JPY,website,2022-02-19T00:00:00,2022-04-03T00:00:00,customers.json,2026-02-10T22:25:28.068809
CUS-00000978,Joseph,Mueller,Joseph Mueller,joseph.mueller880@yahoo.com,+1-330-911-8120,"",46,1980-02-10,6539 Forest Ln,Los Angeles,CA,90001,USA,Silver,80,42398.58,21199.29,2024-03-06T00:00:00,2024-06-19,false,false,true,true,true,,USD,referral,2024-03-06T00:00:00,2024-09-28T00:00:00,customers.json,2026-02-10T22:25:28.068809
CUS-00000979,Elizabeth,Silva,Elizabeth Silva,elizabeth.silva332@yahoo.com,,F,26,2000-02-05,3429 Main Ave,Chicago,IL,60601,USA,Gold,34,46731.78,4248.34,2019-03-30,2022-02-28,yes,true,false,true,true,ja,EUR,website,2019-03-30T00:00:00,2020-05-28T00:00:00,customers.json,2026-02-10T22:25:28.068809
CUS-00000980,Hans,Chen,Hans Chen,hans.chen502@outlook.com,4971152277,"",67,1959-02-15,6174 Elm Rd,Amsterdam,,1012 AB,Netherlands,VIP,52,34882.32,1291.94,2018-10-24T00:00:00,2021-06-19,false,true,false,true,true,en,EUR,referral,2018-10-24T00:00:00,2020-03-06T00:00:00,customers.json,2026-02-10T22:25:28.068809
CUS-00000981,Barbara,Dubois,Barbara Dubois,barbara.dubois126@outlook.com,3822324784,Other,28,1998-02-05,7400 Elm St,Los Angeles,CA,90001,USA,Platinum,17,33120.34,6624.07,07-07-2022,2027-11-16,true,true,false,true,true,zh,USD,social_media,2022-07-07T00:00:00,2023-08-26T00:00:00,customers.json,2026-02-10T22:25:28.068809
CUS-00000982,Jessica,Tanaka,Jessica Tanaka,jessica.tanaka129@outlook.com,+1-991-195-9170,,67,1959-02-15,6562 River St,Paris,,75001,France,bronze,6,16610.65,1277.74,1653602400,2025-09-06,0,true,false,true,true,de,,,2022-05-27T00:00:00,2023-06-29T00:00:00,customers.json,2026-02-10T22:25:28.068809
CUS-00000983,Thomas,Davis,Thomas Davis,thomas.davis928@mail.com,222.603.7704,Female,72,1954-02-16,2723 Lake Rd,Sydney,NSW,2000,Australia,Platinum,176,17657.77,1103.61,04-22-2023,2026-06-25,no,false,,true,true,de,USD,,2023-04-22T00:00:00,2024-01-07T00:00:00,customers.json,2026-02-10T22:25:28.068809
CUS-00000984,William,Mueller,William Mueller,william.mueller698@mail.com,485.564.5949,MALE,29,1997-02-05,909 Forest St,Tokyo,,100-0001,Japan,GOLD,57,13160.67,1012.36,1624572000,2022-04-08,false,false,true,true,false,de,,referral,2021-06-25T00:00:00,2022-05-30T00:00:00,customers.json,2026-02-10T22:25:28.068809
CUS-00000985,Richard,Brown,Richard Brown,richard.brown217@yahoo.com,2109437770,MALE,50,1976-02-11,2637 Main Ln,Sydney,NSW,2000,Australia,Bronze,123,23069.99,1048.64,10/06/2020,2023-11-15,false,true,,true,true,ja,CAD,partner,2020-06-10T00:00:00,2021-08-05T00:00:00,customers.json,2026-02-10T22:25:28.068809
CUS-00000986,John,Silva,John Silva,john.silva905@yahoo.com,UNLISTED,Prefer not to say,68,1958-02-15,7571 Elm Rd,Los Angeles,CA,90001,USA,Platinum,59,16716.75,506.57,2020-12-21,2021-11-15,1,false,false,false,false,en,CAD,referral,2020-12-21T00:00:00,2021-10-20T00:00:00,customers.json,2026-02-10T22:25:28.068809
CUS-00000987,Karen,Mueller,Karen Mueller,karen.mueller209@outlook.com,(529) 432-5651,,25,2001-02-04,3838 Main Dr,Los Angeles,CA,90001,USA,VIP,180,3991.17,399.12,05/11/2023,2028-10-03,true,true,true,false,true,,JPY,social_media,2023-11-05T00:00:00,2024-05-31T00:00:00,customers.json,2026-02-10T22:25:28.068809
CUS-00000988,Emma,O'Brien,Emma O'Brien,emma.o'brien47@company.com,UNLISTED,Other,41,1985-02-08,5736 Main Ln,New York,NY,10001,USA,VIP,30,24412.56,2441.26,2018-01-30,2021-05-02,false,false,false,true,true,en,EUR,referral,2018-01-30T00:00:00,2018-05-23T00:00:00,customers.json,2026-02-10T22:25:28.068809
CUS-00000989,William,Miller,William Miller,william.miller747@company.com,(645) 405-5759,F,65,1961-02-14,2667 Oak Blvd,Los Angeles,CA,90001,USA,VIP,189,16557.59,344.95,1540940400,2026-08-24,0,false,false,true,true,de,,partner,2018-10-31T00:00:00,2019-03-25T00:00:00,customers.json,2026-02-10T22:25:28.068809
CUS-00000990,Fatima,Wang,Fatima Wang,fatima.wang362@gmail.com,8496727657,male,41,1985-02-08,5106 Park St,Toronto,ON,M5V 2H1,Canada,vip,81,1605.55,133.8,27/06/2024,2028-10-18,yes,true,false,true,false,,,mobile_app,2024-06-27T00:00:00,2025-05-27T00:00:00,customers.json,2026-02-10T22:25:28.068809
CUS-00000991,Joseph,Smith,Joseph Smith,joseph.smith654@company.com,UNLISTED,male,21,2005-02-03,2797 Lake Dr,Toronto,ON,M5V 2H1,Canada,bronze,194,13166.16,454.01,1696111200,2025-09-12,1,true,false,true,false,de,USD,referral,2023-10-01T00:00:00,2023-10-04T00:00:00,customers.json,2026-02-10T22:25:28.068809
CUS-00000992,Yuki,Silva,Yuki Silva,yuki.silva475@mail.com,UNLISTED,"",Unknown,,9533 Lake Blvd,Amsterdam,,1012 AB,Netherlands,Bronze,199,33731.24,803.12,1526680800,2020-08-22,false,false,true,false,true,,AUD,referral,2018-05-19T00:00:00,2018-07-28T00:00:00,customers.json,2026-02-10T22:25:28.068809
CUS-00000993,Joseph,Kim,Joseph Kim,joseph.kim842@company.com,+1-655-386-7686,M,65,1961-02-14,5091 Oak Blvd,Tokyo,,100-0001,Japan,Silver,31,35309.91,1261.07,1619647200,2024-03-24,no,false,false,true,false,de,CAD,mobile_app,2021-04-29T00:00:00,2021-09-15T00:00:00,customers.json,2026-02-10T22:25:28.068809
CUS-00000994,Marie,Miller,Marie Miller,marie.miller333@yahoo.com,+1-770-635-4327,Female,78,1948-02-18,9635 Lake Ave,Los Angeles,CA,90001,USA,Bronze,49,40621.7,812.43,1560463200,2019-12-21,true,true,,true,true,fr,GBP,,2019-06-14T00:00:00,2020-03-15T00:00:00,customers.json,2026-02-10T22:25:28.068809
CUS-00000995,Robert,Rodriguez,Robert Rodriguez,carlos.kim60@outlook.com,6593754163,Prefer not to say,58,1968-02-13,4788 Hill Blvd,Paris,,75001,France,Gold,112,33963.27,870.85,02/11/2019,2023-05-04,true,false,,true,false,es,EUR,mobile_app,2019-11-02T00:00:00,2020-10-25T00:00:00,customers.json,2026-02-10T22:25:28.068809
CUS-00000996,Patricia,Silva,Patricia Silva,patricia.silva27@company.com,UNLISTED,MALE,75,1951-02-17,2161 Hill Dr,London,,SW1A 1AA,United Kingdom,Gold,184,25105.54,1394.75,1696456800,2026-05-17,1,true,,false,false,ja,USD,referral,2023-10-05T00:00:00,2024-02-28T00:00:00,customers.json,2026-02-10T22:25:28.068809
CUS-00000997,Joseph,Chen,Joseph Chen,joseph.chen355@gmail.com,+1-853-118-8066,Other,58,1968-02-13,2416 Elm Ave,Chicago,IL,60601,USA,Platinum,44,24112.03,3014.0,30/08/2024,2026-03-02,false,false,,true,true,,GBP,partner,2024-08-30T00:00:00,2025-10-23T00:00:00,customers.json,2026-02-10T22:25:28.068809
CUS-00000998,Michael,Garcia,Michael Garcia,michael.garcia234@yahoo.com,,MALE,56,1970-02-12,1958 Forest St,Amsterdam,,1012 AB,Netherlands,VIP,12,33539.34,1016.34,2021-01-15,2021-10-01,yes,true,true,true,true,zh,EUR,social_media,2021-01-15T00:00:00,2022-05-09T00:00:00,customers.json,2026-02-10T22:25:28.068809
CUS-00000999,Carlos,Chen,Carlos Chen,carlos.chen83@yahoo.com,(689) 128-1840,FEMALE,24,2002-02-04,4405 Park Ave,Chicago,IL,60601,USA,VIP,188,1640.55,410.14,2021-11-06,2026-05-14,yes,true,,true,true,zh,JPY,social_media,2021-11-06T00:00:00,2022-03-10T00:00:00,customers.json,2026-02-10T22:25:28.068809
CUS-00001000,Susan,Kim,Susan Kim,susan.kim779@company.com,4276134471,"",59,1967-02-13,4743 Forest Blvd,Amsterdam,,1012 AB,Netherlands,Silver,196,49604.13,7086.3,1527890400,2022-10-19,true,false,,true,true,zh,CAD,website,2018-06-02T00:00:00,2019-01-24T00:00:00,customers.json,2026-02-10T22:25:28.068809
CUS-00000621,Fatima,Chen,Fatima Chen,N/A,UNLISTED,,37,1989-02-07,4373 Forest Ln,Amsterdam,,1012 AB,Netherlands,Silver,40,39402.72,1576.11,2022-01-08T00:00:00,2023-12-26,true,false,true,true,false,en,JPY,,2022-01-08T00:00:00,2022-02-25T00:00:00,customers.json,2026-02-10T22:25:28.068809
CUS-00000648,Joseph,Smith,Joseph Smith,joseph.smith440@gmail.com,600.520.2716,Female,76,1950-02-17,8797 Main St,Los Angeles,CA,90001,USA,BRONZE,115,,,2023-02-24T00:00:00,2027-01-02,1,true,,false,false,fr,JPY,social_media,2023-02-24T00:00:00,2023-04-17T00:00:00,customers.json,2026-02-10T22:25:28.068809
CUS-00000411,Ahmed,Davis,Ahmed Davis,ahmed.davis463@mail.com,506.701.1960,Male,32,1994-02-06,3896 Hill Ln,Sydney,NSW,2000,Australia,Platinum,81,6170.16,268.27,1612479600,2021-07-21,yes,true,,true,true,,,referral,2021-02-05T00:00:00,2021-04-08T00:00:00,customers.json,2026-02-10T22:25:28.068809
